O:12:"CI_DB_result":8:{s:7:"conn_id";N;s:9:"result_id";N;s:12:"result_array";a:1172:{i:0;a:23:{s:10:"her_two_id";s:1:"3";s:5:"sl_no";s:3:"287";s:7:"test_id";s:16:"MIHC13:13699-701";s:10:"reciv_date";s:10:"22/07/2013";s:9:"deli_date";s:10:"28/07/2013";s:12:"current_date";s:10:"2013-07-22";s:12:"patient_name";s:18:"Mrs. Kohinur Begum";s:3:"age";s:6:"50 Yrs";s:6:"ref_by";s:30:"Syeda Hasina Azam. FCPS, FRCS.";s:3:"sex";s:6:"Female";s:13:"hospital_name";s:31:"Lab Science, Dhanmondi, Dhaka. ";s:13:"specimen_name";s:13:"Lt. breast . ";s:4:"note";s:109:"Result of Immunostaining  for ER, PR &amp; HER-2 of Case No: Lab no:14355 Block No:( 04) from DHL, Path. Lab.";s:6:"er_rpt";s:55:"About 02 % of the tumor cell nuclei show weak staining.";s:8:"er_score";s:7:"2+1=3/8";s:6:"pr_rpt";s:49:"<1 % of the tumor cell nuclei show weak staining.";s:8:"pr_score";s:7:"1+1=2/8";s:11:"her_two_rpt";s:94:"Weak to moderate complete membrane staining is observed in more than 10 % of the tumor cells. ";s:13:"her_two_score";s:2:"2+";s:9:"er_result";s:8:"Positive";s:9:"pr_result";s:8:"Negative";s:14:"her_two_result";s:10:"Borderline";s:8:"rpt_noet";s:0:"";}i:1;a:23:{s:10:"her_two_id";s:1:"4";s:5:"sl_no";s:3:"286";s:7:"test_id";s:16:"MIHC13:13695-697";s:10:"reciv_date";s:10:"22/07/2013";s:9:"deli_date";s:10:"28/07/2013";s:12:"current_date";s:10:"2013-07-22";s:12:"patient_name";s:23:"Mrs. Rawshan Ara Akhter";s:3:"age";s:6:"31 Yrs";s:6:"ref_by";s:0:"";s:3:"sex";s:6:"Female";s:13:"hospital_name";s:38:"Niramoy Clinic (Pvt.) Ltd.Chittagong. ";s:13:"specimen_name";s:20:"Tissue from breast. ";s:4:"note";s:87:"Result of Immunostaining  for ER, PR & HER-2 of Case No:MH13-13693 from DHL. Path. Lab.";s:6:"er_rpt";s:55:"About 02 % of the tumor cell nuclei show weak staining.";s:8:"er_score";s:7:"2+1=3/8";s:6:"pr_rpt";s:50:" <1 % of the tumor cell nuclei show weak staining.";s:8:"pr_score";s:7:"1+1=2/8";s:11:"her_two_rpt";s:94:"Weak incomplete membrane staining is observed in more than 10 % of the tumor cells. Score : 1+";s:13:"her_two_score";s:3:" 1+";s:9:"er_result";s:8:"Positive";s:9:"pr_result";s:8:"Negative";s:14:"her_two_result";s:8:"Negative";s:8:"rpt_noet";s:0:"";}i:2;a:23:{s:10:"her_two_id";s:1:"6";s:5:"sl_no";s:3:"289";s:7:"test_id";s:16:"MIHC13:13811-813";s:10:"reciv_date";s:10:"23/07/2013";s:9:"deli_date";s:10:"28/07/2013";s:12:"current_date";s:10:"2013-07-28";s:12:"patient_name";s:17:"Mrs. Nilufar Alam";s:3:"age";s:6:"54 Yrs";s:6:"ref_by";s:54:"M.N.Huda, FCPS , Principal Chief Consultant (Oncology)";s:3:"sex";s:6:"Female";s:13:"hospital_name";s:3:"DHL";s:13:"specimen_name";s:19:"Tissue from breast.";s:4:"note";s:101:"Result of Immunostaining  for ER, PR & HER-2 of Case No:MH13-13286. Block No (02) from DHL, Path. Lab";s:6:"er_rpt";s:55:"About 65 % of the tumor cell nuclei show weak staining.";s:8:"er_score";s:7:"4+1=5/8";s:6:"pr_rpt";s:59:"About 40 % of the tumor cell nuclei show moderate staining.";s:8:"pr_score";s:7:"4+2=6/8";s:11:"her_two_rpt";s:94:"Weak incomplete membrane staining is observed in more than 10 % of the tumor cells. Score : 1+";s:13:"her_two_score";s:2:"1+";s:9:"er_result";s:8:"Positive";s:9:"pr_result";s:8:"Positive";s:14:"her_two_result";s:8:"Negative";s:8:"rpt_noet";s:0:"";}i:3;a:23:{s:10:"her_two_id";s:1:"7";s:5:"sl_no";s:3:"284";s:7:"test_id";s:17:"MIHC13:-13676-678";s:10:"reciv_date";s:10:"21/07/2013";s:9:"deli_date";s:10:"28/07/2013";s:12:"current_date";s:10:"2013-07-21";s:12:"patient_name";s:17:"Mrs. Kamrun Nahar";s:3:"age";s:6:"35 Yrs";s:6:"ref_by";s:34:"Sagorica Sharmin (Sagar), FCPS (S)";s:3:"sex";s:6:"Female";s:13:"hospital_name";s:47:"Lancet Diagnostic & Research Centre, Chittagong";s:13:"specimen_name";s:24:"Tissue from left breast.";s:4:"note";s:88:"Result of Immunostaining  for ER, PR &amp; HER-2 of Case No: MH13-13115C, DHL. Path. Lab";s:6:"er_rpt";s:35:"Tumor cell nuclei show no staining.";s:8:"er_score";s:0:"";s:6:"pr_rpt";s:35:"Tumor cell nuclei show no staining.";s:8:"pr_score";s:0:"";s:11:"her_two_rpt";s:94:"Strong complete membrane staining is observed in more than 30 % of the tumor cells. Score : 3+";s:13:"her_two_score";s:2:"3+";s:9:"er_result";s:8:"Negative";s:9:"pr_result";s:8:"Negative";s:14:"her_two_result";s:8:"Positive";s:8:"rpt_noet";s:0:"";}i:4;a:23:{s:10:"her_two_id";s:1:"8";s:5:"sl_no";s:3:"282";s:7:"test_id";s:17:"MIHC13:-13570-572";s:10:"reciv_date";s:10:"20/07/2013";s:9:"deli_date";s:10:"28/07/2013";s:12:"current_date";s:10:"2013-07-20";s:12:"patient_name";s:19:"Mrs. Helena Pervin ";s:3:"age";s:6:"40 Yrs";s:6:"ref_by";s:27:"Jannatul Islam Jinnah, FCPS";s:3:"sex";s:6:"Female";s:13:"hospital_name";s:5:"DLMCH";s:13:"specimen_name";s:25:"Mastectomy specimen (Lt.)";s:4:"note";s:104:"Result of Immunostaining  for ER, PR &amp; HER-2 of Case No: MH13-12656C  Block No: (03) from DHL, Path.";s:6:"er_rpt";s:59:"About 60 % of the tumor cell nuclei show moderate staining.";s:8:"er_score";s:7:"4+2=6/8";s:6:"pr_rpt";s:59:"About 70 % of the tumor cell nuclei show moderate staining.";s:8:"pr_score";s:7:"5+2=7/8";s:11:"her_two_rpt";s:100:"Weak to moderate complete membrane staining is observed in more than 10 % of the tumor cells Score :";s:13:"her_two_score";s:2:"2+";s:9:"er_result";s:8:"Positive";s:9:"pr_result";s:8:"Positive";s:14:"her_two_result";s:10:"Borderline";s:8:"rpt_noet";s:0:"";}i:5;a:23:{s:10:"her_two_id";s:1:"9";s:5:"sl_no";s:3:"281";s:7:"test_id";s:16:"MIHC13:13559-561";s:10:"reciv_date";s:10:"20/07/2013";s:9:"deli_date";s:10:"28/07/2013";s:12:"current_date";s:10:"2013-07-20";s:12:"patient_name";s:10:"Mrs. Afroz";s:3:"age";s:6:"42 Yrs";s:6:"ref_by";s:41:"Zebunnesa Yasmin. Consultant, (Oncology).";s:3:"sex";s:6:"Female";s:13:"hospital_name";s:3:"DHL";s:13:"specimen_name";s:19:"Tissue from breast.";s:4:"note";s:117:"Result of Immunostaining  for ER, PR &amp; HER-2 of Case No: MH13-11509 Block No: (02) from DHL, Path. Lab. Dhaka<br>";s:6:"er_rpt";s:55:"About 30 % of the tumor cell nuclei show weak staining.";s:8:"er_score";s:7:"3+1=4/8";s:6:"pr_rpt";s:59:"About 60 % of the tumor cell nuclei show moderate staining.";s:8:"pr_score";s:7:"4+2=6/8";s:11:"her_two_rpt";s:100:" Weak to moderate complete membrane staining is observed in more than 10 % of the tumor cells. Score";s:13:"her_two_score";s:2:"2+";s:9:"er_result";s:8:"Positive";s:9:"pr_result";s:8:"Positive";s:14:"her_two_result";s:10:"Borderline";s:8:"rpt_noet";s:0:"";}i:6;a:23:{s:10:"her_two_id";s:2:"10";s:5:"sl_no";s:3:"280";s:7:"test_id";s:16:"MIHC13:13553-555";s:10:"reciv_date";s:10:"20/07/2013";s:9:"deli_date";s:10:"28/07/2013";s:12:"current_date";s:10:"2013-07-20";s:12:"patient_name";s:14:"Mrs. Nurjahan ";s:3:"age";s:6:"45 Yrs";s:6:"ref_by";s:0:"";s:3:"sex";s:6:"Female";s:13:"hospital_name";s:17:"CSCR, Chittagong ";s:13:"specimen_name";s:14:"Breast tissue.";s:4:"note";s:104:"Result of Immunostaining  for ER, PR &amp; HER-2 of Case No: Lab No: 13551  Block No: ( 01) from DHL, Pa";s:6:"er_rpt";s:60:"About 60 % of the tumor cell nuclei show moderate staining. ";s:8:"er_score";s:7:"4+2=6/8";s:6:"pr_rpt";s:59:"About 65 % of the tumor cell nuclei show moderate staining.";s:8:"pr_score";s:7:"4+2=6/8";s:11:"her_two_rpt";s:95:" Weak incomplete membrane staining is observed in more than 10 % of the tumor cells. Score : 1+";s:13:"her_two_score";s:2:"1+";s:9:"er_result";s:8:"Positive";s:9:"pr_result";s:8:"Positive";s:14:"her_two_result";s:8:"Negative";s:8:"rpt_noet";s:0:"";}i:7;a:23:{s:10:"her_two_id";s:2:"11";s:5:"sl_no";s:3:"278";s:7:"test_id";s:16:"MIHC13:13526-528";s:10:"reciv_date";s:10:"19/07/2013";s:9:"deli_date";s:10:"28/07/2013";s:12:"current_date";s:10:"2013-07-19";s:12:"patient_name";s:4:"Keya";s:3:"age";s:6:"40 Yrs";s:6:"ref_by";s:23:"Syed Asif UI Alam , MS ";s:3:"sex";s:6:"Female";s:13:"hospital_name";s:27:"Faridpur General Hospital. ";s:13:"specimen_name";s:23:"Tissue from Lt. breast.";s:4:"note";s:104:"Result of Immunostaining  for ER, PR &amp; HER-2 of Case No:MH13-11587 Block No: ( 01) from DHL, Path. L";s:6:"er_rpt";s:60:"About 60 %  of the tumor cell nuclei show moderate staining.";s:8:"er_score";s:7:"4+2=6/8";s:6:"pr_rpt";s:59:"About 25 % of the tumor cell nuclei show moderate staining.";s:8:"pr_score";s:7:"3+2=5/8";s:11:"her_two_rpt";s:93:"Weak incomplete membrane staining is observed in more than 10 % of the tumor cells Score : 1+";s:13:"her_two_score";s:2:"1+";s:9:"er_result";s:8:"Positive";s:9:"pr_result";s:8:"Positive";s:14:"her_two_result";s:8:"Negative";s:8:"rpt_noet";s:0:"";}i:8;a:23:{s:10:"her_two_id";s:2:"12";s:5:"sl_no";s:3:"290";s:7:"test_id";s:16:"MIHC13:14015-017";s:10:"reciv_date";s:10:"25/07/2013";s:9:"deli_date";s:10:"28/07/2013";s:12:"current_date";s:10:"2013-07-25";s:12:"patient_name";s:14:"Mrs. Nur Begum";s:3:"age";s:6:"47 Yrs";s:6:"ref_by";s:0:"";s:3:"sex";s:6:"Female";s:13:"hospital_name";s:48:"Lancet Diagnostic & Research, Centre, Chittagong";s:13:"specimen_name";s:23:"Tissue from Rt. Breast.";s:4:"note";s:115:"Result of Immunostaining  for ER, PR &amp; HER-2 of Case No: MH-13549/13  <br>Block No: ( 01) from, DHL, Path. Lab.";s:6:"er_rpt";s:49:"<1 % of the tumor cell nuclei show weak staining.";s:8:"er_score";s:7:"1+1=2/8";s:6:"pr_rpt";s:35:"Tumor cell nuclei show no staining.";s:8:"pr_score";s:0:"";s:11:"her_two_rpt";s:94:"Strong complete membrane staining is observed in more than 30 % of the tumor cells. Score : 3+";s:13:"her_two_score";s:2:"3+";s:9:"er_result";s:8:"Negative";s:9:"pr_result";s:8:"Negative";s:14:"her_two_result";s:8:"Positive";s:8:"rpt_noet";s:0:"";}i:9;a:23:{s:10:"her_two_id";s:2:"13";s:5:"sl_no";s:4:"1111";s:7:"test_id";s:11:"MIHC13:-105";s:10:"reciv_date";s:10:"25/07/2013";s:9:"deli_date";s:10:"25/07/2013";s:12:"current_date";s:10:"2013-07-25";s:12:"patient_name";s:17:"Mrs. Nilufar Alam";s:3:"age";s:6:"50 Yrs";s:6:"ref_by";s:82:"Nazrina Khatun MBBS, MD. (Radiotherapi), Cancer Specalist. NICRH, Mohakhali, Dhaka";s:3:"sex";s:4:"Male";s:13:"hospital_name";s:36:"National Cancer Hospital , Mohakhali";s:13:"specimen_name";s:19:"Tissue from breast.";s:4:"note";s:85:"Result of Immunostaining  for ER, PR & HER-2 of Case No: MH13-12555   Block No: ( 02)";s:6:"er_rpt";s:55:"About 10 % of the tumor cell nuclei show weak staining.";s:8:"er_score";s:7:"3+5=8/8";s:6:"pr_rpt";s:55:"About 10 % of the tumor cell nuclei show weak staining.";s:8:"pr_score";s:7:"3+5=8/8";s:11:"her_two_rpt";s:93:"Weak incomplete membrane staining is observed in more than 10 % of the tumor cells Score : 1+";s:13:"her_two_score";s:2:"3+";s:9:"er_result";s:8:"Negative";s:9:"pr_result";s:8:"Negative";s:14:"her_two_result";s:10:"Borderline";s:8:"rpt_noet";s:0:"";}i:10;a:23:{s:10:"her_two_id";s:2:"14";s:5:"sl_no";s:3:"291";s:7:"test_id";s:16:"MIHC13:14028-030";s:10:"reciv_date";s:10:"25/07/2013";s:9:"deli_date";s:10:"28/07/2013";s:12:"current_date";s:10:"2013-07-25";s:12:"patient_name";s:18:"Mrs. Rabeya Khatun";s:3:"age";s:6:"80 Yrs";s:6:"ref_by";s:45:"Tapesh Kumar Paul,FCPS,MS (Oncology Surgery).";s:3:"sex";s:6:"Female";s:13:"hospital_name";s:3:"DHL";s:13:"specimen_name";s:18:"Tissue from axilla";s:4:"note";s:106:"Result of Immunostaining  for ER, PR &amp; HER-2 of Case No:MH13-13683 Block No: ( 02) from DHL. Path. Lab";s:6:"er_rpt";s:59:"About 70 % of the tumor cell nuclei show moderate staining.";s:8:"er_score";s:7:"5+2=7/8";s:6:"pr_rpt";s:59:"About 02 % of the tumor cell nuclei show moderate staining.";s:8:"pr_score";s:7:"2+2=4/8";s:11:"her_two_rpt";s:40:"Tumor cells show no staining Score : 'O'";s:13:"her_two_score";s:3:""O"";s:9:"er_result";s:8:"Positive";s:9:"pr_result";s:8:"Positive";s:14:"her_two_result";s:8:"Negative";s:8:"rpt_noet";s:0:"";}i:11;a:23:{s:10:"her_two_id";s:2:"20";s:5:"sl_no";s:3:"589";s:7:"test_id";s:16:"MIHC13:14015-017";s:10:"reciv_date";s:10:"27/07/2013";s:9:"deli_date";s:10:"27/07/2013";s:12:"current_date";s:10:"2013-07-27";s:12:"patient_name";s:17:"Mrs. Nilufar Alam";s:3:"age";s:6:"37 Yrs";s:6:"ref_by";s:75:"Tapash Mitra, FCPS (Radiotherapy), M.Phil  (Radiotherapy). Oncologist, CMCH";s:3:"sex";s:6:"Female";s:13:"hospital_name";s:44:"Chittagong Metropoliton Hospital (Pvt.) Ltd.";s:13:"specimen_name";s:40:"One paraffin block case no: 771/13 (R/G)";s:4:"note";s:117:"Result of Immunostaining  for ER, PR &amp; HER-2 of case No: MH13-08923. Block no: (R/G3) from DHL, Path, Lab. Dhaka.";s:6:"er_rpt";s:59:"About 50 % of the tumor cell nuclei show moderate staining.";s:8:"er_score";s:7:"5+2=7/8";s:6:"pr_rpt";s:59:"About 50 % of the tumor cell nuclei show moderate staining.";s:8:"pr_score";s:7:"5+2=7/8";s:11:"her_two_rpt";s:95:"Weak to moderate complete membrane staining is observed in more than 10 % of the tumor cells.
";s:13:"her_two_score";s:2:"2+";s:9:"er_result";s:8:"Positive";s:9:"pr_result";s:8:"Positive";s:14:"her_two_result";s:8:"Negative";s:8:"rpt_noet";s:0:"";}i:12;a:23:{s:10:"her_two_id";s:2:"36";s:5:"sl_no";s:3:"306";s:7:"test_id";s:16:"MIHC13:14509-511";s:10:"reciv_date";s:10:"01/08/2013";s:9:"deli_date";s:10:"18/08/2013";s:12:"current_date";s:10:"2013-07-01";s:12:"patient_name";s:9:"Mrs Rezia";s:3:"age";s:6:"65 Yrs";s:6:"ref_by";s:29:"CSCR (PVT.) Ltd. , Chittagong";s:3:"sex";s:6:"Female";s:13:"hospital_name";s:29:"CSCR , Hospital , Chittagong.";s:13:"specimen_name";s:13:"Breast tissue";s:4:"note";s:111:"Result of Immunostaining  for ER, PR & HER-2 of Case No:MH13-14504, Block No: (02) from DHL, Path. Lab. Dhaka. ";s:6:"er_rpt";s:35:"Tumor cell nuclei show no staining.";s:8:"er_score";s:3:""O"";s:6:"pr_rpt";s:35:"Tumor cell nuclei show no staining.";s:8:"pr_score";s:3:""O"";s:11:"her_two_rpt";s:83:"Strong complete membrane staining is observed in more than 30 % of the tumor cells.";s:13:"her_two_score";s:2:"3+";s:9:"er_result";s:8:"Negative";s:9:"pr_result";s:8:"Negative";s:14:"her_two_result";s:8:"Positive";s:8:"rpt_noet";s:0:"";}i:13;a:23:{s:10:"her_two_id";s:2:"37";s:5:"sl_no";s:3:"307";s:7:"test_id";s:16:"MIHC13:14584-586";s:10:"reciv_date";s:10:"03/08/2013";s:9:"deli_date";s:10:"18/08/2013";s:12:"current_date";s:10:"2013-08-03";s:12:"patient_name";s:17:"Mrs. Shahera Banu";s:3:"age";s:6:"45 Yrs";s:6:"ref_by";s:45:"Tapesh Kumar Paul,FCPS,MS (Oncology Surgery).";s:3:"sex";s:6:"Female";s:13:"hospital_name";s:3:"DHL";s:13:"specimen_name";s:26:"Mastectomy Specimen (Left)";s:4:"note";s:111:"Result of Immunostaining  for ER, PR & HER-2 of Case No: MH13-14320C, Block No: (02) from DHL Path. Lab. Dhaka.";s:6:"er_rpt";s:59:"About 30 % of the tumor cell nuclei show moderate staining.";s:8:"er_score";s:7:"3+2=5/8";s:6:"pr_rpt";s:35:"Tumor cell nuclei show no staining.";s:8:"pr_score";s:3:""O"";s:11:"her_two_rpt";s:84:" Strong complete membrane staining is observed in more than 30 % of the tumor cells.";s:13:"her_two_score";s:2:"3+";s:9:"er_result";s:8:"Positive";s:9:"pr_result";s:8:"Negative";s:14:"her_two_result";s:8:"Positive";s:8:"rpt_noet";s:0:"";}i:14;a:23:{s:10:"her_two_id";s:2:"38";s:5:"sl_no";s:3:"308";s:7:"test_id";s:16:"MIHC13:14591-593";s:10:"reciv_date";s:10:"03/08/2013";s:9:"deli_date";s:10:"18/08/2013";s:12:"current_date";s:10:"2013-08-03";s:12:"patient_name";s:18:"Mrs. Anita Sarker ";s:3:"age";s:6:"50 Yrs";s:6:"ref_by";s:45:"Tapesh Kumar Paul,FCPS,MS (Oncology Surgery).";s:3:"sex";s:6:"Female";s:13:"hospital_name";s:3:"DHL";s:13:"specimen_name";s:27:"Mastectomy Specimen (Right)";s:4:"note";s:110:"Result of Immunostaining  for ER, PR & HER-2 of Case No:MH13-14318, Block No: (01) from DHL Path. Lab. Dhaka. ";s:6:"er_rpt";s:59:"About 60 % of the tumor cell nuclei show moderate staining.";s:8:"er_score";s:8:"4+2=6/ 8";s:6:"pr_rpt";s:59:"About 40 % of the tumor cell nuclei show moderate staining.";s:8:"pr_score";s:7:"4+2=6/8";s:11:"her_two_rpt";s:93:"Weak to moderate complete membrane staining is observed in more than 10 % of the tumor cells.";s:13:"her_two_score";s:2:"2+";s:9:"er_result";s:8:"Positive";s:9:"pr_result";s:8:"Positive";s:14:"her_two_result";s:10:"Borderline";s:8:"rpt_noet";s:0:"";}i:15;a:23:{s:10:"her_two_id";s:2:"39";s:5:"sl_no";s:3:"313";s:7:"test_id";s:16:"MIHC13:14962-964";s:10:"reciv_date";s:10:"13/08/2013";s:9:"deli_date";s:10:"18/08/2013";s:12:"current_date";s:10:"2013-08-13";s:12:"patient_name";s:24:"Mrs. Sayeda Mamtaz Begum";s:3:"age";s:6:"50 Yrs";s:6:"ref_by";s:0:"";s:3:"sex";s:6:"Female";s:13:"hospital_name";s:39:"Metro Diagnostic Centre Ltd.Chittagong.";s:13:"specimen_name";s:24:"Tissue from Breast (Rt.)";s:4:"note";s:110:"Result of Immunostaining  for ER, PR & HER-2 of Case No:MH13-14855, Block No: (02) from DHL, Path. Lab. Dhaka.";s:6:"er_rpt";s:35:"Tumor cell nuclei show no staining.";s:8:"er_score";s:3:""O"";s:6:"pr_rpt";s:35:"Tumor cell nuclei show no staining.";s:8:"pr_score";s:3:""O"";s:11:"her_two_rpt";s:84:" Strong complete membrane staining is observed in more than 30 % of the tumor cells.";s:13:"her_two_score";s:2:"3+";s:9:"er_result";s:8:"Negative";s:9:"pr_result";s:8:"Negative";s:14:"her_two_result";s:8:"Positive";s:8:"rpt_noet";s:0:"";}i:16;a:23:{s:10:"her_two_id";s:2:"40";s:5:"sl_no";s:3:"312";s:7:"test_id";s:16:"MIHC13:14863-865";s:10:"reciv_date";s:10:"08/08/2013";s:9:"deli_date";s:10:"18/08/2013";s:12:"current_date";s:10:"2013-08-08";s:12:"patient_name";s:20:"Mrs.Basonti Rani Das";s:3:"age";s:6:"42 Yrs";s:6:"ref_by";s:45:"Tapesh Kumar Paul,FCPS,MS (Oncology Surgery).";s:3:"sex";s:6:"Female";s:13:"hospital_name";s:11:"DHL, C- 506";s:13:"specimen_name";s:23:"Tissue from Lt. Breast.";s:4:"note";s:116:"Result of Immunostaining for ER, PR & HER-2 of Case No: MH13-14648,Block No:(FP. Growth) from DHL, Path. Lab. Dhaka.";s:6:"er_rpt";s:59:"About 55 % of the tumor cell nuclei show moderate staining.";s:8:"er_score";s:8:"4+2=6/ 8";s:6:"pr_rpt";s:59:"About 10 % of the tumor cell nuclei show moderate staining.";s:8:"pr_score";s:7:"2+2=4/8";s:11:"her_two_rpt";s:93:"Weak to moderate complete membrane staining is observed in more than 10 % of the tumor cells.";s:13:"her_two_score";s:2:"2+";s:9:"er_result";s:8:"Positive";s:9:"pr_result";s:8:"Positive";s:14:"her_two_result";s:10:"Borderline";s:8:"rpt_noet";s:0:"";}i:17;a:23:{s:10:"her_two_id";s:2:"41";s:5:"sl_no";s:3:"314";s:7:"test_id";s:16:"MIHC13:15023-025";s:10:"reciv_date";s:10:"16/08/2013";s:9:"deli_date";s:10:"25/08/2013";s:12:"current_date";s:10:"2013-08-16";s:12:"patient_name";s:11:"Mrs. Shilpi";s:3:"age";s:6:"40 Yrs";s:6:"ref_by";s:45:"Tapesh Kumar Paul,FCPS,MS (Oncology Surgery).";s:3:"sex";s:6:"Female";s:13:"hospital_name";s:11:"DHL, C- 512";s:13:"specimen_name";s:19:" Rt breast tissue. ";s:4:"note";s:140:"Result of Immunostaining  for ER, PR &amp; HER-2 of Case No: 14893/13. Block No (02) <br>(Additional Block) from DHL. Path. Lab. Dhaka. <br>";s:6:"er_rpt";s:58:"About 40 % of the tumor cell nuclei show moderate staining";s:8:"er_score";s:8:"4+2=6/ 8";s:6:"pr_rpt";s:59:"About 20 %/ of the tumor cell nuclei show moderate staining";s:8:"pr_score";s:14:"3+2=5      / 8";s:11:"her_two_rpt";s:85:"Strong complete membrane staining is observed in more than 30 % of the tumor cells.
";s:13:"her_two_score";s:2:"3+";s:9:"er_result";s:8:"Positive";s:9:"pr_result";s:8:"Positive";s:14:"her_two_result";s:8:"Positive";s:8:"rpt_noet";s:0:"";}i:18;a:23:{s:10:"her_two_id";s:2:"42";s:5:"sl_no";s:3:"315";s:7:"test_id";s:16:"MIHC13:15045-047";s:10:"reciv_date";s:10:"17/08/2013";s:9:"deli_date";s:10:"25/08/2013";s:12:"current_date";s:10:"2013-08-17";s:12:"patient_name";s:17:"Mrs. Bandana Dash";s:3:"age";s:6:"39 Yrs";s:6:"ref_by";s:43:"Sajjad Mohammad Yusuff, FCPS (Radiotherapy)";s:3:"sex";s:6:"Female";s:13:"hospital_name";s:26:"CSCR Hospital , Chittagong";s:13:"specimen_name";s:38:"One Paraffin block Case No: H-1906A/13";s:4:"note";s:135:"Result of Immunostaining  for ER, PR &amp; HER-2 of Case No:      H-1906A/13 ,<br>Block No: (    02) from The Lab , Chittagong.<br><br>";s:6:"er_rpt";s:53:"About 2 % of the tumor cell nuclei show weak staining";s:8:"er_score";s:8:"2+1=3/ 8";s:6:"pr_rpt";s:51:"<1  %  of the tumor cell nuclei show weak staining.";s:8:"pr_score";s:9:"1+1=2 / 8";s:11:"her_two_rpt";s:93:"Weak to moderate complete membrane staining is observed in more than 10 % of the tumor cells.";s:13:"her_two_score";s:2:"2+";s:9:"er_result";s:8:"Positive";s:9:"pr_result";s:8:"Negative";s:14:"her_two_result";s:10:"Borderline";s:8:"rpt_noet";s:0:"";}i:19;a:23:{s:10:"her_two_id";s:2:"43";s:5:"sl_no";s:3:"317";s:7:"test_id";s:16:"MIHC13:15141-143";s:10:"reciv_date";s:10:"17/08/2013";s:9:"deli_date";s:10:"25/08/2013";s:12:"current_date";s:10:"2013-08-17";s:12:"patient_name";s:15:"Hosne Ara begum";s:3:"age";s:6:"40 Yrs";s:6:"ref_by";s:44:"Sajjad Mohammad Yusuff, FCPS. (Radiotherapy)";s:3:"sex";s:6:"Female";s:13:"hospital_name";s:16:"CSCR, Chittaging";s:13:"specimen_name";s:22:"Tissue from Lt breast.";s:4:"note";s:127:"Result of Immunostaining  for ER, PR &amp; HER-2 of Case No: MH13-14998 ,&nbsp;     Block No: (02    ) from DHL. Path. Lab.<br>";s:6:"er_rpt";s:35:"Tumor cell nuclei show no staining.";s:8:"er_score";s:3:""O"";s:6:"pr_rpt";s:58:"About 10 % of the tumor cell nuclei show moderate staining";s:8:"pr_score";s:14:"2+2=4      / 8";s:11:"her_two_rpt";s:85:"Weak incomplete membrane staining is observed in more than 10 % of the tumor cells.
";s:13:"her_two_score";s:2:"1+";s:9:"er_result";s:8:"Negative";s:9:"pr_result";s:8:"Positive";s:14:"her_two_result";s:8:"Negative";s:8:"rpt_noet";s:0:"";}i:20;a:23:{s:10:"her_two_id";s:2:"44";s:5:"sl_no";s:3:"318";s:7:"test_id";s:16:"MIHC13:15236-238";s:10:"reciv_date";s:10:"18/08/2013";s:9:"deli_date";s:10:"25/08/2013";s:12:"current_date";s:10:"2013-08-18";s:12:"patient_name";s:12:"Provati Rani";s:3:"age";s:6:"35 Yrs";s:6:"ref_by";s:13:"S.M. A. Taleb";s:3:"sex";s:6:"Female";s:13:"hospital_name";s:45:"Rangpur Community Medical College & Hospital.";s:13:"specimen_name";s:23:"Tissue from Lt. breast.";s:4:"note";s:129:"Result of Immunostaining  for ER, PR &amp; HER-2 of Case No:MH13-14424 ,      Block No: (01    ) from DHL, Path. Lab. Dhaka. <br>";s:6:"er_rpt";s:35:"Tumor cell nuclei show no staining.";s:8:"er_score";s:3:""O"";s:6:"pr_rpt";s:35:"Tumor cell nuclei show no staining.";s:8:"pr_score";s:4:" "O"";s:11:"her_two_rpt";s:95:"Weak to moderate complete membrane staining is observed in more than 10 % of the tumor cells.
";s:13:"her_two_score";s:2:"2+";s:9:"er_result";s:8:"Negative";s:9:"pr_result";s:8:"Negative";s:14:"her_two_result";s:10:"Borderline";s:8:"rpt_noet";s:0:"";}i:21;a:23:{s:10:"her_two_id";s:2:"45";s:5:"sl_no";s:3:"321";s:7:"test_id";s:16:"MIHC13:15643-645";s:10:"reciv_date";s:10:"22/08/2013";s:9:"deli_date";s:10:"25/08/2013";s:12:"current_date";s:10:"2013-08-22";s:12:"patient_name";s:10:"Mrs. Munni";s:3:"age";s:6:"35 Yrs";s:6:"ref_by";s:34:"Ismatara Bina. FCPS (Obs & Gynee).";s:3:"sex";s:6:"Female";s:13:"hospital_name";s:39:"Khalishpur Clinic & Diagnostic , Khulna";s:13:"specimen_name";s:19:"Left breast tissue.";s:4:"note";s:136:"Result of Immunostaining  for ER, PR &amp; HER-2 of Case No:MH13-12396 ,&nbsp;      Block No: (02    ) from, DHL, Path. Lab. Dhaka. <br>";s:6:"er_rpt";s:35:"Tumor cell nuclei show no staining.";s:8:"er_score";s:3:""O"";s:6:"pr_rpt";s:35:"Tumor cell nuclei show no staining.";s:8:"pr_score";s:3:""O"";s:11:"her_two_rpt";s:97:"Weak to moderate complete membrane staining is observed in more than 10 % of the tumor cells.

";s:13:"her_two_score";s:2:"2+";s:9:"er_result";s:8:"Negative";s:9:"pr_result";s:8:"Negative";s:14:"her_two_result";s:10:"Borderline";s:8:"rpt_noet";s:87:"Note: The tissue is poorly fixed. Poor fixation may affect the immunostaining results. ";}i:22;a:23:{s:10:"her_two_id";s:2:"46";s:5:"sl_no";s:3:"320";s:7:"test_id";s:16:"MIHC13:15546-548";s:10:"reciv_date";s:10:"22/08/2013";s:9:"deli_date";s:10:"25/08/2013";s:12:"current_date";s:10:"2013-08-22";s:12:"patient_name";s:19:"Mrs. Morsheda Begum";s:3:"age";s:6:"32 Yrs";s:6:"ref_by";s:15:"Naheed Rukhsana";s:3:"sex";s:6:"Female";s:13:"hospital_name";s:4:"DHL.";s:13:"specimen_name";s:24:"Tissue from breast lump.";s:4:"note";s:124:"Result of Immunostaining  for ER, PR &amp; HER-2 of Case No:MH13-13911,      Block No: ( 01) from DHL, Path. Lab. Dhaka.<br>";s:6:"er_rpt";s:35:"Tumor cell nuclei show no staining.";s:8:"er_score";s:3:""O"";s:6:"pr_rpt";s:35:"Tumor cell nuclei show no staining.";s:8:"pr_score";s:3:""O"";s:11:"her_two_rpt";s:85:"Strong complete membrane staining is observed in more than 30 % of the tumor cells.
";s:13:"her_two_score";s:2:"3+";s:9:"er_result";s:8:"Negative";s:9:"pr_result";s:8:"Negative";s:14:"her_two_result";s:8:"Positive";s:8:"rpt_noet";s:0:"";}i:23;a:23:{s:10:"her_two_id";s:2:"47";s:5:"sl_no";s:3:"323";s:7:"test_id";s:16:"MIHC13:15651-653";s:10:"reciv_date";s:10:"22/08/2013";s:9:"deli_date";s:10:"25/08/2013";s:12:"current_date";s:10:"2013-08-22";s:12:"patient_name";s:20:"Mrs. Archona Bhoumik";s:3:"age";s:6:"45 Yrs";s:6:"ref_by";s:47:"Parvin Akhter Banu, Chief Consultant (Oncology)";s:3:"sex";s:6:"Female";s:13:"hospital_name";s:3:"DHL";s:13:"specimen_name";s:35:"One Paraffin block Case No: D-2001.";s:4:"note";s:145:"Result of Immunostaining  for ER, PR &amp; HER-2 of Case No:D-2001,&nbsp;      Block No:&nbsp;&nbsp; (    01) from TCDC, Mohammadpur, Dhaka. <br>";s:6:"er_rpt";s:59:"About 60 %/ of the tumor cell nuclei show moderate staining";s:8:"er_score";s:8:"4+2=6/ 8";s:6:"pr_rpt";s:58:"About 60 % of the tumor cell nuclei show moderate staining";s:8:"pr_score";s:14:"4+2=6      / 8";s:11:"her_two_rpt";s:93:"Weak to moderate complete membrane staining is observed in more than 10 % of the tumor cells.";s:13:"her_two_score";s:2:"2+";s:9:"er_result";s:8:"Positive";s:9:"pr_result";s:8:"Positive";s:14:"her_two_result";s:10:"Borderline";s:8:"rpt_noet";s:0:"";}i:24;a:23:{s:10:"her_two_id";s:2:"48";s:5:"sl_no";s:3:"324";s:7:"test_id";s:16:"MIHC13:15688-690";s:10:"reciv_date";s:10:"23/08/2013";s:9:"deli_date";s:10:"01/09/2013";s:12:"current_date";s:10:"2013-08-23";s:12:"patient_name";s:13:"Mrs. Dilruba ";s:3:"age";s:6:"35 Yrs";s:6:"ref_by";s:45:"Tapesh Kumar Paul,FCPS,MS (Oncology Surgery).";s:3:"sex";s:6:"Female";s:13:"hospital_name";s:13:"DHL, W- 530/8";s:13:"specimen_name";s:31:"Rt. sided mastectomy specimen. ";s:4:"note";s:134:"Result of Immunostaining  for ER, PR &amp; HER-2 of Case No: MH13-15245 ,&nbsp;     Block No: (01    ) from DHL Path. Lab. Dhaka. <br>";s:6:"er_rpt";s:59:"About 30 % of the tumor cell nuclei show moderate staining.";s:8:"er_score";s:7:"3+2=5/8";s:6:"pr_rpt";s:59:"About 15 % of the tumor cell nuclei show moderate staining.";s:8:"pr_score";s:7:"3+2=5/8";s:11:"her_two_rpt";s:93:"Weak to moderate complete membrane staining is observed in more than 10 % of the tumor cells.";s:13:"her_two_score";s:2:"2+";s:9:"er_result";s:8:"Positive";s:9:"pr_result";s:8:"Positive";s:14:"her_two_result";s:10:"Borderline";s:8:"rpt_noet";s:0:"";}i:25;a:23:{s:10:"her_two_id";s:2:"49";s:5:"sl_no";s:3:"325";s:7:"test_id";s:16:"MIHC13:15700-702";s:10:"reciv_date";s:10:"24/08/2013";s:9:"deli_date";s:10:"01/09/2013";s:12:"current_date";s:10:"2013-07-24";s:12:"patient_name";s:11:"Mrs. Amena ";s:3:"age";s:6:"60 Yrs";s:6:"ref_by";s:47:"Parvin Akhter Banu, Chief Consultant (Oncology)";s:3:"sex";s:6:"Female";s:13:"hospital_name";s:3:"DHL";s:13:"specimen_name";s:25:"Mastectomy specimen (Lt.)";s:4:"note";s:129:"Result of Immunostaining  for ER, PR &amp; HER-2 of Case No:      MH13-13864 , Block No: (01    ) from DHL Path. Lab. Dhaka. <br>";s:6:"er_rpt";s:59:"About 50 % of the tumor cell nuclei show moderate staining.";s:8:"er_score";s:7:"3+2=5/8";s:6:"pr_rpt";s:55:"About 50 % of the tumor cell nuclei show weak staining.";s:8:"pr_score";s:7:"3+1=4/8";s:11:"her_two_rpt";s:83:"Weak incomplete membrane staining is observed in more than 10 % of the tumor cells.";s:13:"her_two_score";s:2:"1+";s:9:"er_result";s:8:"Positive";s:9:"pr_result";s:8:"Positive";s:14:"her_two_result";s:8:"Negative";s:8:"rpt_noet";s:0:"";}i:26;a:23:{s:10:"her_two_id";s:2:"50";s:5:"sl_no";s:3:"327";s:7:"test_id";s:16:"MIHC13:15981-983";s:10:"reciv_date";s:10:"26/08/2013";s:9:"deli_date";s:10:"01/09/2013";s:12:"current_date";s:10:"2013-08-26";s:12:"patient_name";s:18:"Mrs. Mim Tabassum ";s:3:"age";s:6:"39 Yrs";s:6:"ref_by";s:37:"Naheed Rukhsan. MBBS, FCPS (Oncology)";s:3:"sex";s:6:"Female";s:13:"hospital_name";s:3:"DHL";s:13:"specimen_name";s:32:"Core biopsy from Rt. Breast lump";s:4:"note";s:103:"Result of Immunostaining  for ER, PR &amp; HER-2 of Case No: MH13-15428 from DHL Path. Lab. Dhaka. <br>";s:6:"er_rpt";s:59:"About 60 % of the tumor cell nuclei show moderate staining.";s:8:"er_score";s:7:"4+2=6/8";s:6:"pr_rpt";s:59:"About 70 % of the tumor cell nuclei show moderate staining.";s:8:"pr_score";s:7:"5+2=7/8";s:11:"her_two_rpt";s:93:"Weak to moderate complete membrane staining is observed in more than 10 % of the tumor cells.";s:13:"her_two_score";s:2:"2+";s:9:"er_result";s:8:"Positive";s:9:"pr_result";s:8:"Positive";s:14:"her_two_result";s:10:"Borderline";s:8:"rpt_noet";s:0:"";}i:27;a:23:{s:10:"her_two_id";s:2:"51";s:5:"sl_no";s:3:"328";s:7:"test_id";s:16:"MIHC13:15994-996";s:10:"reciv_date";s:10:"27/08/2013";s:9:"deli_date";s:10:"01/09/2013";s:12:"current_date";s:10:"2013-08-27";s:12:"patient_name";s:23:"Mrs. Laxmi Rani Baidya ";s:3:"age";s:6:"50 Yrs";s:6:"ref_by";s:0:"";s:3:"sex";s:6:"Female";s:13:"hospital_name";s:12:"CDC, Sylhet ";s:13:"specimen_name";s:38:"One Paraffin block. Case No: S-1945/13";s:4:"note";s:126:"Result of Immunostaining  for ER, PR &amp; HER-2 of Case No:S-1945/13,&nbsp;      <br>Block No:(    01) from CDC, Sylhet. <br>";s:6:"er_rpt";s:55:"About 01 % of the tumor cell nuclei show weak staining.";s:8:"er_score";s:7:"2+1=3/8";s:6:"pr_rpt";s:35:"Tumor cell nuclei show no staining.";s:8:"pr_score";s:3:""O"";s:11:"her_two_rpt";s:83:"Strong complete membrane staining is observed in more than 30 % of the tumor cells.";s:13:"her_two_score";s:2:"3+";s:9:"er_result";s:8:"Positive";s:9:"pr_result";s:8:"Negative";s:14:"her_two_result";s:8:"Positive";s:8:"rpt_noet";s:0:"";}i:28;a:23:{s:10:"her_two_id";s:2:"52";s:5:"sl_no";s:3:"329";s:7:"test_id";s:16:"MIHC13:16125-127";s:10:"reciv_date";s:10:"29/08/2013";s:9:"deli_date";s:10:"01/09/2013";s:12:"current_date";s:10:"2013-08-29";s:12:"patient_name";s:26:"Mrs. Taslima Akhter Jahan ";s:3:"age";s:6:"47 Yrs";s:6:"ref_by";s:31:"Lt. Col. M S Sarwar Alam (Rtd.)";s:3:"sex";s:6:"Female";s:13:"hospital_name";s:3:"DHL";s:13:"specimen_name";s:23:"Tissue from Rt. Breast.";s:4:"note";s:136:"Result of Immunostaining  for ER, PR &amp; HER-2 of Case No: MH13-09870,&nbsp;      <br>Block No: (03    ) from DHL Path Lab. Dhaka <br>";s:6:"er_rpt";s:55:"About 60 % of the tumor cell nuclei show weak staining.";s:8:"er_score";s:7:"4+1=5/8";s:6:"pr_rpt";s:55:"About 30 % of the tumor cell nuclei show weak staining.";s:8:"pr_score";s:7:"3+1=4/8";s:11:"her_two_rpt";s:83:"Weak incomplete membrane staining is observed in more than 10 % of the tumor cells.";s:13:"her_two_score";s:2:"1+";s:9:"er_result";s:8:"Positive";s:9:"pr_result";s:8:"Positive";s:14:"her_two_result";s:8:"Negative";s:8:"rpt_noet";s:0:"";}i:29;a:23:{s:10:"her_two_id";s:2:"53";s:5:"sl_no";s:3:"330";s:7:"test_id";s:16:"MIHC13:16131-133";s:10:"reciv_date";s:10:"29/08/2013";s:9:"deli_date";s:10:"01/09/2013";s:12:"current_date";s:10:"2013-08-29";s:12:"patient_name";s:18:"Mrs. Hawarun Begum";s:3:"age";s:6:"55 Yrs";s:6:"ref_by";s:37:"Naheed Rukhsana.MBBS, FCPS (Oncology)";s:3:"sex";s:6:"Female";s:13:"hospital_name";s:3:"DHL";s:13:"specimen_name";s:35:"One Paraffin block Case No: HP-2415";s:4:"note";s:148:"Result of Immunostaining  for ER, PR &amp; HER-2 of Case No:HP-2415,&nbsp;      Block No: (02    ) from <br>Popular Medical Centre Ltd. Sylhet. <br>";s:6:"er_rpt";s:55:"About 03 % of the tumor cell nuclei show weak staining.";s:8:"er_score";s:7:"2+1=3/8";s:6:"pr_rpt";s:35:"Tumor cell nuclei show no staining.";s:8:"pr_score";s:3:""O"";s:11:"her_two_rpt";s:83:"Strong complete membrane staining is observed in more than 30 % of the tumor cells.";s:13:"her_two_score";s:2:"3+";s:9:"er_result";s:8:"Positive";s:9:"pr_result";s:8:"Negative";s:14:"her_two_result";s:8:"Positive";s:8:"rpt_noet";s:0:"";}i:30;a:23:{s:10:"her_two_id";s:2:"54";s:5:"sl_no";s:3:"331";s:7:"test_id";s:16:"MIHC13:16134-136";s:10:"reciv_date";s:10:"29/08/2013";s:9:"deli_date";s:10:"01/09/2013";s:12:"current_date";s:10:"2013-08-29";s:12:"patient_name";s:22:"Mrs. Jannatul Ferdous ";s:3:"age";s:6:"35 Yrs";s:6:"ref_by";s:40:"Nazrina Khatun. MBBS, MD (Radiotheraphy)";s:3:"sex";s:6:"Female";s:13:"hospital_name";s:25:"NICRH, Mohakhali , Dhaka.";s:13:"specimen_name";s:30:"Core biopsy  from Lt. breast. ";s:4:"note";s:100:"Result of Immunostaining  for ER, PR &amp; HER-2 of Case No: MH13-15998 from DHL Path Lab. Dhaka<br>";s:6:"er_rpt";s:35:"Tumor cell nuclei show no staining.";s:8:"er_score";s:3:""O"";s:6:"pr_rpt";s:35:"Tumor cell nuclei show no staining.";s:8:"pr_score";s:3:""O"";s:11:"her_two_rpt";s:93:"Weak to moderate complete membrane staining is observed in more than 10 % of the tumor cells.";s:13:"her_two_score";s:2:"2+";s:9:"er_result";s:8:"Negative";s:9:"pr_result";s:8:"Negative";s:14:"her_two_result";s:10:"Borderline";s:8:"rpt_noet";s:0:"";}i:31;a:23:{s:10:"her_two_id";s:2:"55";s:5:"sl_no";s:3:"326";s:7:"test_id";s:16:"MIHC13:21415-417";s:10:"reciv_date";s:10:"19/04/2012";s:9:"deli_date";s:10:"31/08/2012";s:12:"current_date";s:10:"2012-04-19";s:12:"patient_name";s:21:"Mrs. Jannatul Ferdous";s:3:"age";s:6:"34 Yrs";s:6:"ref_by";s:16:"CSCR, Chittagong";s:3:"sex";s:6:"Female";s:13:"hospital_name";s:44:"Chittagong Metropoliton Hospital (Pvt.) Ltd.";s:13:"specimen_name";s:24:"Tissue from breast lump.";s:4:"note";s:103:"Result of Immunostaining&nbsp; for ER, PR &amp; HER-2 of case No: MH12-20653&nbsp; ,Block No: ( 01)<br>";s:6:"er_rpt";s:54:"About 3 % of the tumor cell nuclei show weak staining.";s:8:"er_score";s:7:"2+1=3/8";s:6:"pr_rpt";s:55:"About 20 % of the tumor cell nuclei show weak staining.";s:8:"pr_score";s:7:"3+1=4/8";s:11:"her_two_rpt";s:82:"Weak incomplete membrane staining observed in more than 10 % of the tumor cells.
";s:13:"her_two_score";s:2:"1+";s:9:"er_result";s:8:"Positive";s:9:"pr_result";s:8:"Negative";s:14:"her_two_result";s:10:"Borderline";s:8:"rpt_noet";s:0:"";}i:32;a:23:{s:10:"her_two_id";s:2:"56";s:5:"sl_no";s:3:"327";s:7:"test_id";s:16:"MIHC13:21459-461";s:10:"reciv_date";s:10:"20/08/2012";s:9:"deli_date";s:10:"31/08/2012";s:12:"current_date";s:10:"2012-08-20";s:12:"patient_name";s:15:"Miss. Sagorika.";s:3:"age";s:6:"39 Yrs";s:6:"ref_by";s:48:"Parvin Akhter Banu (Senior Consultant, Oncology)";s:3:"sex";s:6:"Female";s:13:"hospital_name";s:5:"DLMCH";s:13:"specimen_name";s:19:"Breast tissue (Rt.)";s:4:"note";s:103:"Result of Immunostaining&nbsp; for ER, PR &amp; HER-2 of case No: MH12-19475&nbsp; Block No: ( 01 )<br>";s:6:"er_rpt";s:59:"About 40 % of the tumor cell nuclei show moderate staining.";s:8:"er_score";s:7:"4+2=6/8";s:6:"pr_rpt";s:59:"About 60 % of the tumor cell nuclei show moderate staining.";s:8:"pr_score";s:8:"4+2 =6/8";s:11:"her_two_rpt";s:82:"Weak incomplete membrane staining is observed in more than 10 % of the tumor cells";s:13:"her_two_score";s:2:"1+";s:9:"er_result";s:8:"Positive";s:9:"pr_result";s:8:"Positive";s:14:"her_two_result";s:8:"Negative";s:8:"rpt_noet";s:0:"";}i:33;a:23:{s:10:"her_two_id";s:2:"57";s:5:"sl_no";s:3:"328";s:7:"test_id";s:16:"MIHC13:21621-623";s:10:"reciv_date";s:10:"05/08/2012";s:9:"deli_date";s:10:"31/08/2013";s:12:"current_date";s:10:"2012-08-05";s:12:"patient_name";s:26:"Mrs. Nazma Bahar Chowdhury";s:3:"age";s:6:"50 Yrs";s:6:"ref_by";s:77:"Meer Mahbubul Alam. FCPS (Surgery). FICS (America)Aroggya Poly Clinic, Sylhet";s:3:"sex";s:6:"Female";s:13:"hospital_name";s:27:"Aroggya Poly Clinic, Sylhet";s:13:"specimen_name";s:42:"One Parafin Block (SN:-2071) Block No:(02)";s:4:"note";s:133:"Result of Immunostaining&nbsp; for ER, PR &amp; HER-2 of case No: SN-2071 Block No:( 02) <br>from City Diagnostic Centre. Sylhet.<br>";s:6:"er_rpt";s:117:"About _______ %/ <1 % of the tumor cell nuclei show weak/moderate/strong staining/Tumor cell nuclei show no staining.";s:8:"er_score";s:7:"2+1=3/8";s:6:"pr_rpt";s:54:"About 7 % of the tumor cell nuclei show weak staining.";s:8:"pr_score";s:7:"2+1=3/8";s:11:"her_two_rpt";s:85:"Strong complete membrane staining is observed in more than 10 % of the tumor cells.
";s:13:"her_two_score";s:2:"3+";s:9:"er_result";s:8:"Negative";s:9:"pr_result";s:8:"Negative";s:14:"her_two_result";s:10:"Borderline";s:8:"rpt_noet";s:0:"";}i:34;a:23:{s:10:"her_two_id";s:2:"58";s:5:"sl_no";s:3:"329";s:7:"test_id";s:16:"MIHC13:21775-777";s:10:"reciv_date";s:10:"01/08/2012";s:9:"deli_date";s:10:"31/08/2012";s:12:"current_date";s:10:"2012-08-01";s:12:"patient_name";s:19:"Mrs. Shirin Akhter.";s:3:"age";s:2:"30";s:6:"ref_by";s:42:"M.N.Huda. (Chief Consultant , Oncologist.)";s:3:"sex";s:4:"Male";s:13:"hospital_name";s:5:"DLMCH";s:13:"specimen_name";s:41:"One Parafin Block SN:-1777 Block No: (02)";s:4:"note";s:135:"Result of Immunostaining&nbsp; for ER, PR &amp; HER-2 of case No: SN:1777 Block No: ( 02) <br>from , The Alpha Laboratory, Comilla.<br>";s:6:"er_rpt";s:59:"About 50 % of the tumor cell nuclei show moderate staining.";s:8:"er_score";s:7:"4+2=6/8";s:6:"pr_rpt";s:54:"About 3 % of the tumor cell nuclei show weak staining.";s:8:"pr_score";s:7:"2+1=3/8";s:11:"her_two_rpt";s:93:"Weak to moderate complete membrane staining is observed in more than 10 % of the tumor cells.";s:13:"her_two_score";s:2:"2+";s:9:"er_result";s:8:"Negative";s:9:"pr_result";s:8:"Positive";s:14:"her_two_result";s:10:"Borderline";s:8:"rpt_noet";s:0:"";}i:35;a:23:{s:10:"her_two_id";s:2:"59";s:5:"sl_no";s:3:"349";s:7:"test_id";s:16:"MIHC13:22847-849";s:10:"reciv_date";s:10:"28/08/2012";s:9:"deli_date";s:10:"31/08/2012";s:12:"current_date";s:10:"2012-08-28";s:12:"patient_name";s:12:"Mrs. Parveen";s:3:"age";s:6:"30 Yrs";s:6:"ref_by";s:18:"Parvin Akhter Banu";s:3:"sex";s:6:"Female";s:13:"hospital_name";s:3:"DHL";s:13:"specimen_name";s:23:"Tissu from left breast.";s:4:"note";s:119:"Result of Immunostaining&nbsp; for ER, PR &amp; HER-2 of case No: MH12:23012&nbsp;&nbsp; &nbsp;<br>Block No: ( 03 )<br>";s:6:"er_rpt";s:34:"Tumor cell nuclei show no staining";s:8:"er_score";s:3:""O"";s:6:"pr_rpt";s:52:"About 1% of the tumor cell nuclei show weak staining";s:8:"pr_score";s:8:"2+1 =3/8";s:11:"her_two_rpt";s:31:"Tumor cells show no staining 
";s:13:"her_two_score";s:3:""O"";s:9:"er_result";s:8:"Negative";s:9:"pr_result";s:8:"Positive";s:14:"her_two_result";s:8:"Negative";s:8:"rpt_noet";s:0:"";}i:36;a:23:{s:10:"her_two_id";s:2:"60";s:5:"sl_no";s:3:"346";s:7:"test_id";s:16:"MIHC13:22552-554";s:10:"reciv_date";s:10:"13/08/2011";s:9:"deli_date";s:10:"23/08/2012";s:12:"current_date";s:10:"2011-08-13";s:12:"patient_name";s:19:"Mrs. Ferdousi Begum";s:3:"age";s:6:"47 Yrs";s:6:"ref_by";s:34:"Syeda Hasina Azam MBBS, FCPS, FRCS";s:3:"sex";s:6:"Female";s:13:"hospital_name";s:22:"IBN Sina Hospital Ltd.";s:13:"specimen_name";s:28:"One Parafine Block (D204719)";s:4:"note";s:147:"Result of Immunostaining&nbsp; for ER, PR &amp; HER-2 of case No:D204719 Block No: (01) from IBN SINA DIAGNOSTIC &amp; IMMAGING CENTRE , DHAKA.<br>";s:6:"er_rpt";s:60:"About 50 % of the tumor cell nuclei show moderate staining. ";s:8:"er_score";s:7:"4+2+6/8";s:6:"pr_rpt";s:118:"About _______%/ <1  %  of the tumor cell nuclei show weak/moderate/strong staining/Tumor cell nuclei show no staining.";s:8:"pr_score";s:9:"      / 8";s:11:"her_two_rpt";s:82:"Weak incomplete membrane staining is observed in more than 10 % of the tumor cells";s:13:"her_two_score";s:2:"1+";s:9:"er_result";s:8:"Positive";s:9:"pr_result";s:8:"Positive";s:14:"her_two_result";s:8:"Negative";s:8:"rpt_noet";s:0:"";}i:37;a:23:{s:10:"her_two_id";s:2:"61";s:5:"sl_no";s:3:"351";s:7:"test_id";s:16:"MIHC13:22970-972";s:10:"reciv_date";s:10:"14/08/2012";s:9:"deli_date";s:10:"31/08/2012";s:12:"current_date";s:10:"2012-08-14";s:12:"patient_name";s:20:"Mrs. Jahanara Akhter";s:3:"age";s:6:"44 Yrs";s:6:"ref_by";s:28:"Tapesh Kumar Paul , FCPS, MS";s:3:"sex";s:6:"Female";s:13:"hospital_name";s:3:"DHL";s:13:"specimen_name";s:22:"Tissue from Lt breast.";s:4:"note";s:137:"Result of Immunostaining&nbsp; for ER, PR &amp; HER-2 of case No:MH12-20247 (FP)&nbsp;&nbsp;&nbsp;&nbsp;&nbsp;&nbsp; Block No: ( 01 )<br>";s:6:"er_rpt";s:57:"About 50 % of the tumor cell nuclei show strong staining.";s:8:"er_score";s:7:"4+3=7/8";s:6:"pr_rpt";s:60:"About 60 %/ of the tumor cell nuclei show moderate staining.";s:8:"pr_score";s:8:" 4+2=6/8";s:11:"her_two_rpt";s:85:"Weak incomplete membrane staining is observed in more than 10 % of the tumor cells.
";s:13:"her_two_score";s:2:"1+";s:9:"er_result";s:8:"Positive";s:9:"pr_result";s:8:"Positive";s:14:"her_two_result";s:8:"Negative";s:8:"rpt_noet";s:0:"";}i:38;a:23:{s:10:"her_two_id";s:2:"62";s:5:"sl_no";s:3:"352";s:7:"test_id";s:16:"MIHC13:23022-024";s:10:"reciv_date";s:10:"28/08/2012";s:9:"deli_date";s:10:"31/08/2012";s:12:"current_date";s:10:"2012-08-28";s:12:"patient_name";s:6:"Debola";s:3:"age";s:6:"50 Yrs";s:6:"ref_by";s:0:"";s:3:"sex";s:6:"Female";s:13:"hospital_name";s:4:"DMCH";s:13:"specimen_name";s:20:"Mastectomy specimen.";s:4:"note";s:111:"Result of Immunostaining&nbsp; for ER, PR &amp; HER-2 of case No: MH12-22219&nbsp; &nbsp;<br>Block No: (02)<br>";s:6:"er_rpt";s:35:"Tumor cell nuclei show no staining.";s:8:"er_score";s:3:""O"";s:6:"pr_rpt";s:35:"Tumor cell nuclei show no staining.";s:8:"pr_score";s:3:""O"";s:11:"her_two_rpt";s:30:"Tumor cells show no staining. ";s:13:"her_two_score";s:3:""O"";s:9:"er_result";s:8:"Positive";s:9:"pr_result";s:8:"Negative";s:14:"her_two_result";s:8:"Negative";s:8:"rpt_noet";s:0:"";}i:39;a:23:{s:10:"her_two_id";s:2:"63";s:5:"sl_no";s:3:"388";s:7:"test_id";s:16:"MIHC13:24674-676";s:10:"reciv_date";s:10:"15/08/2013";s:9:"deli_date";s:10:"06/08/2012";s:12:"current_date";s:10:"2013-08-15";s:12:"patient_name";s:18:"Mrs. Sajia Akhter ";s:3:"age";s:6:"35 Yrs";s:6:"ref_by";s:55:"Sajjad Mohammad Yusuff, FCPS (Radiotherapy), Oncologist";s:3:"sex";s:6:"Female";s:13:"hospital_name";s:4:"CMCH";s:13:"specimen_name";s:13:"Breast tissue";s:4:"note";s:99:"Result of Immunostaining&nbsp; for ER, PR &amp; HER-2 of case No: MH12-24,678<br>Block No: (01)<br>";s:6:"er_rpt";s:35:"Tumor cell nuclei show no staining.";s:8:"er_score";s:3:""0"";s:6:"pr_rpt";s:35:"Tumor cell nuclei show no staining.";s:8:"pr_score";s:3:""0"";s:11:"her_two_rpt";s:29:"Tumor cells show no staining.";s:13:"her_two_score";s:3:""O"";s:9:"er_result";s:8:"Negative";s:9:"pr_result";s:8:"Negative";s:14:"her_two_result";s:8:"Negative";s:8:"rpt_noet";s:0:"";}i:40;a:23:{s:10:"her_two_id";s:2:"64";s:5:"sl_no";s:3:"405";s:7:"test_id";s:16:"MIHC13:00088-090";s:10:"reciv_date";s:9:"03-Jan-13";s:9:"deli_date";s:10:"28/08/2013";s:12:"current_date";s:10:"2013-01-03";s:12:"patient_name";s:19:"Mrs. Morsheda Begum";s:3:"age";s:6:"54 Yrs";s:6:"ref_by";s:28:"Ahmed Sayeed, FCPS (Surgery)";s:3:"sex";s:6:"Female";s:13:"hospital_name";s:41:"Oncology Centre and General Hospital Ltd.";s:13:"specimen_name";s:18:"Tissue from breast";s:4:"note";s:109:"Result of Immunostaining&nbsp; for ER, PR &amp; HER-2 of case No:MH12-25092&nbsp; <br>Block No: (02 )<br><br>";s:6:"er_rpt";s:59:"About 60 % of the tumor cell nuclei show moderate staining.";s:8:"er_score";s:7:"4+2=6/8";s:6:"pr_rpt";s:57:"About 60 % of the tumor cell nuclei show strong staining.";s:8:"pr_score";s:7:"4+3=7/8";s:11:"her_two_rpt";s:29:"Tumor cells show no staining ";s:13:"her_two_score";s:3:""O"";s:9:"er_result";s:8:"Positive";s:9:"pr_result";s:8:"Positive";s:14:"her_two_result";s:8:"Negative";s:8:"rpt_noet";s:0:"";}i:41;a:23:{s:10:"her_two_id";s:2:"65";s:5:"sl_no";s:3:"107";s:7:"test_id";s:16:"MIHC13:05607-609";s:10:"reciv_date";s:10:"23/08/2013";s:9:"deli_date";s:10:"28/08/2013";s:12:"current_date";s:10:"2013-08-23";s:12:"patient_name";s:20:"Mrs. Shahanaz Akhter";s:3:"age";s:6:"40 Yrs";s:6:"ref_by";s:8:"Tamanna.";s:3:"sex";s:6:"Female";s:13:"hospital_name";s:22:"Model Lab, Chittagong.";s:13:"specimen_name";s:68:"Breast tissue and one paraffin block (316C/13). Case No: MH13-18317.";s:4:"note";s:202:"Result of Immunostaining  for ER, PR &amp; HER-2 of Case No:      Block No: (    )Result of Immunostaining&nbsp; for ER, PR &amp; HER-2 of case No: EX-316/13 , <br>Block No: (01)&nbsp; from CMC.<br><br>";s:6:"er_rpt";s:55:"About 02 % of the tumor cell nuclei show weak staining.";s:8:"er_score";s:7:"2+1=3/8";s:6:"pr_rpt";s:55:"About 03 % of the tumor cell nuclei show weak staining.";s:8:"pr_score";s:7:"2+1=3/8";s:11:"her_two_rpt";s:30:"Tumor cells show no staining. ";s:13:"her_two_score";s:3:""O"";s:9:"er_result";s:8:"Positive";s:9:"pr_result";s:8:"Positive";s:14:"her_two_result";s:8:"Negative";s:8:"rpt_noet";s:0:"";}i:42;a:23:{s:10:"her_two_id";s:2:"66";s:5:"sl_no";s:3:"169";s:7:"test_id";s:16:"MIHC13:09090-092";s:10:"reciv_date";s:10:"14/08/2013";s:9:"deli_date";s:10:"20/08/2013";s:12:"current_date";s:10:"2013-08-14";s:12:"patient_name";s:12:"Masuda Begum";s:3:"age";s:6:"50 Yrs";s:6:"ref_by";s:26:"Left breast and lymph node";s:3:"sex";s:6:"Female";s:13:"hospital_name";s:44:"Care Hospital & Diagnostic (PVT). Ltd. Dhaka";s:13:"specimen_name";s:26:"Left breast and lymph node";s:4:"note";s:94:"Result of Immunostaining&nbsp; for ER, PR &amp; HER-2 of case No: MH13-8716,Block No: (01)<br>";s:6:"er_rpt";s:35:"Tumor cell nuclei show no staining.";s:8:"er_score";s:5:"  "O"";s:6:"pr_rpt";s:35:"Tumor cell nuclei show no staining.";s:8:"pr_score";s:5:"  "O"";s:11:"her_two_rpt";s:29:"Tumor cells show no staining.";s:13:"her_two_score";s:12:"Select Score";s:9:"er_result";s:8:"Negative";s:9:"pr_result";s:8:"Negative";s:14:"her_two_result";s:8:"Negative";s:8:"rpt_noet";s:0:"";}i:43;a:23:{s:10:"her_two_id";s:2:"67";s:5:"sl_no";s:3:"175";s:7:"test_id";s:12:"MIHC13:09226";s:10:"reciv_date";s:9:"23-May-13";s:9:"deli_date";s:9:"26-May-13";s:12:"current_date";s:10:"2013-05-23";s:12:"patient_name";s:22:"Mrs. Rowshan Ara Begum";s:3:"age";s:6:"60 Yrs";s:6:"ref_by";s:0:"";s:3:"sex";s:6:"Female";s:13:"hospital_name";s:17:"CSCR, Chittagong.";s:13:"specimen_name";s:19:"Mastectomy specimen";s:4:"note";s:88:"Result of Immunostaining&nbsp; for LCA of case No:&nbsp; MH13-7299, Block No: ( 02 )<br>";s:6:"er_rpt";s:35:"Tumor cell nuclei show no staining.";s:8:"er_score";s:3:""O"";s:6:"pr_rpt";s:35:"Tumor cell nuclei show no staining.";s:8:"pr_score";s:3:""O"";s:11:"her_two_rpt";s:29:"Tumor cells show no staining.";s:13:"her_two_score";s:3:""O"";s:9:"er_result";s:8:"Negative";s:9:"pr_result";s:8:"Negative";s:14:"her_two_result";s:8:"Negative";s:8:"rpt_noet";s:0:"";}i:44;a:23:{s:10:"her_two_id";s:2:"68";s:5:"sl_no";s:3:"178";s:7:"test_id";s:16:"MIHC13:09481-483";s:10:"reciv_date";s:9:"27-May-13";s:9:"deli_date";s:10:"02-June-13";s:12:"current_date";s:10:"2013-05-27";s:12:"patient_name";s:19:"Nurjahan Begum Runa";s:3:"age";s:6:"30 Yrs";s:6:"ref_by";s:0:"";s:3:"sex";s:6:"Female";s:13:"hospital_name";s:11:"NC HOSPITAL";s:13:"specimen_name";s:22:"Tissue from Lt. breast";s:4:"note";s:110:"Result of Immunostaining&nbsp; for ER, PR &amp; HER-2 of case No: MH13-5957&nbsp; &nbsp;<br>Block No: (01)<br>";s:6:"er_rpt";s:48:"<1 % of the tumor cell nuclei show weak staining";s:8:"er_score";s:7:"1+1=2/8";s:6:"pr_rpt";s:47:"<1% of the tumor cell nuclei show weak staining";s:8:"pr_score";s:7:"1+1=2/8";s:11:"her_two_rpt";s:32:"a) Tumor cells show no staining ";s:13:"her_two_score";s:3:""O"";s:9:"er_result";s:8:"Negative";s:9:"pr_result";s:8:"Negative";s:14:"her_two_result";s:8:"Negative";s:8:"rpt_noet";s:0:"";}i:45;a:23:{s:10:"her_two_id";s:2:"69";s:5:"sl_no";s:3:"252";s:7:"test_id";s:16:"MIHC13:12262-264";s:10:"reciv_date";s:9:"03-Jul-13";s:9:"deli_date";s:9:"07-Jul-13";s:12:"current_date";s:10:"2013-07-03";s:12:"patient_name";s:6:"Halima";s:3:"age";s:6:"32 Yrs";s:6:"ref_by";s:41:"Mohammad Mahbub Alam. Assit. Registar (S)";s:3:"sex";s:6:"Female";s:13:"hospital_name";s:17:"Sh.S.M.C.H, Dhaka";s:13:"specimen_name";s:25:"Mastectomy specimen (Lt.)";s:4:"note";s:132:"Result of Immunostaining&nbsp; for ER, PR &amp; HER-2 of case No:&nbsp; MH13-11859<br>Block No: (01) from DHL. Path. Lab. Dhaka.<br>";s:6:"er_rpt";s:35:"Tumor cell nuclei show no staining.";s:8:"er_score";s:3:""O"";s:6:"pr_rpt";s:35:"Tumor cell nuclei show no staining.";s:8:"pr_score";s:3:""O"";s:11:"her_two_rpt";s:33:"a) Tumor cells show no staining. ";s:13:"her_two_score";s:3:""O"";s:9:"er_result";s:8:"Negative";s:9:"pr_result";s:8:"Negative";s:14:"her_two_result";s:8:"Negative";s:8:"rpt_noet";s:0:"";}i:46;a:23:{s:10:"her_two_id";s:2:"70";s:5:"sl_no";s:3:"332";s:7:"test_id";s:16:"MIHC13:16260-262";s:10:"reciv_date";s:10:"29/08/2013";s:9:"deli_date";s:10:"08/09/2013";s:12:"current_date";s:10:"2013-08-29";s:12:"patient_name";s:19:"Mrs. Jahanara Begum";s:3:"age";s:6:"45 Yrs";s:6:"ref_by";s:46:"Sarwar Alam. MBBS, DIH (DU), M.Phil (Oncology)";s:3:"sex";s:6:"Female";s:13:"hospital_name";s:31:"Health and Hope Hospital, Dhaka";s:13:"specimen_name";s:20:"Mastectomy specimen ";s:4:"note";s:119:"Result of Immunostaining  for ER, PR &amp; HER-2 of Case No: MH13-14695. Block No (02) from DHL. Path. Lab. Dhaka. <br>";s:6:"er_rpt";s:35:"Tumor cell nuclei show no staining.";s:8:"er_score";s:0:"";s:6:"pr_rpt";s:35:"Tumor cell nuclei show no staining.";s:8:"pr_score";s:0:"";s:11:"her_two_rpt";s:85:"Strong complete membrane staining is observed in more than 30 % of the tumor cells.
";s:13:"her_two_score";s:2:"3+";s:9:"er_result";s:8:"Negative";s:9:"pr_result";s:8:"Negative";s:14:"her_two_result";s:8:"Positive";s:8:"rpt_noet";s:0:"";}i:47;a:23:{s:10:"her_two_id";s:2:"71";s:5:"sl_no";s:3:"333";s:7:"test_id";s:16:"MIHC13:16287-289";s:10:"reciv_date";s:10:"30/08/2013";s:9:"deli_date";s:10:"08/09/2013";s:12:"current_date";s:10:"2013-08-30";s:12:"patient_name";s:12:"Mrs. Reshma ";s:3:"age";s:6:"40 Yrs";s:6:"ref_by";s:8:"M.A. Hai";s:3:"sex";s:6:"Female";s:13:"hospital_name";s:33:"Queens Hospital (PVT.)Ltd. Jesore";s:13:"specimen_name";s:72:"(Tissue from axillary lymph node ) Two paraffin block case no: 130806269";s:4:"note";s:140:"Result of Immunostaining  for ER, PR &amp; HER-2 of Case No:&nbsp; 130806269 , <br>&nbsp;Block No: (A1    ) from aiKhan Lab Ltd. Dhaka. <br>";s:6:"er_rpt";s:35:"Tumor cell nuclei show no staining.";s:8:"er_score";s:0:"";s:6:"pr_rpt";s:35:"Tumor cell nuclei show no staining.";s:8:"pr_score";s:0:"";s:11:"her_two_rpt";s:85:"Weak incomplete membrane staining is observed in more than 10 % of the tumor cells.
";s:13:"her_two_score";s:2:"1+";s:9:"er_result";s:8:"Negative";s:9:"pr_result";s:8:"Negative";s:14:"her_two_result";s:8:"Negative";s:8:"rpt_noet";s:0:"";}i:48;a:23:{s:10:"her_two_id";s:2:"72";s:5:"sl_no";s:3:"334";s:7:"test_id";s:16:"MIHC13:16292-294";s:10:"reciv_date";s:10:"31/08/2013";s:9:"deli_date";s:10:"08/09/2013";s:12:"current_date";s:10:"2013-08-31";s:12:"patient_name";s:14:"Mrs. Tinku Dev";s:3:"age";s:6:"38 Yrs";s:6:"ref_by";s:0:"";s:3:"sex";s:6:"Female";s:13:"hospital_name";s:32:"Chevron Clinical Lab. Chittagong";s:13:"specimen_name";s:33:"Breast tissue case no: MH13-16107";s:4:"note";s:131:"Result of Immunostaining  for ER, PR &amp; HER-2 of Case No:      MH13-16107&nbsp; Block no: (02), from DHL, Path, Lab, Dhaka. <br>";s:6:"er_rpt";s:59:"About 40 % of the tumor cell nuclei show moderate staining.";s:8:"er_score";s:7:"4+2=6/8";s:6:"pr_rpt";s:59:"About 65 % of the tumor cell nuclei show moderate staining.";s:8:"pr_score";s:7:"4+2=6/8";s:11:"her_two_rpt";s:86:" Strong complete membrane staining is observed in more than 30 % of the tumor cells.
";s:13:"her_two_score";s:2:"3+";s:9:"er_result";s:8:"Positive";s:9:"pr_result";s:8:"Positive";s:14:"her_two_result";s:8:"Positive";s:8:"rpt_noet";s:0:"";}i:49;a:23:{s:10:"her_two_id";s:2:"73";s:5:"sl_no";s:3:"335";s:7:"test_id";s:16:"MIHC13:16392-394";s:10:"reciv_date";s:10:"05/09/2013";s:9:"deli_date";s:10:"08/09/2013";s:12:"current_date";s:10:"2013-09-05";s:12:"patient_name";s:18:"Mrs. Rokeya Begum ";s:3:"age";s:6:"50 Yrs";s:6:"ref_by";s:37:"Naheed Rukhsana. MBBS,FCPS (Oncology)";s:3:"sex";s:6:"Female";s:13:"hospital_name";s:12:"DHL, Dhaka. ";s:13:"specimen_name";s:38:"Tissue from breast case no: MH13-09909";s:4:"note";s:126:"Result of Immunostaining  for ER, PR &amp; HER-2 of Case No: MH13-09909,     Block No: (01    ) from DHL.Path. Lab. Dhaka.<br>";s:6:"er_rpt";s:35:"Tumor cell nuclei show no staining.";s:8:"er_score";s:3:""O"";s:6:"pr_rpt";s:50:"<1 %  of the tumor cell nuclei show weak staining.";s:8:"pr_score";s:7:"1+1=2/8";s:11:"her_two_rpt";s:86:" Weak incomplete membrane staining is observed in more than 10 % of the tumor cells.
";s:13:"her_two_score";s:2:"1+";s:9:"er_result";s:8:"Negative";s:9:"pr_result";s:8:"Negative";s:14:"her_two_result";s:8:"Negative";s:8:"rpt_noet";s:0:"";}i:50;a:23:{s:10:"her_two_id";s:2:"74";s:5:"sl_no";s:3:"337";s:7:"test_id";s:16:"MIHC13:16448-450";s:10:"reciv_date";s:10:"01/09/2013";s:9:"deli_date";s:10:"08/09/2013";s:12:"current_date";s:10:"2013-09-01";s:12:"patient_name";s:19:"Mrs. Jahanar Begum ";s:3:"age";s:7:"30 Yrs ";s:6:"ref_by";s:45:"Tapesh Kumar Paul,FCPS,MS (Oncology Surgery).";s:3:"sex";s:6:"Female";s:13:"hospital_name";s:5:"DLMCH";s:13:"specimen_name";s:62:"Four paraffin block, (Rt. axillary lymph node) Case No: MJ-953";s:4:"note";s:131:"Result of Immunostaining  for ER, PR &amp; HER-2 of&nbsp; Case No: MJ 953,      Block No: (01    ) from The laboratory, Dhaka. <br>";s:6:"er_rpt";s:56:"About 05 %  of the tumor cell nuclei show weak staining.";s:8:"er_score";s:7:"2+1=3/8";s:6:"pr_rpt";s:35:"Tumor cell nuclei show no staining.";s:8:"pr_score";s:3:""O"";s:11:"her_two_rpt";s:83:"Strong complete membrane staining is observed in more than 30 % of the tumor cells.";s:13:"her_two_score";s:2:"3+";s:9:"er_result";s:8:"Positive";s:9:"pr_result";s:8:"Negative";s:14:"her_two_result";s:8:"Positive";s:8:"rpt_noet";s:0:"";}i:51;a:23:{s:10:"her_two_id";s:2:"75";s:5:"sl_no";s:3:"336";s:7:"test_id";s:16:"MIHC13:16404-406";s:10:"reciv_date";s:10:"01/09/2013";s:9:"deli_date";s:10:"08/09/2013";s:12:"current_date";s:10:"2013-09-01";s:12:"patient_name";s:13:"Mrs.  Shirin ";s:3:"age";s:7:"40 Yrs ";s:6:"ref_by";s:45:"Tapesh Kumar Paul,FCPS,MS (Oncology Surgery).";s:3:"sex";s:6:"Female";s:13:"hospital_name";s:13:"DHL, C- 530/7";s:13:"specimen_name";s:37:"Lt. breast tissue Case No: MH13-16116";s:4:"note";s:123:"Result of Immunostaining  for ER, PR &amp; HER-2 of Case No: MH13-16116 ,     Block No: (01) from DHL. Path. Lab. Dhaka<br>";s:6:"er_rpt";s:49:"<1 % of the tumor cell nuclei show weak staining.";s:8:"er_score";s:7:"1+1=2/8";s:6:"pr_rpt";s:35:"Tumor cell nuclei show no staining.";s:8:"pr_score";s:3:""O"";s:11:"her_two_rpt";s:94:" Weak to moderate complete membrane staining is observed in more than 10 % of the tumor cells.";s:13:"her_two_score";s:2:"2+";s:9:"er_result";s:8:"Negative";s:9:"pr_result";s:8:"Negative";s:14:"her_two_result";s:10:"Borderline";s:8:"rpt_noet";s:0:"";}i:52;a:23:{s:10:"her_two_id";s:2:"76";s:5:"sl_no";s:3:"338";s:7:"test_id";s:16:"MIHC13:16508-510";s:10:"reciv_date";s:10:"01/09/2013";s:9:"deli_date";s:10:"08/09/2013";s:12:"current_date";s:10:"2013-09-01";s:12:"patient_name";s:17:"Mrs. Sufia Akter ";s:3:"age";s:6:"35 Yrs";s:6:"ref_by";s:41:"Md. Yeaqub Ali, MBBS, FCPS, (Radiotheapy)";s:3:"sex";s:6:"Female";s:13:"hospital_name";s:37:"Islami Bank Central Hospital, Dhaka  ";s:13:"specimen_name";s:44:"Tissue from breast lump. Case No: MH13-10407";s:4:"note";s:134:"Result of Immunostaining  for ER, PR &amp; HER-2 of Case No: MH13 10407,&nbsp;      Block No: ( 02 ), from DHL, Path. Lab, Dhaka. <br>";s:6:"er_rpt";s:60:"About 55 % of the tumor cell nuclei show  moderate staining.";s:8:"er_score";s:7:"4+2=6/8";s:6:"pr_rpt";s:59:"About 50 % of the tumor cell nuclei show moderate staining.";s:8:"pr_score";s:7:"4+2=6/8";s:11:"her_two_rpt";s:95:"Weak to moderate complete membrane staining is observed in more than 10 % of the tumor cells.
";s:13:"her_two_score";s:2:"2+";s:9:"er_result";s:8:"Positive";s:9:"pr_result";s:8:"Positive";s:14:"her_two_result";s:10:"Borderline";s:8:"rpt_noet";s:0:"";}i:53;a:23:{s:10:"her_two_id";s:2:"77";s:5:"sl_no";s:3:"340";s:7:"test_id";s:16:"MIHC13:16711-713";s:10:"reciv_date";s:10:"04/09/2013";s:9:"deli_date";s:10:"08/09/2013";s:12:"current_date";s:10:"2013-09-04";s:12:"patient_name";s:12:"Mrs. Ayesha ";s:3:"age";s:7:"58 Yrs ";s:6:"ref_by";s:54:"Prof. M.N. Huda. Principal Chief Consultant (Oncology)";s:3:"sex";s:6:"Female";s:13:"hospital_name";s:4:"DHL.";s:13:"specimen_name";s:36:"Two paraffin block Case No: 132-3767";s:4:"note";s:136:"Result of Immunostaining  for ER, PR &amp; HER-2 of Case No: 132-3767,&nbsp;     Block No: (02    ) from The laboratory , Dhaka.<br><br>";s:6:"er_rpt";s:60:"About 60  % of the tumor cell nuclei show moderate staining.";s:8:"er_score";s:7:"4+2=6/8";s:6:"pr_rpt";s:59:"About 15 % of the tumor cell nuclei show moderate staining.";s:8:"pr_score";s:7:"3+2=5/8";s:11:"her_two_rpt";s:83:"Weak incomplete membrane staining is observed in more than 10 % of the tumor cells.";s:13:"her_two_score";s:2:"1+";s:9:"er_result";s:8:"Positive";s:9:"pr_result";s:8:"Positive";s:14:"her_two_result";s:8:"Negative";s:8:"rpt_noet";s:0:"";}i:54;a:23:{s:10:"her_two_id";s:2:"78";s:5:"sl_no";s:3:"341";s:7:"test_id";s:16:"MIHC13:16819-821";s:10:"reciv_date";s:10:"05/09/2013";s:9:"deli_date";s:10:"08/09/2013";s:12:"current_date";s:10:"2013-09-05";s:12:"patient_name";s:11:"Mrs. Rafiza";s:3:"age";s:7:"38 Yrs ";s:6:"ref_by";s:0:"";s:3:"sex";s:6:"Female";s:13:"hospital_name";s:24:"NICRH. Mohakhali , Dhaka";s:13:"specimen_name";s:36:"Two paraffin block Case No: 131-9859";s:4:"note";s:129:"Result of Immunostaining  for ER, PR &amp; HER-2 of Case No:131-9859, &nbsp; Block No: (02    ) from The laboratory . Dhaka. <br>";s:6:"er_rpt";s:60:"About 50  % of the tumor cell nuclei show moderate staining.";s:8:"er_score";s:7:"4+2=6/8";s:6:"pr_rpt";s:59:"About 30 % of the tumor cell nuclei show moderate staining.";s:8:"pr_score";s:7:"3+2=5/8";s:11:"her_two_rpt";s:94:" Weak to moderate complete membrane staining is observed in more than 10 % of the tumor cells.";s:13:"her_two_score";s:2:"2+";s:9:"er_result";s:8:"Positive";s:9:"pr_result";s:8:"Positive";s:14:"her_two_result";s:10:"Borderline";s:8:"rpt_noet";s:0:"";}i:55;a:23:{s:10:"her_two_id";s:2:"79";s:5:"sl_no";s:3:"343";s:7:"test_id";s:16:"MIHC13:16923-925";s:10:"reciv_date";s:10:"07/09/2013";s:9:"deli_date";s:10:"15/09/2013";s:12:"current_date";s:10:"2013-09-07";s:12:"patient_name";s:9:"Mrs. Minu";s:3:"age";s:6:"45 Yrs";s:6:"ref_by";s:45:"Tapesh Kumar Paul,FCPS,MS (Oncology Surgery).";s:3:"sex";s:6:"Female";s:13:"hospital_name";s:11:"DHL, C- 610";s:13:"specimen_name";s:41:"Mastectomy specimen. Case no: MH13:-16589";s:4:"note";s:138:"Result of Immunostaining  for ER, PR &amp; HER-2 of Case No: MH13-16589,&nbsp;     Block No: (02    ) from, DHL, Path Lab. Dhaka. <br><br>";s:6:"er_rpt";s:55:"About 40 % of the tumor cell nuclei show weak staining.";s:8:"er_score";s:7:"4+1=5/8";s:6:"pr_rpt";s:35:"Tumor cell nuclei show no staining.";s:8:"pr_score";s:0:"";s:11:"her_two_rpt";s:84:" Strong complete membrane staining is observed in more than 30 % of the tumor cells.";s:13:"her_two_score";s:2:"3+";s:9:"er_result";s:8:"Positive";s:9:"pr_result";s:8:"Negative";s:14:"her_two_result";s:8:"Positive";s:8:"rpt_noet";s:0:"";}i:56;a:23:{s:10:"her_two_id";s:2:"80";s:5:"sl_no";s:3:"344";s:7:"test_id";s:16:"MIHC13:16927-929";s:10:"reciv_date";s:10:"07/09/2013";s:9:"deli_date";s:10:"15/09/2013";s:12:"current_date";s:10:"2013-09-07";s:12:"patient_name";s:17:"Mrs. Farida Begum";s:3:"age";s:6:"45 Yrs";s:6:"ref_by";s:45:"Tapesh Kumar Paul,FCPS,MS (Oncology Surgery).";s:3:"sex";s:6:"Female";s:13:"hospital_name";s:10:"530/4,DHL.";s:13:"specimen_name";s:46:"Mastectomy specimen (Rt.). Case No: MH13-16391";s:4:"note";s:136:"Result of Immunostaining  for ER, PR &amp; HER-2 of Case No: MH13-16391,&nbsp;      Block No: (    01) from, DHL. Path. Lab. Dhaka. <br>";s:6:"er_rpt";s:35:"Tumor cell nuclei show no staining.";s:8:"er_score";s:3:""O"";s:6:"pr_rpt";s:35:"Tumor cell nuclei show no staining.";s:8:"pr_score";s:3:""O"";s:11:"her_two_rpt";s:94:" Weak to moderate complete membrane staining is observed in more than 10 % of the tumor cells.";s:13:"her_two_score";s:2:"2+";s:9:"er_result";s:8:"Negative";s:9:"pr_result";s:8:"Negative";s:14:"her_two_result";s:10:"Borderline";s:8:"rpt_noet";s:0:"";}i:57;a:23:{s:10:"her_two_id";s:2:"81";s:5:"sl_no";s:3:"345";s:7:"test_id";s:16:"MIHC13:16957-959";s:10:"reciv_date";s:10:"07/09/2013";s:9:"deli_date";s:10:"15/09/2013";s:12:"current_date";s:10:"2013-09-07";s:12:"patient_name";s:13:"Khairun Nessa";s:3:"age";s:6:"50 Yrs";s:6:"ref_by";s:0:"";s:3:"sex";s:6:"Female";s:13:"hospital_name";s:51:"Shaheed Suhrawardy Medical College Hospital . Dhaka";s:13:"specimen_name";s:46:"Mastectomy specimen (Rt.). Case No: MH13-16523";s:4:"note";s:131:"Result of Immunostaining  for ER, PR &amp; HER-2 of Case No: MH13-16523,&nbsp;      Block No: (01) from DHL. Path. Lab. Dhaka. <br>";s:6:"er_rpt";s:55:"About 03 % of the tumor cell nuclei show weak staining.";s:8:"er_score";s:7:"2+1=3/8";s:6:"pr_rpt";s:35:"Tumor cell nuclei show no staining.";s:8:"pr_score";s:3:""O"";s:11:"her_two_rpt";s:94:" Weak to moderate complete membrane staining is observed in more than 10 % of the tumor cells.";s:13:"her_two_score";s:2:"2+";s:9:"er_result";s:8:"Positive";s:9:"pr_result";s:8:"Negative";s:14:"her_two_result";s:10:"Borderline";s:8:"rpt_noet";s:0:"";}i:58;a:23:{s:10:"her_two_id";s:2:"82";s:5:"sl_no";s:3:"346";s:7:"test_id";s:16:"MIHC13:16964-966";s:10:"reciv_date";s:10:"07/09/2013";s:9:"deli_date";s:10:"15/09/2013";s:12:"current_date";s:10:"2013-09-07";s:12:"patient_name";s:13:"Maksuda Begum";s:3:"age";s:6:"40 Yrs";s:6:"ref_by";s:0:"";s:3:"sex";s:6:"Female";s:13:"hospital_name";s:23:"NICRH, Mohakhali, Dhaka";s:13:"specimen_name";s:39:"Tissue from breast. Case No: MH13-13734";s:4:"note";s:129:"Result of Immunostaining  for ER, PR &amp; HER-2 of Case No: MH13-13734     <br>Block No: (02    ) from DHL, Path. Lab. Dhaka<br>";s:6:"er_rpt";s:59:"About 50 % of the tumor cell nuclei show moderate staining.";s:8:"er_score";s:7:"4+2=6/8";s:6:"pr_rpt";s:35:"Tumor cell nuclei show no staining.";s:8:"pr_score";s:3:""O"";s:11:"her_two_rpt";s:83:"Strong complete membrane staining is observed in more than 30 % of the tumor cells.";s:13:"her_two_score";s:2:"3+";s:9:"er_result";s:8:"Positive";s:9:"pr_result";s:8:"Negative";s:14:"her_two_result";s:8:"Positive";s:8:"rpt_noet";s:0:"";}i:59;a:23:{s:10:"her_two_id";s:2:"83";s:5:"sl_no";s:3:"347";s:7:"test_id";s:12:"MIHC13:17026";s:10:"reciv_date";s:10:"07/09/2013";s:9:"deli_date";s:10:"15/09/2013";s:12:"current_date";s:10:"2013-09-07";s:12:"patient_name";s:16:"Miss. Irin Nahar";s:3:"age";s:6:"18 Yrs";s:6:"ref_by";s:14:"S.M. Abu Taleb";s:3:"sex";s:6:"Female";s:13:"hospital_name";s:53:"Rangpur Community Medical College & Hospital Rangpur.";s:13:"specimen_name";s:24:"Tissue from left sided..";s:4:"note";s:82:"Result of Immunostaining  for ER, PR &amp; HER-2 of Case No:      Block No: (    )";s:6:"er_rpt";s:117:"About _______ %/ <1 % of the tumor cell nuclei show weak/moderate/strong staining/Tumor cell nuclei show no staining.";s:8:"er_score";s:6:"   / 8";s:6:"pr_rpt";s:118:"About _______%/ <1  %  of the tumor cell nuclei show weak/moderate/strong staining/Tumor cell nuclei show no staining.";s:8:"pr_score";s:9:"      / 8";s:11:"her_two_rpt";s:0:"";s:13:"her_two_score";s:12:"Select Score";s:9:"er_result";s:17:"Negative/Positive";s:9:"pr_result";s:17:"Negative/Positive";s:14:"her_two_result";s:28:"Negative/Positive/Borderline";s:8:"rpt_noet";s:0:"";}i:60;a:23:{s:10:"her_two_id";s:2:"84";s:5:"sl_no";s:3:"348";s:7:"test_id";s:16:"MIHC13:17029-031";s:10:"reciv_date";s:10:"07/09/2013";s:9:"deli_date";s:10:"15/09/2013";s:12:"current_date";s:10:"2013-09-07";s:12:"patient_name";s:17:"Mrs. Hasina Begum";s:3:"age";s:6:"45 Yrs";s:6:"ref_by";s:0:"";s:3:"sex";s:6:"Female";s:13:"hospital_name";s:35:"Chevron Clinical Lab , Chittagong. ";s:13:"specimen_name";s:34:"Breast tissue Case No: MH13-16705.";s:4:"note";s:130:"Result of Immunostaining  for ER, PR &amp; HER-2 of Case No:      MH13-16705 , Block No: (03    ) from, DHL. Path. Lab. Dhaka.<br>";s:6:"er_rpt";s:49:"<1 % of the tumor cell nuclei show weak staining.";s:8:"er_score";s:7:"1+1=2/8";s:6:"pr_rpt";s:49:"<1 % of the tumor cell nuclei show weak staining.";s:8:"pr_score";s:7:"1+1=2/8";s:11:"her_two_rpt";s:29:"Tumor cells show no staining.";s:13:"her_two_score";s:3:""O"";s:9:"er_result";s:8:"Negative";s:9:"pr_result";s:8:"Negative";s:14:"her_two_result";s:8:"Negative";s:8:"rpt_noet";s:0:"";}i:61;a:23:{s:10:"her_two_id";s:2:"85";s:5:"sl_no";s:3:"349";s:7:"test_id";s:16:"MIHC13:17045-047";s:10:"reciv_date";s:10:"07/09/2013";s:9:"deli_date";s:10:"15/09/2013";s:12:"current_date";s:10:"2013-09-07";s:12:"patient_name";s:15:"Mr. Munir Ahmed";s:3:"age";s:6:"70 Yrs";s:6:"ref_by";s:0:"";s:3:"sex";s:4:"Male";s:13:"hospital_name";s:21:"Sigma Lab, Chittagong";s:13:"specimen_name";s:31:"Tissue from ileo-caecal growth.";s:4:"note";s:136:"Result of Immunostaining  for ER, PR &amp; HER-2 of Case No:MH13-15005,      Block No: (____    )&nbsp; from DHL. Path. Lab. Dhaka. <br>";s:6:"er_rpt";s:117:"About _______ %/ <1 % of the tumor cell nuclei show weak/moderate/strong staining/Tumor cell nuclei show no staining.";s:8:"er_score";s:6:"   / 8";s:6:"pr_rpt";s:118:"About _______%/ <1  %  of the tumor cell nuclei show weak/moderate/strong staining/Tumor cell nuclei show no staining.";s:8:"pr_score";s:9:"      / 8";s:11:"her_two_rpt";s:0:"";s:13:"her_two_score";s:12:"Select Score";s:9:"er_result";s:17:"Negative/Positive";s:9:"pr_result";s:17:"Negative/Positive";s:14:"her_two_result";s:28:"Negative/Positive/Borderline";s:8:"rpt_noet";s:0:"";}i:62;a:23:{s:10:"her_two_id";s:2:"86";s:5:"sl_no";s:3:"350";s:7:"test_id";s:16:"MIHC13:17102-104";s:10:"reciv_date";s:10:"08/09/2013";s:9:"deli_date";s:10:"15/09/2013";s:12:"current_date";s:10:"2013-09-08";s:12:"patient_name";s:11:"Mrs. Naznin";s:3:"age";s:6:"56 Yrs";s:6:"ref_by";s:32:"Jannatul Islam Jinnah, FCPS (S).";s:3:"sex";s:6:"Female";s:13:"hospital_name";s:11:"DHL, C -514";s:13:"specimen_name";s:47:"Mastectomy specimen (Lt.). Case No: MH13-15655.";s:4:"note";s:137:"Result of Immunostaining  for ER, PR &amp; HER-2 of Case No: MH13-15655 ,&nbsp;      Block No: (02    ) from, DHL. Path. Lab. Dhaka. <br>";s:6:"er_rpt";s:35:"Tumor cell nuclei show no staining.";s:8:"er_score";s:3:""O"";s:6:"pr_rpt";s:35:"Tumor cell nuclei show no staining.";s:8:"pr_score";s:3:""O"";s:11:"her_two_rpt";s:93:"Weak to moderate complete membrane staining is observed in more than 10 % of the tumor cells.";s:13:"her_two_score";s:2:"2+";s:9:"er_result";s:8:"Negative";s:9:"pr_result";s:8:"Negative";s:14:"her_two_result";s:10:"Borderline";s:8:"rpt_noet";s:0:"";}i:63;a:23:{s:10:"her_two_id";s:2:"87";s:5:"sl_no";s:3:"351";s:7:"test_id";s:12:"MIHC13:17118";s:10:"reciv_date";s:10:"08/09/2013";s:9:"deli_date";s:10:"15/09/2013";s:12:"current_date";s:10:"2013-09-08";s:12:"patient_name";s:18:"Mr. Abdul Motalleb";s:3:"age";s:6:"90 Yrs";s:6:"ref_by";s:18:"Md. Jalilur Rahman";s:3:"sex";s:4:"Male";s:13:"hospital_name";s:0:"";s:13:"specimen_name";s:23:"Rt. axillary lymph node";s:4:"note";s:93:"Result of Immunostaining  for ER, PR &amp; HER-2 of Case No:      MH13-16686 , Block No: (02)";s:6:"er_rpt";s:117:"About _______ %/ <1 % of the tumor cell nuclei show weak/moderate/strong staining/Tumor cell nuclei show no staining.";s:8:"er_score";s:6:"   / 8";s:6:"pr_rpt";s:118:"About _______%/ <1  %  of the tumor cell nuclei show weak/moderate/strong staining/Tumor cell nuclei show no staining.";s:8:"pr_score";s:9:"      / 8";s:11:"her_two_rpt";s:0:"";s:13:"her_two_score";s:12:"Select Score";s:9:"er_result";s:17:"Negative/Positive";s:9:"pr_result";s:17:"Negative/Positive";s:14:"her_two_result";s:28:"Negative/Positive/Borderline";s:8:"rpt_noet";s:0:"";}i:64;a:23:{s:10:"her_two_id";s:2:"88";s:5:"sl_no";s:3:"352";s:7:"test_id";s:16:"MIHC13:17142-144";s:10:"reciv_date";s:10:"08/09/2013";s:9:"deli_date";s:10:"15/09/2013";s:12:"current_date";s:10:"2013-09-08";s:12:"patient_name";s:19:"Mrs. Roksana Khanom";s:3:"age";s:6:"35 Yrs";s:6:"ref_by";s:53:"Md. Mukitul Huda M.PHil , FCPS (Consultant, Oncology)";s:3:"sex";s:6:"Female";s:13:"hospital_name";s:14:"DLMCH, Dhaka. ";s:13:"specimen_name";s:43:"Tissue from Rt. Breast.Case No: MH13-06838.";s:4:"note";s:129:"Result of Immunostaining  for ER, PR &amp; HER-2 of Case No:      MH13-06838 , Block No: (02    ) from, DHL. Path. Lab. Dhaka<br>";s:6:"er_rpt";s:59:"About 30 % of the tumor cell nuclei show moderate staining.";s:8:"er_score";s:7:"3+2=5/8";s:6:"pr_rpt";s:59:"About 65 % of the tumor cell nuclei show moderate staining.";s:8:"pr_score";s:7:"4+2=6/8";s:11:"her_two_rpt";s:93:"Weak to moderate complete membrane staining is observed in more than 10 % of the tumor cells.";s:13:"her_two_score";s:2:"2+";s:9:"er_result";s:8:"Positive";s:9:"pr_result";s:8:"Positive";s:14:"her_two_result";s:10:"Borderline";s:8:"rpt_noet";s:0:"";}i:65;a:23:{s:10:"her_two_id";s:2:"89";s:5:"sl_no";s:3:"354";s:7:"test_id";s:16:"MIHC13:17225-227";s:10:"reciv_date";s:10:"10/09/2013";s:9:"deli_date";s:10:"15/09/2013";s:12:"current_date";s:10:"2013-09-10";s:12:"patient_name";s:16:"Mrs. Feroza Nabi";s:3:"age";s:6:"60 Yrs";s:6:"ref_by";s:52:"Swapan Kumar Nath, FCPS, (Radiotherapy), Oncologist.";s:3:"sex";s:6:"Female";s:13:"hospital_name";s:13:"RMCH. Rangpur";s:13:"specimen_name";s:44:"Tissue from Rt. Breast. Case No: MH13-15512.";s:4:"note";s:127:"Result of Immunostaining  for ER, PR &amp; HER-2 of Case No: MH13-     15512 , Block No: (02) from, DHL. Path. Lab. Dhaka. <br>";s:6:"er_rpt";s:48:"<1 % of the tumor cell nuclei show weak staining";s:8:"er_score";s:7:"1+1=2/8";s:6:"pr_rpt";s:49:"<1 %  of the tumor cell nuclei show weak staining";s:8:"pr_score";s:7:"1+1=2/8";s:11:"her_two_rpt";s:83:"Strong complete membrane staining is observed in more than 30 % of the tumor cells.";s:13:"her_two_score";s:2:"3+";s:9:"er_result";s:8:"Negative";s:9:"pr_result";s:8:"Negative";s:14:"her_two_result";s:8:"Positive";s:8:"rpt_noet";s:0:"";}i:66;a:23:{s:10:"her_two_id";s:2:"90";s:5:"sl_no";s:3:"355";s:7:"test_id";s:16:"MIHC13:17357-359";s:10:"reciv_date";s:10:"10/09/2013";s:9:"deli_date";s:10:"15/09/2013";s:12:"current_date";s:10:"2013-09-10";s:12:"patient_name";s:12:"Miss. Shanti";s:3:"age";s:6:"36 Yrs";s:6:"ref_by";s:47:"Parvin Akhter Banu (Chief Consultant, Oncology)";s:3:"sex";s:6:"Female";s:13:"hospital_name";s:3:"DHL";s:13:"specimen_name";s:40:"Tissue from breast. Case No: MH13-16930.";s:4:"note";s:142:"Result of Immunostaining  for ER, PR &amp; HER-2 of Case No:MH13-16930 ,&nbsp;      Block No: (    02) from,&nbsp; DHL. Path. Lab. Dhaka. <br>";s:6:"er_rpt";s:35:"Tumor cell nuclei show no staining.";s:8:"er_score";s:6:"   "O"";s:6:"pr_rpt";s:58:"About 60 % of the tumor cell nuclei show moderate staining";s:8:"pr_score";s:13:"     4+2 =6/8";s:11:"her_two_rpt";s:29:"Tumor cells show no staining.";s:13:"her_two_score";s:3:""O"";s:9:"er_result";s:8:"Negative";s:9:"pr_result";s:9:"Positive ";s:14:"her_two_result";s:8:"Negative";s:8:"rpt_noet";s:0:"";}i:67;a:23:{s:10:"her_two_id";s:2:"91";s:5:"sl_no";s:3:"356";s:7:"test_id";s:16:"MIHC13:17363-365";s:10:"reciv_date";s:10:"10/09/2013";s:9:"deli_date";s:10:"15/09/2013";s:12:"current_date";s:10:"2013-09-10";s:12:"patient_name";s:18:"Mrs. Shamsun Nahar";s:3:"age";s:6:"42 Yrs";s:6:"ref_by";s:29:"Ayesha Nasriin Suravee MS (S)";s:3:"sex";s:6:"Female";s:13:"hospital_name";s:53:"Rangpur Community Medical College & Hospital Rangpur.";s:13:"specimen_name";s:48:"Tissue from Rt. breast lump. Case No: MH13-16692";s:4:"note";s:131:"<u></u>Result of Immunostaining  for ER, PR &amp; HER-2 of Case No: MH13-16692, <br>Block No: (02) from DHL. Path. Lab. Dhaka. <br>";s:6:"er_rpt";s:35:"Tumor cell nuclei show no staining.";s:8:"er_score";s:5:"  "0"";s:6:"pr_rpt";s:35:"Tumor cell nuclei show no staining.";s:8:"pr_score";s:3:""0"";s:11:"her_two_rpt";s:83:"Weak incomplete membrane staining is observed in more than 10 % of the tumor cells.";s:13:"her_two_score";s:2:"1+";s:9:"er_result";s:8:"Negative";s:9:"pr_result";s:8:"Negative";s:14:"her_two_result";s:8:"Negative";s:8:"rpt_noet";s:0:"";}i:68;a:23:{s:10:"her_two_id";s:2:"92";s:5:"sl_no";s:3:"357";s:7:"test_id";s:16:"MIHC13:17370-372";s:10:"reciv_date";s:10:"11/09/2013";s:9:"deli_date";s:10:"15/09/2013";s:12:"current_date";s:10:"2013-09-11";s:12:"patient_name";s:19:"Mrs. Monowara Begum";s:3:"age";s:6:"35 Yrs";s:6:"ref_by";s:45:"Tapesh Kumar Paul,FCPS,MS (Oncology Surgery).";s:3:"sex";s:6:"Female";s:13:"hospital_name";s:10:"DHL, 530/7";s:13:"specimen_name";s:43:"Tissue from Rt. Breast. Case No: MH13-17038";s:4:"note";s:122:"Result of Immunostaining  for ER, PR &amp; HER-2 of Case No: MH13-17038 , Block No: (02) from, DHL. Path. Lab. Dhaka. <br>";s:6:"er_rpt";s:35:"Tumor cell nuclei show no staining.";s:8:"er_score";s:3:""O"";s:6:"pr_rpt";s:35:"Tumor cell nuclei show no staining.";s:8:"pr_score";s:3:""O"";s:11:"her_two_rpt";s:83:"Strong complete membrane staining is observed in more than 30 % of the tumor cells.";s:13:"her_two_score";s:2:"3+";s:9:"er_result";s:8:"Negative";s:9:"pr_result";s:8:"Negative";s:14:"her_two_result";s:8:"Positive";s:8:"rpt_noet";s:0:"";}i:69;a:23:{s:10:"her_two_id";s:2:"93";s:5:"sl_no";s:3:"358";s:7:"test_id";s:16:"MIHC13:17360-362";s:10:"reciv_date";s:10:"10/09/2013";s:9:"deli_date";s:10:"22/09/2013";s:12:"current_date";s:10:"2013-09-10";s:12:"patient_name";s:10:"Mrs. Hashi";s:3:"age";s:6:"30 Yrs";s:6:"ref_by";s:0:"";s:3:"sex";s:6:"Female";s:13:"hospital_name";s:19:"Sh. S. MCH. Dhaka. ";s:13:"specimen_name";s:45:"Tissue from right breast.Case No: MH13-17269.";s:4:"note";s:143:"Result of Immunostaining  for ER, PR &amp; HER-2 of Case No: MH13-017269 ,&nbsp;     Block No: (02    ) from,&nbsp; DHL. Path. Lab. Dhaka. <br>";s:6:"er_rpt";s:35:"Tumor cell nuclei show no staining.";s:8:"er_score";s:3:""O"";s:6:"pr_rpt";s:35:"Tumor cell nuclei show no staining.";s:8:"pr_score";s:3:""O"";s:11:"her_two_rpt";s:83:"Strong complete membrane staining is observed in more than 30 % of the tumor cells.";s:13:"her_two_score";s:2:"3+";s:9:"er_result";s:8:"Negative";s:9:"pr_result";s:8:"Negative";s:14:"her_two_result";s:8:"Positive";s:8:"rpt_noet";s:0:"";}i:70;a:23:{s:10:"her_two_id";s:2:"94";s:5:"sl_no";s:3:"359";s:7:"test_id";s:16:"MIHC13:17377-379";s:10:"reciv_date";s:10:"11/09/2013";s:9:"deli_date";s:10:"22/09/2013";s:12:"current_date";s:10:"2013-09-11";s:12:"patient_name";s:4:"Mili";s:3:"age";s:6:"38 Yrs";s:6:"ref_by";s:24:"Bimol Chandra Roy. FCPS ";s:3:"sex";s:6:"Female";s:13:"hospital_name";s:32:"Update Care Hospital , Rangpur. ";s:13:"specimen_name";s:43:"Tissue from breast lump.Case No: MH13-16625";s:4:"note";s:124:"Result of Immunostaining  for ER, PR &amp; HER-2 of Case No: MH13-16625, Block No: (02    ) from , DHL. Path. Lab. Dhaka<br>";s:6:"er_rpt";s:59:"About 40 % of the tumor cell nuclei show moderate staining.";s:8:"er_score";s:7:"4+2=6/8";s:6:"pr_rpt";s:59:"About 60 % of the tumor cell nuclei show moderate staining.";s:8:"pr_score";s:7:"4+2=6/8";s:11:"her_two_rpt";s:84:" Weak incomplete membrane staining is observed in more than 10 % of the tumor cells.";s:13:"her_two_score";s:2:"1+";s:9:"er_result";s:8:"Positive";s:9:"pr_result";s:8:"Positive";s:14:"her_two_result";s:8:"Negative";s:8:"rpt_noet";s:0:"";}i:71;a:23:{s:10:"her_two_id";s:2:"95";s:5:"sl_no";s:3:"360";s:7:"test_id";s:16:"MIHC13:17398-400";s:10:"reciv_date";s:10:"11/09/2013";s:9:"deli_date";s:10:"29/09/2013";s:12:"current_date";s:10:"2013-09-11";s:12:"patient_name";s:17:"Mrs. Hasina Begum";s:3:"age";s:6:"60 Yrs";s:6:"ref_by";s:63:"Md. Alimuzzaman, Asistant. Prof. (Radioation and Oncology Unit)";s:3:"sex";s:6:"Female";s:13:"hospital_name";s:40:"Shahid Sohrawardy Medical College. Dhaka";s:13:"specimen_name";s:38:"One Paraffin block. Case No: D-2065/13";s:4:"note";s:115:"Result of Immunostaining  for ER, PR &amp; HER-2 of Case No:&nbsp; D-2065/13, from , Hypothyroid Centre. Dhaka.<br>";s:6:"er_rpt";s:55:"About 05 % of the tumor cell nuclei show weak staining.";s:8:"er_score";s:11:"2+1=3   / 8";s:6:"pr_rpt";s:35:"Tumor cell nuclei show no staining.";s:8:"pr_score";s:3:""0"";s:11:"her_two_rpt";s:83:"Weak incomplete membrane staining is observed in more than 10 % of the tumor cells.";s:13:"her_two_score";s:2:"1+";s:9:"er_result";s:8:"Positive";s:9:"pr_result";s:8:"Negative";s:14:"her_two_result";s:8:"Negative";s:8:"rpt_noet";s:132:"Note: Tissue in the paraffin block was not processed properly. Improper processing of tissue may hamper the immunostaining results. ";}i:72;a:23:{s:10:"her_two_id";s:2:"96";s:5:"sl_no";s:3:"361";s:7:"test_id";s:16:"MIHC13:17444-446";s:10:"reciv_date";s:10:"11/09/2013";s:9:"deli_date";s:10:"22/09/2013";s:12:"current_date";s:10:"2013-09-11";s:12:"patient_name";s:17:"Mrs. Rokeya Begum";s:3:"age";s:6:"42 Yrs";s:6:"ref_by";s:37:"Naheed Rukhsana. MBBS,FCPS (Oncology)";s:3:"sex";s:6:"Female";s:13:"hospital_name";s:6:"DLMCH.";s:13:"specimen_name";s:39:"One Paraffin block. Case No: MH-6010/12";s:4:"note";s:154:"Result of Immunostaining  for ER, PR &amp; HER-2 of Case No:MH-6010/12,      Block No: (01 ) from , Medinova Medical ,Services Ltd. Dhanmondi, Dhaka. <br>";s:6:"er_rpt";s:35:"Tumor cell nuclei show no staining.";s:8:"er_score";s:3:""O"";s:6:"pr_rpt";s:35:"Tumor cell nuclei show no staining.";s:8:"pr_score";s:3:""O"";s:11:"her_two_rpt";s:83:"Weak incomplete membrane staining is observed in more than 10 % of the tumor cells.";s:13:"her_two_score";s:2:"1+";s:9:"er_result";s:8:"Negative";s:9:"pr_result";s:8:"Negative";s:14:"her_two_result";s:8:"Negative";s:8:"rpt_noet";s:0:"";}i:73;a:23:{s:10:"her_two_id";s:2:"97";s:5:"sl_no";s:3:"362";s:7:"test_id";s:16:"MIHC13:17450-452";s:10:"reciv_date";s:10:"11/09/2013";s:9:"deli_date";s:10:"22/09/2013";s:12:"current_date";s:10:"2013-09-11";s:12:"patient_name";s:17:"Mrs. Farida Begum";s:3:"age";s:6:"55 Yrs";s:6:"ref_by";s:48:"Tapesh Kumar Paul, FCPS, MS.(Surgical. Oncology)";s:3:"sex";s:6:"Female";s:13:"hospital_name";s:11:"C-503 , DHL";s:13:"specimen_name";s:46:"Mastectomy specimen (Rt.). Case No: MH13-17117";s:4:"note";s:126:"Result of Immunostaining  for ER, PR &amp; HER-2 of Case No:      MH13-17117 , Block No: (02    ). from DHL. Path. Dhaka. <br>";s:6:"er_rpt";s:35:"Tumor cell nuclei show no staining.";s:8:"er_score";s:3:""O"";s:6:"pr_rpt";s:35:"Tumor cell nuclei show no staining.";s:8:"pr_score";s:3:""O"";s:11:"her_two_rpt";s:84:" Weak incomplete membrane staining is observed in more than 10 % of the tumor cells.";s:13:"her_two_score";s:2:"1+";s:9:"er_result";s:8:"Negative";s:9:"pr_result";s:8:"Negative";s:14:"her_two_result";s:8:"Negative";s:8:"rpt_noet";s:0:"";}i:74;a:23:{s:10:"her_two_id";s:2:"98";s:5:"sl_no";s:3:"365";s:7:"test_id";s:16:"MIHC13:17650-652";s:10:"reciv_date";s:10:"15/09/2013";s:9:"deli_date";s:10:"22/09/2013";s:12:"current_date";s:10:"2013-09-15";s:12:"patient_name";s:12:"Mrs. Nasrin ";s:3:"age";s:6:"30 Yrs";s:6:"ref_by";s:47:"Tapesh Kumar Paul, FCPS, MS.(Surgery. Oncology)";s:3:"sex";s:6:"Female";s:13:"hospital_name";s:3:"DHL";s:13:"specimen_name";s:24:"Tissue from left breast.";s:4:"note";s:137:"Result of Immunostaining  for ER, PR &amp; HER-2 of Case No:      MH13-16060, Aditional <br>Block No: (02) from DHL, Path. Lab. Dhaka<br>";s:6:"er_rpt";s:59:"About 50 % of the tumor cell nuclei show moderate staining.";s:8:"er_score";s:7:"4+2=6/8";s:6:"pr_rpt";s:59:"About 15 % of the tumor cell nuclei show moderate staining.";s:8:"pr_score";s:7:"3+2=5/8";s:11:"her_two_rpt";s:93:"Weak to moderate complete membrane staining is observed in more than 10 % of the tumor cells.";s:13:"her_two_score";s:2:"2+";s:9:"er_result";s:8:"Positive";s:9:"pr_result";s:8:"Positive";s:14:"her_two_result";s:10:"Borderline";s:8:"rpt_noet";s:0:"";}i:75;a:23:{s:10:"her_two_id";s:2:"99";s:5:"sl_no";s:3:"367";s:7:"test_id";s:16:"MIHC13:17736-738";s:10:"reciv_date";s:10:"15/09/2013";s:9:"deli_date";s:10:"22/09/2013";s:12:"current_date";s:10:"2013-09-15";s:12:"patient_name";s:11:"Mrs. Hafiza";s:3:"age";s:6:"28 Yrs";s:6:"ref_by";s:55:"Md. Yeaqub Ali, MBBS, FCPS, (Radiotheapy) FRSH (London)";s:3:"sex";s:6:"Female";s:13:"hospital_name";s:35:"AL-RAJI HOSPITAL , Farmget. Dhaka. ";s:13:"specimen_name";s:42:"One Paraffin block. Case No: 13-001-5889. ";s:4:"note";s:150:"Result of Immunostaining  for ER, PR &amp; HER-2 of Case No:13-001-5889,&nbsp; Block No: (04    )&nbsp; from Anowara Medical Services. Dhaka. <br><br>";s:6:"er_rpt";s:35:"Tumor cell nuclei show no staining.";s:8:"er_score";s:3:""O"";s:6:"pr_rpt";s:35:"Tumor cell nuclei show no staining.";s:8:"pr_score";s:3:""O"";s:11:"her_two_rpt";s:93:"Weak to moderate complete membrane staining is observed in more than 10 % of the tumor cells.";s:13:"her_two_score";s:2:"2+";s:9:"er_result";s:8:"Negative";s:9:"pr_result";s:8:"Negative";s:14:"her_two_result";s:10:"Borderline";s:8:"rpt_noet";s:0:"";}i:76;a:23:{s:10:"her_two_id";s:3:"100";s:5:"sl_no";s:3:"369";s:7:"test_id";s:16:"MIHC13:17832-834";s:10:"reciv_date";s:10:"16/09/2013";s:9:"deli_date";s:10:"22/09/2013";s:12:"current_date";s:10:"2013-09-16";s:12:"patient_name";s:10:"Mrs. Hashi";s:3:"age";s:6:"30 Yrs";s:6:"ref_by";s:23:"NICRH. Mohakhali, Dhaka";s:3:"sex";s:6:"Female";s:13:"hospital_name";s:25:"National Cancer Institute";s:13:"specimen_name";s:36:"One Paraffin block. Case No: 3327/13";s:4:"note";s:136:"Result of Immunostaining  for ER, PR &amp; HER-2 of Case No: 3327/13,&nbsp;      Block No: (01) from SIGMA MEDICAL SERVICES, DHAKA. <br>";s:6:"er_rpt";s:59:"About 30 % of the tumor cell nuclei show moderate staining.";s:8:"er_score";s:7:"3+2=5/8";s:6:"pr_rpt";s:59:"About 30 % of the tumor cell nuclei show moderate staining.";s:8:"pr_score";s:7:"3+2=5/8";s:11:"her_two_rpt";s:93:"Weak to moderate complete membrane staining is observed in more than 10 % of the tumor cells.";s:13:"her_two_score";s:2:"2+";s:9:"er_result";s:8:"Positive";s:9:"pr_result";s:8:"Positive";s:14:"her_two_result";s:10:"Borderline";s:8:"rpt_noet";s:132:"Note: Tissue in the paraffin block was not processed properly. Improper processing of the tissue may hampering immunostaing results.";}i:77;a:23:{s:10:"her_two_id";s:3:"101";s:5:"sl_no";s:3:"372";s:7:"test_id";s:16:"MIHC13:17750-752";s:10:"reciv_date";s:10:"16/09/2013";s:9:"deli_date";s:10:"22/09/2013";s:12:"current_date";s:10:"2013-09-16";s:12:"patient_name";s:6:"Fatema";s:3:"age";s:6:"50 Yrs";s:6:"ref_by";s:0:"";s:3:"sex";s:6:"Female";s:13:"hospital_name";s:23:"NICRH, Mohakhali, Dhaka";s:13:"specimen_name";s:46:"Mastectomy specimen (Rt.), Case No: MH13-16233";s:4:"note";s:130:"Result of Immunostaining  for ER, PR &amp; HER-2 of Case No:      MH13-16233 , Block No: (01    ) from , DHL. Path. Lab. Dhaka<br>";s:6:"er_rpt";s:35:"Tumor cell nuclei show no staining.";s:8:"er_score";s:3:""O"";s:6:"pr_rpt";s:35:"Tumor cell nuclei show no staining.";s:8:"pr_score";s:3:""O"";s:11:"her_two_rpt";s:31:"Tumor cells show no staining.
";s:13:"her_two_score";s:3:""O"";s:9:"er_result";s:8:"Negative";s:9:"pr_result";s:8:"Negative";s:14:"her_two_result";s:8:"Negative";s:8:"rpt_noet";s:0:"";}i:78;a:23:{s:10:"her_two_id";s:3:"102";s:5:"sl_no";s:3:"373";s:7:"test_id";s:16:"MIHC13:17391-933";s:10:"reciv_date";s:10:"18/09/2013";s:9:"deli_date";s:10:"22/09/2013";s:12:"current_date";s:10:"2013-09-18";s:12:"patient_name";s:13:"Shamsun Nahar";s:3:"age";s:6:"44 Yrs";s:6:"ref_by";s:21:"Peoples Hospital Ctg.";s:3:"sex";s:6:"Female";s:13:"hospital_name";s:16:"CSCR, Chittagong";s:13:"specimen_name";s:43:"Tissue from Lt. breast. Case No: MH13-17020";s:4:"note";s:133:"Result of Immunostaining  for ER, PR &amp; HER-2 of Case No: MH13-17020&nbsp;     Block No: (02    ) from , DHL. Path. Lab. Dhaka<br>";s:6:"er_rpt";s:59:"About 30 % of the tumor cell nuclei show moderate staining.";s:8:"er_score";s:7:"3+2=5/8";s:6:"pr_rpt";s:35:"Tumor cell nuclei show no staining.";s:8:"pr_score";s:3:""O"";s:11:"her_two_rpt";s:97:"Weak to moderate complete membrane staining is observed in more than 10 % of the tumor cells.

";s:13:"her_two_score";s:2:"2+";s:9:"er_result";s:8:"Positive";s:9:"pr_result";s:8:"Negative";s:14:"her_two_result";s:10:"Borderline";s:8:"rpt_noet";s:0:"";}i:79;a:23:{s:10:"her_two_id";s:3:"103";s:5:"sl_no";s:4:"2222";s:7:"test_id";s:11:"MIHC13:2222";s:10:"reciv_date";s:10:"31/10/2013";s:9:"deli_date";s:10:"31/10/2013";s:12:"current_date";s:10:"2013-10-31";s:12:"patient_name";s:12:"Amena Khatun";s:3:"age";s:6:"20 Yrs";s:6:"ref_by";s:41:"Mohammad Mahbub Alam. Assit. Registar (S)";s:3:"sex";s:4:"Male";s:13:"hospital_name";s:27:"Max Care Hospital, Rangpur.";s:13:"specimen_name";s:41:"Tissue from Lt. adnexal mass and omental.";s:4:"note";s:82:"Result of Immunostaining  for ER, PR &amp; HER-2 of Case No:      Block No: (    )";s:6:"er_rpt";s:50:"About 20 % of the tumor cell nuclei show staining.";s:8:"er_score";s:7:"1+1=2/8";s:6:"pr_rpt";s:50:"About 20 % of the tumor cell nuclei show staining.";s:8:"pr_score";s:7:"1+1=2/8";s:11:"her_two_rpt";s:0:"";s:13:"her_two_score";s:0:"";s:9:"er_result";s:17:"Negative/Positive";s:9:"pr_result";s:17:"Negative/Positive";s:14:"her_two_result";s:0:"";s:8:"rpt_noet";s:0:"";}i:80;a:23:{s:10:"her_two_id";s:3:"104";s:5:"sl_no";s:3:"375";s:7:"test_id";s:16:"MIHC13:18125-127";s:10:"reciv_date";s:10:"19/09/2013";s:9:"deli_date";s:10:"29/09/2013";s:12:"current_date";s:10:"2013-09-19";s:12:"patient_name";s:18:"Mrs. Shamsun Nahar";s:3:"age";s:6:"60 Yrs";s:6:"ref_by";s:43:"Sultana Afroza, MBBS. M.Phil (Radiotherapy)";s:3:"sex";s:6:"Female";s:13:"hospital_name";s:24:"Medi Aid Hospital, Dhaka";s:13:"specimen_name";s:64:"One paraffin block (Tissue from Lt. breast mass) Case No: G-1783";s:4:"note";s:164:"Result of Immunostaining  for ER, PR &amp; HER-2 of Case No: G-1783 ,&nbsp;      <br>Block No: (02    ) from IBN SINA DIAGNOSTIC &amp; IMAGING CENTER. Dhaka<br><br>";s:6:"er_rpt";s:55:"About 02 % of the tumor cell nuclei show weak staining.";s:8:"er_score";s:11:"2+1=3   / 8";s:6:"pr_rpt";s:56:"About 02 %  of the tumor cell nuclei show weak staining.";s:8:"pr_score";s:10:" 2+1= 3/ 8";s:11:"her_two_rpt";s:83:"Strong complete membrane staining is observed in more than 30 % of the tumor cells.";s:13:"her_two_score";s:2:"3+";s:9:"er_result";s:15:"Positive (Weak)";s:9:"pr_result";s:15:"Positive (Weak)";s:14:"her_two_result";s:8:"Positive";s:8:"rpt_noet";s:85:"Note: Tissue is poorly fixed. Poor fixation may influence of immunostaining results. ";}i:81;a:23:{s:10:"her_two_id";s:3:"105";s:5:"sl_no";s:3:"376";s:7:"test_id";s:16:"MIHC13:18392-394";s:10:"reciv_date";s:10:"23/09/2013";s:9:"deli_date";s:10:"29/09/2013";s:12:"current_date";s:10:"2013-09-23";s:12:"patient_name";s:10:"Mrs. Khuki";s:3:"age";s:6:"45 Yrs";s:6:"ref_by";s:4:"Self";s:3:"sex";s:6:"Female";s:13:"hospital_name";s:5:"DLMCH";s:13:"specimen_name";s:57:"Tissue from Mastectomy specimen (Lt.) Case No: MH13-18116";s:4:"note";s:135:"Result of Immunostaining  for ER, PR &amp; HER-2 of Case No: MH13-18116,&nbsp;      Block No: (02    ) from DHL. Path. Lab. Dhaka. <br>";s:6:"er_rpt";s:35:"Tumor cell nuclei show no staining.";s:8:"er_score";s:3:""0"";s:6:"pr_rpt";s:35:"Tumor cell nuclei show no staining.";s:8:"pr_score";s:3:""0"";s:11:"her_two_rpt";s:93:"Weak to moderate complete membrane staining is observed in more than 10 % of the tumor cells.";s:13:"her_two_score";s:2:"2+";s:9:"er_result";s:8:"Negative";s:9:"pr_result";s:8:"Negative";s:14:"her_two_result";s:10:"Borderline";s:8:"rpt_noet";s:0:"";}i:82;a:23:{s:10:"her_two_id";s:3:"106";s:5:"sl_no";s:3:"377";s:7:"test_id";s:16:"MIHC13:18404-406";s:10:"reciv_date";s:10:"23/09/2013";s:9:"deli_date";s:10:"29/09/2013";s:12:"current_date";s:10:"2013-09-23";s:12:"patient_name";s:8:"Monowara";s:3:"age";s:6:"50 Yrs";s:6:"ref_by";s:0:"";s:3:"sex";s:6:"Female";s:13:"hospital_name";s:27:"Max Care Hospital, Rangpur.";s:13:"specimen_name";s:39:"Tissue from breast. Case No: MH13-16983";s:4:"note";s:130:"Result of Immunostaining  for ER, PR &amp; HER-2 of Case No:      MH13-16983 ,<br>Block No: (02    ) from DHL Path. Lab. Dhaka<br>";s:6:"er_rpt";s:58:"About 60 % of the tumor cell nuclei show moderate staining";s:8:"er_score";s:8:"4+2=6/ 8";s:6:"pr_rpt";s:59:"About 60 % of the tumor cell nuclei show moderate staining.";s:8:"pr_score";s:11:"  4+2= 6/ 8";s:11:"her_two_rpt";s:83:"Weak incomplete membrane staining is observed in more than 10 % of the tumor cells.";s:13:"her_two_score";s:2:"1+";s:9:"er_result";s:8:"Positive";s:9:"pr_result";s:8:"Positive";s:14:"her_two_result";s:8:"Negative";s:8:"rpt_noet";s:0:"";}i:83;a:23:{s:10:"her_two_id";s:3:"107";s:5:"sl_no";s:3:"378";s:7:"test_id";s:16:"MIHC13:18408-410";s:10:"reciv_date";s:10:"23/09/2013";s:9:"deli_date";s:10:"29/09/2013";s:12:"current_date";s:10:"2013-09-23";s:12:"patient_name";s:19:"Mrs. Nurjahan Begum";s:3:"age";s:6:"55 Yrs";s:6:"ref_by";s:42:"M.A. Awal M.Phil (Radiotherapy),CMCH, Ctg.";s:3:"sex";s:6:"Female";s:13:"hospital_name";s:41:"Popular Diagnostic Centre Ltd,Chittagong.";s:13:"specimen_name";s:56:"Tissue from Rt. mastectomy specimen. Case No: MH13-18103";s:4:"note";s:136:"Result of Immunostaining  for ER, PR &amp; HER-2 of Case No: MH13-18103 ,&nbsp;      Block No: (03    ), from, DHL. Path. Lab. Dhaka<br>";s:6:"er_rpt";s:35:"Tumor cell nuclei show no staining.";s:8:"er_score";s:3:""0"";s:6:"pr_rpt";s:35:"Tumor cell nuclei show no staining.";s:8:"pr_score";s:3:""0"";s:11:"her_two_rpt";s:83:"Weak incomplete membrane staining is observed in more than 10 % of the tumor cells.";s:13:"her_two_score";s:2:"1+";s:9:"er_result";s:8:"Negative";s:9:"pr_result";s:8:"Negative";s:14:"her_two_result";s:8:"Negative";s:8:"rpt_noet";s:0:"";}i:84;a:23:{s:10:"her_two_id";s:3:"108";s:5:"sl_no";s:3:"379";s:7:"test_id";s:16:"MIHC13:18419-421";s:10:"reciv_date";s:10:"24/09/2013";s:9:"deli_date";s:10:"29/09/2013";s:12:"current_date";s:10:"2013-09-24";s:12:"patient_name";s:18:"Mrs. Shamsun Nahar";s:3:"age";s:6:"32 Yrs";s:6:"ref_by";s:31:"A.S.M. Mostaque Ahmed. MCPS, MD";s:3:"sex";s:6:"Female";s:13:"hospital_name";s:32:"Bio Path Laboratory, Chittagong.";s:13:"specimen_name";s:45:"Tissue from breast lump. Case No: MH13-16576.";s:4:"note";s:135:"Result of Immunostaining  for ER, PR &amp; HER-2 of Case No: MH13-16576 ,&nbsp;     Block No: (02    ), from, DHL. Path. Lab. Dhaka<br>";s:6:"er_rpt";s:59:"About 60 % of the tumor cell nuclei show moderate staining.";s:8:"er_score";s:7:"4+2=6/8";s:6:"pr_rpt";s:57:"About 3 % of the tumor cell nuclei show moderate staining";s:8:"pr_score";s:11:"   2+2 =4/8";s:11:"her_two_rpt";s:93:"Weak to moderate complete membrane staining is observed in more than 10 % of the tumor cells.";s:13:"her_two_score";s:2:"2+";s:9:"er_result";s:8:"Positive";s:9:"pr_result";s:8:"Positive";s:14:"her_two_result";s:10:"Borderline";s:8:"rpt_noet";s:0:"";}i:85;a:23:{s:10:"her_two_id";s:3:"109";s:5:"sl_no";s:3:"380";s:7:"test_id";s:16:"MIHC13:18463-465";s:10:"reciv_date";s:10:"24/09/2013";s:9:"deli_date";s:10:"29/09/2013";s:12:"current_date";s:10:"2013-09-24";s:12:"patient_name";s:19:"Mrs. Moslema Khatun";s:3:"age";s:6:"59 Yrs";s:6:"ref_by";s:14:"Basuti Chakma.";s:3:"sex";s:6:"Female";s:13:"hospital_name";s:60:"CSCR Hospital , Chittagong. (Corporate Name: Chittagong Lab)";s:13:"specimen_name";s:44:"Tissue from breast (Rt.) Case No: MH13-18196";s:4:"note";s:139:"Result of Immunostaining  for ER, PR &amp; HER-2 of Case No:MH13-18196,      <br>Block No: (    02),&nbsp; from ,DHL. Path. Lab. Dhaka.<br>";s:6:"er_rpt";s:35:"Tumor cell nuclei show no staining.";s:8:"er_score";s:3:""0"";s:6:"pr_rpt";s:35:"Tumor cell nuclei show no staining.";s:8:"pr_score";s:3:""0"";s:11:"her_two_rpt";s:93:"Weak to moderate complete membrane staining is observed in more than 10 % of the tumor cells.";s:13:"her_two_score";s:2:"2+";s:9:"er_result";s:8:"Negative";s:9:"pr_result";s:8:"Negative";s:14:"her_two_result";s:10:"Borderline";s:8:"rpt_noet";s:0:"";}i:86;a:23:{s:10:"her_two_id";s:3:"110";s:5:"sl_no";s:3:"381";s:7:"test_id";s:16:"MIHC13:18595-597";s:10:"reciv_date";s:10:"25/09/2013";s:9:"deli_date";s:10:"29/09/2013";s:12:"current_date";s:10:"2013-09-25";s:12:"patient_name";s:17:"Mrs. Riazun Nahar";s:3:"age";s:6:"45 Yrs";s:6:"ref_by";s:15:"Basuti Chakma. ";s:3:"sex";s:6:"Female";s:13:"hospital_name";s:26:"CSCR Hospital , Chittagong";s:13:"specimen_name";s:39:"Tissue from breast. Case No: MH13-18206";s:4:"note";s:129:"Result of Immunostaining  for ER, PR &amp; HER-2 of Case No:MH13-18206,<br>&nbsp;Block No: (01), from, DHL. Path. Lab. Dhaka.<br>";s:6:"er_rpt";s:58:"About 30 % of the tumor cell nuclei show moderate staining";s:8:"er_score";s:8:"3+2= 5/8";s:6:"pr_rpt";s:59:"About 20 %  of the tumor cell nuclei show moderate staining";s:8:"pr_score";s:15:"3+2= 5      / 8";s:11:"her_two_rpt";s:93:"Weak to moderate complete membrane staining is observed in more than 10 % of the tumor cells.";s:13:"her_two_score";s:2:"2+";s:9:"er_result";s:8:"Positive";s:9:"pr_result";s:8:"Positive";s:14:"her_two_result";s:10:"Borderline";s:8:"rpt_noet";s:0:"";}i:87;a:23:{s:10:"her_two_id";s:3:"111";s:5:"sl_no";s:3:"384";s:7:"test_id";s:16:"MIHC13:18692-694";s:10:"reciv_date";s:10:"26/09/2013";s:9:"deli_date";s:10:"29/09/2013";s:12:"current_date";s:10:"2013-09-26";s:12:"patient_name";s:12:"Arobi Akhter";s:3:"age";s:6:"65 Yrs";s:6:"ref_by";s:58:"Md. Setabur Rahman, MS (S), Asst. Prof. Surgical Oncology.";s:3:"sex";s:6:"Female";s:13:"hospital_name";s:23:"NICRH, Mohakhali, Dhaka";s:13:"specimen_name";s:44:"Tissue from breast lump, Case No: MH13-17067";s:4:"note";s:131:"Result of Immunostaining  for ER, PR &amp; HER-2 of Case No:      MH13-17067 , Block No: (02    ), from, DHL. Path. Lab. Dhaka.<br>";s:6:"er_rpt";s:35:"Tumor cell nuclei show no staining.";s:8:"er_score";s:6:"   "0"";s:6:"pr_rpt";s:35:"Tumor cell nuclei show no staining.";s:8:"pr_score";s:4:" "0"";s:11:"her_two_rpt";s:93:"Weak to moderate complete membrane staining is observed in more than 10 % of the tumor cells.";s:13:"her_two_score";s:2:"2+";s:9:"er_result";s:8:"Negative";s:9:"pr_result";s:8:"Negative";s:14:"her_two_result";s:10:"Borderline";s:8:"rpt_noet";s:0:"";}i:88;a:23:{s:10:"her_two_id";s:3:"112";s:5:"sl_no";s:3:"386";s:7:"test_id";s:16:"MIHC13:18301-303";s:10:"reciv_date";s:10:"22/09/2013";s:9:"deli_date";s:10:"06/10/2013";s:12:"current_date";s:10:"2013-09-22";s:12:"patient_name";s:18:"Mrs. Nisha Akhter ";s:3:"age";s:6:"26 Yrs";s:6:"ref_by";s:47:"Parvin Akhter Banu (Chief Consultant, Oncology)";s:3:"sex";s:6:"Female";s:13:"hospital_name";s:4:"DHL.";s:13:"specimen_name";s:38:"One paraffin block, Case No: H-1234/13";s:4:"note";s:97:"Result of Immunostaining  for ER, PR &amp; HER-2 of Case No:H-1234/13 from Doctor's Lab. Comilla.";s:6:"er_rpt";s:35:"Tumor cell nuclei show no staining.";s:8:"er_score";s:3:""O"";s:6:"pr_rpt";s:54:"About 05% of the tumor cell nuclei show weak staining.";s:8:"pr_score";s:9:"2+1= 3/ 8";s:11:"her_two_rpt";s:93:"Weak to moderate complete membrane staining is observed in more than 10 % of the tumor cells.";s:13:"her_two_score";s:2:"2+";s:9:"er_result";s:8:"Negative";s:9:"pr_result";s:8:"Positive";s:14:"her_two_result";s:10:"Borderline";s:8:"rpt_noet";s:0:"";}i:89;a:23:{s:10:"her_two_id";s:3:"113";s:5:"sl_no";s:3:"387";s:7:"test_id";s:16:"MIHC13:18809-811";s:10:"reciv_date";s:10:"29/09/2013";s:9:"deli_date";s:10:"06/10/2013";s:12:"current_date";s:10:"2013-09-29";s:12:"patient_name";s:18:"Mrs. Nasrin Akhter";s:3:"age";s:6:"45 Yrs";s:6:"ref_by";s:45:"Tapesh Kumar Paul,FCPS,MS (Oncology Surgery).";s:3:"sex";s:6:"Female";s:13:"hospital_name";s:11:"DHL, C- 513";s:13:"specimen_name";s:46:"Mastectomy specimen (Lt.). Case No: MH13-18569";s:4:"note";s:136:"Result of Immunostaining  for ER, PR &amp; HER-2 of Case No:MH-18569/13,&nbsp;      Block No: (01    ). from DHL. Path. Lab. Dhaka. <br>";s:6:"er_rpt";s:59:"About 60 % of the tumor cell nuclei show moderate staining.";s:8:"er_score";s:7:"4+2=6/8";s:6:"pr_rpt";s:59:"About 10 % of the tumor cell nuclei show moderate staining.";s:8:"pr_score";s:7:"2+2=4/8";s:11:"her_two_rpt";s:83:"Strong complete membrane staining is observed in more than 30 % of the tumor cells.";s:13:"her_two_score";s:2:"3+";s:9:"er_result";s:8:"Positive";s:9:"pr_result";s:8:"Positive";s:14:"her_two_result";s:8:"Positive";s:8:"rpt_noet";s:0:"";}i:90;a:23:{s:10:"her_two_id";s:3:"114";s:5:"sl_no";s:3:"388";s:7:"test_id";s:16:"MIHC13:18827-829";s:10:"reciv_date";s:10:"29/09/2013";s:9:"deli_date";s:10:"06/10/2013";s:12:"current_date";s:10:"2013-09-29";s:12:"patient_name";s:10:"Mrs. Shova";s:3:"age";s:6:"33 Yrs";s:6:"ref_by";s:46:"Md. Burhan Uddin Khan.FCPS (S) , MRCS (London)";s:3:"sex";s:6:"Female";s:13:"hospital_name";s:34:"Mukti Clinic , Nabab Ganj. Dhaka. ";s:13:"specimen_name";s:54:"Tissue from Rt. Sided breast lump. Case No: DH13-2060.";s:4:"note";s:124:"Result of Immunostaining  for ER, PR &amp; HER-2 of Case No:      DH13-2060 , Block No: (02). from DHL. Pah. Lab. Dhaka.<br>";s:6:"er_rpt";s:59:"About 60 % of the tumor cell nuclei show moderate staining.";s:8:"er_score";s:7:"4+2=6/8";s:6:"pr_rpt";s:60:"About 40 %  of the tumor cell nuclei show moderate staining.";s:8:"pr_score";s:8:"4+2 =6/8";s:11:"her_two_rpt";s:93:"Weak to moderate complete membrane staining is observed in more than 10 % of the tumor cells.";s:13:"her_two_score";s:2:"2+";s:9:"er_result";s:8:"Positive";s:9:"pr_result";s:8:"Positive";s:14:"her_two_result";s:10:"Borderline";s:8:"rpt_noet";s:0:"";}i:91;a:23:{s:10:"her_two_id";s:3:"115";s:5:"sl_no";s:3:"389";s:7:"test_id";s:16:"MIHC13:18874-876";s:10:"reciv_date";s:10:"29/09/2013";s:9:"deli_date";s:10:"06/10/2013";s:12:"current_date";s:10:"2013-09-29";s:12:"patient_name";s:6:"Shafia";s:3:"age";s:6:"41 Yrs";s:6:"ref_by";s:9:"Omar Ali ";s:3:"sex";s:6:"Female";s:13:"hospital_name";s:33:"Popular General Hospital. Pabna. ";s:13:"specimen_name";s:40:"Tissue from breast. Case No: MH13-12612.";s:4:"note";s:131:"Result of Immunostaining  for ER, PR &amp; HER-2 of Case No:MH13-12612 ,&nbsp;      Block No: (02) from. DHL. Path. Lab. Dhaka.<br>";s:6:"er_rpt";s:54:"About 01 % of the tumor cell nuclei show weak staining";s:8:"er_score";s:7:"2+1=3/8";s:6:"pr_rpt";s:56:"About 02 %  of the tumor cell nuclei show weak staining.";s:8:"pr_score";s:7:"2+1=3/8";s:11:"her_two_rpt";s:93:"Weak to moderate complete membrane staining is observed in more than 10 % of the tumor cells.";s:13:"her_two_score";s:2:"2+";s:9:"er_result";s:8:"Positive";s:9:"pr_result";s:8:"Positive";s:14:"her_two_result";s:10:"Borderline";s:8:"rpt_noet";s:0:"";}i:92;a:23:{s:10:"her_two_id";s:3:"116";s:5:"sl_no";s:3:"390";s:7:"test_id";s:16:"MIHC13:18928-930";s:10:"reciv_date";s:10:"30/09/2013";s:9:"deli_date";s:10:"06/10/2013";s:12:"current_date";s:10:"2013-09-30";s:12:"patient_name";s:21:"Mrs. Shikha Rani Paul";s:3:"age";s:6:"50 Yrs";s:6:"ref_by";s:78:"Md. Rezaul Sharif, MBBS, M.Phil (Radiotherapy) Consultant, (Clinical Oncology)";s:3:"sex";s:6:"Female";s:13:"hospital_name";s:19:"DHL (Oncology Unit)";s:13:"specimen_name";s:51:"Tissue from left breast lump, Case No : MH13-17978.";s:4:"note";s:131:"Result of Immunostaining  for ER, PR &amp; HER-2 of Case No:      MH13-17978 , Block No: (01    ), from DHL, Path, Lab. Dhaka. <br>";s:6:"er_rpt";s:59:"About 60 % of the tumor cell nuclei show moderate staining.";s:8:"er_score";s:8:"4+2=6/ 8";s:6:"pr_rpt";s:59:"About 60 % of the tumor cell nuclei show moderate staining.";s:8:"pr_score";s:9:"4+2= 6/ 8";s:11:"her_two_rpt";s:83:"Weak incomplete membrane staining is observed in more than 10 % of the tumor cells.";s:13:"her_two_score";s:2:"1+";s:9:"er_result";s:8:"Positive";s:9:"pr_result";s:8:"Positive";s:14:"her_two_result";s:8:"Negative";s:8:"rpt_noet";s:0:"";}i:93;a:23:{s:10:"her_two_id";s:3:"117";s:5:"sl_no";s:3:"391";s:7:"test_id";s:16:"MIHC13:18963-965";s:10:"reciv_date";s:10:"30/09/2013";s:9:"deli_date";s:10:"06/10/2013";s:12:"current_date";s:10:"2013-09-30";s:12:"patient_name";s:6:"Rafeza";s:3:"age";s:6:"50 Yrs";s:6:"ref_by";s:71:"Md. Setabur Rahman, MBBS, MS (Surgery), Assit. Prof. Surgical Oncology.";s:3:"sex";s:6:"Female";s:13:"hospital_name";s:43:"National Cancer Hospital , Mohakhali. Dhaka";s:13:"specimen_name";s:40:"Mastectomy specimen, Case No: MH13-15509";s:4:"note";s:134:"Result of Immunostaining  for ER, PR &amp; HER-2 of Case No: MH13-15509 ,&nbsp;     Block No: (02    ) from DHL, Path