O:12:"CI_DB_result":8:{s:7:"conn_id";N;s:9:"result_id";N;s:12:"result_array";a:50:{i:0;a:23:{s:10:"her_two_id";s:3:"954";s:5:"sl_no";s:3:"219";s:7:"test_id";s:16:"MIHC14:08381-383";s:10:"reciv_date";s:10:"03/05/2014";s:9:"deli_date";s:10:"04/05/2014";s:12:"current_date";s:10:"2014-05-03";s:12:"patient_name";s:11:"Ms. Shimul.";s:3:"age";s:6:"27 Yrs";s:6:"ref_by";s:0:"";s:3:"sex";s:6:"Female";s:13:"hospital_name";s:33:"Chevron Clinical Lab , Chittagong";s:13:"specimen_name";s:43:"Tissue from Lt. breast. Case No: MH14-07151";s:4:"note";s:125:"Result of Immunostaining  for ER, PR &amp; HER-2 of Case No:      MH14-07151, Block No: (01) from DHL, Path. Lab. Dhaka. <br>";s:6:"er_rpt";s:35:"Tumor cell nuclei show no staining.";s:8:"er_score";s:3:""O"";s:6:"pr_rpt";s:35:"Tumor cell nuclei show no staining.";s:8:"pr_score";s:3:""O"";s:11:"her_two_rpt";s:83:"Strong complete membrane staining is observed in more than 30 % of the tumor cells.";s:13:"her_two_score";s:2:"3+";s:9:"er_result";s:8:"Negative";s:9:"pr_result";s:8:"Negative";s:14:"her_two_result";s:8:"Positive";s:8:"rpt_noet";s:0:"";}i:1;a:23:{s:10:"her_two_id";s:3:"955";s:5:"sl_no";s:3:"220";s:7:"test_id";s:16:"MIHC14:08426-428";s:10:"reciv_date";s:10:"03/05/2014";s:9:"deli_date";s:10:"11/05/2014";s:12:"current_date";s:10:"2014-05-03";s:12:"patient_name";s:13:"Anowara Kujat";s:3:"age";s:6:"70 Yrs";s:6:"ref_by";s:7:"Imtiaz.";s:3:"sex";s:6:"Female";s:13:"hospital_name";s:49:"Holy Family Red Crescent Medical College Hospital";s:13:"specimen_name";s:43:"Tissue from left breast. Case No: MH14-8822";s:4:"note";s:124:"Result of Immunostaining  for ER, PR &amp; HER-2 of Case No:      MH14-8822, Block No: (03) from DHL, Path. Lab. Dhaka. <br>";s:6:"er_rpt";s:59:"About 65 % of the tumor cell nuclei show moderate staining.";s:8:"er_score";s:9:"4+2=6 / 8";s:6:"pr_rpt";s:59:"About 60 % of the tumor cell nuclei show moderate staining.";s:8:"pr_score";s:9:"4+2=6 / 8";s:11:"her_two_rpt";s:83:"Strong complete membrane staining is observed in more than 30 % of the tumor cells.";s:13:"her_two_score";s:2:"3+";s:9:"er_result";s:8:"Positive";s:9:"pr_result";s:8:"Positive";s:14:"her_two_result";s:8:"Positive";s:8:"rpt_noet";s:0:"";}i:2;a:23:{s:10:"her_two_id";s:3:"956";s:5:"sl_no";s:3:"221";s:7:"test_id";s:16:"MIHC14:08485-487";s:10:"reciv_date";s:10:"04/05/2014";s:9:"deli_date";s:10:"11/05/2014";s:12:"current_date";s:10:"2014-05-04";s:12:"patient_name";s:12:"Feroza Begum";s:3:"age";s:6:"38 Yrs";s:6:"ref_by";s:43:"Md. Zillur Rahman. Cyto & Histopathologist.";s:3:"sex";s:6:"Female";s:13:"hospital_name";s:31:"Care Investigation. Chittagong.";s:13:"specimen_name";s:47:"One paraffin block (Breast). Case No: H-983A/14";s:4:"note";s:152:"Result of Immunostaining  for ER, PR &amp; HER-2 of Case No:      H-983A/14, Block No: (01) from Dr. Zillur Rahman. Care Investigation. Chittagong. <br>";s:6:"er_rpt";s:59:"About 40 % of the tumor cell nuclei show moderate staining.";s:8:"er_score";s:9:"4+2=6 / 8";s:6:"pr_rpt";s:59:"About 55 % of the tumor cell nuclei show moderate staining.";s:8:"pr_score";s:9:"4+2=6 / 8";s:11:"her_two_rpt";s:94:" Weak to moderate complete membrane staining is observed in more than 10 % of the tumor cells.";s:13:"her_two_score";s:2:"2+";s:9:"er_result";s:8:"Positive";s:9:"pr_result";s:8:"Positive";s:14:"her_two_result";s:10:"Borderline";s:8:"rpt_noet";s:0:"";}i:3;a:23:{s:10:"her_two_id";s:3:"957";s:5:"sl_no";s:3:"222";s:7:"test_id";s:16:"MIHC14:08578-580";s:10:"reciv_date";s:10:"04/05/2014";s:9:"deli_date";s:10:"18/05/2014";s:12:"current_date";s:10:"2014-05-04";s:12:"patient_name";s:13:"Mrs. Mohsena.";s:3:"age";s:6:"35 Yrs";s:6:"ref_by";s:38:"M.A. Awal. MBBS, M.Phil (Radiotherapy)";s:3:"sex";s:6:"Female";s:13:"hospital_name";s:41:"Popular Diagnostic Centre Ltd,Chittagong.";s:13:"specimen_name";s:43:"One paraffin block (L.N). Case No: 1784D/14";s:4:"note";s:116:"Result of Immunostaining  for ER, PR &amp; HER-2 of Case No: 1784/14, Block No: (D) from Cyto-site. Chittagong. <br>";s:6:"er_rpt";s:35:"Tumor cell nuclei show no staining.";s:8:"er_score";s:3:""O"";s:6:"pr_rpt";s:35:"Tumor cell nuclei show no staining.";s:8:"pr_score";s:3:""O"";s:11:"her_two_rpt";s:93:"Weak to moderate complete membrane staining is observed in more than 10 % of the tumor cells.";s:13:"her_two_score";s:2:"2+";s:9:"er_result";s:8:"Negative";s:9:"pr_result";s:8:"Negative";s:14:"her_two_result";s:10:"Borderline";s:8:"rpt_noet";s:0:"";}i:4;a:23:{s:10:"her_two_id";s:3:"958";s:5:"sl_no";s:3:"223";s:7:"test_id";s:16:"MIHC14:08649-651";s:10:"reciv_date";s:10:"05/05/2014";s:9:"deli_date";s:10:"11/05/2014";s:12:"current_date";s:10:"2014-05-05";s:12:"patient_name";s:11:"Mrs. Nazma.";s:3:"age";s:6:"30 Yrs";s:6:"ref_by";s:32:"A. R. M Rafiqul Islam. M/O. OPD.";s:3:"sex";s:6:"Female";s:13:"hospital_name";s:23:"NICRH, Mohakhali, Dhaka";s:13:"specimen_name";s:44:"Mastectomy specimen (Rt). Case No: MH14-5702";s:4:"note";s:124:"Result of Immunostaining  for ER, PR &amp; HER-2 of Case No:      MH14-5702, Block No: (03) from DHL, Path. Lab. Dhaka. <br>";s:6:"er_rpt";s:35:"Tumor cell nuclei show no staining.";s:8:"er_score";s:3:""O"";s:6:"pr_rpt";s:35:"Tumor cell nuclei show no staining.";s:8:"pr_score";s:3:""O"";s:11:"her_two_rpt";s:83:"Strong complete membrane staining is observed in more than 30 % of the tumor cells.";s:13:"her_two_score";s:2:"3+";s:9:"er_result";s:8:"Negative";s:9:"pr_result";s:8:"Negative";s:14:"her_two_result";s:8:"Positive";s:8:"rpt_noet";s:0:"";}i:5;a:23:{s:10:"her_two_id";s:3:"959";s:5:"sl_no";s:3:"225";s:7:"test_id";s:16:"MIHC14:08709-711";s:10:"reciv_date";s:10:"06/05/2014";s:9:"deli_date";s:10:"11/05/2014";s:12:"current_date";s:10:"2014-05-06";s:12:"patient_name";s:20:"Miss. Dilruba Khanom";s:3:"age";s:6:"54 Yrs";s:6:"ref_by";s:58:"Tapesh Kumar Paul, FCPS (Surgery), MS (Surgical Oncology).";s:3:"sex";s:6:"Female";s:13:"hospital_name";s:40:"Delta Medical College & Hospital. Dhaka.";s:13:"specimen_name";s:44:"Lt. breast tissue . Case No: MH14-8242 (Lt.)";s:4:"note";s:134:"Result of Immunostaining  for ER, PR &amp; HER-2 of Case No:      MH14-8242, (Lt.) Block No: (Addi 2) from DHL, Path. Lab. Dhaka. <br>";s:6:"er_rpt";s:60:"About 60  % of the tumor cell nuclei show moderate staining.";s:8:"er_score";s:9:"4+2=6 / 8";s:6:"pr_rpt";s:59:"About 45 % of the tumor cell nuclei show moderate staining.";s:8:"pr_score";s:9:"4+2=6 / 8";s:11:"her_two_rpt";s:83:"Strong complete membrane staining is observed in more than 30 % of the tumor cells.";s:13:"her_two_score";s:2:"3+";s:9:"er_result";s:8:"Positive";s:9:"pr_result";s:8:"Positive";s:14:"her_two_result";s:8:"Positive";s:8:"rpt_noet";s:0:"";}i:6;a:23:{s:10:"her_two_id";s:3:"960";s:5:"sl_no";s:3:"224";s:7:"test_id";s:12:"MIHC14:08702";s:10:"reciv_date";s:10:"05/05/2014";s:9:"deli_date";s:10:"11/05/2014";s:12:"current_date";s:10:"2014-05-05";s:12:"patient_name";s:15:"Mr. Jafar Ullah";s:3:"age";s:6:"57 Yrs";s:6:"ref_by";s:61:"Lt. Col. M.S. Sarwar Alam (Rtd). FCPS, (Clinical Oncologist).";s:3:"sex";s:4:"Male";s:13:"hospital_name";s:40:"Delta Medical College & Hospital. Dhaka.";s:13:"specimen_name";s:47:"One parafin block. (Stomach) Case No: H-376/14.";s:4:"note";s:113:"Result of Immunostaining  for HER-2 of Case No:      H-376/14, from UAMCH Dept. of Pathology. Uttara. Dhaka. <br>";s:6:"er_rpt";s:0:"";s:8:"er_score";s:0:"";s:6:"pr_rpt";s:0:"";s:8:"pr_score";s:0:"";s:11:"her_two_rpt";s:83:"Weak incomplete membrane staining is observed in more than 10 % of the tumor cells.";s:13:"her_two_score";s:2:"1+";s:9:"er_result";s:0:"";s:9:"pr_result";s:0:"";s:14:"her_two_result";s:8:"Negative";s:8:"rpt_noet";s:0:"";}i:7;a:23:{s:10:"her_two_id";s:3:"961";s:5:"sl_no";s:3:"226";s:7:"test_id";s:16:"MIHC14:08802-804";s:10:"reciv_date";s:10:"06/05/2014";s:9:"deli_date";s:10:"11/05/2014";s:12:"current_date";s:10:"2014-05-06";s:12:"patient_name";s:14:"Kohinur Begum.";s:3:"age";s:6:"40 Yrs";s:6:"ref_by";s:61:"Sajjad Mohammad Yusuff, Oncolgoist, MCPS, FCPS.(Radiotherapy)";s:3:"sex";s:6:"Female";s:13:"hospital_name";s:16:"CSCR, Chittagong";s:13:"specimen_name";s:44:"Lt. axillary lymph node. Case No: MH14-08585";s:4:"note";s:124:"Result of Immunostaining  for ER, PR &amp; HER-2 of Case No: MH14-08585, Block No: (01) from DHL, Path. Lab. Dhaka. <br><br>";s:6:"er_rpt";s:35:"Tumor cell nuclei show no staining.";s:8:"er_score";s:3:""O"";s:6:"pr_rpt";s:35:"Tumor cell nuclei show no staining.";s:8:"pr_score";s:3:""O"";s:11:"her_two_rpt";s:83:"Weak incomplete membrane staining is observed in more than 10 % of the tumor cells.";s:13:"her_two_score";s:2:"1+";s:9:"er_result";s:8:"Negative";s:9:"pr_result";s:8:"Negative";s:14:"her_two_result";s:8:"Negative";s:8:"rpt_noet";s:0:"";}i:8;a:23:{s:10:"her_two_id";s:3:"962";s:5:"sl_no";s:3:"228";s:7:"test_id";s:16:"MIHC14:08839-841";s:10:"reciv_date";s:10:"07/05/2014";s:9:"deli_date";s:10:"11/05/2014";s:12:"current_date";s:10:"2014-05-07";s:12:"patient_name";s:18:"Mrs. Ayesha Begum.";s:3:"age";s:6:"26 Yrs";s:6:"ref_by";s:50:"Parvin Akhter Banu, Chief Consultant (Oncologist).";s:3:"sex";s:6:"Female";s:13:"hospital_name";s:40:"Delta Medical College & Hospital.Dhaka. ";s:13:"specimen_name";s:48:"One paraffin block (Rt. breast.)Case No: D217536";s:4:"note";s:144:"Result of Immunostaining  for ER, PR &amp; HER-2 of Case No:      D217536, Block No: (02) from&nbsp; IBN SINA Diagnostic and Imaging Center.<br>";s:6:"er_rpt";s:59:"About 60 % of the tumor cell nuclei show moderate staining.";s:8:"er_score";s:9:"4+2=6 / 8";s:6:"pr_rpt";s:59:"About 60 % of the tumor cell nuclei show moderate staining.";s:8:"pr_score";s:9:"4+2=6 / 8";s:11:"her_two_rpt";s:93:"Weak to moderate complete membrane staining is observed in more than 10 % of the tumor cells.";s:13:"her_two_score";s:2:"2+";s:9:"er_result";s:8:"Positive";s:9:"pr_result";s:8:"Positive";s:14:"her_two_result";s:10:"Borderline";s:8:"rpt_noet";s:0:"";}i:9;a:23:{s:10:"her_two_id";s:3:"963";s:5:"sl_no";s:3:"227";s:7:"test_id";s:16:"MIHC14:08812-814";s:10:"reciv_date";s:10:"07/05/2014";s:9:"deli_date";s:10:"11/05/2014";s:12:"current_date";s:10:"2014-05-07";s:12:"patient_name";s:19:"Mrs. Shefali Begum.";s:3:"age";s:6:"40 Yrs";s:6:"ref_by";s:59:"Tapesh Kumar Paul, FCPS, (Surgery), MS (Surgical Oncology).";s:3:"sex";s:6:"Female";s:13:"hospital_name";s:56:"Delta Medical College & Hospital.Dhaka , C-535/6, Dhaka.";s:13:"specimen_name";s:38:"Breast tissue (Rt.) Case No: MH14-7409";s:4:"note";s:124:"Result of Immunostaining  for ER, PR &amp; HER-2 of Case No:      MH14-7409, Block No: (02) from DHL, Path. Lab. Dhaka. <br>";s:6:"er_rpt";s:35:"Tumor cell nuclei show no staining.";s:8:"er_score";s:3:""O"";s:6:"pr_rpt";s:55:"About 10 % of the tumor cell nuclei show weak staining.";s:8:"pr_score";s:7:"2+1=3/8";s:11:"her_two_rpt";s:93:"Weak to moderate complete membrane staining is observed in more than 10 % of the tumor cells.";s:13:"her_two_score";s:2:"2+";s:9:"er_result";s:8:"Negative";s:9:"pr_result";s:8:"Positive";s:14:"her_two_result";s:10:"Borderline";s:8:"rpt_noet";s:0:"";}i:10;a:23:{s:10:"her_two_id";s:3:"964";s:5:"sl_no";s:3:"229";s:7:"test_id";s:16:"MIHC14:08895-897";s:10:"reciv_date";s:10:"08/05/2014";s:9:"deli_date";s:10:"11/05/2014";s:12:"current_date";s:10:"2014-05-08";s:12:"patient_name";s:11:"Anima Barua";s:3:"age";s:6:"55 Yrs";s:6:"ref_by";s:0:"";s:3:"sex";s:6:"Female";s:13:"hospital_name";s:32:"Ctg. Metropoliton Hospital, Ctg.";s:13:"specimen_name";s:43:"Tissue from Rt. Breast. Case No: MH14-8463.";s:4:"note";s:124:"Result of Immunostaining  for ER, PR &amp; HER-2 of Case No:      MH14-8463, Block No: (01) from DHL, Path. Lab. Dhaka. <br>";s:6:"er_rpt";s:59:"About 50 % of the tumor cell nuclei show moderate staining.";s:8:"er_score";s:9:"4+2=6 / 8";s:6:"pr_rpt";s:35:"Tumor cell nuclei show no staining.";s:8:"pr_score";s:3:""O"";s:11:"her_two_rpt";s:93:"Weak to moderate complete membrane staining is observed in more than 10 % of the tumor cells.";s:13:"her_two_score";s:2:"2+";s:9:"er_result";s:8:"Positive";s:9:"pr_result";s:8:"Negative";s:14:"her_two_result";s:10:"Borderline";s:8:"rpt_noet";s:0:"";}i:11;a:23:{s:10:"her_two_id";s:3:"965";s:5:"sl_no";s:3:"230";s:7:"test_id";s:16:"MIHC14:08898-900";s:10:"reciv_date";s:10:"08/05/2014";s:9:"deli_date";s:10:"11/05/2014";s:12:"current_date";s:10:"2014-05-08";s:12:"patient_name";s:19:"Mrs. Renu Bala Dey.";s:3:"age";s:6:"40 Yrs";s:6:"ref_by";s:48:"Md. Zillur Rahman. Cyto & Histopathologist. Ctg.";s:3:"sex";s:6:"Female";s:13:"hospital_name";s:30:"Care Investigation Chittagong.";s:13:"specimen_name";s:53:"One paraffin block (Lt. Breast). Case No:  H-1023B/14";s:4:"note";s:133:"Result of Immunostaining  for ER, PR &amp; HER-2 of Case&nbsp; No H-1023B/14, Block No: (02) from Care Investigation. Chittagong.<br>";s:6:"er_rpt";s:59:"About 50 % of the tumor cell nuclei show moderate staining.";s:8:"er_score";s:9:"4+2=6 / 8";s:6:"pr_rpt";s:59:"About 15 % of the tumor cell nuclei show moderate staining.";s:8:"pr_score";s:8:"3+2= 5/8";s:11:"her_two_rpt";s:93:"Weak to moderate complete membrane staining is observed in more than 10 % of the tumor cells.";s:13:"her_two_score";s:2:"2+";s:9:"er_result";s:8:"Positive";s:9:"pr_result";s:8:"Positive";s:14:"her_two_result";s:10:"Borderline";s:8:"rpt_noet";s:0:"";}i:12;a:23:{s:10:"her_two_id";s:3:"966";s:5:"sl_no";s:3:"231";s:7:"test_id";s:16:"MIHC14:08915-917";s:10:"reciv_date";s:10:"08/05/2014";s:9:"deli_date";s:10:"11/05/2014";s:12:"current_date";s:10:"2014-05-08";s:12:"patient_name";s:18:"Mrs. Helena Begum.";s:3:"age";s:6:"50 Yrs";s:6:"ref_by";s:29:"Ahmed Sayeed,  FCPS (Surgery)";s:3:"sex";s:6:"Female";s:13:"hospital_name";s:49:"Oncology Centre and General Hospital Ltd. Dhaka. ";s:13:"specimen_name";s:57:"Tissue from left axillary lymph node. Case No: MH14-08400";s:4:"note";s:123:"Result of Immunostaining  for ER, PR &amp; HER-2 of Case No:      MH14-08400, Block No: (01) from DHL, Path. Lab. Dhaka<br>";s:6:"er_rpt";s:59:"About 40 % of the tumor cell nuclei show moderate staining.";s:8:"er_score";s:9:"4+2=6 / 8";s:6:"pr_rpt";s:59:"About 20 % of the tumor cell nuclei show moderate staining.";s:8:"pr_score";s:8:"3+2= 5/8";s:11:"her_two_rpt";s:83:"Weak incomplete membrane staining is observed in more than 10 % of the tumor cells.";s:13:"her_two_score";s:2:"1+";s:9:"er_result";s:8:"Positive";s:9:"pr_result";s:8:"Positive";s:14:"her_two_result";s:8:"Negative";s:8:"rpt_noet";s:0:"";}i:13;a:23:{s:10:"her_two_id";s:3:"967";s:5:"sl_no";s:3:"232";s:7:"test_id";s:16:"DIHC14:00958-960";s:10:"reciv_date";s:10:"07/05/2014";s:9:"deli_date";s:10:"11/05/2014";s:12:"current_date";s:10:"2014-05-07";s:12:"patient_name";s:12:"Mrs. Hazera.";s:3:"age";s:6:"43 Yrs";s:6:"ref_by";s:40:"Md. Mashiur Arefin Rubel, FCPS, MRCS, MS";s:3:"sex";s:6:"Female";s:13:"hospital_name";s:26:"Islamia Arogya Sadan Ltd. ";s:13:"specimen_name";s:40:"Mastectomy specimen. Case No: DH14-00957";s:4:"note";s:128:"Result of Immunostaining  for ER, PR &amp; HER-2 of Case No: DH14-00957,&nbsp;     Block No: (01) from DHL, Path. Lab. Dhaka<br>";s:6:"er_rpt";s:59:"About 55 % of the tumor cell nuclei show moderate staining.";s:8:"er_score";s:9:"4+2=6 / 8";s:6:"pr_rpt";s:59:"About 20 % of the tumor cell nuclei show moderate staining.";s:8:"pr_score";s:9:"3+2=5 / 8";s:11:"her_two_rpt";s:93:"Weak to moderate complete membrane staining is observed in more than 10 % of the tumor cells.";s:13:"her_two_score";s:2:"2+";s:9:"er_result";s:8:"Positive";s:9:"pr_result";s:8:"Positive";s:14:"her_two_result";s:10:"Borderline";s:8:"rpt_noet";s:0:"";}i:14;a:23:{s:10:"her_two_id";s:3:"968";s:5:"sl_no";s:3:"234";s:7:"test_id";s:16:"MIHC14:08979-981";s:10:"reciv_date";s:10:"09/05/2014";s:9:"deli_date";s:10:"18/05/2014";s:12:"current_date";s:10:"2014-05-09";s:12:"patient_name";s:21:"Mrs. Khurshida Begum.";s:3:"age";s:6:"36 Yrs";s:6:"ref_by";s:69:"Naheed Rukhsana ,MBBS,  FCPS, (Radiotherapy). Consultant. oncologist.";s:3:"sex";s:6:"Female";s:13:"hospital_name";s:39:"Delta Medical College & Hospital. Dhaka";s:13:"specimen_name";s:44:"Tissue from left breast. Case No : MH14-9150";s:4:"note";s:124:"Result of Immunostaining  for ER, PR &amp; HER-2 of Case No:      MH14-9150, Block No: (02) from DHL, Path. Lab. Dhaka. <br>";s:6:"er_rpt";s:55:"About 20 % of the tumor cell nuclei show weak staining.";s:8:"er_score";s:7:"3+1=4/8";s:6:"pr_rpt";s:55:"About 10 % of the tumor cell nuclei show weak staining.";s:8:"pr_score";s:7:"2+1=3/8";s:11:"her_two_rpt";s:93:"Weak to moderate complete membrane staining is observed in more than 10 % of the tumor cells.";s:13:"her_two_score";s:2:"2+";s:9:"er_result";s:8:"Positive";s:9:"pr_result";s:8:"Positive";s:14:"her_two_result";s:10:"Borderline";s:8:"rpt_noet";s:86:"Note: Tissue is poorly fixed. Poor fixation may interfere with immunostaining results.";}i:15;a:23:{s:10:"her_two_id";s:3:"969";s:5:"sl_no";s:3:"236";s:7:"test_id";s:16:"MIHC14:09079-081";s:10:"reciv_date";s:10:"10/05/2014";s:9:"deli_date";s:10:"18/05/2014";s:12:"current_date";s:10:"2014-05-10";s:12:"patient_name";s:15:"Mrs. Nur Jahan.";s:3:"age";s:6:"50 Yrs";s:6:"ref_by";s:16:"M/O, DMCH, Dhaka";s:3:"sex";s:6:"Female";s:13:"hospital_name";s:38:"Dhaka Medical College Hospital , Dhaka";s:13:"specimen_name";s:44:"Tissue from Lt. breast. Case No: MH14-08879.";s:4:"note";s:110:"Result of Immunostaining  for ER, PR &amp; HER-2 of Case No:      MH14-08879, from DHL, Path. Lab. Dhaka. <br>";s:6:"er_rpt";s:35:"Tumor cell nuclei show no staining.";s:8:"er_score";s:3:""O"";s:6:"pr_rpt";s:35:"Tumor cell nuclei show no staining.";s:8:"pr_score";s:3:""O"";s:11:"her_two_rpt";s:93:"Weak to moderate complete membrane staining is observed in more than 10 % of the tumor cells.";s:13:"her_two_score";s:2:"2+";s:9:"er_result";s:8:"Negative";s:9:"pr_result";s:8:"Negative";s:14:"her_two_result";s:10:"Borderline";s:8:"rpt_noet";s:0:"";}i:16;a:23:{s:10:"her_two_id";s:3:"970";s:5:"sl_no";s:3:"237";s:7:"test_id";s:16:"MIHC14:09099-101";s:10:"reciv_date";s:10:"11/05/2014";s:9:"deli_date";s:10:"18/05/2014";s:12:"current_date";s:10:"2014-05-11";s:12:"patient_name";s:20:"Mrs. Shirin Akhter. ";s:3:"age";s:6:"46 Yrs";s:6:"ref_by";s:58:"Tapesh Kumar Paul, FCPS (Surgery), MS (Surgical Oncology).";s:3:"sex";s:6:"Female";s:13:"hospital_name";s:47:"Delta Medical College & Hospital , Dhaka, C-612";s:13:"specimen_name";s:39:"Lt. Breast tissue . Case No : MH14-8819";s:4:"note";s:124:"Result of Immunostaining  for ER, PR &amp; HER-2 of Case No:      MH14-8819, Block No: (01) from DHL, Path. Lab. Dhaka. <br>";s:6:"er_rpt";s:59:"About 50 % of the tumor cell nuclei show moderate staining.";s:8:"er_score";s:7:"4+2=6/8";s:6:"pr_rpt";s:59:"About 65 % of the tumor cell nuclei show moderate staining.";s:8:"pr_score";s:7:"4+2=6/8";s:11:"her_two_rpt";s:83:"Strong complete membrane staining is observed in more than 30 % of the tumor cells.";s:13:"her_two_score";s:2:"3+";s:9:"er_result";s:8:"Positive";s:9:"pr_result";s:8:"Positive";s:14:"her_two_result";s:8:"Positive";s:8:"rpt_noet";s:0:"";}i:17;a:23:{s:10:"her_two_id";s:3:"971";s:5:"sl_no";s:3:"238";s:7:"test_id";s:16:"MIHC14:09102-104";s:10:"reciv_date";s:10:"11/05/2014";s:9:"deli_date";s:10:"18/05/2014";s:12:"current_date";s:10:"2014-05-11";s:12:"patient_name";s:12:"Mrs. Parul. ";s:3:"age";s:6:"40 Yrs";s:6:"ref_by";s:59:"Tapesh Kumar Paul, FCPS, (Surgery), MS (Surgical Oncology).";s:3:"sex";s:6:"Female";s:13:"hospital_name";s:40:"Delta Medical College & Hospital. Dhaka.";s:13:"specimen_name";s:46:"Mastectomy specimen (Lt.).Case No:  MH14-08799";s:4:"note";s:126:"Result of Immunostaining  for ER, PR &amp; HER-2 of Case No:      MH14-08799, Block No: (01) from DHL , Path. Lab. Dhaka. <br>";s:6:"er_rpt";s:59:"About 50 % of the tumor cell nuclei show moderate staining.";s:8:"er_score";s:7:"4+2=6/8";s:6:"pr_rpt";s:59:"About 60 % of the tumor cell nuclei show moderate staining.";s:8:"pr_score";s:7:"4+2=6/8";s:11:"her_two_rpt";s:84:" Weak incomplete membrane staining is observed in more than 10 % of the tumor cells.";s:13:"her_two_score";s:2:"1+";s:9:"er_result";s:8:"Positive";s:9:"pr_result";s:8:"Positive";s:14:"her_two_result";s:8:"Negative";s:8:"rpt_noet";s:0:"";}i:18;a:23:{s:10:"her_two_id";s:3:"972";s:5:"sl_no";s:3:"240";s:7:"test_id";s:16:"MIHC14:09238-240";s:10:"reciv_date";s:10:"12/05/2014";s:9:"deli_date";s:10:"18/05/2014";s:12:"current_date";s:10:"2014-05-12";s:12:"patient_name";s:17:"Mrs. Amena Begum.";s:3:"age";s:6:"55 Yrs";s:6:"ref_by";s:41:"Sagorika Sharmin (Sagor), FCPS (Surgery).";s:3:"sex";s:6:"Female";s:13:"hospital_name";s:40:"Lancet Diagnostic & Research, Chittagong";s:13:"specimen_name";s:44:"Mastectomy specimen (Lt). Case No: MH14-8576";s:4:"note";s:130:"Result of Immunostaining  for ER, PR &amp; HER-2 of Case No:MH14-8576,      Block No: (02)&nbsp; from DHL , Path. Lab. Dhaka. <br>";s:6:"er_rpt";s:59:"About 60 % of the tumor cell nuclei show moderate staining.";s:8:"er_score";s:7:"4+2=6/8";s:6:"pr_rpt";s:59:"About 30 % of the tumor cell nuclei show moderate staining.";s:8:"pr_score";s:7:"3+2=5/8";s:11:"her_two_rpt";s:83:"Weak incomplete membrane staining is observed in more than 10 % of the tumor cells.";s:13:"her_two_score";s:2:"1+";s:9:"er_result";s:8:"Positive";s:9:"pr_result";s:8:"Positive";s:14:"her_two_result";s:8:"Negative";s:8:"rpt_noet";s:0:"";}i:19;a:23:{s:10:"her_two_id";s:3:"973";s:5:"sl_no";s:3:"241";s:7:"test_id";s:16:"MIHC14:09242-244";s:10:"reciv_date";s:10:"12/05/2014";s:9:"deli_date";s:10:"18/05/2014";s:12:"current_date";s:10:"2014-05-12";s:12:"patient_name";s:17:"Mrs. Munni Begum.";s:3:"age";s:6:"36 Yrs";s:6:"ref_by";s:11:"M/O. NICRH.";s:3:"sex";s:6:"Female";s:13:"hospital_name";s:23:"NICRH, Mohakhali, Dhaka";s:13:"specimen_name";s:48:"One paraffin block (Lt. breast).Case No: D223340";s:4:"note";s:149:"Result of Immunostaining  for ER, PR &amp; HER-2 of Case No:      D223340, Block No: (02) from IBN SINA DIAGNOSTIC &amp; IMMAGING CENTER. Dhaka. <br>";s:6:"er_rpt";s:59:"About 50 % of the tumor cell nuclei show moderate staining.";s:8:"er_score";s:7:"4+2=6/8";s:6:"pr_rpt";s:59:"About 65 % of the tumor cell nuclei show moderate staining.";s:8:"pr_score";s:7:"4+2=6/8";s:11:"her_two_rpt";s:93:"Weak to moderate complete membrane staining is observed in more than 10 % of the tumor cells.";s:13:"her_two_score";s:2:"2+";s:9:"er_result";s:8:"Positive";s:9:"pr_result";s:8:"Positive";s:14:"her_two_result";s:10:"Borderline";s:8:"rpt_noet";s:0:"";}i:20;a:23:{s:10:"her_two_id";s:3:"974";s:5:"sl_no";s:3:"242";s:7:"test_id";s:16:"MIHC14:09257-259";s:10:"reciv_date";s:10:"13/05/2014";s:9:"deli_date";s:10:"18/05/2014";s:12:"current_date";s:10:"2014-05-13";s:12:"patient_name";s:18:"Mrs. Tania Akhter.";s:3:"age";s:6:"23 Yrs";s:6:"ref_by";s:57:"Tapesh Kumar Paul, FCPS, (Surgery) MS (Surgery Oncology).";s:3:"sex";s:6:"Female";s:13:"hospital_name";s:48:"Delta Medical College & Hospital., C-609, Dhaka.";s:13:"specimen_name";s:45:"Mastectomy specimen (Lt). Case No : MH14-8962";s:4:"note";s:123:"Result of Immunostaining  for ER, PR &amp; HER-2 of Case No: MH14-8962, Block No: (01) from DHL, Path. Lab. Dhaka. <br><br>";s:6:"er_rpt";s:35:"Tumor cell nuclei show no staining.";s:8:"er_score";s:3:""O"";s:6:"pr_rpt";s:35:"Tumor cell nuclei show no staining.";s:8:"pr_score";s:3:""O"";s:11:"her_two_rpt";s:83:"Strong complete membrane staining is observed in more than 30 % of the tumor cells.";s:13:"her_two_score";s:2:"3+";s:9:"er_result";s:8:"Negative";s:9:"pr_result";s:8:"Negative";s:14:"her_two_result";s:8:"Positive";s:8:"rpt_noet";s:0:"";}i:21;a:23:{s:10:"her_two_id";s:3:"975";s:5:"sl_no";s:3:"243";s:7:"test_id";s:16:"MIHC14:09268-270";s:10:"reciv_date";s:10:"13/05/2014";s:9:"deli_date";s:10:"18/05/2014";s:12:"current_date";s:10:"2014-05-13";s:12:"patient_name";s:20:"Mrs. Monowara Begum.";s:3:"age";s:6:"40 Yrs";s:6:"ref_by";s:41:"Sagarika Sharmin (Sagar), FCPS (Surgery).";s:3:"sex";s:6:"Female";s:13:"hospital_name";s:40:"Lancet Diagnostic & Research, Chittagong";s:13:"specimen_name";s:31:"Left breast. Case No: MH14-9033";s:4:"note";s:118:"Result of Immunostaining  for ER, PR &amp; HER-2 of Case No: MH14-9033, Block No: (03) from DHL, Path. Lab Dhaka. <br>";s:6:"er_rpt";s:59:"About 50 % of the tumor cell nuclei show moderate staining.";s:8:"er_score";s:7:"4+2=6/8";s:6:"pr_rpt";s:59:"About 68 % of the tumor cell nuclei show moderate staining.";s:8:"pr_score";s:7:"5+2=7/8";s:11:"her_two_rpt";s:93:"Weak to moderate complete membrane staining is observed in more than 10 % of the tumor cells.";s:13:"her_two_score";s:2:"2+";s:9:"er_result";s:8:"Positive";s:9:"pr_result";s:8:"Positive";s:14:"her_two_result";s:10:"Borderline";s:8:"rpt_noet";s:0:"";}i:22;a:23:{s:10:"her_two_id";s:3:"976";s:5:"sl_no";s:3:"244";s:7:"test_id";s:16:"MIHC14:09271-273";s:10:"reciv_date";s:10:"13/05/2014";s:9:"deli_date";s:10:"18/05/2014";s:12:"current_date";s:10:"2014-05-13";s:12:"patient_name";s:19:"Mrs. Anowara Begum.";s:3:"age";s:6:"55 Yrs";s:6:"ref_by";s:50:"Asstt. Prof. Dr. Md. Saiful Haque, FCPS (Surgery).";s:3:"sex";s:6:"Female";s:13:"hospital_name";s:22:"Ekushey Hospital, Ctg.";s:13:"specimen_name";s:42:"Tissue from Rt. breast. Case No: MH14-9026";s:4:"note";s:124:"Result of Immunostaining  for ER, PR &amp; HER-2 of Case No:      MH14-9026, Block No: (03) from DHL, Path. Lab. Dhaka. <br>";s:6:"er_rpt";s:35:"Tumor cell nuclei show no staining.";s:8:"er_score";s:3:""O"";s:6:"pr_rpt";s:35:"Tumor cell nuclei show no staining.";s:8:"pr_score";s:3:""O"";s:11:"her_two_rpt";s:87:"Strong complete membrane staining is observed in more than 30 % of the tumor cells.

";s:13:"her_two_score";s:2:"3+";s:9:"er_result";s:8:"Negative";s:9:"pr_result";s:8:"Negative";s:14:"her_two_result";s:8:"Positive";s:8:"rpt_noet";s:0:"";}i:23;a:23:{s:10:"her_two_id";s:3:"977";s:5:"sl_no";s:3:"245";s:7:"test_id";s:16:"MIHC14:09306-308";s:10:"reciv_date";s:10:"13/05/2014";s:9:"deli_date";s:10:"18/05/2014";s:12:"current_date";s:10:"2014-05-13";s:12:"patient_name";s:14:"Mrs. Nurjahan.";s:3:"age";s:6:"49 Yrs";s:6:"ref_by";s:79:"Md. Rezaul Sharif, M.Phil, in Radiotherapy (BSMMU) Consultant Clinical Oncology";s:3:"sex";s:6:"Female";s:13:"hospital_name";s:33:"Delta Medical College & Hospital.";s:13:"specimen_name";s:52:"One paraffin block (Rt. breast.). Case No: S0414-140";s:4:"note";s:138:"Result of Immunostaining  for ER, PR &amp; HER-2 of Case No:      S0414-140, Block No: (L/N) from SAIC Digital Diagnostic Lab. Dhaka. <br>";s:6:"er_rpt";s:35:"Tumor cell nuclei show no staining.";s:8:"er_score";s:3:""O"";s:6:"pr_rpt";s:35:"Tumor cell nuclei show no staining.";s:8:"pr_score";s:3:""O"";s:11:"her_two_rpt";s:83:"Strong complete membrane staining is observed in more than 30 % of the tumor cells.";s:13:"her_two_score";s:2:"3+";s:9:"er_result";s:8:"Negative";s:9:"pr_result";s:8:"Negative";s:14:"her_two_result";s:8:"Positive";s:8:"rpt_noet";s:0:"";}i:24;a:23:{s:10:"her_two_id";s:3:"978";s:5:"sl_no";s:3:"249";s:7:"test_id";s:16:"MIHC14:09510-512";s:10:"reciv_date";s:10:"15/05/2014";s:9:"deli_date";s:10:"25/05/2014";s:12:"current_date";s:10:"2014-05-15";s:12:"patient_name";s:20:"Mrs. Mohasena Begum.";s:3:"age";s:6:"38 Yrs";s:6:"ref_by";s:46:"Md. Zillur Rahman , MBBS, M.Phil (Path.). PhD.";s:3:"sex";s:6:"Female";s:13:"hospital_name";s:32:"Care Investigation, Chittagong. ";s:13:"specimen_name";s:52:"One paraffin block (Breast). Case no: H-05-1059 A/14";s:4:"note";s:137:"Result of Immunostaining  for ER, PR &amp; HER-2 of Case No:      H-05-1059 A/14 Block No: (01) from Care Investigation. Chittagong. <br>";s:6:"er_rpt";s:55:"About 30 % of the tumor cell nuclei show weak staining.";s:8:"er_score";s:7:"3+1=4/8";s:6:"pr_rpt";s:59:"About 30 % of the tumor cell nuclei show moderate staining.";s:8:"pr_score";s:7:"3+2=5/8";s:11:"her_two_rpt";s:83:"Weak incomplete membrane staining is observed in more than 10 % of the tumor cells.";s:13:"her_two_score";s:2:"1+";s:9:"er_result";s:8:"Positive";s:9:"pr_result";s:8:"Positive";s:14:"her_two_result";s:8:"Negative";s:8:"rpt_noet";s:0:"";}i:25;a:23:{s:10:"her_two_id";s:3:"979";s:5:"sl_no";s:3:"251";s:7:"test_id";s:12:"MIHC14:09517";s:10:"reciv_date";s:10:"15/05/2014";s:9:"deli_date";s:10:"25/05/2014";s:12:"current_date";s:10:"2014-05-15";s:12:"patient_name";s:19:"Mr. Somiron Biswash";s:3:"age";s:6:"42 Yrs";s:6:"ref_by";s:28:"Md. Zillur Rahman , FCPS, MS";s:3:"sex";s:4:"Male";s:13:"hospital_name";s:32:"Care Investigation, Chittagong. ";s:13:"specimen_name";s:41:"One paraffin block case no: H-05-1045A/14";s:4:"note";s:138:"Result of Immunostaining  for ER, PR &amp; HER-2 of Case No:      H-05-1045A/14, Block No: (02) from Care Investigation , Chittagong. <br>";s:6:"er_rpt";s:117:"About _______ %/ <1 % of the tumor cell nuclei show weak/moderate/strong staining/Tumor cell nuclei show no staining.";s:8:"er_score";s:6:"   / 8";s:6:"pr_rpt";s:118:"About _______%/ <1  %  of the tumor cell nuclei show weak/moderate/strong staining/Tumor cell nuclei show no staining.";s:8:"pr_score";s:9:"      / 8";s:11:"her_two_rpt";s:0:"";s:13:"her_two_score";s:12:"Select Score";s:9:"er_result";s:17:"Negative/Positive";s:9:"pr_result";s:17:"Negative/Positive";s:14:"her_two_result";s:28:"Negative/Positive/Borderline";s:8:"rpt_noet";s:0:"";}i:26;a:23:{s:10:"her_two_id";s:3:"980";s:5:"sl_no";s:3:"252";s:7:"test_id";s:16:"MIHC14:09518-520";s:10:"reciv_date";s:10:"15/05/2014";s:9:"deli_date";s:10:"25/05/2014";s:12:"current_date";s:10:"2014-05-15";s:12:"patient_name";s:16:"Mrs. Shahinoor. ";s:3:"age";s:6:"44 Yrs";s:6:"ref_by";s:59:"Tapesh Kumar Paul, FCPS, (Surgery), MS (Surgical Oncology).";s:3:"sex";s:6:"Female";s:13:"hospital_name";s:42:"Delta Medical College  & Hospital, Dhaka. ";s:13:"specimen_name";s:43:"Tissue from Rt. breast. Case No: MH14-9187.";s:4:"note";s:107:"Result of Immunostaining  for ER, PR &amp; HER-2 of Case No:      MH14-9187 from DHL, Path. Lab. Dhaka.<br>";s:6:"er_rpt";s:35:"Tumor cell nuclei show no staining.";s:8:"er_score";s:3:""O"";s:6:"pr_rpt";s:35:"Tumor cell nuclei show no staining.";s:8:"pr_score";s:3:""O"";s:11:"her_two_rpt";s:93:"Weak to moderate complete membrane staining is observed in more than 10 % of the tumor cells.";s:13:"her_two_score";s:2:"2+";s:9:"er_result";s:8:"Negative";s:9:"pr_result";s:8:"Negative";s:14:"her_two_result";s:10:"Borderline";s:8:"rpt_noet";s:0:"";}i:27;a:23:{s:10:"her_two_id";s:3:"981";s:5:"sl_no";s:3:"253";s:7:"test_id";s:16:"MIHC14:09536-538";s:10:"reciv_date";s:10:"15/05/2014";s:9:"deli_date";s:10:"25/05/2014";s:12:"current_date";s:10:"2014-05-15";s:12:"patient_name";s:17:"Mrs. Piyara Begum";s:3:"age";s:6:"47 Yrs";s:6:"ref_by";s:64:"M M S Hossain, MBBS, FCPS. (Radiotherapy) Consultant Oncologist.";s:3:"sex";s:6:"Female";s:13:"hospital_name";s:41:"Ashic Oncology & Palliative Care Center. ";s:13:"specimen_name";s:39:"Mastectomy specimen. Case No: MH14-8474";s:4:"note";s:130:"Result of Immunostaining  for ER, PR &amp; HER-2 of Case No:      MH14-8474, Block No: (01) from DHL, Path. Lab. Dhaka.&nbsp; <br>";s:6:"er_rpt";s:59:"About 60 % of the tumor cell nuclei show moderate staining.";s:8:"er_score";s:7:"4+2=6/8";s:6:"pr_rpt";s:59:"About 20 % of the tumor cell nuclei show moderate staining.";s:8:"pr_score";s:7:"3+2=5/8";s:11:"her_two_rpt";s:94:" Weak to moderate complete membrane staining is observed in more than 10 % of the tumor cells.";s:13:"her_two_score";s:2:"2+";s:9:"er_result";s:8:"Positive";s:9:"pr_result";s:8:"Positive";s:14:"her_two_result";s:10:"Borderline";s:8:"rpt_noet";s:0:"";}i:28;a:23:{s:10:"her_two_id";s:3:"982";s:5:"sl_no";s:3:"254";s:7:"test_id";s:16:"MIHC14:09552-554";s:10:"reciv_date";s:10:"16/05/2014";s:9:"deli_date";s:10:"25/05/2014";s:12:"current_date";s:10:"2014-05-16";s:12:"patient_name";s:16:"Mrs. Khuku Moni.";s:3:"age";s:6:"33 Yrs";s:6:"ref_by";s:28:"Ahsanul Abedin, FCPS, MCPS. ";s:3:"sex";s:6:"Female";s:13:"hospital_name";s:26:"CSCR Hospital , Chittagong";s:13:"specimen_name";s:32:"Right breast. Case No: MH14-9551";s:4:"note";s:124:"Result of Immunostaining  for ER, PR &amp; HER-2 of Case No:      MH14-9551, Block No: (01) from DHL, Path. Lab. Dhaka. <br>";s:6:"er_rpt";s:49:"<1 % of the tumor cell nuclei show weak staining.";s:8:"er_score";s:7:"1+1=2/8";s:6:"pr_rpt";s:54:"About 1 % of the tumor cell nuclei show weak staining.";s:8:"pr_score";s:7:"2+1=3/8";s:11:"her_two_rpt";s:93:"Weak to moderate complete membrane staining is observed in more than 10 % of the tumor cells.";s:13:"her_two_score";s:2:"2+";s:9:"er_result";s:8:"Negative";s:9:"pr_result";s:15:"Positive (Weak)";s:14:"her_two_result";s:10:"Borderline";s:8:"rpt_noet";s:0:"";}i:29;a:23:{s:10:"her_two_id";s:3:"983";s:5:"sl_no";s:3:"256";s:7:"test_id";s:16:"MIHC14:09573-575";s:10:"reciv_date";s:10:"17/05/2014";s:9:"deli_date";s:10:"25/05/2014";s:12:"current_date";s:10:"2014-05-17";s:12:"patient_name";s:14:"Mrs. Jahanara ";s:3:"age";s:6:"50 Yrs";s:6:"ref_by";s:59:"Tapesh Kumar Paul, FCPS, (Surgery), MS (Surgical Oncology).";s:3:"sex";s:6:"Female";s:13:"hospital_name";s:41:"Delta Medical College  & Hospital, Dhaka.";s:13:"specimen_name";s:59:"Tissue from left breast. (Core biopsy) Case No: MH14-08996.";s:4:"note";s:109:"Result of Immunostaining  for ER, PR &amp; HER-2 of Case No:      MH14-08996 from DHL, Path. Lab. Dhaka. <br>";s:6:"er_rpt";s:59:"About 50 % of the tumor cell nuclei show moderate staining.";s:8:"er_score";s:7:"4+2=6/8";s:6:"pr_rpt";s:59:"About 55 % of the tumor cell nuclei show moderate staining.";s:8:"pr_score";s:7:"4+2=6/8";s:11:"her_two_rpt";s:93:"Weak to moderate complete membrane staining is observed in more than 10 % of the tumor cells.";s:13:"her_two_score";s:2:"2+";s:9:"er_result";s:8:"Positive";s:9:"pr_result";s:8:"Positive";s:14:"her_two_result";s:10:"Borderline";s:8:"rpt_noet";s:0:"";}i:30;a:23:{s:10:"her_two_id";s:3:"984";s:5:"sl_no";s:3:"257";s:7:"test_id";s:16:"MIHC14:09636-638";s:10:"reciv_date";s:10:"17/05/2014";s:9:"deli_date";s:10:"25/05/2014";s:12:"current_date";s:10:"2014-05-17";s:12:"patient_name";s:18:"Mrs. Latifa Khanom";s:3:"age";s:6:"52 Yrs";s:6:"ref_by";s:0:"";s:3:"sex";s:6:"Female";s:13:"hospital_name";s:27:"Sigma Lab Ltd. , Chittagong";s:13:"specimen_name";s:34:"Breast tissue. Case No: MH13-17090";s:4:"note";s:126:"Result of Immunostaining  for ER, PR &amp; HER-2 of Case No:      MH13-17090, Block No: (02) from DHL , Path. Lab. Dhaka. <br>";s:6:"er_rpt";s:55:"About 05 % of the tumor cell nuclei show weak staining.";s:8:"er_score";s:7:"2+1=3/8";s:6:"pr_rpt";s:55:"About 20 % of the tumor cell nuclei show weak staining.";s:8:"pr_score";s:7:"3+1=4/8";s:11:"her_two_rpt";s:93:"Weak to moderate complete membrane staining is observed in more than 10 % of the tumor cells.";s:13:"her_two_score";s:2:"2+";s:9:"er_result";s:15:"Positive (Weak)";s:9:"pr_result";s:8:"Positive";s:14:"her_two_result";s:10:"Borderline";s:8:"rpt_noet";s:0:"";}i:31;a:23:{s:10:"her_two_id";s:3:"985";s:5:"sl_no";s:3:"258";s:7:"test_id";s:16:"MIHC14:09664-666";s:10:"reciv_date";s:10:"18/05/2014";s:9:"deli_date";s:10:"25/05/2014";s:12:"current_date";s:10:"2014-05-18";s:12:"patient_name";s:12:"Mrs. Shafia.";s:3:"age";s:6:"50 Yrs";s:6:"ref_by";s:59:"Tapesh Kumar Paul, FCPS, (Surgery), MS (Surgical Oncology).";s:3:"sex";s:6:"Female";s:13:"hospital_name";s:49:"Delta Medical College  & Hospital, Dhaka.W-535/1.";s:13:"specimen_name";s:42:"Tissue from Rt. Breast. Case No: MH14-9407";s:4:"note";s:124:"Result of Immunostaining  for ER, PR &amp; HER-2 of Case No:      MH14-9407, Block No: (02) from DHL, Path. Lab. Dhaka. <br>";s:6:"er_rpt";s:59:"About 60 % of the tumor cell nuclei show moderate staining.";s:8:"er_score";s:7:"4+2=6/8";s:6:"pr_rpt";s:35:"Tumor cell nuclei show no staining.";s:8:"pr_score";s:3:""O"";s:11:"her_two_rpt";s:93:"Weak to moderate complete membrane staining is observed in more than 10 % of the tumor cells.";s:13:"her_two_score";s:2:"2+";s:9:"er_result";s:8:"Positive";s:9:"pr_result";s:8:"Negative";s:14:"her_two_result";s:10:"Borderline";s:8:"rpt_noet";s:0:"";}i:32;a:23:{s:10:"her_two_id";s:3:"986";s:5:"sl_no";s:3:"259";s:7:"test_id";s:12:"MIHC14:09731";s:10:"reciv_date";s:10:"18/05/2014";s:9:"deli_date";s:10:"25/05/2014";s:12:"current_date";s:10:"2014-05-18";s:12:"patient_name";s:17:"Mr. Nisar Hasnat ";s:3:"age";s:6:"65 Yrs";s:6:"ref_by";s:47:"Parvin Akhter Banu, Chief Consultant (Oncology)";s:3:"sex";s:4:"Male";s:13:"hospital_name";s:3:"DHL";s:13:"specimen_name";s:40:"One paraffin block case no: V14050056829";s:4:"note";s:128:"Result of Immunostaining  for ER, PR &amp; HER-2 of Case No:      V14050056829, from Square Hospital Ltd, Path. Lab. Dhaka. <br>";s:6:"er_rpt";s:117:"About _______ %/ <1 % of the tumor cell nuclei show weak/moderate/strong staining/Tumor cell nuclei show no staining.";s:8:"er_score";s:6:"   / 8";s:6:"pr_rpt";s:118:"About _______%/ <1  %  of the tumor cell nuclei show weak/moderate/strong staining/Tumor cell nuclei show no staining.";s:8:"pr_score";s:9:"      / 8";s:11:"her_two_rpt";s:0:"";s:13:"her_two_score";s:12:"Select Score";s:9:"er_result";s:17:"Negative/Positive";s:9:"pr_result";s:17:"Negative/Positive";s:14:"her_two_result";s:28:"Negative/Positive/Borderline";s:8:"rpt_noet";s:0:"";}i:33;a:23:{s:10:"her_two_id";s:3:"987";s:5:"sl_no";s:3:"260";s:7:"test_id";s:16:"DIHC14:01055-057";s:10:"reciv_date";s:10:"16/05/2014";s:9:"deli_date";s:10:"25/05/2014";s:12:"current_date";s:10:"2014-05-16";s:12:"patient_name";s:15:"Suraiya Khanum ";s:3:"age";s:6:"57 Yrs";s:6:"ref_by";s:39:"Syed Mozammel Hossain , FCPS (Surgery).";s:3:"sex";s:6:"Female";s:13:"hospital_name";s:29:"Islami Bank Hospital, Khulna ";s:13:"specimen_name";s:32:"Right breast. Case No: DH14-1054";s:4:"note";s:124:"Result of Immunostaining  for ER, PR &amp; HER-2 of Case No:      DH14-1054, Block No: (02) from DHL, Path. Lab. Dhaka. <br>";s:6:"er_rpt";s:60:"About 30 % of the tumor cell nuclei show moderate  staining.";s:8:"er_score";s:7:"3+2=5/8";s:6:"pr_rpt";s:60:"About 60 %  of the tumor cell nuclei show moderate staining.";s:8:"pr_score";s:7:"4+2=6/8";s:11:"her_two_rpt";s:83:"Weak incomplete membrane staining is observed in more than 10 % of the tumor cells.";s:13:"her_two_score";s:2:"1+";s:9:"er_result";s:8:"Positive";s:9:"pr_result";s:8:"Positive";s:14:"her_two_result";s:8:"Negative";s:8:"rpt_noet";s:0:"";}i:34;a:23:{s:10:"her_two_id";s:3:"988";s:5:"sl_no";s:3:"261";s:7:"test_id";s:16:"MIHC14:09741-743";s:10:"reciv_date";s:10:"19/05/2014";s:9:"deli_date";s:10:"25/05/2014";s:12:"current_date";s:10:"2014-05-19";s:12:"patient_name";s:21:"Mosammat Hafsa Begum.";s:3:"age";s:6:"55 Yrs";s:6:"ref_by";s:77:"Sajjad Mohammad Yusuff , Oncologist, MCPS (Radiotherapy), FCPS (Radiotherapy)";s:3:"sex";s:6:"Female";s:13:"hospital_name";s:28:"CSCR Hospital , Chittagong. ";s:13:"specimen_name";s:43:"Tissue from Rt. breast. Case No: MH14-07296";s:4:"note";s:126:"Result of Immunostaining  for ER, PR &amp; HER-2 of Case No:      MH14-07296 , Block No: (02) from DHL, Path. Lab. Dhaka. <br>";s:6:"er_rpt";s:59:"About 20 % of the tumor cell nuclei show moderate staining.";s:8:"er_score";s:7:"3+2=5/8";s:6:"pr_rpt";s:55:"About 03 % of the tumor cell nuclei show weak staining.";s:8:"pr_score";s:7:"2+1=3/8";s:11:"her_two_rpt";s:93:"Weak to moderate complete membrane staining is observed in more than 10 % of the tumor cells.";s:13:"her_two_score";s:2:"2+";s:9:"er_result";s:8:"Positive";s:9:"pr_result";s:15:"Positive (Weak)";s:14:"her_two_result";s:10:"Borderline";s:8:"rpt_noet";s:0:"";}i:35;a:23:{s:10:"her_two_id";s:3:"989";s:5:"sl_no";s:3:"263";s:7:"test_id";s:16:"MIHC14:09861-863";s:10:"reciv_date";s:10:"20/05/2014";s:9:"deli_date";s:10:"25/05/2014";s:12:"current_date";s:10:"2014-05-20";s:12:"patient_name";s:17:"Mrs. Mabia Begum.";s:3:"age";s:6:"65 Yrs";s:6:"ref_by";s:59:"Tapesh Kumar Paul, FCPS, (Surgery), MS (Surgical Oncology).";s:3:"sex";s:6:"Female";s:13:"hospital_name";s:48:"Delta Medical College & Hospital , Dhaka , C-612";s:13:"specimen_name";s:32:"Right breast. Case No: MH14-9509";s:4:"note";s:124:"Result of Immunostaining  for ER, PR &amp; HER-2 of Case No:      MH14-9509, Block No: (02) from DHL, Path. Lab. Dhaka. <br>";s:6:"er_rpt";s:35:"Tumor cell nuclei show no staining.";s:8:"er_score";s:3:""O"";s:6:"pr_rpt";s:35:"Tumor cell nuclei show no staining.";s:8:"pr_score";s:3:""O"";s:11:"her_two_rpt";s:84:" Weak incomplete membrane staining is observed in more than 10 % of the tumor cells.";s:13:"her_two_score";s:2:"1+";s:9:"er_result";s:8:"Negative";s:9:"pr_result";s:8:"Negative";s:14:"her_two_result";s:8:"Negative";s:8:"rpt_noet";s:0:"";}i:36;a:23:{s:10:"her_two_id";s:3:"990";s:5:"sl_no";s:3:"264";s:7:"test_id";s:16:"MIHC14:09906-908";s:10:"reciv_date";s:10:"20/05/2014";s:9:"deli_date";s:10:"25/05/2014";s:12:"current_date";s:10:"2014-05-20";s:12:"patient_name";s:18:"Mrs. Merry Sikder.";s:3:"age";s:6:"65 Yrs";s:6:"ref_by";s:59:"Tapesh Kumar Paul, FCPS, (Surgery), MS (Surgical Oncology).";s:3:"sex";s:6:"Female";s:13:"hospital_name";s:49:"Delta Medical College & Hospital , Dhaka , W-611.";s:13:"specimen_name";s:30:"Lt. breast. Case No: MH14-9313";s:4:"note";s:129:"Result of Immunostaining  for ER, PR &amp; HER-2 of Case No:MH14-9313,&nbsp;      Block No: (02) from DHL, Path. Lab. Dhaka. <br>";s:6:"er_rpt";s:35:"Tumor cell nuclei show no staining.";s:8:"er_score";s:3:""O"";s:6:"pr_rpt";s:35:"Tumor cell nuclei show no staining.";s:8:"pr_score";s:3:""O"";s:11:"her_two_rpt";s:93:"Weak to moderate complete membrane staining is observed in more than 10 % of the tumor cells.";s:13:"her_two_score";s:2:"2+";s:9:"er_result";s:8:"Negative";s:9:"pr_result";s:8:"Negative";s:14:"her_two_result";s:10:"Borderline";s:8:"rpt_noet";s:0:"";}i:37;a:23:{s:10:"her_two_id";s:3:"991";s:5:"sl_no";s:3:"265";s:7:"test_id";s:16:"MIHC14:09925-927";s:10:"reciv_date";s:10:"20/05/2014";s:9:"deli_date";s:10:"25/05/2014";s:12:"current_date";s:10:"2014-05-20";s:12:"patient_name";s:12:"Mrs. Majeda ";s:3:"age";s:6:"35 Yrs";s:6:"ref_by";s:60:"Lt. Col. M.S. Sarwar Alam (Rtd.), FCPS, Clinical Oncologist.";s:3:"sex";s:6:"Female";s:13:"hospital_name";s:40:"Delta Medical College & Hospital , Dhaka";s:13:"specimen_name";s:52:"Tissue from axillary lymph node. Case No: MH13-20393";s:4:"note";s:123:"Result of Immunostaining  for ER, PR &amp; HER-2 of Case No:      MH13-20393, Block No (02) from DHL Path. Lab. Dhaka. <br>";s:6:"er_rpt";s:35:"Tumor cell nuclei show no staining.";s:8:"er_score";s:3:""O"";s:6:"pr_rpt";s:35:"Tumor cell nuclei show no staining.";s:8:"pr_score";s:3:""O"";s:11:"her_two_rpt";s:29:"Tumor cells show no staining.";s:13:"her_two_score";s:3:""O"";s:9:"er_result";s:8:"Negative";s:9:"pr_result";s:8:"Negative";s:14:"her_two_result";s:8:"Negative";s:8:"rpt_noet";s:0:"";}i:38;a:23:{s:10:"her_two_id";s:3:"992";s:5:"sl_no";s:3:"266";s:7:"test_id";s:16:"MIHC14:09961-963";s:10:"reciv_date";s:10:"21/05/2014";s:9:"deli_date";s:10:"25/05/2014";s:12:"current_date";s:10:"2014-05-21";s:12:"patient_name";s:19:"Mrs. Rashida Akhter";s:3:"age";s:6:"32 Yrs";s:6:"ref_by";s:59:"Tapesh Kumar Paul, FCPS, (Surgery), MS (Surgical Oncology).";s:3:"sex";s:6:"Female";s:13:"hospital_name";s:48:"Delta Medical College & Hospital , Dhaka , C-531";s:13:"specimen_name";s:58:"Tissue from Lt. breast with Lymph node. Case No: MH14-9634";s:4:"note";s:139:"Result of Immunostaining  for ER, PR &amp; HER-2 of Case No: MH14-9634,     Block No: Lymph node (03)&nbsp; from DHL, Path. Lab. Dhaka.<br>";s:6:"er_rpt";s:55:"About 15 % of the tumor cell nuclei show weak staining.";s:8:"er_score";s:7:"3+1=4/8";s:6:"pr_rpt";s:35:"Tumor cell nuclei show no staining.";s:8:"pr_score";s:3:""O"";s:11:"her_two_rpt";s:93:"Weak to moderate complete membrane staining is observed in more than 10 % of the tumor cells.";s:13:"her_two_score";s:2:"2+";s:9:"er_result";s:8:"Positive";s:9:"pr_result";s:8:"Negative";s:14:"her_two_result";s:10:"Borderline";s:8:"rpt_noet";s:0:"";}i:39;a:23:{s:10:"her_two_id";s:3:"993";s:5:"sl_no";s:3:"267";s:7:"test_id";s:16:"MIHC14:10022-024";s:10:"reciv_date";s:10:"21/05/2014";s:9:"deli_date";s:10:"25/05/2014";s:12:"current_date";s:10:"2014-05-21";s:12:"patient_name";s:18:"Mrs. Moklesa Begum";s:3:"age";s:6:"60 Yrs";s:6:"ref_by";s:62:"Jahan Afroza Lucky, MBBS, M.Phil ( Radio Therapy ), Oncologist";s:3:"sex";s:6:"Female";s:13:"hospital_name";s:15:"RMCH, Rangpur. ";s:13:"specimen_name";s:44:"Tissue from Breast lump. Case no: MH14-09171";s:4:"note";s:122:"Result of Immunostaining  for ER, PR &amp; HER-2 of Case No:      MH14-09171 Block No (02) from DHL, Path. Lab. Dhaka <br>";s:6:"er_rpt";s:59:"About 60 % of the tumor cell nuclei show moderate staining.";s:8:"er_score";s:7:"4+2=6/8";s:6:"pr_rpt";s:59:"About 60 % of the tumor cell nuclei show moderate staining.";s:8:"pr_score";s:7:"4+2=6/8";s:11:"her_two_rpt";s:83:"Weak incomplete membrane staining is observed in more than 10 % of the tumor cells.";s:13:"her_two_score";s:2:"1+";s:9:"er_result";s:8:"Positive";s:9:"pr_result";s:8:"Positive";s:14:"her_two_result";s:8:"Negative";s:8:"rpt_noet";s:0:"";}i:40;a:23:{s:10:"her_two_id";s:3:"994";s:5:"sl_no";s:3:"255";s:7:"test_id";s:16:"MIHC14:09567-569";s:10:"reciv_date";s:10:"16/05/2014";s:9:"deli_date";s:10:"25/05/2014";s:12:"current_date";s:10:"2014-05-16";s:12:"patient_name";s:18:"Mrs. Sakhina Begum";s:3:"age";s:6:"55 Yrs";s:6:"ref_by";s:68:"Brig. Gen. Md. Azizul Islam , FCPS (Medicine) OJT (Medical oncology)";s:3:"sex";s:6:"Female";s:13:"hospital_name";s:50:"Hitech Multicare Hospital Ltd, Dhaka, Cantonment. ";s:13:"specimen_name";s:46:"Core biopsy (Lt. breast). Case no: MH14-09262.";s:4:"note";s:104:"Result of Immunostaining  for ER, PR &amp; HER-2 of Case No: MH14-09262 from DHL, Path. Lab. Dhaka. <br>";s:6:"er_rpt";s:59:"About 60 % of the tumor cell nuclei show moderate staining.";s:8:"er_score";s:7:"4+2=6/8";s:6:"pr_rpt";s:60:"About 30 %  of the tumor cell nuclei show moderate staining.";s:8:"pr_score";s:7:"3+2=5/8";s:11:"her_two_rpt";s:83:"Strong complete membrane staining is observed in more than 30 % of the tumor cells.";s:13:"her_two_score";s:2:"3+";s:9:"er_result";s:8:"Positive";s:9:"pr_result";s:8:"Positive";s:14:"her_two_result";s:8:"Positive";s:8:"rpt_noet";s:0:"";}i:41;a:23:{s:10:"her_two_id";s:3:"995";s:5:"sl_no";s:3:"269";s:7:"test_id";s:16:"MIHC14:10027-029";s:10:"reciv_date";s:10:"22-05-2014";s:9:"deli_date";s:10:"01-06-2014";s:12:"current_date";s:10:"2014-05-22";s:12:"patient_name";s:18:"Mrs. Nusrat Jahan.";s:3:"age";s:6:"38 Yrs";s:6:"ref_by";s:59:"Tapesh Kumar Paul, FCPS, (Surgery), MS (Surgical Oncology).";s:3:"sex";s:6:"Female";s:13:"hospital_name";s:40:"Delta Medical College & Hospital. Dhaka.";s:13:"specimen_name";s:43:"Tissue from Rt. breast. Case No: MH14-09627";s:4:"note";s:120:"Result of Immunostaining for ER, PR & HER-2 of Case No: MH14-09627, Block No: (F.G. 01) from DHL, Path. Lab. Dhaka. <br>";s:6:"er_rpt";s:35:"Tumor cell nuclei show no staining.";s:8:"er_score";s:3:""O"";s:6:"pr_rpt";s:56:"About 03 %  of the tumor cell nuclei show weak staining.";s:8:"pr_score";s:7:"2+1=3/8";s:11:"her_two_rpt";s:83:"Strong complete membrane staining is observed in more than 30 % of the tumor cells.";s:13:"her_two_score";s:2:"3+";s:9:"er_result";s:8:"Negative";s:9:"pr_result";s:15:"Positive (Weak)";s:14:"her_two_result";s:8:"Positive";s:8:"rpt_noet";s:0:"";}i:42;a:23:{s:10:"her_two_id";s:3:"996";s:5:"sl_no";s:3:"271";s:7:"test_id";s:16:"MIHC14:10128-130";s:10:"reciv_date";s:10:"23-05-2014";s:9:"deli_date";s:10:"01-06-2014";s:12:"current_date";s:10:"2014-05-23";s:12:"patient_name";s:18:"Mrs. Sajeda Begum.";s:3:"age";s:6:"32 Yrs";s:6:"ref_by";s:42:"Md. Rashid Un Nabi. M.Phil (Radiotherapy).";s:3:"sex";s:6:"Female";s:13:"hospital_name";s:20:"United Hospial Ltd. ";s:13:"specimen_name";s:33:"Breast tissue. Case No: MH14-2002";s:4:"note";s:118:"Result of Immunostaining for ER, PR & HER-2 of Case No: MH14-2002, Block No: R/G (05) from DHL, Path. Lab. Dhaka. <br>";s:6:"er_rpt";s:35:"Tumor cell nuclei show no staining.";s:8:"er_score";s:3:""O"";s:6:"pr_rpt";s:35:"Tumor cell nuclei show no staining.";s:8:"pr_score";s:3:""O"";s:11:"her_two_rpt";s:83:"Weak incomplete membrane staining is observed in more than 10 % of the tumor cells.";s:13:"her_two_score";s:2:"1+";s:9:"er_result";s:8:"Negative";s:9:"pr_result";s:8:"Negative";s:14:"her_two_result";s:8:"Negative";s:8:"rpt_noet";s:126:"Note: Sections reveal small nests of neoplastic cells. Repeat immunostaining from the original lumpectomy block is suggested. ";}i:43;a:23:{s:10:"her_two_id";s:3:"997";s:5:"sl_no";s:3:"272";s:7:"test_id";s:16:"MIHC14:10140-142";s:10:"reciv_date";s:10:"24-05-2014";s:9:"deli_date";s:10:"01-06-2014";s:12:"current_date";s:10:"2014-05-24";s:12:"patient_name";s:16:"Mrs. Razia Begum";s:3:"age";s:6:"43 Yrs";s:6:"ref_by";s:59:"Tapesh Kumar Paul, FCPS, (Surgery), MS (Surgical Oncology).";s:3:"sex";s:6:"Female";s:13:"hospital_name";s:50:"C - 608, Delta Medical College & Hospital, Dhaka. ";s:13:"specimen_name";s:44:"Mastectomy specimen (Rt.) Case No: MH14-9814";s:4:"note";s:114:"Result of Immunostaining for ER, PR & HER-2 of Case No: MH14-9814, Block No: (03) from DHL, Path. Lab. Dhaka. <br>";s:6:"er_rpt";s:59:"About 30 % of the tumor cell nuclei show moderate staining.";s:8:"er_score";s:7:"3+2=5/8";s:6:"pr_rpt";s:59:"About 50 % of the tumor cell nuclei show moderate staining.";s:8:"pr_score";s:7:"4+2=6/8";s:11:"her_two_rpt";s:83:"Strong complete membrane staining is observed in more than 30 % of the tumor cells.";s:13:"her_two_score";s:2:"3+";s:9:"er_result";s:8:"Positive";s:9:"pr_result";s:8:"Positive";s:14:"her_two_result";s:8:"Positive";s:8:"rpt_noet";s:0:"";}i:44;a:23:{s:10:"her_two_id";s:3:"998";s:5:"sl_no";s:3:"273";s:7:"test_id";s:16:"MIHC14:10206-208";s:10:"reciv_date";s:10:"24-05-2014";s:9:"deli_date";s:10:"01-06-2014";s:12:"current_date";s:10:"2014-05-24";s:12:"patient_name";s:18:"Mrs. Momtaz Begum.";s:3:"age";s:6:"52 Yrs";s:6:"ref_by";s:46:"Md. Zillur Rahman , MBBS, M.Phil (Path.). PhD.";s:3:"sex";s:6:"Female";s:13:"hospital_name";s:29:"Care Investigtion.Chittagong.";s:13:"specimen_name";s:58:"One paraffin block (Breast tissue). Case No: H-05-1129A/14";s:4:"note";s:127:"Result of Immunostaining for ER, PR & HER-2 of Case No: H-05-1129A/14, Block No: (02) from Care Investigation , Chittagong.<br>";s:6:"er_rpt";s:55:"About 03 % of the tumor cell nuclei show weak staining.";s:8:"er_score";s:7:"2+1=3/8";s:6:"pr_rpt";s:50:"<1 %  of the tumor cell nuclei show weak staining.";s:8:"pr_score";s:7:"1+1=2/8";s:11:"her_two_rpt";s:83:"Strong complete membrane staining is observed in more than 30 % of the tumor cells.";s:13:"her_two_score";s:2:"3+";s:9:"er_result";s:15:"Positive (Weak)";s:9:"pr_result";s:8:"Negative";s:14:"her_two_result";s:8:"Positive";s:8:"rpt_noet";s:0:"";}i:45;a:23:{s:10:"her_two_id";s:3:"999";s:5:"sl_no";s:3:"276";s:7:"test_id";s:16:"MIHC14:10451-453";s:10:"reciv_date";s:10:"27-05-2014";s:9:"deli_date";s:10:"08/06/2014";s:12:"current_date";s:10:"2014-05-27";s:12:"patient_name";s:17:"Mrs. Akhter Begum";s:3:"age";s:6:"42 Yrs";s:6:"ref_by";s:46:"Md. Zillur Rahman , MBBS, M.Phil (Path.). PhD.";s:3:"sex";s:6:"Female";s:13:"hospital_name";s:31:"Care Investigation. Chittagong.";s:13:"specimen_name";s:49:"One paraffin block (L.N). Case No: H-05-1165B/14.";s:4:"note";s:132:"Result of Immunostaining for ER, PR &amp; HER-2 of Case No: H-05-1165B/14, Block No: (01) from Care Investigation , Chittagong. <br>";s:6:"er_rpt";s:59:"About 30 % of the tumor cell nuclei show moderate staining.";s:8:"er_score";s:7:"3+2=5/8";s:6:"pr_rpt";s:60:"About 60 %  of the tumor cell nuclei show moderate staining.";s:8:"pr_score";s:7:"4+2=6/8";s:11:"her_two_rpt";s:83:"Weak incomplete membrane staining is observed in more than 10 % of the tumor cells.";s:13:"her_two_score";s:2:"1+";s:9:"er_result";s:8:"Positive";s:9:"pr_result";s:8:"Positive";s:14:"her_two_result";s:8:"Negative";s:8:"rpt_noet";s:0:"";}i:46;a:23:{s:10:"her_two_id";s:4:"1000";s:5:"sl_no";s:3:"277";s:7:"test_id";s:16:"DIHC14:01133-135";s:10:"reciv_date";s:10:"27-05-2014";s:9:"deli_date";s:10:"01-06-2014";s:12:"current_date";s:10:"2014-05-27";s:12:"patient_name";s:13:"Parvin Akhter";s:3:"age";s:6:"35 Yrs";s:6:"ref_by";s:14:"Mohiuddin, MS.";s:3:"sex";s:6:"Female";s:13:"hospital_name";s:39:"Central General Hospital , Narayangonj.";s:13:"specimen_name";s:31:"Rt. breast. Case No: DH14-01035";s:4:"note";s:115:"Result of Immunostaining for ER, PR & HER-2 of Case No: DH14-01035, Block No: (01) from DHL, Path. Lab. Dhaka. <br>";s:6:"er_rpt";s:35:"Tumor cell nuclei show no staining.";s:8:"er_score";s:3:""O"";s:6:"pr_rpt";s:52:"<1  %  of the tumor cell nuclei show weak staining. ";s:8:"pr_score";s:7:"1+1=2/8";s:11:"her_two_rpt";s:93:"Weak to moderate complete membrane staining is observed in more than 10 % of the tumor cells.";s:13:"her_two_score";s:2:"2+";s:9:"er_result";s:8:"Negative";s:9:"pr_result";s:8:"Negative";s:14:"her_two_result";s:10:"Borderline";s:8:"rpt_noet";s:0:"";}i:47;a:23:{s:10:"her_two_id";s:4:"1001";s:5:"sl_no";s:3:"278";s:7:"test_id";s:16:"MIHC14:10571-573";s:10:"reciv_date";s:10:"28-05-2014";s:9:"deli_date";s:10:"01-06-2014";s:12:"current_date";s:10:"2014-05-28";s:12:"patient_name";s:12:"Mrs. Ayesha ";s:3:"age";s:6:"43 Yrs";s:6:"ref_by";s:0:"";s:3:"sex";s:6:"Female";s:13:"hospital_name";s:28:"Chittagong Lab, Chittagong. ";s:13:"specimen_name";s:43:"Tissue from breast lump. Case No: MH14-9006";s:4:"note";s:118:"Result of Immunostaining for ER, PR &amp; HER-2 of Case No: MH14-9006, Block No: (01) from DHL, Path. Lab. Dhaka. <br>";s:6:"er_rpt";s:59:"About 50 % of the tumor cell nuclei show moderate staining.";s:8:"er_score";s:7:"4+2=6/8";s:6:"pr_rpt";s:60:"About 50 %  of the tumor cell nuclei show moderate staining.";s:8:"pr_score";s:7:"4+2=6/8";s:11:"her_two_rpt";s:93:"Weak to moderate complete membrane staining is observed in more than 10 % of the tumor cells.";s:13:"her_two_score";s:2:"2+";s:9:"er_result";s:8:"Positive";s:9:"pr_result";s:8:"Positive";s:14:"her_two_result";s:10:"Borderline";s:8:"rpt_noet";s:0:"";}i:48;a:23:{s:10:"her_two_id";s:4:"1002";s:5:"sl_no";s:3:"279";s:7:"test_id";s:16:"MIHC14:10591-593";s:10:"reciv_date";s:10:"29-05-2014";s:9:"deli_date";s:10:"01-06-2014";s:12:"current_date";s:10:"2014-05-29";s:12:"patient_name";s:15:"Archana Baidya.";s:3:"age";s:6:"37 Yrs";s:6:"ref_by";s:77:"Sajjad Mohammad Yusuff (Oncologist), MCPS (Radiotherapy), FCPS (Radiotherapy)";s:3:"sex";s:6:"Female";s:13:"hospital_name";s:16:"CSCR, Chittagong";s:13:"specimen_name";s:34:"Breast tissue. Case No: MH14-09775";s:4:"note";s:118:"Result of Immunostaining for ER, PR &amp; HER-2 of Case No: MH14-09775, Block No: (02) from DHL, Path. Lab Dhaka. <br>";s:6:"er_rpt";s:35:"Tumor cell nuclei show no staining.";s:8:"er_score";s:3:""O"";s:6:"pr_rpt";s:55:"About 05 % of the tumor cell nuclei show weak staining.";s:8:"pr_score";s:7:"2+1=3/8";s:11:"her_two_rpt";s:93:"Weak to moderate complete membrane staining is observed in more than 10 % of the tumor cells.";s:13:"her_two_score";s:2:"2+";s:9:"er_result";s:8:"Negative";s:9:"pr_result";s:8:"Positive";s:14:"her_two_result";s:10:"Borderline";s:8:"rpt_noet";s:0:"";}i:49;a:23:{s:10:"her_two_id";s:4:"1003";s:5:"sl_no";s:3:"283";s:7:"test_id";s:16:"MIHC14:10773-775";s:10:"reciv_date";s:10:"01/06/2014";s:9:"deli_date";s:10:"08/06/2014";s:12:"current_date";s:10:"2014-05-01";s:12:"patient_name";s:13:"Mrs. Fahmida.";s:3:"age";s:6:"33 Yrs";s:6:"ref_by";s:15:"Khalilur Rahman";s:3:"sex";s:6:"Female";s:13:"hospital_name";s:33:"Mukti Clinic (Pvt.) Ltd. Rajshahi";s:13:"specimen_name";s:52:"Tissue from axillary lymph Node. Case no: MH14-10772";s:4:"note";s:122:"Result of Immunostaining  for ER, PR & HER-2 of Case No: MH14-10772,     Block No: (03) from DHL, Path. Lab. Dhaka. <br>";s:6:"er_rpt";s:59:"About 25 % of the tumor cell nuclei show moderate staining.";s:8:"er_score";s:7:"3+2=5/8";s:6:"pr_rpt";s:55:"About 05 % of the tumor cell nuclei show weak staining.";s:8:"pr_score";s:7:"2+1=3/8";s:11:"her_two_rpt";s:92:"Weak to moderate complete membrane staining is observed in more than 10 % of the tumor cells";s:13:"her_two_score";s:2:"2+";s:9:"er_result";s:8:"Positive";s:9:"pr_result";s:8:"Positive";s:14:"her_two_result";s:10:"Borderline";s:8:"rpt_noet";s:0:"";}}s:13:"result_object";a:50:{i:0;O:8:"stdClass":23:{s:10:"her_two_id";s:3:"954";s:5:"sl_no";s:3:"219";s:7:"test_id";s:16:"MIHC14:08381-383";s:10:"reciv_date";s:10:"03/05/2014";s:9:"deli_date";s:10:"04/05/2014";s:12:"current_date";s:10:"2014-05-03";s:12:"patient_name";s:11:"Ms. Shimul.";s:3:"age";s:6:"27 Yrs";s:6:"ref_by";s:0:"";s:3:"sex";s:6:"Female";s:13:"hospital_name";s:33:"Chevron Clinical Lab , Chittagong";s:13:"specimen_name";s:43:"Tissue from Lt. breast. Case No: MH14-07151";s:4:"note";s:125:"Result of Immunostaining  for ER, PR &amp; HER-2 of Case No:      MH14-07151, Block No: (01) from DHL, Path. Lab. Dhaka. <br>";s:6:"er_rpt";s:35:"Tumor cell nuclei show no staining.";s:8:"er_score";s:3:""O"";s:6:"pr_rpt";s:35:"Tumor cell nuclei show no staining.";s:8:"pr_score";s:3:""O"";s:11:"her_two_rpt";s:83:"Strong complete membrane staining is observed in more than 30 % of the tumor cells.";s:13:"her_two_score";s:2:"3+";s:9:"er_result";s:8:"Negative";s:9:"pr_result";s:8:"Negative";s:14:"her_two_result";s:8:"Positive";s:8:"rpt_noet";s:0:"";}i:1;O:8:"stdClass":23:{s:10:"her_two_id";s:3:"955";s:5:"sl_no";s:3:"220";s:7:"test_id";s:16:"MIHC14:08426-428";s:10:"reciv_date";s:10:"03/05/2014";s:9:"deli_date";s:10:"11/05/2014";s:12:"current_date";s:10:"2014-05-03";s:12:"patient_name";s:13:"Anowara Kujat";s:3:"age";s:6:"70 Yrs";s:6:"ref_by";s:7:"Imtiaz.";s:3:"sex";s:6:"Female";s:13:"hospital_name";s:49:"Holy Family Red Crescent Medical College Hospital";s:13:"specimen_name";s:43:"Tissue from left breast. Case No: MH14-8822";s:4:"note";s:124:"Result of Immunostaining  for ER, PR &amp; HER-2 of Case No:      MH14-8822, Block No: (03) from DHL, Path. Lab. Dhaka. <br>";s:6:"er_rpt";s:59:"About 65 % of the tumor cell nuclei show moderate staining.";s:8:"er_score";s:9:"4+2=6 / 8";s:6:"pr_rpt";s:59:"About 60 % of the tumor cell nuclei show moderate staining.";s:8:"pr_score";s:9:"4+2=6 / 8";s:11:"her_two_rpt";s:83:"Strong complete membrane staining is observed in more than 30 % of the tumor cells.";s:13:"her_two_score";s:2:"3+";s:9:"er_result";s:8:"Positive";s:9:"pr_result";s:8:"Positive";s:14:"her_two_result";s:8:"Positive";s:8:"rpt_noet";s:0:"";}i:2;O:8:"stdClass":23:{s:10:"her_two_id";s:3:"956";s:5:"sl_no";s:3:"221";s:7:"test_id";s:16:"MIHC14:08485-487";s:10:"reciv_date";s:10:"04/05/2014";s:9:"deli_date";s:10:"11/05/2014";s:12:"current_date";s:10:"2014-05-04";s:12:"patient_name";s:12:"Feroza Begum";s:3:"age";s:6:"38 Yrs";s:6:"ref_by";s:43:"Md. Zillur Rahman. Cyto & Histopathologist.";s:3:"sex";s:6:"Female";s:13:"hospital_name";s:31:"Care Investigation. Chittagong.";s:13:"specimen_name";s:47:"One paraffin block (Breast). Case No: H-983A/14";s:4:"note";s:152:"Result of Immunostaining  for ER, PR &amp; HER-2 of Case No:      H-983A/14, Block No: (01) from Dr. Zillur Rahman. Care Investigation. Chittagong. <br>";s:6:"er_rpt";s:59:"About 40 % of the tumor cell nuclei show moderate staining.";s:8:"er_score";s:9:"4+2=6 / 8";s:6:"pr_rpt";s:59:"About 55 % of the tumor cell nuclei show moderate staining.";s:8:"pr_score";s:9:"4+2=6 / 8";s:11:"her_two_rpt";s:94:" Weak to moderate complete membrane staining is observed in more than 10 % of the tumor cells.";s:13:"her_two_score";s:2:"2+";s:9:"er_result";s:8:"Positive";s:9:"pr_result";s:8:"Positive";s:14:"her_two_result";s:10:"Borderline";s:8:"rpt_noet";s:0:"";}i:3;O:8:"stdClass":23:{s:10:"her_two_id";s:3:"957";s:5:"sl_no";s:3:"222";s:7:"test_id";s:16:"MIHC14:08578-580";s:10:"reciv_date";s:10:"04/05/2014";s:9:"deli_date";s:10:"18/05/2014";s:12:"current_date";s:10:"2014-05-04";s:12:"patient_name";s:13:"Mrs. Mohsena.";s:3:"age";s:6:"35 Yrs";s:6:"ref_by";s:38:"M.A. Awal. MBBS, M.Phil (Radiotherapy)";s:3:"sex";s:6:"Female";s:13:"hospital_name";s:41:"Popular Diagnostic Centre Ltd,Chittagong.";s:13:"specimen_name";s:43:"One paraffin block (L.N). Case No: 1784D/14";s:4:"note";s:116:"Result of Immunostaining  for ER, PR &amp; HER-2 of Case No: 1784/14, Block No: (D) from Cyto-site. Chittagong. <br>";s:6:"er_rpt";s:35:"Tumor cell nuclei show no staining.";s:8:"er_score";s:3:""O"";s:6:"pr_rpt";s:35:"Tumor cell nuclei show no staining.";s:8:"pr_score";s:3:""O"";s:11:"her_two_rpt";s:93:"Weak to moderate complete membrane staining is observed in more than 10 % of the tumor cells.";s:13:"her_two_score";s:2:"2+";s:9:"er_result";s:8:"Negative";s:9:"pr_result";s:8:"Negative";s:14:"her_two_result";s:10:"Borderline";s:8:"rpt_noet";s:0:"";}i:4;O:8:"stdClass":23:{s:10:"her_two_id";s:3:"958";s:5:"sl_no";s:3:"223";s:7:"test_id";s:16:"MIHC14:08649-651";s:10:"reciv_date";s:10:"05/05/2014";s:9:"deli_date";s:10:"11/05/2014";s:12:"current_date";s:10:"2014-05-05";s:12:"patient_name";s:11:"Mrs. Nazma.";s:3:"age";s:6:"30 Yrs";s:6:"ref_by";s:32:"A. R. M Rafiqul Islam. M/O. OPD.";s:3:"sex";s:6:"Female";s:13:"hospital_name";s:23:"NICRH, Mohakhali, Dhaka";s:13:"specimen_name";s:44:"Mastectomy specimen (Rt). Case No: MH14-5702";s:4:"note";s:124:"Result of Immunostaining  for ER, PR &amp; HER-2 of Case No:      MH14-5702, Block No: (03) from DHL, Path. Lab. Dhaka. <br>";s:6:"er_rpt";s:35:"Tumor cell nuclei show no staining.";s:8:"er_score";s:3:""O"";s:6:"pr_rpt";s:35:"Tumor cell nuclei show no staining.";s:8:"pr_score";s:3:""O"";s:11:"her_two_rpt";s:83:"Strong complete membrane staining is observed in more than 30 % of the tumor cells.";s:13:"her_two_score";s:2:"3+";s:9:"er_result";s:8:"Negative";s:9:"pr_result";s:8:"Negative";s:14:"her_two_result";s:8:"Positive";s:8:"rpt_noet";s:0:"";}i:5;O:8:"stdClass":23:{s:10:"her_two_id";s:3:"959";s:5:"sl_no";s:3:"225";s:7:"test_id";s:16:"MIHC14:08709-711";s:10:"reciv_date";s:10:"06/05/2014";s:9:"deli_date";s:10:"11/05/2014";s:12:"current_date";s:10:"2014-05-06";s:12:"patient_name";s:20:"Miss. Dilruba Khanom";s:3:"age";s:6:"54 Yrs";s:6:"ref_by";s:58:"Tapesh Kumar Paul, FCPS (Surgery), MS (Surgical Oncology).";s:3:"sex";s:6:"Female";s:13:"hospital_name";s:40:"Delta Medical College & Hospital. Dhaka.";s:13:"specimen_name";s:44:"Lt. breast tissue . Case No: MH14-8242 (Lt.)";s:4:"note";s:134:"Result of Immunostaining  for ER, PR &amp; HER-2 of Case No:      MH14-8242, (Lt.) Block No: (Addi 2) from DHL, Path. Lab. Dhaka. <br>";s:6:"er_rpt";s:60:"About 60  % of the tumor cell nuclei show moderate staining.";s:8:"er_score";s:9:"4+2=6 / 8";s:6:"pr_rpt";s:59:"About 45 % of the tumor cell nuclei show moderate staining.";s:8:"pr_score";s:9:"4+2=6 / 8";s:11:"her_two_rpt";s:83:"Strong complete membrane staining is observed in more than 30 % of the tumor cells.";s:13:"her_two_score";s:2:"3+";s:9:"er_result";s:8:"Positive";s:9:"pr_result";s:8:"Positive";s:14:"her_two_result";s:8:"Positive";s:8:"rpt_noet";s:0:"";}i:6;O:8:"stdClass":23:{s:10:"her_two_id";s:3:"960";s:5:"sl_no";s:3:"224";s:7:"test_id";s:12:"MIHC14:08702";s:10:"reciv_date";s:10:"05/05/2014";s:9:"deli_date";s:10:"11/05/2014";s:12:"current_date";s:10:"2014-05-05";s:12:"patient_name";s:15:"Mr. Jafar Ullah";s:3:"age";s:6:"57 Yrs";s:6:"ref_by";s:61:"Lt. Col. M.S. Sarwar Alam (Rtd). FCPS, (Clinical Oncologist).";s:3:"sex";s:4:"Male";s:13:"hospital_name";s:40:"Delta Medical College & Hospital. Dhaka.";s:13:"specimen_name";s:47:"One parafin block. (Stomach) Case No: H-376/14.";s:4:"note";s:113:"Result of Immunostaining  for HER-2 of Case No:      H-376/14, from UAMCH Dept. of Pathology. Uttara. Dhaka. <br>";s:6:"er_rpt";s:0:"";s:8:"er_score";s:0:"";s:6:"pr_rpt";s:0:"";s:8:"pr_score";s:0:"";s:11:"her_two_rpt";s:83:"Weak incomplete membrane staining is observed in more than 10 % of the tumor cells.";s:13:"her_two_score";s:2:"1+";s:9:"er_result";s:0:"";s:9:"pr_result";s:0:"";s:14:"her_two_result";s:8:"Negative";s:8:"rpt_noet";s:0:"";}i:7;O:8:"stdClass":23:{s:10:"her_two_id";s:3:"961";s:5:"sl_no";s:3:"226";s:7:"test_id";s:16:"MIHC14:08802-804";s:10:"reciv_date";s:10:"06/05/2014";s:9:"deli_date";s:10:"11/05/2014";s:12:"current_date";s:10:"2014-05-06";s:12:"patient_name";s:14:"Kohinur Begum.";s:3:"age";s:6:"40 Yrs";s:6:"ref_by";s:61:"Sajjad Mohammad Yusuff, Oncolgoist, MCPS, FCPS.(Radiotherapy)";s:3:"sex";s:6:"Female";s:13:"hospital_name";s:16:"CSCR, Chittagong";s:13:"specimen_name";s:44:"Lt. axillary lymph node. Case No: MH14-08585";s:4:"note";s:124:"Result of Immunostaining  for ER, PR &amp; HER-2 of Case No: MH14-08585, Block No: (01) from DHL, Path. Lab. Dhaka. <br><br>";s:6:"er_rpt";s:35:"Tumor cell nuclei show no staining.";s:8:"er_score";s:3:""O"";s:6:"pr_rpt";s:35:"Tumor cell nuclei show no staining.";s:8:"pr_score";s:3:""O"";s:11:"her_two_rpt";s:83:"Weak incomplete membrane staining is observed in more than 10 % of the tumor cells.";s:13:"her_two_score";s:2:"1+";s:9:"er_result";s:8:"Negative";s:9:"pr_result";s:8:"Negative";s:14:"her_two_result";s:8:"Negative";s:8:"rpt_noet";s:0:"";}i:8;O:8:"stdClass":23:{s:10:"her_two_id";s:3:"962";s:5:"sl_no";s:3:"228";s:7:"test_id";s:16:"MIHC14:08839-841";s:10:"reciv_date";s:10:"07/05/2014";s:9:"deli_date";s:10:"11/05/2014";s:12:"current_date";s:10:"2014-05-07";s:12:"patient_name";s:18:"Mrs. Ayesha Begum.";s:3:"age";s:6:"26 Yrs";s:6:"ref_by";s:50:"Parvin Akhter Banu, Chief Consultant (Oncologist).";s:3:"sex";s:6:"Female";s:13:"hospital_name";s:40:"Delta Medical College & Hospital.Dhaka. ";s:13:"specimen_name";s:48:"One paraffin block (Rt. breast.)Case No: D217536";s:4:"note";s:144:"Result of Immunostaining  for ER, PR &amp; HER-2 of Case No:      D217536, Block No: (02) from&nbsp; IBN SINA Diagnostic and Imaging Center.<br>";s:6:"er_rpt";s:59:"About 60 % of the tumor cell nuclei show moderate staining.";s:8:"er_score";s:9:"4+2=6 / 8";s:6:"pr_rpt";s:59:"About 60 % of the tumor cell nuclei show moderate staining.";s:8:"pr_score";s:9:"4+2=6 / 8";s:11:"her_two_rpt";s:93:"Weak to moderate complete membrane staining is observed in more than 10 % of the tumor cells.";s:13:"her_two_score";s:2:"2+";s:9:"er_result";s:8:"Positive";s:9:"pr_result";s:8:"Positive";s:14:"her_two_result";s:10:"Borderline";s:8:"rpt_noet";s:0:"";}i:9;O:8:"stdClass":23:{s:10:"her_two_id";s:3:"963";s:5:"sl_no";s:3:"227";s:7:"test_id";s:16:"MIHC14:08812-814";s:10:"reciv_date";s:10:"07/05/2014";s:9:"deli_date";s:10:"11/05/2014";s:12:"current_date";s:10:"2014-05-07";s:12:"patient_name";s:19:"Mrs. Shefali Begum.";s:3:"age";s:6:"40 Yrs";s:6:"ref_by";s:59:"Tapesh Kumar Paul, FCPS, (Surgery), MS (Surgical Oncology).";s:3:"sex";s:6:"Female";s:13:"hospital_name";s:56:"Delta Medical College & Hospital.Dhaka , C-535/6, Dhaka.";s:13:"specimen_name";s:38:"Breast tissue (Rt.) Case No: MH14-7409";s:4:"note";s:124:"Result of Immunostaining  for ER, PR &amp; HER-2 of Case No:      MH14-7409, Block No: (02) from DHL, Path. Lab. Dhaka. <br>";s:6:"er_rpt";s:35:"Tumor cell nuclei show no staining.";s:8:"er_score";s:3:""O"";s:6:"pr_rpt";s:55:"About 10 % of the tumor cell nuclei show weak staining.";s:8:"pr_score";s:7:"2+1=3/8";s:11:"her_two_rpt";s:93:"Weak to moderate complete membrane staining is observed in more than 10 % of the tumor cells.";s:13:"her_two_score";s:2:"2+";s:9:"er_result";s:8:"Negative";s:9:"pr_result";s:8:"Positive";s:14:"her_two_result";s:10:"Borderline";s:8:"rpt_noet";s:0:"";}i:10;O:8:"stdClass":23:{s:10:"her_two_id";s:3:"964";s:5:"sl_no";s:3:"229";s:7:"test_id";s:16:"MIHC14:08895-897";s:10:"reciv_date";s:10:"08/05/2014";s:9:"deli_date";s:10:"11/05/2014";s:12:"current_date";s:10:"2014-05-08";s:12:"patient_name";s:11:"Anima Barua";s:3:"age";s:6:"55 Yrs";s:6:"ref_by";s:0:"";s:3:"sex";s:6:"Female";s:13:"hospital_name";s:32:"Ctg. Metropoliton Hospital, Ctg.";s:13:"specimen_name";s:43:"Tissue from Rt. Breast. Case No: MH14-8463.";s:4:"note";s:124:"Result of Immunostaining  for ER, PR &amp; HER-2 of Case No:      MH14-8463, Block No: (01) from DHL, Path. Lab. Dhaka. <br>";s:6:"er_rpt";s:59:"About 50 % of the tumor cell nuclei show moderate staining.";s:8:"er_score";s:9:"4+2=6 / 8";s:6:"pr_rpt";s:35:"Tumor cell nuclei show no staining.";s:8:"pr_score";s:3:""O"";s:11:"her_two_rpt";s:93:"Weak to moderate complete membrane staining is observed in more than 10 % of the tumor cells.";s:13:"her_two_score";s:2:"2+";s:9:"er_result";s:8:"Positive";s:9:"pr_result";s:8:"Negative";s:14:"her_two_result";s:10:"Borderline";s:8:"rpt_noet";s:0:"";}i:11;O:8:"stdClass":23:{s:10:"her_two_id";s:3:"965";s:5:"sl_no";s:3:"230";s:7:"test_id";s:16:"MIHC14:08898-900";s:10:"reciv_date";s:10:"08/05/2014";s:9:"deli_date";s:10:"11/05/2014";s:12:"current_date";s:10:"2014-05-08";s:12:"patient_name";s:19:"Mrs. Renu Bala Dey.";s:3:"age";s:6:"40 Yrs";s:6:"ref_by";s:48:"Md. Zillur Rahman. Cyto & Histopathologist. Ctg.";s:3:"sex";s:6:"Female";s:13:"hospital_name";s:30:"Care Investigation Chittagong.";s:13:"specimen_name";s:53:"One paraffin block (Lt. Breast). Case No:  H-1023B/14";s:4:"note";s:133:"Result of Immunostaining  for ER, PR &amp; HER-2 of Case&nbsp; No H-1023B/14, Block No: (02) from Care Investigation. Chittagong.<br>";s:6:"er_rpt";s:59:"About 50 % of the tumor cell nuclei show moderate staining.";s:8:"er_score";s:9:"4+2=6 / 8";s:6:"pr_rpt";s:59:"About 15 % of the tumor cell nuclei show moderate staining.";s:8:"pr_score";s:8:"3+2= 5/8";s:11:"her_two_rpt";s:93:"Weak to moderate complete membrane staining is observed in more than 10 % of the tumor cells.";s:13:"her_two_score";s:2:"2+";s:9:"er_result";s:8:"Positive";s:9:"pr_result";s:8:"Positive";s:14:"her_two_result";s:10:"Borderline";s:8:"rpt_noet";s:0:"";}i:12;O:8:"stdClass":23:{s:10:"her_two_id";s:3:"966";s:5:"sl_no";s:3:"231";s:7:"test_id";s:16:"MIHC14:08915-917";s:10:"reciv_date";s:10:"08/05/2014";s:9:"deli_date";s:10:"11/05/2014";s:12:"current_date";s:10:"2014-05-08";s:12:"patient_name";s:18:"Mrs. Helena Begum.";s:3:"age";s:6:"50 Yrs";s:6:"ref_by";s:29:"Ahmed Sayeed,  FCPS (Surgery)";s:3:"sex";s:6:"Female";s:13:"hospital_name";s:49:"Oncology Centre and General Hospital Ltd. Dhaka. ";s:13:"specimen_name";s:57:"Tissue from left axillary lymph node. Case No: MH14-08400";s:4:"note";s:123:"Result of Immunostaining  for ER, PR &amp; HER-2 of Case No:      MH14-08400, Block No: (01) from DHL, Path. Lab. Dhaka<br>";s:6:"er_rpt";s:59:"About 40 % of the tumor cell nuclei show moderate staining.";s:8:"er_score";s:9:"4+2=6 / 8";s:6:"pr_rpt";s:59:"About 20 % of the tumor cell nuclei show moderate staining.";s:8:"pr_score";s:8:"3+2= 5/8";s:11:"her_two_rpt";s:83:"Weak incomplete membrane staining is observed in more than 10 % of the tumor cells.";s:13:"her_two_score";s:2:"1+";s:9:"er_result";s:8:"Positive";s:9:"pr_result";s:8:"Positive";s:14:"her_two_result";s:8:"Negative";s:8:"rpt_noet";s:0:"";}i:13;O:8:"stdClass":23:{s:10:"her_two_id";s:3:"967";s:5:"sl_no";s:3:"232";s:7:"test_id";s:16:"DIHC14:00958-960";s:10:"reciv_date";s:10:"07/05/2014";s:9:"deli_date";s:10:"11/05/2014";s:12:"current_date";s:10:"2014-05-07";s:12:"patient_name";s:12:"Mrs. Hazera.";s:3:"age";s:6:"43 Yrs";s:6:"ref_by";s:40:"Md. Mashiur Arefin Rubel, FCPS, MRCS, MS";s:3:"sex";s:6:"Female";s:13:"hospital_name";s:26:"Islamia Arogya Sadan Ltd. ";s:13:"specimen_name";s:40:"Mastectomy specimen. Case No: DH14-00957";s:4:"note";s:128:"Result of Immunostaining  for ER, PR &amp; HER-2 of Case No: DH14-00957,&nbsp;     Block No: (01) from DHL, Path. Lab. Dhaka<br>";s:6:"er_rpt";s:59:"About 55 % of the tumor cell nuclei show moderate staining.";s:8:"er_score";s:9:"4+2=6 / 8";s:6:"pr_rpt";s:59:"About 20 % of the tumor cell nuclei show moderate staining.";s:8:"pr_score";s:9:"3+2=5 / 8";s:11:"her_two_rpt";s:93:"Weak to moderate complete membrane staining is observed in more than 10 % of the tumor cells.";s:13:"her_two_score";s:2:"2+";s:9:"er_result";s:8:"Positive";s:9:"pr_result";s:8:"Positive";s:14:"her_two_result";s:10:"Borderline";s:8:"rpt_noet";s:0:"";}i:14;O:8:"stdClass":23:{s:10:"her_two_id";s:3:"968";s:5:"sl_no";s:3:"234";s:7:"test_id";s:16:"MIHC14:08979-981";s:10:"reciv_date";s:10:"09/05/2014";s:9:"deli_date";s:10:"18/05/2014";s:12:"current_date";s:10:"2014-05-09";s:12:"patient_name";s:21:"Mrs. Khurshida Begum.";s:3:"age";s:6:"36 Yrs";s:6:"ref_by";s:69:"Naheed Rukhsana ,MBBS,  FCPS, (Radiotherapy). Consultant. oncologist.";s:3:"sex";s:6:"Female";s:13:"hospital_name";s:39:"Delta Medical College & Hospital. Dhaka";s:13:"specimen_name";s:44:"Tissue from left breast. Case No : MH14-9150";s:4:"note";s:124:"Result of Immunostaining  for ER, PR &amp; HER-2 of Case No:      MH14-9150, Block No: (02) from DHL, Path. Lab. Dhaka. <br>";s:6:"er_rpt";s:55:"About 20 % of the tumor cell nuclei show weak staining.";s:8:"er_score";s:7:"3+1=4/8";s:6:"pr_rpt";s:55:"About 10 % of the tumor cell nuclei show weak staining.";s:8:"pr_score";s:7:"2+1=3/8";s:11:"her_two_rpt";s:93:"Weak to moderate complete membrane staining is observed in more than 10 % of the tumor cells.";s:13:"her_two_score";s:2:"2+";s:9:"er_result";s:8:"Positive";s:9:"pr_result";s:8:"Positive";s:14:"her_two_result";s:10:"Borderline";s:8:"rpt_noet";s:86:"Note: Tissue is poorly fixed. Poor fixation may interfere with immunostaining results.";}i:15;O:8:"stdClass":23:{s:10:"her_two_id";s:3:"969";s:5:"sl_no";s:3:"236";s:7:"test_id";s:16:"MIHC14:09079-081";s:10:"reciv_date";s:10:"10/05/2014";s:9:"deli_date";s:10:"18/05/2014";s:12:"current_date";s:10:"2014-05-10";s:12:"patient_name";s:15:"Mrs. Nur Jahan.";s:3:"age";s:6:"50 Yrs";s:6:"ref_by";s:16:"M/O, DMCH, Dhaka";s:3:"sex";s:6:"Female";s:13:"hospital_name";s:38:"Dhaka Medical College Hospital , Dhaka";s:13:"specimen_name";s:44:"Tissue from Lt. breast. Case No: MH14-08879.";s:4:"note";s:110:"Result of Immunostaining  for ER, PR &amp; HER-2 of Case No:      MH14-08879, from DHL, Path. Lab. Dhaka. <br>";s:6:"er_rpt";s:35:"Tumor cell nuclei show no staining.";s:8:"er_score";s:3:""O"";s:6:"pr_rpt";s:35:"Tumor cell nuclei show no staining.";s:8:"pr_score";s:3:""O"";s:11:"her_two_rpt";s:93:"Weak to moderate complete membrane staining is observed in more than 10 % of the tumor cells.";s:13:"her_two_score";s:2:"2+";s:9:"er_result";s:8:"Negative";s:9:"pr_result";s:8:"Negative";s:14:"her_two_result";s:10:"Borderline";s:8:"rpt_noet";s:0:"";}i:16;O:8:"stdClass":23:{s:10:"her_two_id";s:3:"970";s:5:"sl_no";s:3:"237";s:7:"test_id";s:16:"MIHC14:09099-101";s:10:"reciv_date";s:10:"11/05/2014";s:9:"deli_date";s:10:"18/05/2014";s:12:"current_date";s:10:"2014-05-11";s:12:"patient_name";s:20:"Mrs. Shirin Akhter. ";s:3:"age";s:6:"46 Yrs";s:6:"ref_by";s:58:"Tapesh Kumar Paul, FCPS (Surgery), MS (Surgical Oncology).";s:3:"sex";s:6:"Female";s:13:"hospital_name";s:47:"Delta Medical College & Hospital , Dhaka, C-612";s:13:"specimen_name";s:39:"Lt. Breast tissue . Case No : MH14-8819";s:4:"note";s:124:"Result of Immunostaining  for ER, PR &amp; HER-2 of Case No:      MH14-8819, Block No: (01) from DHL, Path. Lab. Dhaka. <br>";s:6:"er_rpt";s:59:"About 50 % of the tumor cell nuclei show moderate staining.";s:8:"er_score";s:7:"4+2=6/8";s:6:"pr_rpt";s:59:"About 65 % of the tumor cell nuclei show moderate staining.";s:8:"pr_score";s:7:"4+2=6/8";s:11:"her_two_rpt";s:83:"Strong complete membrane staining is observed in more than 30 % of the tumor cells.";s:13:"her_two_score";s:2:"3+";s:9:"er_result";s:8:"Positive";s:9:"pr_result";s:8:"Positive";s:14:"her_two_result";s:8:"Positive";s:8:"rpt_noet";s:0:"";}i:17;O:8:"stdClass":23:{s:10:"her_two_id";s:3:"971";s:5:"sl_no";s:3:"238";s:7:"test_id";s:16:"MIHC14:09102-104";s:10:"reciv_date";s:10:"11/05/2014";s:9:"deli_date";s:10:"18/05/2014";s:12:"current_date";s:10:"2014-05-11";s:12:"patient_name";s:12:"Mrs. Parul. ";s:3:"age";s:6:"40 Yrs";s:6:"ref_by";s:59:"Tapesh Kumar Paul, FCPS, (Surgery), MS (Surgical Oncology).";s:3:"sex";s:6:"Female";s:13:"hospital_name";s:40:"Delta Medical College & Hospital. Dhaka.";s:13:"specimen_name";s:46:"Mastectomy specimen (Lt.).Case No:  MH14-08799";s:4:"note";s:126:"Result of Immunostaining  for ER, PR &amp; HER-2 of Case No:      MH14-08799, Block No: (01) from DHL , Path. Lab. Dhaka. <br>";s:6:"er_rpt";s:59:"About 50 % of the tumor cell nuclei show moderate staining.";s:8:"er_score";s:7:"4+2=6/8";s:6:"pr_rpt";s:59:"About 60 % of the tumor cell nuclei show moderate staining.";s:8:"pr_score";s:7:"4+2=6/8";s:11:"her_two_rpt";s:84:" Weak incomplete membrane staining is observed in more than 10 % of the tumor cells.";s:13:"her_two_score";s:2:"1+";s:9:"er_result";s:8:"Positive";s:9:"pr_result";s:8:"Positive";s:14:"her_two_result";s:8:"Negative";s:8:"rpt_noet";s:0:"";}i:18;O:8:"stdClass":23:{s:10:"her_two_id";s:3:"972";s:5:"sl_no";s:3:"240";s:7:"test_id";s:16:"MIHC14:09238-240";s:10:"reciv_date";s:10:"12/05/2014";s:9:"deli_date";s:10:"18/05/2014";s:12:"current_date";s:10:"2014-05-12";s:12:"patient_name";s:17:"Mrs. Amena Begum.";s:3:"age";s:6:"55 Yrs";s:6:"ref_by";s:41:"Sagorika Sharmin (Sagor), FCPS (Surgery).";s:3:"sex";s:6:"Female";s:13:"hospital_name";s:40:"Lancet Diagnostic & Research, Chittagong";s:13:"specimen_name";s:44:"Mastectomy specimen (Lt). Case No: MH14-8576";s:4:"note";s:130:"Result of Immunostaining  for ER, PR &amp; HER-2 of Case No:MH14-8576,      Block No: (02)&nbsp; from DHL , Path. Lab. Dhaka. <br>";s:6:"er_rpt";s:59:"About 60 % of the tumor cell nuclei show moderate staining.";s:8:"er_score";s:7:"4+2=6/8";s:6:"pr_rpt";s:59:"About 30 % of the tumor cell nuclei show moderate staining.";s:8:"pr_score";s:7:"3+2=5/8";s:11:"her_two_rpt";s:83:"Weak incomplete membrane staining is observed in more than 10 % of the tumor cells.";s:13:"her_two_score";s:2:"1+";s:9:"er_result";s:8:"Positive";s:9:"pr_result";s:8:"Positive";s:14:"her_two_result";s:8:"Negative";s:8:"rpt_noet";s:0:"";}i:19;O:8:"stdClass":23:{s:10:"her_two_id";s:3:"973";s:5:"sl_no";s:3:"241";s:7:"test_id";s:16:"MIHC14:09242-244";s:10:"reciv_date";s:10:"12/05/2014";s:9:"deli_date";s:10:"18/05/2014";s:12:"current_date";s:10:"2014-05-12";s:12:"patient_name";s:17:"Mrs. Munni Begum.";s:3:"age";s:6:"36 Yrs";s:6:"ref_by";s:11:"M/O. NICRH.";s:3:"sex";s:6:"Female";s:13:"hospital_name";s:23:"NICRH, Mohakhali, Dhaka";s:13:"specimen_name";s:48:"One paraffin block (Lt. breast).Case No: D223340";s:4:"note";s:149:"Result of Immunostaining  for ER, PR &amp; HER-2 of Case No:      D223340, Block No: (02) from IBN SINA DIAGNOSTIC &amp; IMMAGING CENTER. Dhaka. <br>";s:6:"er_rpt";s:59:"About 50 % of the tumor cell nuclei show moderate staining.";s:8:"er_score";s:7:"4+2=6/8";s:6:"pr_rpt";s:59:"About 65 % of the tumor cell nuclei show moderate staining.";s:8:"pr_score";s:7:"4+2=6/8";s:11:"her_two_rpt";s:93:"Weak to moderate complete membrane staining is observed in more than 10 % of the tumor cells.";s:13:"her_two_score";s:2:"2+";s:9:"er_result";s:8:"Positive";s:9:"pr_result";s:8:"Positive";s:14:"her_two_result";s:10:"Borderline";s:8:"rpt_noet";s:0:"";}i:20;O:8:"stdClass":23:{s:10:"her_two_id";s:3:"974";s:5:"sl_no";s:3:"242";s:7:"test_id";s:16:"MIHC14:09257-259";s:10:"reciv_date";s:10:"13/05/2014";s:9:"deli_date";s:10:"18/05/2014";s:12:"current_date";s:10:"2014-05-13";s:12:"patient_name";s:18:"Mrs. Tania Akhter.";s:3:"age";s:6:"23 Yrs";s:6:"ref_by";s:57:"Tapesh Kumar Paul, FCPS, (Surgery) MS (Surgery Oncology).";s:3:"sex";s:6:"Female";s:13:"hospital_name";s:48:"Delta Medical College & Hospital., C-609, Dhaka.";s:13:"specimen_name";s:45:"Mastectomy specimen (Lt). Case No : MH14-8962";s:4:"note";s:123:"Result of Immunostaining  for ER, PR &amp; HER-2 of Case No: MH14-8962, Block No: (01) from DHL, Path. Lab. Dhaka. <br><br>";s:6:"er_rpt";s:35:"Tumor cell nuclei show no staining.";s:8:"er_score";s:3:""O"";s:6:"pr_rpt";s:35:"Tumor cell nuclei show no staining.";s:8:"pr_score";s:3:""O"";s:11:"her_two_rpt";s:83:"Strong complete membrane staining is observed in more than 30 % of the tumor cells.";s:13:"her_two_score";s:2:"3+";s:9:"er_result";s:8:"Negative";s:9:"pr_result";s:8:"Negative";s:14:"her_two_result";s:8:"Positive";s:8:"rpt_noet";s:0:"";}i:21;O:8:"stdClass":23:{s:10:"her_two_id";s:3:"975";s:5:"sl_no";s:3:"243";s:7:"test_id";s:16:"MIHC14:09268-270";s:10:"reciv_date";s:10:"13/05/2014";s:9:"deli_date";s:10:"18/05/2014";s:12:"current_date";s:10:"2014-05-13";s:12:"patient_name";s:20:"Mrs. Monowara Begum.";s:3:"age";s:6:"40 Yrs";s:6:"ref_by";s:41:"Sagarika Sharmin (Sagar), FCPS (Surgery).";s:3:"sex";s:6:"Female";s:13:"hospital_name";s:40:"Lancet Diagnostic & Research, Chittagong";s:13:"specimen_name";s:31:"Left breast. Case No: MH14-9033";s:4:"note";s:118:"Result of Immunostaining  for ER, PR &amp; HER-2 of Case No: MH14-9033, Block No: (03) from DHL, Path. Lab Dhaka. <br>";s:6:"er_rpt";s:59:"About 50 % of the tumor cell nuclei show moderate staining.";s:8:"er_score";s:7:"4+2=6/8";s:6:"pr_rpt";s:59:"About 68 % of the tumor cell nuclei show moderate staining.";s:8:"pr_score";s:7:"5+2=7/8";s:11:"her_two_rpt";s:93:"Weak to moderate complete membrane staining is observed in more than 10 % of the tumor cells.";s:13:"her_two_score";s:2:"2+";s:9:"er_result";s:8:"Positive";s:9:"pr_result";s:8:"Positive";s:14:"her_two_result";s:10:"Borderline";s:8:"rpt_noet";s:0:"";}i:22;O:8:"stdClass":23:{s:10:"her_two_id";s:3:"976";s:5:"sl_no";s:3:"244";s:7:"test_id";s:16:"MIHC14:09271-273";s:10:"reciv_date";s:10:"13/05/2014";s:9:"deli_date";s:10:"18/05/2014";s:12:"current_date";s:10:"2014-05-13";s:12:"patient_name";s:19:"Mrs. Anowara Begum.";s:3:"age";s:6:"55 Yrs";s:6:"ref_by";s:50:"Asstt. Prof. Dr. Md. Saiful Haque, FCPS (Surgery).";s:3:"sex";s:6:"Female";s:13:"hospital_name";s:22:"Ekushey Hospital, Ctg.";s:13:"specimen_name";s:42:"Tissue from Rt. breast. Case No: MH14-9026";s:4:"note";s:124:"Result of Immunostaining  for ER, PR &amp; HER-2 of Case No:      MH14-9026, Block No: (03) from DHL, Path. Lab. Dhaka. <br>";s:6:"er_rpt";s:35:"Tumor cell nuclei show no staining.";s:8:"er_score";s:3:""O"";s:6:"pr_rpt";s:35:"Tumor cell nuclei show no staining.";s:8:"pr_score";s:3:""O"";s:11:"her_two_rpt";s:87:"Strong complete membrane staining is observed in more than 30 % of the tumor cells.

";s:13:"her_two_score";s:2:"3+";s:9:"er_result";s:8:"Negative";s:9:"pr_result";s:8:"Negative";s:14:"her_two_result";s:8:"Positive";s:8:"rpt_noet";s:0:"";}i:23;O:8:"stdClass":23:{s:10:"her_two_id";s:3:"977";s:5:"sl_no";s:3:"245";s:7:"test_id";s:16:"MIHC14:09306-308";s:10:"reciv_date";s:10:"13/05/2014";s:9:"deli_date";s:10:"18/05/2014";s:12:"current_date";s:10:"2014-05-13";s:12:"patient_name";s:14:"Mrs. Nurjahan.";s:3:"age";s:6:"49 Yrs";s:6:"ref_by";s:79:"Md. Rezaul Sharif, M.Phil, in Radiotherapy (BSMMU) Consultant Clinical Oncology";s:3:"sex";s:6:"Female";s:13:"hospital_name";s:33:"Delta Medical College & Hospital.";s:13:"specimen_name";s:52:"One paraffin block (Rt. breast.). Case No: S0414-140";s:4:"note";s:138:"Result of Immunostaining  for ER, PR &amp; HER-2 of Case No:      S0414-140, Block No: (L/N) from SAIC Digital Diagnostic Lab. Dhaka. <br>";s:6:"er_rpt";s:35:"Tumor cell nuclei show no staining.";s:8:"er_score";s:3:""O"";s:6:"pr_rpt";s:35:"Tumor cell nuclei show no staining.";s:8:"pr_score";s:3:""O"";s:11:"her_two_rpt";s:83:"Strong complete membrane staining is observed in more than 30 % of the tumor cells.";s:13:"her_two_score";s:2:"3+";s:9:"er_result";s:8:"Negative";s:9:"pr_result";s:8:"Negative";s:14:"her_two_result";s:8:"Positive";s:8:"rpt_noet";s:0:"";}i:24;O:8:"stdClass":23:{s:10:"her_two_id";s:3:"978";s:5:"sl_no";s:3:"249";s:7:"test_id";s:16:"MIHC14:09510-512";s:10:"reciv_date";s:10:"15/05/2014";s:9:"deli_date";s:10:"25/05/2014";s:12:"current_date";s:10:"2014-05-15";s:12:"patient_name";s:20:"Mrs. Mohasena Begum.";s:3:"age";s:6:"38 Yrs";s:6:"ref_by";s:46:"Md. Zillur Rahman , MBBS, M.Phil (Path.). PhD.";s:3:"sex";s:6:"Female";s:13:"hospital_name";s:32:"Care Investigation, Chittagong. ";s:13:"specimen_name";s:52:"One paraffin block (Breast). Case no: H-05-1059 A/14";s:4:"note";s:137:"Result of Immunostaining  for ER, PR &amp; HER-2 of Case No:      H-05-1059 A/14 Block No: (01) from Care Investigation. Chittagong. <br>";s:6:"er_rpt";s:55:"About 30 % of the tumor cell nuclei show weak staining.";s:8:"er_score";s:7:"3+1=4/8";s:6:"pr_rpt";s:59:"About 30 % of the tumor cell nuclei show moderate staining.";s:8:"pr_score";s:7:"3+2=5/8";s:11:"her_two_rpt";s:83:"Weak incomplete membrane staining is observed in more than 10 % of the tumor cells.";s:13:"her_two_score";s:2:"1+";s:9:"er_result";s:8:"Positive";s:9:"pr_result";s:8:"Positive";s:14:"her_two_result";s:8:"Negative";s:8:"rpt_noet";s:0:"";}i:25;O:8:"stdClass":23:{s:10:"her_two_id";s:3:"979";s:5:"sl_no";s:3:"251";s:7:"test_id";s:12:"MIHC14:09517";s:10:"reciv_date";s:10:"15/05/2014";s:9:"deli_date";s:10:"25/05/2014";s:12:"current_date";s:10:"2014-05-15";s:12:"patient_name";s:19:"Mr. Somiron Biswash";s:3:"age";s:6:"42 Yrs";s:6:"ref_by";s:28:"Md. Zillur Rahman , FCPS, MS";s:3:"sex";s:4:"Male";s:13:"hospital_name";s:32:"Care Investigation, Chittagong. ";s:13:"specimen_name";s:41:"One paraffin block case no: H-05-1045A/14";s:4:"note";s:138:"Result of Immunostaining  for ER, PR &amp; HER-2 of Case No:      H-05-1045A/14, Block No: (02) from Care Investigation , Chittagong. <br>";s:6:"er_rpt";s:117:"About _______ %/ <1 % of the tumor cell nuclei show weak/moderate/strong staining/Tumor cell nuclei show no staining.";s:8:"er_score";s:6:"   / 8";s:6:"pr_rpt";s:118:"About _______%/ <1  %  of the tumor cell nuclei show weak/moderate/strong staining/Tumor cell nuclei show no staining.";s:8:"pr_score";s:9:"      / 8";s:11:"her_two_rpt";s:0:"";s:13:"her_two_score";s:12:"Select Score";s:9:"er_result";s:17:"Negative/Positive";s:9:"pr_result";s:17:"Negative/Positive";s:14:"her_two_result";s:28:"Negative/Positive/Borderline";s:8:"rpt_noet";s:0:"";}i:26;O:8:"stdClass":23:{s:10:"her_two_id";s:3:"980";s:5:"sl_no";s:3:"252";s:7:"test_id";s:16:"MIHC14:09518-520";s:10:"reciv_date";s:10:"15/05/2014";s:9:"deli_date";s:10:"25/05/2014";s:12:"current_date";s:10:"2014-05-15";s:12:"patient_name";s:16:"Mrs. Shahinoor. ";s:3:"age";s:6:"44 Yrs";s:6:"ref_by";s:59:"Tapesh Kumar Paul, FCPS, (Surgery), MS (Surgical Oncology).";s:3:"sex";s:6:"Female";s:13:"hospital_name";s:42:"Delta Medical College  & Hospital, Dhaka. ";s:13:"specimen_name";s:43:"Tissue from Rt. breast. Case No: MH14-9187.";s:4:"note";s:107:"Result of Immunostaining  for ER, PR &amp; HER-2 of Case No:      MH14-9187 from DHL, Path. Lab. Dhaka.<br>";s:6:"er_rpt";s:35:"Tumor cell nuclei show no staining.";s:8:"er_score";s:3:""O"";s:6:"pr_rpt";s:35:"Tumor cell nuclei show no staining.";s:8:"pr_score";s:3:""O"";s:11:"her_two_rpt";s:93:"Weak to moderate complete membrane staining is observed in more than 10 % of the tumor cells.";s:13:"her_two_score";s:2:"2+";s:9:"er_result";s:8:"Negative";s:9:"pr_result";s:8:"Negative";s:14:"her_two_result";s:10:"Borderline";s:8:"rpt_noet";s:0:"";}i:27;O:8:"stdClass":23:{s:10:"her_two_id";s:3:"981";s:5:"sl_no";s:3:"253";s:7:"test_id";s:16:"MIHC14:09536-538";s:10:"reciv_date";s:10:"15/05/2014";s:9:"deli_date";s:10:"25/05/2014";s:12:"current_date";s:10:"2014-05-15";s:12:"patient_name";s:17:"Mrs. Piyara Begum";s:3:"age";s:6:"47 Yrs";s:6:"ref_by";s:64:"M M S Hossain, MBBS, FCPS. (Radiotherapy) Consultant Oncologist.";s:3:"sex";s:6:"Female";s:13:"hospital_name";s:41:"Ashic Oncology & Palliative Care Center. ";s:13:"specimen_name";s:39:"Mastectomy specimen. Case No: MH14-8474";s:4:"note";s:130:"Result of Immunostaining  for ER, PR &amp; HER-2 of Case No:      MH14-8474, Block No: (01) from DHL, Path. Lab. Dhaka.&nbsp; <br>";s:6:"er_rpt";s:59:"About 60 % of the tumor cell nuclei show moderate staining.";s:8:"er_score";s:7:"4+2=6/8";s:6:"pr_rpt";s:59:"About 20 % of the tumor cell nuclei show moderate staining.";s:8:"pr_score";s:7:"3+2=5/8";s:11:"her_two_rpt";s:94:" Weak to moderate complete membrane staining is observed in more than 10 % of the tumor cells.";s:13:"her_two_score";s:2:"2+";s:9:"er_result";s:8:"Positive";s:9:"pr_result";s:8:"Positive";s:14:"her_two_result";s:10:"Borderline";s:8:"rpt_noet";s:0:"";}i:28;O:8:"stdClass":23:{s:10:"her_two_id";s:3:"982";s:5:"sl_no";s:3:"254";s:7:"test_id";s:16:"MIHC14:09552-554";s:10:"reciv_date";s:10:"16/05/2014";s:9:"deli_date";s:10:"25/05/2014";s:12:"current_date";s:10:"2014-05-16";s:12:"patient_name";s:16:"Mrs. Khuku Moni.";s:3:"age";s:6:"33 Yrs";s:6:"ref_by";s:28:"Ahsanul Abedin, FCPS, MCPS. ";s:3:"sex";s:6:"Female";s:13:"hospital_name";s:26:"CSCR Hospital , Chittagong";s:13:"specimen_name";s:32:"Right breast. Case No: MH14-9551";s:4:"note";s:124:"Result of Immunostaining  for ER, PR &amp; HER-2 of Case No:      MH14-9551, Block No: (01) from DHL, Path. Lab. Dhaka. <br>";s:6:"er_rpt";s:49:"<1 % of the tumor cell nuclei show weak staining.";s:8:"er_score";s:7:"1+1=2/8";s:6:"pr_rpt";s:54:"About 1 % of the tumor cell nuclei show weak staining.";s:8:"pr_score";s:7:"2+1=3/8";s:11:"her_two_rpt";s:93:"Weak to moderate complete membrane staining is observed in more than 10 % of the tumor cells.";s:13:"her_two_score";s:2:"2+";s:9:"er_result";s:8:"Negative";s:9:"pr_result";s:15:"Positive (Weak)";s:14:"her_two_result";s:10:"Borderline";s:8:"rpt_noet";s:0:"";}i:29;O:8:"stdClass":23:{s:10:"her_two_id";s:3:"983";s:5:"sl_no";s:3:"256";s:7:"test_id";s:16:"MIHC14:09573-575";s:10:"reciv_date";s:10:"17/05/2014";s:9:"deli_date";s:10:"25/05/2014";s:12:"current_date";s:10:"2014-05-17";s:12:"patient_name";s:14:"Mrs. Jahanara ";s:3:"age";s:6:"50 Yrs";s:6:"ref_by";s:59:"Tapesh Kumar Paul, FCPS, (Surgery), MS (Surgical Oncology).";s:3:"sex";s:6:"Female";s:13:"hospital_name";s:41:"Delta Medical College  & Hospital, Dhaka.";s:13:"specimen_name";s:59:"Tissue from left breast. (Core biopsy) Case No: MH14-08996.";s:4:"note";s:109:"Result of Immunostaining  for ER, PR &amp; HER-2 of Case No:      MH14-08996 from DHL, Path. Lab. Dhaka. <br>";s:6:"er_rpt";s:59:"About 50 % of the tumor cell nuclei show moderate staining.";s:8:"er_score";s:7:"4+2=6/8";s:6:"pr_rpt";s:59:"About 55 % of the tumor cell nuclei show moderate staining.";s:8:"pr_score";s:7:"4+2=6/8";s:11:"her_two_rpt";s:93:"Weak to moderate complete membrane staining is observed in more than 10 % of the tumor cells.";s:13:"her_two_score";s:2:"2+";s:9:"er_result";s:8:"Positive";s:9:"pr_result";s:8:"Positive";s:14:"her_two_result";s:10:"Borderline";s:8:"rpt_noet";s:0:"";}i:30;O:8:"stdClass":23:{s:10:"her_two_id";s:3:"984";s:5:"sl_no";s:3:"257";s:7:"test_id";s:16:"MIHC14:09636-638";s:10:"reciv_date";s:10:"17/05/2014";s:9:"deli_date";s:10:"25/05/2014";s:12:"current_date";s:10:"2014-05-17";s:12:"patient_name";s:18:"Mrs. Latifa Khanom";s:3:"age";s:6:"52 Yrs";s:6:"ref_by";s:0:"";s:3:"sex";s:6:"Female";s:13:"hospital_name";s:27:"Sigma Lab Ltd. , Chittagong";s:13:"specimen_name";s:34:"Breast tissue. Case No: MH13-17090";s:4:"note";s:126:"Result of Immunostaining  for ER, PR &amp; HER-2 of Case No:      MH13-17090, Block No: (02) from DHL , Path. Lab. Dhaka. <br>";s:6:"er_rpt";s:55:"About 05 % of the tumor cell nuclei show weak staining.";s:8:"er_score";s:7:"2+1=3/8";s:6:"pr_rpt";s:55:"About 20 % of the tumor cell nuclei show weak staining.";s:8:"pr_score";s:7:"3+1=4/8";s:11:"her_two_rpt";s:93:"Weak to moderate complete membrane staining is observed in more than 10 % of the tumor cells.";s:13:"her_two_score";s:2:"2+";s:9:"er_result";s:15:"Positive (Weak)";s:9:"pr_result";s:8:"Positive";s:14:"her_two_result";s:10:"Borderline";s:8:"rpt_noet";s:0:"";}i:31;O:8:"stdClass":23:{s:10:"her_two_id";s:3:"985";s:5:"sl_no";s:3:"258";s:7:"test_id";s:16:"MIHC14:09664-666";s:10:"reciv_date";s:10:"18/05/2014";s:9:"deli_date";s:10:"25/05/2014";s:12:"current_date";s:10:"2014-05-18";s:12:"patient_name";s:12:"Mrs. Shafia.";s:3:"age";s:6:"50 Yrs";s:6:"ref_by";s:59:"Tapesh Kumar Paul, FCPS, (Surgery), MS (Surgical Oncology).";s:3:"sex";s:6:"Female";s:13:"hospital_name";s:49:"Delta Medical College  & Hospital, Dhaka.W-535/1.";s:13:"specimen_name";s:42:"Tissue from Rt. Breast. Case No: MH14-9407";s:4:"note";s:124:"Result of Immunostaining  for ER, PR &amp; HER-2 of Case No:      MH14-9407, Block No: (02) from DHL, Path. Lab. Dhaka. <br>";s:6:"er_rpt";s:59:"About 60 % of the tumor cell nuclei show moderate staining.";s:8:"er_score";s:7:"4+2=6/8";s:6:"pr_rpt";s:35:"Tumor cell nuclei show no staining.";s:8:"pr_score";s:3:""O"";s:11:"her_two_rpt";s:93:"Weak to moderate complete membrane staining is observed in more than 10 % of the tumor cells.";s:13:"her_two_score";s:2:"2+";s:9:"er_result";s:8:"Positive";s:9:"pr_result";s:8:"Negative";s:14:"her_two_result";s:10:"Borderline";s:8:"rpt_noet";s:0:"";}i:32;O:8:"stdClass":23:{s:10:"her_two_id";s:3:"986";s:5:"sl_no";s:3:"259";s:7:"test_id";s:12:"MIHC14:09731";s:10:"reciv_date";s:10:"18/05/2014";s:9:"deli_date";s:10:"25/05/2014";s:12:"current_date";s:10:"2014-05-18";s:12:"patient_name";s:17:"Mr. Nisar Hasnat ";s:3:"age";s:6:"65 Yrs";s:6:"ref_by";s:47:"Parvin Akhter Banu, Chief Consultant (Oncology)";s:3:"sex";s:4:"Male";s:13:"hospital_name";s:3:"DHL";s:13:"specimen_name";s:40:"One paraffin block case no: V14050056829";s:4:"note";s:128:"Result of Immunostaining  for ER, PR &amp; HER-2 of Case No:      V14050056829, from Square Hospital Ltd, Path. Lab. Dhaka. <br>";s:6:"er_rpt";s:117:"About _______ %/ <1 % of the tumor cell nuclei show weak/moderate/strong staining/Tumor cell nuclei show no staining.";s:8:"er_score";s:6:"   / 8";s:6:"pr_rpt";s:118:"About _______%/ <1  %  of the tumor cell nuclei show weak/moderate/strong staining/Tumor cell nuclei show no staining.";s:8:"pr_score";s:9:"      / 8";s:11:"her_two_rpt";s:0:"";s:13:"her_two_score";s:12:"Select Score";s:9:"er_result";s:17:"Negative/Positive";s:9:"pr_result";s:17:"Negative/Positive";s:14:"her_two_result";s:28:"Negative/Positive/Borderline";s:8:"rpt_noet";s:0:"";}i:33;O:8:"stdClass":23:{s:10:"her_two_id";s:3:"987";s:5:"sl_no";s:3:"260";s:7:"test_id";s:16:"DIHC14:01055-057";s:10:"reciv_date";s:10:"16/05/2014";s:9:"deli_date";s:10:"25/05/2014";s:12:"current_date";s:10:"2014-05-16";s:12:"patient_name";s:15:"Suraiya Khanum ";s:3:"age";s:6:"57 Yrs";s:6:"ref_by";s:39:"Syed Mozammel Hossain , FCPS (Surgery).";s:3:"sex";s:6:"Female";s:13:"hospital_name";s:29:"Islami Bank Hospital, Khulna ";s:13:"specimen_name";s:32:"Right breast. Case No: DH14-1054";s:4:"note";s:124:"Result of Immunostaining  for ER, PR &amp; HER-2 of Case No:      DH14-1054, Block No: (02) from DHL, Path. Lab. Dhaka. <br>";s:6:"er_rpt";s:60:"About 30 % of the tumor cell nuclei show moderate  staining.";s:8:"er_score";s:7:"3+2=5/8";s:6:"pr_rpt";s:60:"About 60 %  of the tumor cell nuclei show moderate staining.";s:8:"pr_score";s:7:"4+2=6/8";s:11:"her_two_rpt";s:83:"Weak incomplete membrane staining is observed in more than 10 % of the tumor cells.";s:13:"her_two_score";s:2:"1+";s:9:"er_result";s:8:"Positive";s:9:"pr_result";s:8:"Positive";s:14:"her_two_result";s:8:"Negative";s:8:"rpt_noet";s:0:"";}i:34;O:8:"stdClass":23:{s:10:"her_two_id";s:3:"988";s:5:"sl_no";s:3:"261";s:7:"test_id";s:16:"MIHC14:09741-743";s:10:"reciv_date";s:10:"19/05/2014";s:9:"deli_date";s:10:"25/05/2014";s:12:"current_date";s:10:"2014-05-19";s:12:"patient_name";s:21:"Mosammat Hafsa Begum.";s:3:"age";s:6:"55 Yrs";s:6:"ref_by";s:77:"Sajjad Mohammad Yusuff , Oncologist, MCPS (Radiotherapy), FCPS (Radiotherapy)";s:3:"sex";s:6:"Female";s:13:"hospital_name";s:28:"CSCR Hospital , Chittagong. ";s:13:"specimen_name";s:43:"Tissue from Rt. breast. Case No: MH14-07296";s:4:"note";s:126:"Result of Immunostaining  for ER, PR &amp; HER-2 of Case No:      MH14-07296 , Block No: (02) from DHL, Path. Lab. Dhaka. <br>";s:6:"er_rpt";s:59:"About 20 % of the tumor cell nuclei show moderate staining.";s:8:"er_score";s:7:"3+2=5/8";s:6:"pr_rpt";s:55:"About 03 % of the tumor cell nuclei show weak staining.";s:8:"pr_score";s:7:"2+1=3/8";s:11:"her_two_rpt";s:93:"Weak to moderate complete membrane staining is observed in more than 10 % of the tumor cells.";s:13:"her_two_score";s:2:"2+";s:9:"er_result";s:8:"Positive";s:9:"pr_result";s:15:"Positive (Weak)";s:14:"her_two_result";s:10:"Borderline";s:8:"rpt_noet";s:0:"";}i:35;O:8:"stdClass":23:{s:10:"her_two_id";s:3:"989";s:5:"sl_no";s:3:"263";s:7:"test_id";s:16:"MIHC14:09861-863";s:10:"reciv_date";s:10:"20/05/2014";s:9:"deli_date";s:10:"25/05/2014";s:12:"current_date";s:10:"2014-05-20";s:12:"patient_name";s:17:"Mrs. Mabia Begum.";s:3:"age";s:6:"65 Yrs";s:6:"ref_by";s:59:"Tapesh Kumar Paul, FCPS, (Surgery), MS (Surgical Oncology).";s:3:"sex";s:6:"Female";s:13:"hospital_name";s:48:"Delta Medical College & Hospital , Dhaka , C-612";s:13:"specimen_name";s:32:"Right breast. Case No: MH14-9509";s:4:"note";s:124:"Result of Immunostaining  for ER, PR &amp; HER-2 of Case No:      MH14-9509, Block No: (02) from DHL, Path. Lab. Dhaka. <br>";s:6:"er_rpt";s:35:"Tumor cell nuclei show no staining.";s:8:"er_score";s:3:""O"";s:6:"pr_rpt";s:35:"Tumor cell nuclei show no staining.";s:8:"pr_score";s:3:""O"";s:11:"her_two_rpt";s:84:" Weak incomplete membrane staining is observed in more than 10 % of the tumor cells.";s:13:"her_two_score";s:2:"1+";s:9:"er_result";s:8:"Negative";s:9:"pr_result";s:8:"Negative";s:14:"her_two_result";s:8:"Negative";s:8:"rpt_noet";s:0:"";}i:36;O:8:"stdClass":23:{s:10:"her_two_id";s:3:"990";s:5:"sl_no";s:3:"264";s:7:"test_id";s:16:"MIHC14:09906-908";s:10:"reciv_date";s:10:"20/05/2014";s:9:"deli_date";s:10:"25/05/2014";s:12:"current_date";s:10:"2014-05-20";s:12:"patient_name";s:18:"Mrs. Merry Sikder.";s:3:"age";s:6:"65 Yrs";s:6:"ref_by";s:59:"Tapesh Kumar Paul, FCPS, (Surgery), MS (Surgical Oncology).";s:3:"sex";s:6:"Female";s:13:"hospital_name";s:49:"Delta Medical College & Hospital , Dhaka , W-611.";s:13:"specimen_name";s:30:"Lt. breast. Case No: MH14-9313";s:4:"note";s:129:"Result of Immunostaining  for ER, PR &amp; HER-2 of Case No:MH14-9313,&nbsp;      Block No: (02) from DHL, Path. Lab. Dhaka. <br>";s:6:"er_rpt";s:35:"Tumor cell nuclei show no staining.";s:8:"er_score";s:3:""O"";s:6:"pr_rpt";s:35:"Tumor cell nuclei show no staining.";s:8:"pr_score";s:3:""O"";s:11:"her_two_rpt";s:93:"Weak to moderate complete membrane staining is observed in more than 10 % of the tumor cells.";s:13:"her_two_score";s:2:"2+";s:9:"er_result";s:8:"Negative";s:9:"pr_result";s:8:"Negative";s:14:"her_two_result";s:10:"Borderline";s:8:"rpt_noet";s:0:"";}i:37;O:8:"stdClass":23:{s:10:"her_two_id";s:3:"991";s:5:"sl_no";s:3:"265";s:7:"test_id";s:16:"MIHC14:09925-927";s:10:"reciv_date";s:10:"20/05/2014";s:9:"deli_date";s:10:"25/05/2014";s:12:"current_date";s:10:"2014-05-20";s:12:"patient_name";s:12:"Mrs. Majeda ";s:3:"age";s:6:"35 Yrs";s:6:"ref_by";s:60:"Lt. Col. M.S. Sarwar Alam (Rtd.), FCPS, Clinical Oncologist.";s:3:"sex";s:6:"Female";s:13:"hospital_name";s:40:"Delta Medical College & Hospital , Dhaka";s:13:"specimen_name";s:52:"Tissue from axillary lymph node. Case No: MH13-20393";s:4:"note";s:123:"Result of Immunostaining  for ER, PR &amp; HER-2 of Case No:      MH13-20393, Block No (02) from DHL Path. Lab. Dhaka. <br>";s:6:"er_rpt";s:35:"Tumor cell nuclei show no staining.";s:8:"er_score";s:3:""O"";s:6:"pr_rpt";s:35:"Tumor cell nuclei show no staining.";s:8:"pr_score";s:3:""O"";s:11:"her_two_rpt";s:29:"Tumor cells show no staining.";s:13:"her_two_score";s:3:""O"";s:9:"er_result";s:8:"Negative";s:9:"pr_result";s:8:"Negative";s:14:"her_two_result";s:8:"Negative";s:8:"rpt_noet";s:0:"";}i:38;O:8:"stdClass":23:{s:10:"her_two_id";s:3:"992";s:5:"sl_no";s:3:"266";s:7:"test_id";s:16:"MIHC14:09961-963";s:10:"reciv_date";s:10:"21/05/2014";s:9:"deli_date";s:10:"25/05/2014";s:12:"current_date";s:10:"2014-05-21";s:12:"patient_name";s:19:"Mrs. Rashida Akhter";s:3:"age";s:6:"32 Yrs";s:6:"ref_by";s:59:"Tapesh Kumar Paul, FCPS, (Surgery), MS (Surgical Oncology).";s:3:"sex";s:6:"Female";s:13:"hospital_name";s:48:"Delta Medical College & Hospital , Dhaka , C-531";s:13:"specimen_name";s:58:"Tissue from Lt. breast with Lymph node. Case No: MH14-9634";s:4:"note";s:139:"Result of Immunostaining  for ER, PR &amp; HER-2 of Case No: MH14-9634,     Block No: Lymph node (03)&nbsp; from DHL, Path. Lab. Dhaka.<br>";s:6:"er_rpt";s:55:"About 15 % of the tumor cell nuclei show weak staining.";s:8:"er_score";s:7:"3+1=4/8";s:6:"pr_rpt";s:35:"Tumor cell nuclei show no staining.";s:8:"pr_score";s:3:""O"";s:11:"her_two_rpt";s:93:"Weak to moderate complete membrane staining is observed in more than 10 % of the tumor cells.";s:13:"her_two_score";s:2:"2+";s:9:"er_result";s:8:"Positive";s:9:"pr_result";s:8:"Negative";s:14:"her_two_result";s:10:"Borderline";s:8:"rpt_noet";s:0:"";}i:39;O:8:"stdClass":23:{s:10:"her_two_id";s:3:"993";s:5:"sl_no";s:3:"267";s:7:"test_id";s:16:"MIHC14:10022-024";s:10