O:12:"CI_DB_result":8:{s:7:"conn_id";N;s:9:"result_id";N;s:12:"result_array";a:27:{i:0;a:23:{s:10:"her_two_id";s:3:"267";s:5:"sl_no";s:3:"001";s:7:"test_id";s:16:"MIHC14:00051-053";s:10:"reciv_date";s:10:"01/01/2014";s:9:"deli_date";s:10:"05/01/2014";s:12:"current_date";s:10:"2014-01-01";s:12:"patient_name";s:15:"Mrs. Rina Akter";s:3:"age";s:6:"48 Yrs";s:6:"ref_by";s:32:"Kazi iftekhar Uddin Ahmed, FCPS ";s:3:"sex";s:6:"Female";s:13:"hospital_name";s:40:"Ashic Oncology & Palliative Care Centre.";s:13:"specimen_name";s:59:"(Tissue from breast.) One paraffin block. Case No: D119377 ";s:4:"note";s:142:"Result of Immunostaining  for ER, PR &amp; HER-2 of Case No:D119377, Block No: (T1) from IBN-SINA Diagnostic &amp; Imaging Center. Dhaka. <br>";s:6:"er_rpt";s:49:"<1 % of the tumor cell nuclei show weak staining.";s:8:"er_score";s:7:"1+1=2/8";s:6:"pr_rpt";s:49:"<1 % of the tumor cell nuclei show weak staining.";s:8:"pr_score";s:7:"1+1=2/8";s:11:"her_two_rpt";s:84:"`Strong complete membrane staining is observed in more than 30 % of the tumor cells.";s:13:"her_two_score";s:2:"3+";s:9:"er_result";s:8:"Negative";s:9:"pr_result";s:8:"Negative";s:14:"her_two_result";s:8:"Positive";s:8:"rpt_noet";s:0:"";}i:1;a:23:{s:10:"her_two_id";s:3:"268";s:5:"sl_no";s:3:"002";s:7:"test_id";s:16:"MIHC14:00062-064";s:10:"reciv_date";s:10:"01/01/2014";s:9:"deli_date";s:10:"05/01/2014";s:12:"current_date";s:10:"2014-01-01";s:12:"patient_name";s:17:"Md. Amir Hossain ";s:3:"age";s:6:"18 Yrs";s:6:"ref_by";s:22:"Md. Mukitul Huda FCPS.";s:3:"sex";s:4:"Male";s:13:"hospital_name";s:10:"DHL, 316/D";s:13:"specimen_name";s:63:"Tissue from cervical lymph node.(Lt. side). Case No: MH13-24354";s:4:"note";s:124:"Result of Immunostaining  for ER, PR &amp; HER-2 of Case No:MH13-24354,      Block No: (02) from DHL. Path. Lab. Dhaka. <br>";s:6:"er_rpt";s:117:"About _______ %/ <1 % of the tumor cell nuclei show weak/moderate/strong staining/Tumor cell nuclei show no staining.";s:8:"er_score";s:6:"   / 8";s:6:"pr_rpt";s:118:"About _______%/ <1  %  of the tumor cell nuclei show weak/moderate/strong staining/Tumor cell nuclei show no staining.";s:8:"pr_score";s:9:"      / 8";s:11:"her_two_rpt";s:0:"";s:13:"her_two_score";s:12:"Select Score";s:9:"er_result";s:17:"Negative/Positive";s:9:"pr_result";s:17:"Negative/Positive";s:14:"her_two_result";s:28:"Negative/Positive/Borderline";s:8:"rpt_noet";s:0:"";}i:2;a:23:{s:10:"her_two_id";s:3:"312";s:5:"sl_no";s:2:"06";s:7:"test_id";s:16:"MIHC14:00205-207";s:10:"reciv_date";s:10:"05/01/2014";s:9:"deli_date";s:10:"12/01/2014";s:12:"current_date";s:10:"2014-01-05";s:12:"patient_name";s:18:"Mrs. Shahida Hamid";s:3:"age";s:6:"45 Yrs";s:6:"ref_by";s:47:"Tapesh Kumar Paul, FCPS, MS (Oncology Surgery).";s:3:"sex";s:6:"Female";s:13:"hospital_name";s:10:"DHL, C-518";s:13:"specimen_name";s:53:"Rt. breast with axillary lymph node. Case No: MH14-35";s:4:"note";s:122:"Result of Immunostaining  for ER, PR &amp; HER-2 of Case No:      MH14-35, Block No: (01) from DHL, Path. Lab. Dhaka. <br>";s:6:"er_rpt";s:35:"Tumor cell nuclei show no staining.";s:8:"er_score";s:3:""O"";s:6:"pr_rpt";s:35:"Tumor cell nuclei show no staining.";s:8:"pr_score";s:3:""O"";s:11:"her_two_rpt";s:93:"Weak to moderate complete membrane staining is observed in more than 10 % of the tumor cells.";s:13:"her_two_score";s:2:"2+";s:9:"er_result";s:8:"Negative";s:9:"pr_result";s:8:"Negative";s:14:"her_two_result";s:10:"Borderline";s:8:"rpt_noet";s:0:"";}i:3;a:23:{s:10:"her_two_id";s:3:"313";s:5:"sl_no";s:2:"08";s:7:"test_id";s:17:"MIHC14:-00252-254";s:10:"reciv_date";s:10:"06/01/2014";s:9:"deli_date";s:10:"12/01/2014";s:12:"current_date";s:10:"2014-01-06";s:12:"patient_name";s:19:"Mrs. Rasheda Akhter";s:3:"age";s:6:"26 Yrs";s:6:"ref_by";s:0:"";s:3:"sex";s:6:"Female";s:13:"hospital_name";s:33:"Chevron Clinical Lab , Chittagong";s:13:"specimen_name";s:44:"Tissue from left breast. Case No: MH13-24059";s:4:"note";s:126:"Result of Immunostaining  for ER, PR & HER-2 of Case No: MH13-24059,      Block No: (02    ) from DHL. Path. Lab. Dhaka. <br>";s:6:"er_rpt";s:59:"About 30 % of the tumor cell nuclei show moderate staining.";s:8:"er_score";s:7:"3+2=5/8";s:6:"pr_rpt";s:59:"About 15 % of the tumor cell nuclei show moderate staining.";s:8:"pr_score";s:7:"3+2=5/8";s:11:"her_two_rpt";s:93:"Weak to moderate complete membrane staining is observed in more than 10 % of the tumor cells.";s:13:"her_two_score";s:2:"2+";s:9:"er_result";s:8:"Positive";s:9:"pr_result";s:8:"Positive";s:14:"her_two_result";s:10:"Borderline";s:8:"rpt_noet";s:0:"";}i:4;a:23:{s:10:"her_two_id";s:3:"314";s:5:"sl_no";s:2:"09";s:7:"test_id";s:16:"MIHC14:00257-259";s:10:"reciv_date";s:10:"06/01/2014";s:9:"deli_date";s:10:"12/01/2014";s:12:"current_date";s:10:"2014-01-06";s:12:"patient_name";s:17:"Mrs. Rozina Islam";s:3:"age";s:6:"36 Yrs";s:6:"ref_by";s:47:"Tapesh Kumar Paul, FCPS, MS (Oncology Surgery).";s:3:"sex";s:6:"Female";s:13:"hospital_name";s:10:"DMCHL,-603";s:13:"specimen_name";s:56:"Rt. breast with axillary lymph node. Case No: MH14-00054";s:4:"note";s:124:"Result of Immunostaining  for ER, PR &amp; HER-2 of Case No: MH14-00054,     Block No: (03) from DHL. Path. Lab. Dhaka. <br>";s:6:"er_rpt";s:60:"About  20 % of the tumor cell nuclei show moderate staining.";s:8:"er_score";s:7:"3+2=5/8";s:6:"pr_rpt";s:59:"About 30 % of the tumor cell nuclei show moderate staining.";s:8:"pr_score";s:7:"3+2=5/8";s:11:"her_two_rpt";s:93:"Weak to moderate complete membrane staining is observed in more than 10 % of the tumor cells.";s:13:"her_two_score";s:2:"2+";s:9:"er_result";s:8:"Positive";s:9:"pr_result";s:8:"Positive";s:14:"her_two_result";s:10:"Borderline";s:8:"rpt_noet";s:0:"";}i:5;a:23:{s:10:"her_two_id";s:3:"315";s:5:"sl_no";s:2:"10";s:7:"test_id";s:16:"MIHC14:00296-298";s:10:"reciv_date";s:10:"08/01/2014";s:9:"deli_date";s:10:"12/01/2014";s:12:"current_date";s:10:"2014-01-08";s:12:"patient_name";s:14:"Mrs. Gul Nahar";s:3:"age";s:6:"42 Yrs";s:6:"ref_by";s:47:"Tapesh Kumar Paul, FCPS, MS (Oncology Surgery).";s:3:"sex";s:6:"Female";s:13:"hospital_name";s:14:"DHL, -W- 535/4";s:13:"specimen_name";s:43:"Tissue from Rt. Breast. Case No: MH14-192. ";s:4:"note";s:122:"Result of Immunostaining  for ER, PR &amp; HER-2 of Case No: MH14-192, Block No: (02) from DHL. Path. Lab. Dhaka. <br><br>";s:6:"er_rpt";s:59:"About 40 % of the tumor cell nuclei show moderate staining.";s:8:"er_score";s:7:"4+2=6/8";s:6:"pr_rpt";s:59:"About 45 % of the tumor cell nuclei show moderate staining.";s:8:"pr_score";s:7:"4+2=6/8";s:11:"her_two_rpt";s:84:" Weak incomplete membrane staining is observed in more than 10 % of the tumor cells.";s:13:"her_two_score";s:2:"1+";s:9:"er_result";s:8:"Positive";s:9:"pr_result";s:8:"Positive";s:14:"her_two_result";s:8:"Negative";s:8:"rpt_noet";s:0:"";}i:6;a:23:{s:10:"her_two_id";s:3:"375";s:5:"sl_no";s:2:"13";s:7:"test_id";s:16:"MIHC14:00399-401";s:10:"reciv_date";s:10:"11/01/2014";s:9:"deli_date";s:10:"19/01/2014";s:12:"current_date";s:10:"2014-01-11";s:12:"patient_name";s:21:"Mrs. Chemon Ara Begum";s:3:"age";s:6:"46 Yrs";s:6:"ref_by";s:51:"Lutfun Nahar. M.Phil, FCPS (Consultant oncologist).";s:3:"sex";s:6:"Female";s:13:"hospital_name";s:40:"Delta Medical College & Hospital. Dhaka.";s:13:"specimen_name";s:44:"Tissue from left breast. Case No: MH13-14208";s:4:"note";s:125:"Result of Immunostaining  for ER, PR &amp; HER-2 of Case No:      MH13-14208, Block No: (02) from DHL. Path. Lab. Dhaka. <br>";s:6:"er_rpt";s:59:"About 20 % of the tumor cell nuclei show moderate staining.";s:8:"er_score";s:7:"3+2=5/8";s:6:"pr_rpt";s:60:"About 30 %  of the tumor cell nuclei show moderate staining.";s:8:"pr_score";s:8:"3+2= 5/8";s:11:"her_two_rpt";s:83:"Weak incomplete membrane staining is observed in more than 10 % of the tumor cells.";s:13:"her_two_score";s:2:"1+";s:9:"er_result";s:8:"Positive";s:9:"pr_result";s:8:"Positive";s:14:"her_two_result";s:8:"Negative";s:8:"rpt_noet";s:0:"";}i:7;a:23:{s:10:"her_two_id";s:3:"376";s:5:"sl_no";s:2:"14";s:7:"test_id";s:16:"MIHC14:00513-515";s:10:"reciv_date";s:10:"12/01/2014";s:9:"deli_date";s:10:"19/01/2014";s:12:"current_date";s:10:"2014-01-12";s:12:"patient_name";s:12:"Diba Farhana";s:3:"age";s:6:"33 Yrs";s:6:"ref_by";s:37:"Md. Moarraf Hossen, MBBS, FCPS, DMRT.";s:3:"sex";s:6:"Female";s:13:"hospital_name";s:23:"LAB AID LIMITED. DHAKA.";s:13:"specimen_name";s:42:"Tissue from Rt. Breast.Case No: MH14-00111";s:4:"note";s:109:"Result of Immunostaining  for ER, PR &amp; HER-2 of Case No:      MH14-00111 from DHL. Path. Lab. Dhaka. <br>";s:6:"er_rpt";s:55:"About 05 % of the tumor cell nuclei show weak staining.";s:8:"er_score";s:9:"2+1 = 3/8";s:6:"pr_rpt";s:35:"Tumor cell nuclei show no staining.";s:8:"pr_score";s:3:""O"";s:11:"her_two_rpt";s:83:"Weak incomplete membrane staining is observed in more than 10 % of the tumor cells.";s:13:"her_two_score";s:2:"1+";s:9:"er_result";s:8:"Positive";s:9:"pr_result";s:8:"Negative";s:14:"her_two_result";s:8:"Negative";s:8:"rpt_noet";s:0:"";}i:8;a:23:{s:10:"her_two_id";s:3:"377";s:5:"sl_no";s:2:"16";s:7:"test_id";s:16:"MIHC14:00545-547";s:10:"reciv_date";s:10:"13/01/2014";s:9:"deli_date";s:10:"19/01/2014";s:12:"current_date";s:10:"2014-01-13";s:12:"patient_name";s:18:"Most. Zahura Begum";s:3:"age";s:6:"56 Yrs";s:6:"ref_by";s:0:"";s:3:"sex";s:6:"Female";s:13:"hospital_name";s:83:"Rangpur Swadesh Hospital (Pvt.) Ltd.(Corporate Name: New Swadesh Hospital, Rangpur)";s:13:"specimen_name";s:40:"Tissue from breast. Case No : MH14-00144";s:4:"note";s:126:"Result of Immunostaining  for ER, PR &amp; HER-2 of Case No:      MH14-00144 , Block No: (02) from DHL. Path. Lab. Dhaka. <br>";s:6:"er_rpt";s:59:"About 60 % of the tumor cell nuclei show moderate staining.";s:8:"er_score";s:7:"4+2=6/8";s:6:"pr_rpt";s:59:"About 15 % of the tumor cell nuclei show moderate staining.";s:8:"pr_score";s:8:"3+2= 5/8";s:11:"her_two_rpt";s:83:"Weak incomplete membrane staining is observed in more than 10 % of the tumor cells.";s:13:"her_two_score";s:2:"1+";s:9:"er_result";s:8:"Positive";s:9:"pr_result";s:8:"Positive";s:14:"her_two_result";s:8:"Negative";s:8:"rpt_noet";s:0:"";}i:9;a:23:{s:10:"her_two_id";s:3:"378";s:5:"sl_no";s:2:"20";s:7:"test_id";s:16:"MIHC14:00741-743";s:10:"reciv_date";s:10:"16/01/2014";s:9:"deli_date";s:10:"19/01/2014";s:12:"current_date";s:10:"2014-01-16";s:12:"patient_name";s:12:"Purobi Sinha";s:3:"age";s:6:"41 Yrs";s:6:"ref_by";s:0:"";s:3:"sex";s:6:"Female";s:13:"hospital_name";s:32:"Nirmoy Diagnostic Centre, Sylhet";s:13:"specimen_name";s:61:"Tissue from breast lump and Lymph nodes. Case No: MH14-00694.";s:4:"note";s:126:"Result of Immunostaining  for ER, PR &amp; HER-2 of Case No: MH14-694.      Block No: (    A) from DHL. Path. Lab. Dhaka. <br>";s:6:"er_rpt";s:35:"Tumor cell nuclei show no staining.";s:8:"er_score";s:3:""O"";s:6:"pr_rpt";s:35:"Tumor cell nuclei show no staining.";s:8:"pr_score";s:3:""O"";s:11:"her_two_rpt";s:83:"Weak incomplete membrane staining is observed in more than 10 % of the tumor cells.";s:13:"her_two_score";s:2:"1+";s:9:"er_result";s:8:"Negative";s:9:"pr_result";s:8:"Negative";s:14:"her_two_result";s:8:"Negative";s:8:"rpt_noet";s:0:"";}i:10;a:23:{s:10:"her_two_id";s:3:"440";s:5:"sl_no";s:3:"022";s:7:"test_id";s:16:"MIHC14:00794-796";s:10:"reciv_date";s:10:"16/01/2014";s:9:"deli_date";s:10:"26/01/2014";s:12:"current_date";s:10:"2014-01-16";s:12:"patient_name";s:18:"Mrs. Rezia Khatun.";s:3:"age";s:6:"45 Yrs";s:6:"ref_by";s:47:"Tapesh Kumar Paul, FCPS, MS (Oncology Surgery).";s:3:"sex";s:6:"Female";s:13:"hospital_name";s:12:"DHL, W-535/3";s:13:"specimen_name";s:45:"Mastectomy specimen (Lt.) Case No: MH14-00512";s:4:"note";s:128:"Result of Immunostaining  for ER, PR &amp; HER-2 of Case No:MH14-00512,      Block No: (03    ) from DHL. Path. Lab. Dhaka. <br>";s:6:"er_rpt";s:49:"<1 % of the tumor cell nuclei show weak staining.";s:8:"er_score";s:7:"1+1=2/8";s:6:"pr_rpt";s:49:"<1 % of the tumor cell nuclei show weak staining.";s:8:"pr_score";s:7:"1+1=2/8";s:11:"her_two_rpt";s:83:"Weak incomplete membrane staining is observed in more than 10 % of the tumor cells.";s:13:"her_two_score";s:2:"1+";s:9:"er_result";s:8:"Negative";s:9:"pr_result";s:8:"Negative";s:14:"her_two_result";s:8:"Negative";s:8:"rpt_noet";s:0:"";}i:11;a:23:{s:10:"her_two_id";s:3:"441";s:5:"sl_no";s:3:"023";s:7:"test_id";s:16:"MIHC14:00798-800";s:10:"reciv_date";s:10:"16/01/2014";s:9:"deli_date";s:10:"26/01/2014";s:12:"current_date";s:10:"2014-01-16";s:12:"patient_name";s:18:"Mrs. Shirin Akhter";s:3:"age";s:6:"32 Yrs";s:6:"ref_by";s:47:"Tapesh Kumar Paul, FCPS, MS (Oncology Surgery).";s:3:"sex";s:6:"Female";s:13:"hospital_name";s:3:"DHL";s:13:"specimen_name";s:47:"Tissue from Rt. breast. Case No: MH14-00457 F-G";s:4:"note";s:120:"Result of Immunostaining  for ER, PR &amp; HER-2 of Case No: MH14-00457 Block No: (F-G) from DHL. Path. Lab. Dhaka. <br>";s:6:"er_rpt";s:59:"About 40 % of the tumor cell nuclei show moderate staining.";s:8:"er_score";s:7:"4+2=6/8";s:6:"pr_rpt";s:59:"About 60 % of the tumor cell nuclei show moderate staining.";s:8:"pr_score";s:7:"4+2=6/8";s:11:"her_two_rpt";s:83:"Strong complete membrane staining is observed in more than 30 % of the tumor cells.";s:13:"her_two_score";s:2:"3+";s:9:"er_result";s:8:"Positive";s:9:"pr_result";s:8:"Positive";s:14:"her_two_result";s:8:"Positive";s:8:"rpt_noet";s:0:"";}i:12;a:23:{s:10:"her_two_id";s:3:"442";s:5:"sl_no";s:3:"024";s:7:"test_id";s:16:"MIHC14:00840-842";s:10:"reciv_date";s:10:"18/01/2014";s:9:"deli_date";s:10:"26/01/2014";s:12:"current_date";s:10:"2014-01-18";s:12:"patient_name";s:13:"Mrs. Gulbahar";s:3:"age";s:6:"40 Yrs";s:6:"ref_by";s:12:"Sohel Iqbal.";s:3:"sex";s:6:"Female";s:13:"hospital_name";s:42:"Rose Clinic and Diagnostic Centre, Savar. ";s:13:"specimen_name";s:44:"Tissue from breast lump. Case No: MH13-24092";s:4:"note";s:124:"Result of Immunostaining  for ER, PR &amp; HER-2 of Case No:      MH13-24092, Block No: (02) from DHL. Path. Lab. Dhaka.<br>";s:6:"er_rpt";s:35:"Tumor cell nuclei show no staining.";s:8:"er_score";s:3:""O"";s:6:"pr_rpt";s:35:"Tumor cell nuclei show no staining.";s:8:"pr_score";s:3:""O"";s:11:"her_two_rpt";s:93:"Weak to moderate complete membrane staining is observed in more than 10 % of the tumor cells.";s:13:"her_two_score";s:2:"2+";s:9:"er_result";s:9:"Negative.";s:9:"pr_result";s:9:"Negative.";s:14:"her_two_result";s:11:"Borderline.";s:8:"rpt_noet";s:0:"";}i:13;a:23:{s:10:"her_two_id";s:3:"443";s:5:"sl_no";s:3:"025";s:7:"test_id";s:16:"MIHC14:00867-869";s:10:"reciv_date";s:10:"18/01/2014";s:9:"deli_date";s:10:"19/01/2014";s:12:"current_date";s:10:"2014-01-18";s:12:"patient_name";s:20:"Mr. Md. Jashim Uddin";s:3:"age";s:6:"49 Yrs";s:6:"ref_by";s:48:"M.N.Huda, Principle, Cheaf Consultant, Oncology.";s:3:"sex";s:4:"Male";s:13:"hospital_name";s:3:"DHL";s:13:"specimen_name";s:51:"Tissue from cervical lymph node. Case No: MH14-237 ";s:4:"note";s:96:"Result of Immunostaining  for ER, PR &amp; HER-2 of Case No: MH14-237 ,&nbsp; Block No: (01)<br>";s:6:"er_rpt";s:117:"About _______ %/ <1 % of the tumor cell nuclei show weak/moderate/strong staining/Tumor cell nuclei show no staining.";s:8:"er_score";s:6:"   / 8";s:6:"pr_rpt";s:118:"About _______%/ <1  %  of the tumor cell nuclei show weak/moderate/strong staining/Tumor cell nuclei show no staining.";s:8:"pr_score";s:9:"      / 8";s:11:"her_two_rpt";s:0:"";s:13:"her_two_score";s:12:"Select Score";s:9:"er_result";s:17:"Negative/Positive";s:9:"pr_result";s:17:"Negative/Positive";s:14:"her_two_result";s:28:"Negative/Positive/Borderline";s:8:"rpt_noet";s:0:"";}i:14;a:23:{s:10:"her_two_id";s:3:"444";s:5:"sl_no";s:3:"026";s:7:"test_id";s:16:"MIHC14:00934-936";s:10:"reciv_date";s:10:"19/01/2014";s:9:"deli_date";s:10:"26/01/2014";s:12:"current_date";s:10:"2014-01-19";s:12:"patient_name";s:11:"Mrs. Josna ";s:3:"age";s:6:"36 Yrs";s:6:"ref_by";s:47:"Parvin Akhter Banu (Chief Consultant, Oncology)";s:3:"sex";s:6:"Female";s:13:"hospital_name";s:11:"DHL, Dhaka.";s:13:"specimen_name";s:44:"Tissue from Rt. Breast. Case No: MH14-00004 ";s:4:"note";s:121:"Result of Immunostaining  for ER, PR &amp; HER-2 of Case No: MH14-00004 , Block No: (01) from DHL. Path. Lab. Dhaka. <br>";s:6:"er_rpt";s:59:"About 20 % of the tumor cell nuclei show moderate staining.";s:8:"er_score";s:7:"3+2=5/8";s:6:"pr_rpt";s:59:"About 50 % of the tumor cell nuclei show moderate staining.";s:8:"pr_score";s:7:"4+2=6/8";s:11:"her_two_rpt";s:94:" Weak to moderate complete membrane staining is observed in more than 10 % of the tumor cells.";s:13:"her_two_score";s:2:"2+";s:9:"er_result";s:8:"Positive";s:9:"pr_result";s:8:"Positive";s:14:"her_two_result";s:10:"Borderline";s:8:"rpt_noet";s:0:"";}i:15;a:23:{s:10:"her_two_id";s:3:"445";s:5:"sl_no";s:3:"027";s:7:"test_id";s:16:"MIHC14:00940-942";s:10:"reciv_date";s:10:"19/01/2014";s:9:"deli_date";s:10:"26/01/2014";s:12:"current_date";s:10:"2014-01-19";s:12:"patient_name";s:16:"Mrs. Asma Rahman";s:3:"age";s:6:"57 Yrs";s:6:"ref_by";s:47:"Tapesh Kumar Paul, FCPS, MS (Oncology Surgery).";s:3:"sex";s:6:"Female";s:13:"hospital_name";s:11:"DHL, C-605.";s:13:"specimen_name";s:44:"Tissue from left breast. Case No: MH14-00695";s:4:"note";s:131:"Result of Immunostaining  for ER, PR &amp; HER-2 of Case No: MH14-00695,&nbsp;      Block No: (01) from DHL. Path. Lab. Dhaka. <br>";s:6:"er_rpt";s:55:"About 03 % of the tumor cell nuclei show weak staining.";s:8:"er_score";s:9:"2+1 = 3/8";s:6:"pr_rpt";s:35:"Tumor cell nuclei show no staining.";s:8:"pr_score";s:3:""O"";s:11:"her_two_rpt";s:83:"Strong complete membrane staining is observed in more than 30 % of the tumor cells.";s:13:"her_two_score";s:2:"3+";s:9:"er_result";s:8:"Positive";s:9:"pr_result";s:8:"Negative";s:14:"her_two_result";s:8:"Positive";s:8:"rpt_noet";s:0:"";}i:16;a:23:{s:10:"her_two_id";s:3:"446";s:5:"sl_no";s:3:"029";s:7:"test_id";s:16:"MIHC14:01005-007";s:10:"reciv_date";s:10:"20/01/2014";s:9:"deli_date";s:10:"26/01/2014";s:12:"current_date";s:10:"2014-01-20";s:12:"patient_name";s:17:"Mrs. Laila Khanom";s:3:"age";s:6:"50 Yrs";s:6:"ref_by";s:0:"";s:3:"sex";s:6:"Female";s:13:"hospital_name";s:29:"Good Health Hospital, Rangpur";s:13:"specimen_name";s:49:"Tissue from left breast lump. Case No: MH13-24358";s:4:"note";s:132:"Result of Immunostaining  for ER, PR &amp; HER-2 of Case No: MH13-24358 ,&nbsp;      Block No: (01) form DHL. Path. Lab. Dhaka. <br>";s:6:"er_rpt";s:59:"About 30 % of the tumor cell nuclei show moderate staining.";s:8:"er_score";s:7:"3+2=5/8";s:6:"pr_rpt";s:59:"About 30 % of the tumor cell nuclei show moderate staining.";s:8:"pr_score";s:8:"3+2= 5/8";s:11:"her_two_rpt";s:94:" Weak to moderate complete membrane staining is observed in more than 10 % of the tumor cells.";s:13:"her_two_score";s:2:"2+";s:9:"er_result";s:8:"Positive";s:9:"pr_result";s:8:"Positive";s:14:"her_two_result";s:10:"Borderline";s:8:"rpt_noet";s:0:"";}i:17;a:23:{s:10:"her_two_id";s:3:"447";s:5:"sl_no";s:3:"030";s:7:"test_id";s:16:"MIHC14:01091-093";s:10:"reciv_date";s:10:"22/01/2014";s:9:"deli_date";s:10:"26/01/2014";s:12:"current_date";s:10:"2014-01-22";s:12:"patient_name";s:17:"Mrs. Shanaz Begum";s:3:"age";s:6:"46 Yrs";s:6:"ref_by";s:47:"Tapesh Kumar Paul, FCPS, MS (Oncology Surgery).";s:3:"sex";s:6:"Female";s:13:"hospital_name";s:10:"DHL, C-507";s:13:"specimen_name";s:42:"Tissue from Lt. breast. Case No: MH14-862.";s:4:"note";s:125:"Result of Immunostaining  for ER, PR &amp; HER-2 of Case No: MH14-862, Block No: (F-G)&nbsp; from DHL. Path. Lab. Dhaka. <br>";s:6:"er_rpt";s:35:"Tumor cell nuclei show no staining.";s:8:"er_score";s:3:""O"";s:6:"pr_rpt";s:35:"Tumor cell nuclei show no staining.";s:8:"pr_score";s:3:""O"";s:11:"her_two_rpt";s:93:"Weak to moderate complete membrane staining is observed in more than 10 % of the tumor cells.";s:13:"her_two_score";s:2:"2+";s:9:"er_result";s:8:"Negative";s:9:"pr_result";s:8:"Negative";s:14:"her_two_result";s:10:"Borderline";s:8:"rpt_noet";s:0:"";}i:18;a:23:{s:10:"her_two_id";s:3:"500";s:5:"sl_no";s:3:"300";s:7:"test_id";s:16:"MIHC13:14303-305";s:10:"reciv_date";s:10:"29/01/2014";s:9:"deli_date";s:10:"04/08/2013";s:12:"current_date";s:10:"2014-01-29";s:12:"patient_name";s:7:"Mariyam";s:3:"age";s:6:"35 Yrs";s:6:"ref_by";s:45:"Md. Setabur Rahman, MS (S), Surgical Oncology";s:3:"sex";s:6:"Female";s:13:"hospital_name";s:23:"NICRH, Mohakhali, Dhaka";s:13:"specimen_name";s:23:"Tissue from Rt. Breast.";s:4:"note";s:125:"Result of Immunostaining  for ER, PR &amp; HER-2 of Case No: MH13-12384,      Block No: (02) from DHL, Path. Lab. Dhaka. <br>";s:6:"er_rpt";s:49:"<1 % of the tumor cell nuclei show weak staining.";s:8:"er_score";s:7:"1+1=2/8";s:6:"pr_rpt";s:49:"<1 % of the tumor cell nuclei show weak staining.";s:8:"pr_score";s:7:"1+1=2/8";s:11:"her_two_rpt";s:83:"Weak incomplete membrane staining is observed in more than 10 % of the tumor cells.";s:13:"her_two_score";s:2:"1+";s:9:"er_result";s:8:"Negative";s:9:"pr_result";s:8:"Negative";s:14:"her_two_result";s:8:"Negative";s:8:"rpt_noet";s:0:"";}i:19;a:23:{s:10:"her_two_id";s:3:"505";s:5:"sl_no";s:3:"031";s:7:"test_id";s:16:"MIHC14:01262-264";s:10:"reciv_date";s:10:"26/01/2014";s:9:"deli_date";s:10:"02/02/2014";s:12:"current_date";s:10:"2014-01-26";s:12:"patient_name";s:19:"Mrs. Jahanara Begum";s:3:"age";s:6:"45 Yrs";s:6:"ref_by";s:63:"Naheed Rukhsana , FCPS, (Radiotherapy), Consultant. oncologist.";s:3:"sex";s:6:"Female";s:13:"hospital_name";s:40:"Delta Medical College & Hospital. Dhaka.";s:13:"specimen_name";s:46:"Tissue from left breast. Case No: MH14-00263, ";s:4:"note";s:120:"Result of Immunostaining  for ER, PR &amp; HER-2 of Case No: MH14-00263, Block No: (02) from DHL, Path. Lab. Dhaka. <br>";s:6:"er_rpt";s:55:"About 03 % of the tumor cell nuclei show weak staining.";s:8:"er_score";s:7:"2+1=3/8";s:6:"pr_rpt";s:35:"Tumor cell nuclei show no staining.";s:8:"pr_score";s:3:""O"";s:11:"her_two_rpt";s:93:"Weak to moderate complete membrane staining is observed in more than 10 % of the tumor cells.";s:13:"her_two_score";s:2:"2+";s:9:"er_result";s:8:"Positive";s:9:"pr_result";s:8:"Negative";s:14:"her_two_result";s:10:"Borderline";s:8:"rpt_noet";s:0:"";}i:20;a:23:{s:10:"her_two_id";s:3:"506";s:5:"sl_no";s:3:"034";s:7:"test_id";s:16:"MIHC14:01397-399";s:10:"reciv_date";s:10:"27/01/2014";s:9:"deli_date";s:10:"02/02/2014";s:12:"current_date";s:10:"2014-01-27";s:12:"patient_name";s:12:"Mrs. Hasina ";s:3:"age";s:6:"65 Yrs";s:6:"ref_by";s:0:"";s:3:"sex";s:6:"Female";s:13:"hospital_name";s:26:"CSCR Hospital , Chittagong";s:13:"specimen_name";s:50:"Tissue from Mastectomy specimen. Case No: MH14-764";s:4:"note";s:123:"Result of Immunostaining  for ER, PR &amp; HER-2 of Case No:      MH14-764, Block No: (01) from DHL, Path. Lab. Dhaka. <br>";s:6:"er_rpt";s:59:"About 15 % of the tumor cell nuclei show moderate staining.";s:8:"er_score";s:8:"3+2= 5/8";s:6:"pr_rpt";s:55:"About 02 % of the tumor cell nuclei show weak staining.";s:8:"pr_score";s:7:"2+1=3/8";s:11:"her_two_rpt";s:83:"Strong complete membrane staining is observed in more than 30 % of the tumor cells.";s:13:"her_two_score";s:2:"3+";s:9:"er_result";s:8:"Positive";s:9:"pr_result";s:15:"Positive (Weak)";s:14:"her_two_result";s:8:"Positive";s:8:"rpt_noet";s:0:"";}i:21;a:23:{s:10:"her_two_id";s:3:"507";s:5:"sl_no";s:3:"035";s:7:"test_id";s:16:"MIHC14:01465-467";s:10:"reciv_date";s:10:"27/01/2014";s:9:"deli_date";s:10:"02/02/2014";s:12:"current_date";s:10:"2014-01-27";s:12:"patient_name";s:18:"Mrs. Panna Rahman ";s:3:"age";s:6:"45 Yrs";s:6:"ref_by";s:0:"";s:3:"sex";s:6:"Female";s:13:"hospital_name";s:47:"Institute of Laser Surgery & Hospital , Dhaka. ";s:13:"specimen_name";s:44:"Tissue from breast lump, Case No: MH14-01227";s:4:"note";s:124:"Result of Immunostaining  for ER, PR &amp; HER-2 of Case No: MH14-01227,     Block No: (01) from DHL, Path. Lab, Dhaka. <br>";s:6:"er_rpt";s:59:"About 65 % of the tumor cell nuclei show moderate staining.";s:8:"er_score";s:7:"4+2=6/8";s:6:"pr_rpt";s:60:"About 60 %  of the tumor cell nuclei show moderate staining.";s:8:"pr_score";s:9:"4+2= 6/ 8";s:11:"her_two_rpt";s:93:"Weak to moderate complete membrane staining is observed in more than 10 % of the tumor cells.";s:13:"her_two_score";s:2:"2+";s:9:"er_result";s:8:"Positive";s:9:"pr_result";s:8:"Positive";s:14:"her_two_result";s:10:"Borderline";s:8:"rpt_noet";s:0:"";}i:22;a:23:{s:10:"her_two_id";s:3:"508";s:5:"sl_no";s:3:"036";s:7:"test_id";s:16:"MIHC14:01468-470";s:10:"reciv_date";s:10:"27/01/2014";s:9:"deli_date";s:10:"02/02/2014";s:12:"current_date";s:10:"2014-01-27";s:12:"patient_name";s:9:"Mrs. Nipa";s:3:"age";s:6:"40 Yrs";s:6:"ref_by";s:56:"Md. Moarraf Hossen, MBBS, FCPS, DMRT (Cancer Specialist)";s:3:"sex";s:6:"Female";s:13:"hospital_name";s:19:"Lab Aid Ltd., Dhaka";s:13:"specimen_name";s:44:"Tissue from left breast. Case No: MH14-01437";s:4:"note";s:127:"Result of Immunostaining  for ER, PR &amp; HER-2 of Case No:      MH14-01437 , Block No: (02) from DHL, Path. Lab . Dhaka. <br>";s:6:"er_rpt";s:60:"About 60 %  of the tumor cell nuclei show moderate staining.";s:8:"er_score";s:8:"4+2 =6/8";s:6:"pr_rpt";s:60:"About 70 %  of the tumor cell nuclei show moderate staining.";s:8:"pr_score";s:7:"5+2=7/8";s:11:"her_two_rpt";s:83:"Weak incomplete membrane staining is observed in more than 10 % of the tumor cells.";s:13:"her_two_score";s:2:"1+";s:9:"er_result";s:8:"Positive";s:9:"pr_result";s:8:"Positive";s:14:"her_two_result";s:8:"Negative";s:8:"rpt_noet";s:0:"";}i:23;a:23:{s:10:"her_two_id";s:3:"509";s:5:"sl_no";s:3:"037";s:7:"test_id";s:16:"MIHC14:01553-555";s:10:"reciv_date";s:10:"29/01/2014";s:9:"deli_date";s:10:"02/02/2014";s:12:"current_date";s:10:"2014-01-29";s:12:"patient_name";s:15:"Mrs. Nurus Safa";s:3:"age";s:6:"32 Yrs";s:6:"ref_by";s:30:"Sagorika Sharmin (Sagor), FCPS";s:3:"sex";s:6:"Female";s:13:"hospital_name";s:40:"Lancet Diagnostic & Research, Chittagong";s:13:"specimen_name";s:56:"Tissue from Mastectomy specimen (Rt.), Case No: MH14-930";s:4:"note";s:123:"Result of Immunostaining  for ER, PR &amp; HER-2 of Case No:      MH14-930 , Block No: (02) from DHL, Path. Lab. Dhaka.<br>";s:6:"er_rpt";s:35:"Tumor cell nuclei show no staining.";s:8:"er_score";s:3:""O"";s:6:"pr_rpt";s:35:"Tumor cell nuclei show no staining.";s:8:"pr_score";s:3:""O"";s:11:"her_two_rpt";s:85:"Weak incomplete membrane staining is observed in more than 10 % of the tumor cells.
";s:13:"her_two_score";s:2:"1+";s:9:"er_result";s:8:"Negative";s:9:"pr_result";s:8:"Negative";s:14:"her_two_result";s:8:"Negative";s:8:"rpt_noet";s:0:"";}i:24;a:23:{s:10:"her_two_id";s:3:"510";s:5:"sl_no";s:3:"038";s:7:"test_id";s:16:"MIHC14:01579-581";s:10:"reciv_date";s:10:"29/01/2014";s:9:"deli_date";s:10:"02/02/2014";s:12:"current_date";s:10:"2014-01-29";s:12:"patient_name";s:9:"Mrs. Mita";s:3:"age";s:6:"44 Yrs";s:6:"ref_by";s:0:"";s:3:"sex";s:6:"Female";s:13:"hospital_name";s:39:"Metro Diagnostic Centre Ltd. Chittagong";s:13:"specimen_name";s:44:"Tissue from left breast. Case No:  MH14-1102";s:4:"note";s:129:"Result of Immunostaining  for ER, PR &amp; HER-2 of Case No: MH14-1102,&nbsp;     Block No: (02) from DHL, Path. Lab. Dhaka. <br>";s:6:"er_rpt";s:59:"About 50 % of the tumor cell nuclei show moderate staining.";s:8:"er_score";s:9:"4+2 =/6 8";s:6:"pr_rpt";s:59:"About 70 % of the tumor cell nuclei show moderate staining.";s:8:"pr_score";s:7:"5+2=7/8";s:11:"her_two_rpt";s:93:"Weak to moderate complete membrane staining is observed in more than 10 % of the tumor cells.";s:13:"her_two_score";s:2:"2+";s:9:"er_result";s:8:"Positive";s:9:"pr_result";s:8:"Positive";s:14:"her_two_result";s:10:"Borderline";s:8:"rpt_noet";s:0:"";}i:25;a:23:{s:10:"her_two_id";s:3:"511";s:5:"sl_no";s:3:"041";s:7:"test_id";s:12:"MIHC14:01283";s:10:"reciv_date";s:10:"25/01/2014";s:9:"deli_date";s:10:"03/02/2014";s:12:"current_date";s:10:"2014-01-25";s:12:"patient_name";s:19:"Mrs. Jahanara Begum";s:3:"age";s:6:"65 Yrs";s:6:"ref_by";s:5:"Self ";s:3:"sex";s:6:"Female";s:13:"hospital_name";s:0:"";s:13:"specimen_name";s:73:"Two H & E stained slides and 01 (One) paraffin block received for review.";s:4:"note";s:88:"Result of Immunostaining  for ER, PR &amp; HER-2 of Case No:      ___Block No: (___    )";s:6:"er_rpt";s:117:"About _______ %/ <1 % of the tumor cell nuclei show weak/moderate/strong staining/Tumor cell nuclei show no staining.";s:8:"er_score";s:6:"   / 8";s:6:"pr_rpt";s:118:"About _______%/ <1  %  of the tumor cell nuclei show weak/moderate/strong staining/Tumor cell nuclei show no staining.";s:8:"pr_score";s:9:"      / 8";s:11:"her_two_rpt";s:0:"";s:13:"her_two_score";s:12:"Select Score";s:9:"er_result";s:17:"Negative/Positive";s:9:"pr_result";s:17:"Negative/Positive";s:14:"her_two_result";s:28:"Negative/Positive/Borderline";s:8:"rpt_noet";s:0:"";}i:26;a:23:{s:10:"her_two_id";s:3:"512";s:5:"sl_no";s:3:"023";s:7:"test_id";s:12:"MIHC14:00457";s:10:"reciv_date";s:10:"11/01/2014";s:9:"deli_date";s:10:"03/02/2014";s:12:"current_date";s:10:"2014-01-11";s:12:"patient_name";s:19:"Mrs. Shirin Akhter ";s:3:"age";s:6:"32 Yrs";s:6:"ref_by";s:47:"Tapesh Kumar Paul, FCPS, MS (Oncology Surgery).";s:3:"sex";s:6:"Female";s:13:"hospital_name";s:10:"DHL, C-518";s:13:"specimen_name";s:24:"Tissue from Rt. breast. ";s:4:"note";s:88:"Result of Immunostaining  for ER, PR &amp; HER-2 of Case No:___      Block No: (___    )";s:6:"er_rpt";s:117:"About _______ %/ <1 % of the tumor cell nuclei show weak/moderate/strong staining/Tumor cell nuclei show no staining.";s:8:"er_score";s:6:"   / 8";s:6:"pr_rpt";s:118:"About _______%/ <1  %  of the tumor cell nuclei show weak/moderate/strong staining/Tumor cell nuclei show no staining.";s:8:"pr_score";s:9:"      / 8";s:11:"her_two_rpt";s:0:"";s:13:"her_two_score";s:12:"Select Score";s:9:"er_result";s:17:"Negative/Positive";s:9:"pr_result";s:17:"Negative/Positive";s:14:"her_two_result";s:28:"Negative/Positive/Borderline";s:8:"rpt_noet";s:0:"";}}s:13:"result_object";a:27:{i:0;O:8:"stdClass":23:{s:10:"her_two_id";s:3:"267";s:5:"sl_no";s:3:"001";s:7:"test_id";s:16:"MIHC14:00051-053";s:10:"reciv_date";s:10:"01/01/2014";s:9:"deli_date";s:10:"05/01/2014";s:12:"current_date";s:10:"2014-01-01";s:12:"patient_name";s:15:"Mrs. Rina Akter";s:3:"age";s:6:"48 Yrs";s:6:"ref_by";s:32:"Kazi iftekhar Uddin Ahmed, FCPS ";s:3:"sex";s:6:"Female";s:13:"hospital_name";s:40:"Ashic Oncology & Palliative Care Centre.";s:13:"specimen_name";s:59:"(Tissue from breast.) One paraffin block. Case No: D119377 ";s:4:"note";s:142:"Result of Immunostaining  for ER, PR &amp; HER-2 of Case No:D119377, Block No: (T1) from IBN-SINA Diagnostic &amp; Imaging Center. Dhaka. <br>";s:6:"er_rpt";s:49:"<1 % of the tumor cell nuclei show weak staining.";s:8:"er_score";s:7:"1+1=2/8";s:6:"pr_rpt";s:49:"<1 % of the tumor cell nuclei show weak staining.";s:8:"pr_score";s:7:"1+1=2/8";s:11:"her_two_rpt";s:84:"`Strong complete membrane staining is observed in more than 30 % of the tumor cells.";s:13:"her_two_score";s:2:"3+";s:9:"er_result";s:8:"Negative";s:9:"pr_result";s:8:"Negative";s:14:"her_two_result";s:8:"Positive";s:8:"rpt_noet";s:0:"";}i:1;O:8:"stdClass":23:{s:10:"her_two_id";s:3:"268";s:5:"sl_no";s:3:"002";s:7:"test_id";s:16:"MIHC14:00062-064";s:10:"reciv_date";s:10:"01/01/2014";s:9:"deli_date";s:10:"05/01/2014";s:12:"current_date";s:10:"2014-01-01";s:12:"patient_name";s:17:"Md. Amir Hossain ";s:3:"age";s:6:"18 Yrs";s:6:"ref_by";s:22:"Md. Mukitul Huda FCPS.";s:3:"sex";s:4:"Male";s:13:"hospital_name";s:10:"DHL, 316/D";s:13:"specimen_name";s:63:"Tissue from cervical lymph node.(Lt. side). Case No: MH13-24354";s:4:"note";s:124:"Result of Immunostaining  for ER, PR &amp; HER-2 of Case No:MH13-24354,      Block No: (02) from DHL. Path. Lab. Dhaka. <br>";s:6:"er_rpt";s:117:"About _______ %/ <1 % of the tumor cell nuclei show weak/moderate/strong staining/Tumor cell nuclei show no staining.";s:8:"er_score";s:6:"   / 8";s:6:"pr_rpt";s:118:"About _______%/ <1  %  of the tumor cell nuclei show weak/moderate/strong staining/Tumor cell nuclei show no staining.";s:8:"pr_score";s:9:"      / 8";s:11:"her_two_rpt";s:0:"";s:13:"her_two_score";s:12:"Select Score";s:9:"er_result";s:17:"Negative/Positive";s:9:"pr_result";s:17:"Negative/Positive";s:14:"her_two_result";s:28:"Negative/Positive/Borderline";s:8:"rpt_noet";s:0:"";}i:2;O:8:"stdClass":23:{s:10:"her_two_id";s:3:"312";s:5:"sl_no";s:2:"06";s:7:"test_id";s:16:"MIHC14:00205-207";s:10:"reciv_date";s:10:"05/01/2014";s:9:"deli_date";s:10:"12/01/2014";s:12:"current_date";s:10:"2014-01-05";s:12:"patient_name";s:18:"Mrs. Shahida Hamid";s:3:"age";s:6:"45 Yrs";s:6:"ref_by";s:47:"Tapesh Kumar Paul, FCPS, MS (Oncology Surgery).";s:3:"sex";s:6:"Female";s:13:"hospital_name";s:10:"DHL, C-518";s:13:"specimen_name";s:53:"Rt. breast with axillary lymph node. Case No: MH14-35";s:4:"note";s:122:"Result of Immunostaining  for ER, PR &amp; HER-2 of Case No:      MH14-35, Block No: (01) from DHL, Path. Lab. Dhaka. <br>";s:6:"er_rpt";s:35:"Tumor cell nuclei show no staining.";s:8:"er_score";s:3:""O"";s:6:"pr_rpt";s:35:"Tumor cell nuclei show no staining.";s:8:"pr_score";s:3:""O"";s:11:"her_two_rpt";s:93:"Weak to moderate complete membrane staining is observed in more than 10 % of the tumor cells.";s:13:"her_two_score";s:2:"2+";s:9:"er_result";s:8:"Negative";s:9:"pr_result";s:8:"Negative";s:14:"her_two_result";s:10:"Borderline";s:8:"rpt_noet";s:0:"";}i:3;O:8:"stdClass":23:{s:10:"her_two_id";s:3:"313";s:5:"sl_no";s:2:"08";s:7:"test_id";s:17:"MIHC14:-00252-254";s:10:"reciv_date";s:10:"06/01/2014";s:9:"deli_date";s:10:"12/01/2014";s:12:"current_date";s:10:"2014-01-06";s:12:"patient_name";s:19:"Mrs. Rasheda Akhter";s:3:"age";s:6:"26 Yrs";s:6:"ref_by";s:0:"";s:3:"sex";s:6:"Female";s:13:"hospital_name";s:33:"Chevron Clinical Lab , Chittagong";s:13:"specimen_name";s:44:"Tissue from left breast. Case No: MH13-24059";s:4:"note";s:126:"Result of Immunostaining  for ER, PR & HER-2 of Case No: MH13-24059,      Block No: (02    ) from DHL. Path. Lab. Dhaka. <br>";s:6:"er_rpt";s:59:"About 30 % of the tumor cell nuclei show moderate staining.";s:8:"er_score";s:7:"3+2=5/8";s:6:"pr_rpt";s:59:"About 15 % of the tumor cell nuclei show moderate staining.";s:8:"pr_score";s:7:"3+2=5/8";s:11:"her_two_rpt";s:93:"Weak to moderate complete membrane staining is observed in more than 10 % of the tumor cells.";s:13:"her_two_score";s:2:"2+";s:9:"er_result";s:8:"Positive";s:9:"pr_result";s:8:"Positive";s:14:"her_two_result";s:10:"Borderline";s:8:"rpt_noet";s:0:"";}i:4;O:8:"stdClass":23:{s:10:"her_two_id";s:3:"314";s:5:"sl_no";s:2:"09";s:7:"test_id";s:16:"MIHC14:00257-259";s:10:"reciv_date";s:10:"06/01/2014";s:9:"deli_date";s:10:"12/01/2014";s:12:"current_date";s:10:"2014-01-06";s:12:"patient_name";s:17:"Mrs. Rozina Islam";s:3:"age";s:6:"36 Yrs";s:6:"ref_by";s:47:"Tapesh Kumar Paul, FCPS, MS (Oncology Surgery).";s:3:"sex";s:6:"Female";s:13:"hospital_name";s:10:"DMCHL,-603";s:13:"specimen_name";s:56:"Rt. breast with axillary lymph node. Case No: MH14-00054";s:4:"note";s:124:"Result of Immunostaining  for ER, PR &amp; HER-2 of Case No: MH14-00054,     Block No: (03) from DHL. Path. Lab. Dhaka. <br>";s:6:"er_rpt";s:60:"About  20 % of the tumor cell nuclei show moderate staining.";s:8:"er_score";s:7:"3+2=5/8";s:6:"pr_rpt";s:59:"About 30 % of the tumor cell nuclei show moderate staining.";s:8:"pr_score";s:7:"3+2=5/8";s:11:"her_two_rpt";s:93:"Weak to moderate complete membrane staining is observed in more than 10 % of the tumor cells.";s:13:"her_two_score";s:2:"2+";s:9:"er_result";s:8:"Positive";s:9:"pr_result";s:8:"Positive";s:14:"her_two_result";s:10:"Borderline";s:8:"rpt_noet";s:0:"";}i:5;O:8:"stdClass":23:{s:10:"her_two_id";s:3:"315";s:5:"sl_no";s:2:"10";s:7:"test_id";s:16:"MIHC14:00296-298";s:10:"reciv_date";s:10:"08/01/2014";s:9:"deli_date";s:10:"12/01/2014";s:12:"current_date";s:10:"2014-01-08";s:12:"patient_name";s:14:"Mrs. Gul Nahar";s:3:"age";s:6:"42 Yrs";s:6:"ref_by";s:47:"Tapesh Kumar Paul, FCPS, MS (Oncology Surgery).";s:3:"sex";s:6:"Female";s:13:"hospital_name";s:14:"DHL, -W- 535/4";s:13:"specimen_name";s:43:"Tissue from Rt. Breast. Case No: MH14-192. ";s:4:"note";s:122:"Result of Immunostaining  for ER, PR &amp; HER-2 of Case No: MH14-192, Block No: (02) from DHL. Path. Lab. Dhaka. <br><br>";s:6:"er_rpt";s:59:"About 40 % of the tumor cell nuclei show moderate staining.";s:8:"er_score";s:7:"4+2=6/8";s:6:"pr_rpt";s:59:"About 45 % of the tumor cell nuclei show moderate staining.";s:8:"pr_score";s:7:"4+2=6/8";s:11:"her_two_rpt";s:84:" Weak incomplete membrane staining is observed in more than 10 % of the tumor cells.";s:13:"her_two_score";s:2:"1+";s:9:"er_result";s:8:"Positive";s:9:"pr_result";s:8:"Positive";s:14:"her_two_result";s:8:"Negative";s:8:"rpt_noet";s:0:"";}i:6;O:8:"stdClass":23:{s:10:"her_two_id";s:3:"375";s:5:"sl_no";s:2:"13";s:7:"test_id";s:16:"MIHC14:00399-401";s:10:"reciv_date";s:10:"11/01/2014";s:9:"deli_date";s:10:"19/01/2014";s:12:"current_date";s:10:"2014-01-11";s:12:"patient_name";s:21:"Mrs. Chemon Ara Begum";s:3:"age";s:6:"46 Yrs";s:6:"ref_by";s:51:"Lutfun Nahar. M.Phil, FCPS (Consultant oncologist).";s:3:"sex";s:6:"Female";s:13:"hospital_name";s:40:"Delta Medical College & Hospital. Dhaka.";s:13:"specimen_name";s:44:"Tissue from left breast. Case No: MH13-14208";s:4:"note";s:125:"Result of Immunostaining  for ER, PR &amp; HER-2 of Case No:      MH13-14208, Block No: (02) from DHL. Path. Lab. Dhaka. <br>";s:6:"er_rpt";s:59:"About 20 % of the tumor cell nuclei show moderate staining.";s:8:"er_score";s:7:"3+2=5/8";s:6:"pr_rpt";s:60:"About 30 %  of the tumor cell nuclei show moderate staining.";s:8:"pr_score";s:8:"3+2= 5/8";s:11:"her_two_rpt";s:83:"Weak incomplete membrane staining is observed in more than 10 % of the tumor cells.";s:13:"her_two_score";s:2:"1+";s:9:"er_result";s:8:"Positive";s:9:"pr_result";s:8:"Positive";s:14:"her_two_result";s:8:"Negative";s:8:"rpt_noet";s:0:"";}i:7;O:8:"stdClass":23:{s:10:"her_two_id";s:3:"376";s:5:"sl_no";s:2:"14";s:7:"test_id";s:16:"MIHC14:00513-515";s:10:"reciv_date";s:10:"12/01/2014";s:9:"deli_date";s:10:"19/01/2014";s:12:"current_date";s:10:"2014-01-12";s:12:"patient_name";s:12:"Diba Farhana";s:3:"age";s:6:"33 Yrs";s:6:"ref_by";s:37:"Md. Moarraf Hossen, MBBS, FCPS, DMRT.";s:3:"sex";s:6:"Female";s:13:"hospital_name";s:23:"LAB AID LIMITED. DHAKA.";s:13:"specimen_name";s:42:"Tissue from Rt. Breast.Case No: MH14-00111";s:4:"note";s:109:"Result of Immunostaining  for ER, PR &amp; HER-2 of Case No:      MH14-00111 from DHL. Path. Lab. Dhaka. <br>";s:6:"er_rpt";s:55:"About 05 % of the tumor cell nuclei show weak staining.";s:8:"er_score";s:9:"2+1 = 3/8";s:6:"pr_rpt";s:35:"Tumor cell nuclei show no staining.";s:8:"pr_score";s:3:""O"";s:11:"her_two_rpt";s:83:"Weak incomplete membrane staining is observed in more than 10 % of the tumor cells.";s:13:"her_two_score";s:2:"1+";s:9:"er_result";s:8:"Positive";s:9:"pr_result";s:8:"Negative";s:14:"her_two_result";s:8:"Negative";s:8:"rpt_noet";s:0:"";}i:8;O:8:"stdClass":23:{s:10:"her_two_id";s:3:"377";s:5:"sl_no";s:2:"16";s:7:"test_id";s:16:"MIHC14:00545-547";s:10:"reciv_date";s:10:"13/01/2014";s:9:"deli_date";s:10:"19/01/2014";s:12:"current_date";s:10:"2014-01-13";s:12:"patient_name";s:18:"Most. Zahura Begum";s:3:"age";s:6:"56 Yrs";s:6:"ref_by";s:0:"";s:3:"sex";s:6:"Female";s:13:"hospital_name";s:83:"Rangpur Swadesh Hospital (Pvt.) Ltd.(Corporate Name: New Swadesh Hospital, Rangpur)";s:13:"specimen_name";s:40:"Tissue from breast. Case No : MH14-00144";s:4:"note";s:126:"Result of Immunostaining  for ER, PR &amp; HER-2 of Case No:      MH14-00144 , Block No: (02) from DHL. Path. Lab. Dhaka. <br>";s:6:"er_rpt";s:59:"About 60 % of the tumor cell nuclei show moderate staining.";s:8:"er_score";s:7:"4+2=6/8";s:6:"pr_rpt";s:59:"About 15 % of the tumor cell nuclei show moderate staining.";s:8:"pr_score";s:8:"3+2= 5/8";s:11:"her_two_rpt";s:83:"Weak incomplete membrane staining is observed in more than 10 % of the tumor cells.";s:13:"her_two_score";s:2:"1+";s:9:"er_result";s:8:"Positive";s:9:"pr_result";s:8:"Positive";s:14:"her_two_result";s:8:"Negative";s:8:"rpt_noet";s:0:"";}i:9;O:8:"stdClass":23:{s:10:"her_two_id";s:3:"378";s:5:"sl_no";s:2:"20";s:7:"test_id";s:16:"MIHC14:00741-743";s:10:"reciv_date";s:10:"16/01/2014";s:9:"deli_date";s:10:"19/01/2014";s:12:"current_date";s:10:"2014-01-16";s:12:"patient_name";s:12:"Purobi Sinha";s:3:"age";s:6:"41 Yrs";s:6:"ref_by";s:0:"";s:3:"sex";s:6:"Female";s:13:"hospital_name";s:32:"Nirmoy Diagnostic Centre, Sylhet";s:13:"specimen_name";s:61:"Tissue from breast lump and Lymph nodes. Case No: MH14-00694.";s:4:"note";s:126:"Result of Immunostaining  for ER, PR &amp; HER-2 of Case No: MH14-694.      Block No: (    A) from DHL. Path. Lab. Dhaka. <br>";s:6:"er_rpt";s:35:"Tumor cell nuclei show no staining.";s:8:"er_score";s:3:""O"";s:6:"pr_rpt";s:35:"Tumor cell nuclei show no staining.";s:8:"pr_score";s:3:""O"";s:11:"her_two_rpt";s:83:"Weak incomplete membrane staining is observed in more than 10 % of the tumor cells.";s:13:"her_two_score";s:2:"1+";s:9:"er_result";s:8:"Negative";s:9:"pr_result";s:8:"Negative";s:14:"her_two_result";s:8:"Negative";s:8:"rpt_noet";s:0:"";}i:10;O:8:"stdClass":23:{s:10:"her_two_id";s:3:"440";s:5:"sl_no";s:3:"022";s:7:"test_id";s:16:"MIHC14:00794-796";s:10:"reciv_date";s:10:"16/01/2014";s:9:"deli_date";s:10:"26/01/2014";s:12:"current_date";s:10:"2014-01-16";s:12:"patient_name";s:18:"Mrs. Rezia Khatun.";s:3:"age";s:6:"45 Yrs";s:6:"ref_by";s:47:"Tapesh Kumar Paul, FCPS, MS (Oncology Surgery).";s:3:"sex";s:6:"Female";s:13:"hospital_name";s:12:"DHL, W-535/3";s:13:"specimen_name";s:45:"Mastectomy specimen (Lt.) Case No: MH14-00512";s:4:"note";s:128:"Result of Immunostaining  for ER, PR &amp; HER-2 of Case No:MH14-00512,      Block No: (03    ) from DHL. Path. Lab. Dhaka. <br>";s:6:"er_rpt";s:49:"<1 % of the tumor cell nuclei show weak staining.";s:8:"er_score";s:7:"1+1=2/8";s:6:"pr_rpt";s:49:"<1 % of the tumor cell nuclei show weak staining.";s:8:"pr_score";s:7:"1+1=2/8";s:11:"her_two_rpt";s:83:"Weak incomplete membrane staining is observed in more than 10 % of the tumor cells.";s:13:"her_two_score";s:2:"1+";s:9:"er_result";s:8:"Negative";s:9:"pr_result";s:8:"Negative";s:14:"her_two_result";s:8:"Negative";s:8:"rpt_noet";s:0:"";}i:11;O:8:"stdClass":23:{s:10:"her_two_id";s:3:"441";s:5:"sl_no";s:3:"023";s:7:"test_id";s:16:"MIHC14:00798-800";s:10:"reciv_date";s:10:"16/01/2014";s:9:"deli_date";s:10:"26/01/2014";s:12:"current_date";s:10:"2014-01-16";s:12:"patient_name";s:18:"Mrs. Shirin Akhter";s:3:"age";s:6:"32 Yrs";s:6:"ref_by";s:47:"Tapesh Kumar Paul, FCPS, MS (Oncology Surgery).";s:3:"sex";s:6:"Female";s:13:"hospital_name";s:3:"DHL";s:13:"specimen_name";s:47:"Tissue from Rt. breast. Case No: MH14-00457 F-G";s:4:"note";s:120:"Result of Immunostaining  for ER, PR &amp; HER-2 of Case No: MH14-00457 Block No: (F-G) from DHL. Path. Lab. Dhaka. <br>";s:6:"er_rpt";s:59:"About 40 % of the tumor cell nuclei show moderate staining.";s:8:"er_score";s:7:"4+2=6/8";s:6:"pr_rpt";s:59:"About 60 % of the tumor cell nuclei show moderate staining.";s:8:"pr_score";s:7:"4+2=6/8";s:11:"her_two_rpt";s:83:"Strong complete membrane staining is observed in more than 30 % of the tumor cells.";s:13:"her_two_score";s:2:"3+";s:9:"er_result";s:8:"Positive";s:9:"pr_result";s:8:"Positive";s:14:"her_two_result";s:8:"Positive";s:8:"rpt_noet";s:0:"";}i:12;O:8:"stdClass":23:{s:10:"her_two_id";s:3:"442";s:5:"sl_no";s:3:"024";s:7:"test_id";s:16:"MIHC14:00840-842";s:10:"reciv_date";s:10:"18/01/2014";s:9:"deli_date";s:10:"26/01/2014";s:12:"current_date";s:10:"2014-01-18";s:12:"patient_name";s:13:"Mrs. Gulbahar";s:3:"age";s:6:"40 Yrs";s:6:"ref_by";s:12:"Sohel Iqbal.";s:3:"sex";s:6:"Female";s:13:"hospital_name";s:42:"Rose Clinic and Diagnostic Centre, Savar. ";s:13:"specimen_name";s:44:"Tissue from breast lump. Case No: MH13-24092";s:4:"note";s:124:"Result of Immunostaining  for ER, PR &amp; HER-2 of Case No:      MH13-24092, Block No: (02) from DHL. Path. Lab. Dhaka.<br>";s:6:"er_rpt";s:35:"Tumor cell nuclei show no staining.";s:8:"er_score";s:3:""O"";s:6:"pr_rpt";s:35:"Tumor cell nuclei show no staining.";s:8:"pr_score";s:3:""O"";s:11:"her_two_rpt";s:93:"Weak to moderate complete membrane staining is observed in more than 10 % of the tumor cells.";s:13:"her_two_score";s:2:"2+";s:9:"er_result";s:9:"Negative.";s:9:"pr_result";s:9:"Negative.";s:14:"her_two_result";s:11:"Borderline.";s:8:"rpt_noet";s:0:"";}i:13;O:8:"stdClass":23:{s:10:"her_two_id";s:3:"443";s:5:"sl_no";s:3:"025";s:7:"test_id";s:16:"MIHC14:00867-869";s:10:"reciv_date";s:10:"18/01/2014";s:9:"deli_date";s:10:"19/01/2014";s:12:"current_date";s:10:"2014-01-18";s:12:"patient_name";s:20:"Mr. Md. Jashim Uddin";s:3:"age";s:6:"49 Yrs";s:6:"ref_by";s:48:"M.N.Huda, Principle, Cheaf Consultant, Oncology.";s:3:"sex";s:4:"Male";s:13:"hospital_name";s:3:"DHL";s:13:"specimen_name";s:51:"Tissue from cervical lymph node. Case No: MH14-237 ";s:4:"note";s:96:"Result of Immunostaining  for ER, PR &amp; HER-2 of Case No: MH14-237 ,&nbsp; Block No: (01)<br>";s:6:"er_rpt";s:117:"About _______ %/ <1 % of the tumor cell nuclei show weak/moderate/strong staining/Tumor cell nuclei show no staining.";s:8:"er_score";s:6:"   / 8";s:6:"pr_rpt";s:118:"About _______%/ <1  %  of the tumor cell nuclei show weak/moderate/strong staining/Tumor cell nuclei show no staining.";s:8:"pr_score";s:9:"      / 8";s:11:"her_two_rpt";s:0:"";s:13:"her_two_score";s:12:"Select Score";s:9:"er_result";s:17:"Negative/Positive";s:9:"pr_result";s:17:"Negative/Positive";s:14:"her_two_result";s:28:"Negative/Positive/Borderline";s:8:"rpt_noet";s:0:"";}i:14;O:8:"stdClass":23:{s:10:"her_two_id";s:3:"444";s:5:"sl_no";s:3:"026";s:7:"test_id";s:16:"MIHC14:00934-936";s:10:"reciv_date";s:10:"19/01/2014";s:9:"deli_date";s:10:"26/01/2014";s:12:"current_date";s:10:"2014-01-19";s:12:"patient_name";s:11:"Mrs. Josna ";s:3:"age";s:6:"36 Yrs";s:6:"ref_by";s:47:"Parvin Akhter Banu (Chief Consultant, Oncology)";s:3:"sex";s:6:"Female";s:13:"hospital_name";s:11:"DHL, Dhaka.";s:13:"specimen_name";s:44:"Tissue from Rt. Breast. Case No: MH14-00004 ";s:4:"note";s:121:"Result of Immunostaining  for ER, PR &amp; HER-2 of Case No: MH14-00004 , Block No: (01) from DHL. Path. Lab. Dhaka. <br>";s:6:"er_rpt";s:59:"About 20 % of the tumor cell nuclei show moderate staining.";s:8:"er_score";s:7:"3+2=5/8";s:6:"pr_rpt";s:59:"About 50 % of the tumor cell nuclei show moderate staining.";s:8:"pr_score";s:7:"4+2=6/8";s:11:"her_two_rpt";s:94:" Weak to moderate complete membrane staining is observed in more than 10 % of the tumor cells.";s:13:"her_two_score";s:2:"2+";s:9:"er_result";s:8:"Positive";s:9:"pr_result";s:8:"Positive";s:14:"her_two_result";s:10:"Borderline";s:8:"rpt_noet";s:0:"";}i:15;O:8:"stdClass":23:{s:10:"her_two_id";s:3:"445";s:5:"sl_no";s:3:"027";s:7:"test_id";s:16:"MIHC14:00940-942";s:10:"reciv_date";s:10:"19/01/2014";s:9:"deli_date";s:10:"26/01/2014";s:12:"current_date";s:10:"2014-01-19";s:12:"patient_name";s:16:"Mrs. Asma Rahman";s:3:"age";s:6:"57 Yrs";s:6:"ref_by";s:47:"Tapesh Kumar Paul, FCPS, MS (Oncology Surgery).";s:3:"sex";s:6:"Female";s:13:"hospital_name";s:11:"DHL, C-605.";s:13:"specimen_name";s:44:"Tissue from left breast. Case No: MH14-00695";s:4:"note";s:131:"Result of Immunostaining  for ER, PR &amp; HER-2 of Case No: MH14-00695,&nbsp;      Block No: (01) from DHL. Path. Lab. Dhaka. <br>";s:6:"er_rpt";s:55:"About 03 % of the tumor cell nuclei show weak staining.";s:8:"er_score";s:9:"2+1 = 3/8";s:6:"pr_rpt";s:35:"Tumor cell nuclei show no staining.";s:8:"pr_score";s:3:""O"";s:11:"her_two_rpt";s:83:"Strong complete membrane staining is observed in more than 30 % of the tumor cells.";s:13:"her_two_score";s:2:"3+";s:9:"er_result";s:8:"Positive";s:9:"pr_result";s:8:"Negative";s:14:"her_two_result";s:8:"Positive";s:8:"rpt_noet";s:0:"";}i:16;O:8:"stdClass":23:{s:10:"her_two_id";s:3:"446";s:5:"sl_no";s:3:"029";s:7:"test_id";s:16:"MIHC14:01005-007";s:10:"reciv_date";s:10:"20/01/2014";s:9:"deli_date";s:10:"26/01/2014";s:12:"current_date";s:10:"2014-01-20";s:12:"patient_name";s:17:"Mrs. Laila Khanom";s:3:"age";s:6:"50 Yrs";s:6:"ref_by";s:0:"";s:3:"sex";s:6:"Female";s:13:"hospital_name";s:29:"Good Health Hospital, Rangpur";s:13:"specimen_name";s:49:"Tissue from left breast lump. Case No: MH13-24358";s:4:"note";s:132:"Result of Immunostaining  for ER, PR &amp; HER-2 of Case No: MH13-24358 ,&nbsp;      Block No: (01) form DHL. Path. Lab. Dhaka. <br>";s:6:"er_rpt";s:59:"About 30 % of the tumor cell nuclei show moderate staining.";s:8:"er_score";s:7:"3+2=5/8";s:6:"pr_rpt";s:59:"About 30 % of the tumor cell nuclei show moderate staining.";s:8:"pr_score";s:8:"3+2= 5/8";s:11:"her_two_rpt";s:94:" Weak to moderate complete membrane staining is observed in more than 10 % of the tumor cells.";s:13:"her_two_score";s:2:"2+";s:9:"er_result";s:8:"Positive";s:9:"pr_result";s:8:"Positive";s:14:"her_two_result";s:10:"Borderline";s:8:"rpt_noet";s:0:"";}i:17;O:8:"stdClass":23:{s:10:"her_two_id";s:3:"447";s:5:"sl_no";s:3:"030";s:7:"test_id";s:16:"MIHC14:01091-093";s:10:"reciv_date";s:10:"22/01/2014";s:9:"deli_date";s:10:"26/01/2014";s:12:"current_date";s:10:"2014-01-22";s:12:"patient_name";s:17:"Mrs. Shanaz Begum";s:3:"age";s:6:"46 Yrs";s:6:"ref_by";s:47:"Tapesh Kumar Paul, FCPS, MS (Oncology Surgery).";s:3:"sex";s:6:"Female";s:13:"hospital_name";s:10:"DHL, C-507";s:13:"specimen_name";s:42:"Tissue from Lt. breast. Case No: MH14-862.";s:4:"note";s:125:"Result of Immunostaining  for ER, PR &amp; HER-2 of Case No: MH14-862, Block No: (F-G)&nbsp; from DHL. Path. Lab. Dhaka. <br>";s:6:"er_rpt";s:35:"Tumor cell nuclei show no staining.";s:8:"er_score";s:3:""O"";s:6:"pr_rpt";s:35:"Tumor cell nuclei show no staining.";s:8:"pr_score";s:3:""O"";s:11:"her_two_rpt";s:93:"Weak to moderate complete membrane staining is observed in more than 10 % of the tumor cells.";s:13:"her_two_score";s:2:"2+";s:9:"er_result";s:8:"Negative";s:9:"pr_result";s:8:"Negative";s:14:"her_two_result";s:10:"Borderline";s:8:"rpt_noet";s:0:"";}i:18;O:8:"stdClass":23:{s:10:"her_two_id";s:3:"500";s:5:"sl_no";s:3:"300";s:7:"test_id";s:16:"MIHC13:14303-305";s:10:"reciv_date";s:10:"29/01/2014";s:9:"deli_date";s:10:"04/08/2013";s:12:"current_date";s:10:"2014-01-29";s:12:"patient_name";s:7:"Mariyam";s:3:"age";s:6:"35 Yrs";s:6:"ref_by";s:45:"Md. Setabur Rahman, MS (S), Surgical Oncology";s:3:"sex";s:6:"Female";s:13:"hospital_name";s:23:"NICRH, Mohakhali, Dhaka";s:13:"specimen_name";s:23:"Tissue from Rt. Breast.";s:4:"note";s:125:"Result of Immunostaining  for ER, PR &amp; HER-2 of Case No: MH13-12384,      Block No: (02) from DHL, Path. Lab. Dhaka. <br>";s:6:"er_rpt";s:49:"<1 % of the tumor cell nuclei show weak staining.";s:8:"er_score";s:7:"1+1=2/8";s:6:"pr_rpt";s:49:"<1 % of the tumor cell nuclei show weak staining.";s:8:"pr_score";s:7:"1+1=2/8";s:11:"her_two_rpt";s:83:"Weak incomplete membrane staining is observed in more than 10 % of the tumor cells.";s:13:"her_two_score";s:2:"1+";s:9:"er_result";s:8:"Negative";s:9:"pr_result";s:8:"Negative";s:14:"her_two_result";s:8:"Negative";s:8:"rpt_noet";s:0:"";}i:19;O:8:"stdClass":23:{s:10:"her_two_id";s:3:"505";s:5:"sl_no";s:3:"031";s:7:"test_id";s:16:"MIHC14:01262-264";s:10:"reciv_date";s:10:"26/01/2014";s:9:"deli_date";s:10:"02/02/2014";s:12:"current_date";s:10:"2014-01-26";s:12:"patient_name";s:19:"Mrs. Jahanara Begum";s:3:"age";s:6:"45 Yrs";s:6:"ref_by";s:63:"Naheed Rukhsana , FCPS, (Radiotherapy), Consultant. oncologist.";s:3:"sex";s:6:"Female";s:13:"hospital_name";s:40:"Delta Medical College & Hospital. Dhaka.";s:13:"specimen_name";s:46:"Tissue from left breast. Case No: MH14-00263, ";s:4:"note";s:120:"Result of Immunostaining  for ER, PR &amp; HER-2 of Case No: MH14-00263, Block No: (02) from DHL, Path. Lab. Dhaka. <br>";s:6:"er_rpt";s:55:"About 03 % of the tumor cell nuclei show weak staining.";s:8:"er_score";s:7:"2+1=3/8";s:6:"pr_rpt";s:35:"Tumor cell nuclei show no staining.";s:8:"pr_score";s:3:""O"";s:11:"her_two_rpt";s:93:"Weak to moderate complete membrane staining is observed in more than 10 % of the tumor cells.";s:13:"her_two_score";s:2:"2+";s:9:"er_result";s:8:"Positive";s:9:"pr_result";s:8:"Negative";s:14:"her_two_result";s:10:"Borderline";s:8:"rpt_noet";s:0:"";}i:20;O:8:"stdClass":23:{s:10:"her_two_id";s:3:"506";s:5:"sl_no";s:3:"034";s:7:"test_id";s:16:"MIHC14:01397-399";s:10:"reciv_date";s:10:"27/01/2014";s:9:"deli_date";s:10:"02/02/2014";s:12:"current_date";s:10:"2014-01-27";s:12:"patient_name";s:12:"Mrs. Hasina ";s:3:"age";s:6:"65 Yrs";s:6:"ref_by";s:0:"";s:3:"sex";s:6:"Female";s:13:"hospital_name";s:26:"CSCR Hospital , Chittagong";s:13:"specimen_name";s:50:"Tissue from Mastectomy specimen. Case No: MH14-764";s:4:"note";s:123:"Result of Immunostaining  for ER, PR &amp; HER-2 of Case No:      MH14-764, Block No: (01) from DHL, Path. Lab. Dhaka. <br>";s:6:"er_rpt";s:59:"About 15 % of the tumor cell nuclei show moderate staining.";s:8:"er_score";s:8:"3+2= 5/8";s:6:"pr_rpt";s:55:"About 02 % of the tumor cell nuclei show weak staining.";s:8:"pr_score";s:7:"2+1=3/8";s:11:"her_two_rpt";s:83:"Strong complete membrane staining is observed in more than 30 % of the tumor cells.";s:13:"her_two_score";s:2:"3+";s:9:"er_result";s:8:"Positive";s:9:"pr_result";s:15:"Positive (Weak)";s:14:"her_two_result";s:8:"Positive";s:8:"rpt_noet";s:0:"";}i:21;O:8:"stdClass":23:{s:10:"her_two_id";s:3:"507";s:5:"sl_no";s:3:"035";s:7:"test_id";s:16:"MIHC14:01465-467";s:10:"reciv_date";s:10:"27/01/2014";s:9:"deli_date";s:10:"02/02/2014";s:12:"current_date";s:10:"2014-01-27";s:12:"patient_name";s:18:"Mrs. Panna Rahman ";s:3:"age";s:6:"45 Yrs";s:6:"ref_by";s:0:"";s:3:"sex";s:6:"Female";s:13:"hospital_name";s:47:"Institute of Laser Surgery & Hospital , Dhaka. ";s:13:"specimen_name";s:44:"Tissue from breast lump, Case No: MH14-01227";s:4:"note";s:124:"Result of Immunostaining  for ER, PR &amp; HER-2 of Case No: MH14-01227,     Block No: (01) from DHL, Path. Lab, Dhaka. <br>";s:6:"er_rpt";s:59:"About 65 % of the tumor cell nuclei show moderate staining.";s:8:"er_score";s:7:"4+2=6/8";s:6:"pr_rpt";s:60:"About 60 %  of the tumor cell nuclei show moderate staining.";s:8:"pr_score";s:9:"4+2= 6/ 8";s:11:"her_two_rpt";s:93:"Weak to moderate complete membrane staining is observed in more than 10 % of the tumor cells.";s:13:"her_two_score";s:2:"2+";s:9:"er_result";s:8:"Positive";s:9:"pr_result";s:8:"Positive";s:14:"her_two_result";s:10:"Borderline";s:8:"rpt_noet";s:0:"";}i:22;O:8:"stdClass":23:{s:10:"her_two_id";s:3:"508";s:5:"sl_no";s:3:"036";s:7:"test_id";s:16:"MIHC14:01468-470";s:10:"reciv_date";s:10:"27/01/2014";s:9:"deli_date";s:10:"02/02/2014";s:12:"current_date";s:10:"2014-01-27";s:12:"patient_name";s:9:"Mrs. Nipa";s:3:"age";s:6:"40 Yrs";s:6:"ref_by";s:56:"Md. Moarraf Hossen, MBBS, FCPS, DMRT (Cancer Specialist)";s:3:"sex";s:6:"Female";s:13:"hospital_name";s:19:"Lab Aid Ltd., Dhaka";s:13:"specimen_name";s:44:"Tissue from left breast. Case No: MH14-01437";s:4:"note";s:127:"Result of Immunostaining  for ER, PR &amp; HER-2 of Case No:      MH14-01437 , Block No: (02) from DHL, Path. Lab . Dhaka. <br>";s:6:"er_rpt";s:60:"About 60 %  of the tumor cell nuclei show moderate staining.";s:8:"er_score";s:8:"4+2 =6/8";s:6:"pr_rpt";s:60:"About 70 %  of the tumor cell nuclei show moderate staining.";s:8:"pr_score";s:7:"5+2=7/8";s:11:"her_two_rpt";s:83:"Weak incomplete membrane staining is observed in more than 10 % of the tumor cells.";s:13:"her_two_score";s:2:"1+";s:9:"er_result";s:8:"Positive";s:9:"pr_result";s:8:"Positive";s:14:"her_two_result";s:8:"Negative";s:8:"rpt_noet";s:0:"";}i:23;O:8:"stdClass":23:{s:10:"her_two_id";s:3:"509";s:5:"sl_no";s:3:"037";s:7:"test_id";s:16:"MIHC14:01553-555";s:10:"reciv_date";s:10:"29/01/2014";s:9:"deli_date";s:10:"02/02/2014";s:12:"current_date";s:10:"2014-01-29";s:12:"patient_name";s:15:"Mrs. Nurus Safa";s:3:"age";s:6:"32 Yrs";s:6:"ref_by";s:30:"Sagorika Sharmin (Sagor), FCPS";s:3:"sex";s:6:"Female";s:13:"hospital_name";s:40:"Lancet Diagnostic & Research, Chittagong";s:13:"specimen_name";s:56:"Tissue from Mastectomy specimen (Rt.), Case No: MH14-930";s:4:"note";s:123:"Result of Immunostaining  for ER, PR &amp; HER-2 of Case No:      MH14-930 , Block No: (02) from DHL, Path. Lab. Dhaka.<br>";s:6:"er_rpt";s:35:"Tumor cell nuclei show no staining.";s:8:"er_score";s:3:""O"";s:6:"pr_rpt";s:35:"Tumor cell nuclei show no staining.";s:8:"pr_score";s:3:""O"";s:11:"her_two_rpt";s:85:"Weak incomplete membrane staining is observed in more than 10 % of the tumor cells.
";s:13:"her_two_score";s:2:"1+";s:9:"er_result";s:8:"Negative";s:9:"pr_result";s:8:"Negative";s:14:"her_two_result";s:8:"Negative";s:8:"rpt_noet";s:0:"";}i:24;O:8:"stdClass":23:{s:10:"her_two_id";s:3:"510";s:5:"sl_no";s:3:"038";s:7:"test_id";s:16:"MIHC14:01579-581";s:10:"reciv_date";s:10:"29/01/2014";s:9:"deli_date";s:10:"02/02/2014";s:12:"current_date";s:10:"2014-01-29";s:12:"patient_name";s:9:"Mrs. Mita";s:3:"age";s:6:"44 Yrs";s:6:"ref_by";s:0:"";s:3:"sex";s:6:"Female";s:13:"hospital_name";s:39:"Metro Diagnostic Centre Ltd. Chittagong";s:13:"specimen_name";s:44:"Tissue from left breast. Case No:  MH14-1102";s:4:"note";s:129:"Result of Immunostaining  for ER, PR &amp; HER-2 of Case No: MH14-1102,&nbsp;     Block No: (02) from DHL, Path. Lab. Dhaka. <br>";s:6:"er_rpt";s:59:"About 50 % of the tumor cell nuclei show moderate staining.";s:8:"er_score";s:9:"4+2 =/6 8";s:6:"pr_rpt";s:59:"About 70 % of the tumor cell nuclei show moderate staining.";s:8:"pr_score";s:7:"5+2=7/8";s:11:"her_two_rpt";s:93:"Weak to moderate complete membrane staining is observed in more than 10 % of the tumor cells.";s:13:"her_two_score";s:2:"2+";s:9:"er_result";s:8:"Positive";s:9:"pr_result";s:8:"Positive";s:14:"her_two_result";s:10:"Borderline";s:8:"rpt_noet";s:0:"";}i:25;O:8:"stdClass":23:{s:10:"her_two_id";s:3:"511";s:5:"sl_no";s:3:"041";s:7:"test_id";s:12:"MIHC14:01283";s:10:"reciv_date";s:10:"25/01/2014";s:9:"deli_date";s:10:"03/02/2014";s:12:"current_date";s:10:"2014-01-25";s:12:"patient_name";s:19:"Mrs. Jahanara Begum";s:3:"age";s:6:"65 Yrs";s:6:"ref_by";s:5:"Self ";s:3:"sex";s:6:"Female";s:13:"hospital_name";s:0:"";s:13:"specimen_name";s:73:"Two H & E stained slides and 01 (One) paraffin block received for review.";s:4:"note";s:88:"Result of Immunostaining  for ER, PR &amp; HER-2 of Case No:      ___Block No: (___    )";s:6:"er_rpt";s:117:"About _______ %/ <1 % of the tumor cell nuclei show weak/moderate/strong staining/Tumor cell nuclei show no staining.";s:8:"er_score";s:6:"   / 8";s:6:"pr_rpt";s:118:"About _______%/ <1  %  of the tumor cell nuclei show weak/moderate/strong staining/Tumor cell nuclei show no staining.";s:8:"pr_score";s:9:"      / 8";s:11:"her_two_rpt";s:0:"";s:13:"her_two_score";s:12:"Select Score";s:9:"er_result";s:17:"Negative/Positive";s:9:"pr_result";s:17:"Negative/Positive";s:14:"her_two_result";s:28:"Negative/Positive/Borderline";s:8:"rpt_noet";s:0:"";}i:26;O:8:"stdClass":23:{s:10:"her_two_id";s:3:"512";s:5:"sl_no";s:3:"023";s:7:"test_id";s:12:"MIHC14:00457";s:10:"reciv_date";s:10:"11/01/2014";s:9:"deli_date";s:10:"03/02/2014";s:12:"current_date";s:10:"2014-01-11";s:12:"patient_name";s:19:"Mrs. Shirin Akhter ";s:3:"age";s:6:"32 Yrs";s:6:"ref_by";s:47:"Tapesh Kumar Paul, FCPS, MS (Oncology Surgery).";s:3:"sex";s:6:"Female";s:13:"hospital_name";s:10:"DHL, C-518";s:13:"specimen_name";s:24:"Tissue from Rt. breast. ";s:4:"note";s:88:"Result of Immunostaining  for ER, PR &amp; HER-2 of Case No:___      Block No: (___    )";s:6:"er_rpt";s:117:"About _______ %/ <1 % of the tumor cell nuclei show weak/moderate/strong staining/Tumor cell nuclei show no staining.";s:8:"er_score";s:6:"   / 8";s:6:"pr_rpt";s:118:"About _______%/ <1  %  of the tumor cell nuclei show weak/moderate/strong staining/Tumor cell nuclei show no staining.";s:8:"pr_score";s:9:"      / 8";s:11:"her_two_rpt";s:0:"";s:13:"her_two_score";s:12:"Select Score";s:9:"er_result";s:17:"Negative/Positive";s:9:"pr_result";s:17:"Negative/Positive";s:14:"her_two_result";s:28:"Negative/Positive/Borderline";s:8:"rpt_noet";s:0:"";}}s:20:"custom_result_object";a:0:{}s:11:"current_row";i:0;s:8:"num_rows";i:27;s:8:"row_data";N;}