O:12:"CI_DB_result":8:{s:7:"conn_id";N;s:9:"result_id";N;s:12:"result_array";a:160:{i:0;a:15:{s:7:"immu_id";s:2:"26";s:5:"sl_no";s:3:"180";s:7:"test_id";s:16:"MIHC13-09598-599";s:10:"reciv_date";s:10:"28-05-2013";s:12:"current_date";s:10:"2013-05-28";s:9:"deli_date";s:10:"23-06-2013";s:12:"patient_name";s:18:"Mrs. Zarin Sultana";s:3:"age";s:6:"23 Yrs";s:6:"ref_by";s:48:"Mahtab Uddin Ahmed. MBBS, MD (Path. Thisis Part)";s:3:"sex";s:6:"Female";s:13:"hospital_name";s:13:"BIHS Hospital";s:13:"specimen_name";s:35:"Tissue from Lt. cervical lymph node";s:4:"note";s:109:"Result of Immunostaining  for LCA &amp; CD30  of case No:MH13-01747Block No: (02) from DHL , Path Lab. Dhaka.";s:15:"reporting_board";s:262:"&nbsp;

 &nbsp;
<br><span>
 LCA : Lymphoid cells show diffuse staining for LCA. <br>
 <br>
 CD30: Large atypical cells resembling RS cells show positive staining for CD30. </span>

 &nbsp;

 &nbsp;

 &nbsp;

 &nbsp;

 &nbsp;

 &nbsp;

 &nbsp;";s:10:"add_doctor";s:1:"0";}i:1;a:15:{s:7:"immu_id";s:2:"51";s:5:"sl_no";s:3:"264";s:7:"test_id";s:13:"MIHC13:-13028";s:10:"reciv_date";s:10:"12/07/2013";s:12:"current_date";s:10:"2013-07-12";s:9:"deli_date";s:10:"21/07/2013";s:12:"patient_name";s:12:"Parul Sikder";s:3:"age";s:6:"67 Yrs";s:6:"ref_by";s:68:"Md. Mokhles Uddin , FCPS , Prof. of. Radiotherapy, CMC, Chittagong. ";s:3:"sex";s:6:"Female";s:13:"hospital_name";s:51:"Chevron Clinical Laboratory (Pvt.) Ltd. Chittagong.";s:13:"specimen_name";s:46:"Tissue from upper 1/3 perforated jejunum wall.";s:4:"note";s:86:"Result of Immunostaining  for CD117 of Case No:MH13-12064 from DHL, Path. Lab. Dhaka. ";s:15:"reporting_board";s:242:"<p><em><strong>CD117 :-</strong></em> Tumour cells show positive staining for <strong>CD117.</strong></p>

<p><em><strong>Summary : CD117-Positive&nbsp;</strong></em></p>

<p>&nbsp;</p>

<p>&nbsp;</p>

<p>&nbsp;</p>

<p>&nbsp;</p>
";s:10:"add_doctor";s:1:"0";}i:2;a:15:{s:7:"immu_id";s:2:"52";s:5:"sl_no";s:3:"270";s:7:"test_id";s:17:"MIHC13:-13375-380";s:10:"reciv_date";s:10:"17/07/2013";s:12:"current_date";s:10:"2013-07-17";s:9:"deli_date";s:10:"21/07/2013";s:12:"patient_name";s:19:"Mrs. Rudbar Mahmud ";s:3:"age";s:6:"22 Yrs";s:6:"ref_by";s:61:"Parvin Akhter Banu, Chief Consultant (Oncology)DMC&H, Dhaka. ";s:3:"sex";s:6:"Female";s:13:"hospital_name";s:43:"IBN SINA DIAGNOSTIC & IMAGING CENTRE, DHAKA";s:13:"specimen_name";s:38:"One paraffin block case no: HB13-4745F";s:4:"note";s:168:"Result of Immunostaining  for LCA , CD3 , CD20 , CD15 , CD30 & EMA  of case No:HB13-4745 F Block No: (06) from Bankok Hospital Group Pathology Center, Bankok, Thailand ";s:15:"reporting_board";s:842:"<p><strong>LCA :- </strong>Lymphoid cells show positive staining for <strong>LCA</strong>.</p>

<p><strong>CD3:- </strong>Some of the lymphoid cells show positive staining&nbsp; for <strong>CD3</strong>.<br />
<br />
<strong>CD20:-</strong> Some of the lymphoid cells show positive staining for <strong>CD20</strong>.<br />
<br />
<strong>CD15:-</strong> Scattered large atyical cells show positive staining for <strong>CD15</strong>.</p>

<p><strong>CD30:-</strong> Scattered large atypical cells show positive staining for <strong>CD30</strong>.</p>

<p><strong>EMA:-</strong> Scattered large atypical cells show positive staining for <strong>EMA</strong>.</p>

<h3><em><strong>Conclusion:&nbsp; Immunostaining results favor the diagnosis of Nodular lymphocyte-predominent lymphoma (N-LPHL)</strong></em></h3>

<p>&nbsp;</p>
";s:10:"add_doctor";s:1:"0";}i:3;a:15:{s:7:"immu_id";s:2:"53";s:5:"sl_no";s:3:"272";s:7:"test_id";s:13:"MIHC13:-13429";s:10:"reciv_date";s:10:"17/07/2013";s:12:"current_date";s:10:"2013-07-17";s:9:"deli_date";s:10:"21/07/2013";s:12:"patient_name";s:4:"Asha";s:3:"age";s:6:"18 Yrs";s:6:"ref_by";s:26:"Md. Setabur Rahman, MS (S)";s:3:"sex";s:6:"Female";s:13:"hospital_name";s:23:"NICRH, Mohakhali, Dhaka";s:13:"specimen_name";s:35:"Tissue from ? intestinal lymphnode.";s:4:"note";s:102:"Result of Immunostaining  for CD117 of Case No: MH13-11919 Block No: (02) from DHL, Path. Lab. Dhaka. ";s:15:"reporting_board";s:225:"<p><strong>CD117 :-</strong> Tumour cells show no staining for <strong>CD117.</strong></p>

<p>&nbsp;</p>

<h3><em><strong>Summary : CD117-Negative. </strong></em></h3>

<p>&nbsp;</p>

<p>&nbsp;</p>

<p>&nbsp;</p>
";s:10:"add_doctor";s:1:"0";}i:4;a:15:{s:7:"immu_id";s:2:"57";s:5:"sl_no";s:3:"279";s:7:"test_id";s:17:"MIHC13:-13543-545";s:10:"reciv_date";s:10:"19/07/2013";s:12:"current_date";s:10:"2013-07-19";s:9:"deli_date";s:10:"28/07/2013";s:12:"patient_name";s:15:"Mrs. Lipi Begum";s:3:"age";s:6:"25 Yrs";s:6:"ref_by";s:62:"Jahan Afroza Lucky, MBBS, M.Phil ( Radio Therapy ), Oncologist";s:3:"sex";s:6:"Female";s:13:"hospital_name";s:13:"RMCH, Rangpur";s:13:"specimen_name";s:32:"Tissue from broad Ligament tumor";s:4:"note";s:91:"Result of Immunostaining  for S100 , CK & Vimentin of Case No: MH13-11220  Block No: ( 02 )";s:15:"reporting_board";s:447:"<p><strong>S100 :</strong> Atypical cells show positive staining for <strong>S100.</strong></p>

<p>&nbsp;</p>

<p><strong>CK :</strong> Atypical cells are negative for <strong>CK. </strong></p>

<p>&nbsp;</p>

<p><strong>Vimentin : </strong>Atypical cells show positive staining for <strong>Vimentin.</strong></p>

<p>&nbsp;</p>

<h3><em><strong>Conclusion: Immunostaining results favor the diagnosis of sarcoma. </strong></em></h3>
";s:10:"add_doctor";s:1:"0";}i:5;a:15:{s:7:"immu_id";s:2:"58";s:5:"sl_no";s:3:"283";s:7:"test_id";s:13:"MIHC13:-13631";s:10:"reciv_date";s:10:"21/07/2013";s:12:"current_date";s:10:"2013-07-21";s:9:"deli_date";s:10:"28/07/2013";s:12:"patient_name";s:4:"Sumi";s:3:"age";s:6:"20 Yrs";s:6:"ref_by";s:0:"";s:3:"sex";s:6:"Female";s:13:"hospital_name";s:42:"Comilla Popular Hospital Pvt. Ltd. Comilla";s:13:"specimen_name";s:38:"One paraffin block Case no: ALH1335/13";s:4:"note";s:106:"Result of Immunostaining  for CD99 of Case No:ALH1335/13. Block No (02) from The Alfa Laboratory, Comilla.";s:15:"reporting_board";s:335:"<p><strong>CD99 </strong>: Clusters of atypical round cells show positive staining for <strong>CD99.</strong></p>

<h3><em><strong>Conclusion: Immunostaining results favor the diagnosis of Ewing&#39;s sarcoma. </strong></em></h3>

<p>&nbsp;</p>

<p>&nbsp;</p>

<p>&nbsp;</p>

<p>&nbsp;</p>

<p>&nbsp;</p>

<p>&nbsp;</p>
";s:10:"add_doctor";s:1:"0";}i:6;a:15:{s:7:"immu_id";s:2:"63";s:5:"sl_no";s:3:"311";s:7:"test_id";s:17:"MIHC13:-14769-770";s:10:"reciv_date";s:10:"05/08/2013";s:12:"current_date";s:10:"2013-08-05";s:9:"deli_date";s:10:"18/08/2013";s:12:"patient_name";s:12:"Fatema Begum";s:3:"age";s:6:"65 Yrs";s:6:"ref_by";s:41:"Md.Yeaqub Ali, MBBS, FCPS (Radiotherapy).";s:3:"sex";s:6:"Female";s:13:"hospital_name";s:66:"AL-RAJI HOSPITAL (Diagnostic & Consultation Centre). Farmgat.Dhaka";s:13:"specimen_name";s:39:"Tissue from Rt. sided lymph node (neck)";s:4:"note";s:87:"Result of Immunostaining  for LCA, CK of Case No: MH13-14561 from DHL Path. Lab. Dhaka.";s:15:"reporting_board";s:377:"<br><br><br><b>LCA:-</b>Tumor cells show diffuse staining for <b>LCA. </b><br><br><b>CK :-</b> Tumor cells show no staining for <b>CK. </b><br><br><br><b><i>Conclusion: Immunostaining results favor the diagnosis of non-Hodgkin's lymphoma. </i></b><br><br><br><h4><b>Advice: CD3&nbsp; &amp; CD20 Staining may be done to differentiate&nbsp; T/B cell origin. </b></h4><br><br><br>";s:10:"add_doctor";s:1:"0";}i:7;a:15:{s:7:"immu_id";s:2:"68";s:5:"sl_no";s:3:"322";s:7:"test_id";s:10:"MH13-15322";s:10:"reciv_date";s:10:"19/08/2013";s:12:"current_date";s:10:"2013-08-19";s:9:"deli_date";s:10:"25/08/2013";s:12:"patient_name";s:13:"Most. Tahmina";s:3:"age";s:6:"26 Yrs";s:6:"ref_by";s:20:"Mizanur Rahman , PGT";s:3:"sex";s:6:"Female";s:13:"hospital_name";s:26:"Rabeya Nursing Home, Bogra";s:13:"specimen_name";s:23:"Tissue from Rt. Breast.";s:4:"note";s:92:"&nbsp;Result of Immunostaining  for CD31of Case No: MH13-15322 , DHL, Path. Lab. Dhaka. <br>";s:15:"reporting_board";s:92:"<b>CD31</b>:<br><br><br><br><br><br><br><br><br><br><br><br><br><br><br><br><br><br><br><br>";s:10:"add_doctor";s:1:"0";}i:8;a:15:{s:7:"immu_id";s:2:"70";s:5:"sl_no";s:3:"339";s:7:"test_id";s:17:"MIHC13:-16684-685";s:10:"reciv_date";s:10:"03/09/2013";s:12:"current_date";s:10:"2013-09-03";s:9:"deli_date";s:10:"08/09/2013";s:12:"patient_name";s:13:"Fatema Begum ";s:3:"age";s:8:"65 Yrs, ";s:6:"ref_by";s:41:"Md. Yeaqub Ali. MBBS, FCPS (Radiotherapy)";s:3:"sex";s:6:"Female";s:13:"hospital_name";s:33:"Al Raji Hospital, Farmget, Dhaka ";s:13:"specimen_name";s:26:"Tissue from Rt. lymph node";s:4:"note";s:130:"Result of Immunostaining  for CD3 &amp; CD20 of Case No: MH13-14561,&nbsp; Block No: (01)<br>from&nbsp; DHL, Path. Lab, Dhaka.<br>";s:15:"reporting_board";s:380:"<br><br><b>CD3&nbsp; :&nbsp; </b>Scattered lymphoid cells show positive staining for <b> </b>CD3<b>.<br><br><br>CD20 :&nbsp; </b>Most of the atypical lymphoid cells show positive staining for <b>CD20</b><br><br><br><br><b><i>Conclusion:&nbsp; Immunostaining results favor the diagnosis of non-Hodgkin's lymphoma of "B" cell origin</i>. </b><br><br><br><br><br><br><br><br><br><br>";s:10:"add_doctor";s:1:"0";}i:9;a:15:{s:7:"immu_id";s:2:"72";s:5:"sl_no";s:3:"353";s:7:"test_id";s:23:"MIHC13:-17147-149,17334";s:10:"reciv_date";s:10:"08/09/2013";s:12:"current_date";s:10:"2013-09-08";s:9:"deli_date";s:10:"15/09/2013";s:12:"patient_name";s:17:"Mrs. Farhat Begum";s:3:"age";s:6:"63 Yrs";s:6:"ref_by";s:45:"Amin Lutful Kabir M.Phil , FCPS (Haematology)";s:3:"sex";s:6:"Female";s:13:"hospital_name";s:12:"DLMCH, Dhaka";s:13:"specimen_name";s:43:"Tissue from lymph node. Case No: MH13-16900";s:4:"note";s:117:"Result of Immunostaining  for CD3 , CD20, CD15 &amp; CD30 of Case No: MH13-16900, <br>from, DHL. Path. Lab. Dhaka<br>";s:15:"reporting_board";s:463:"<b>CD3 </b>: Scattered lymphoid cells show positive staining for <b>CD3</b>.<br><br><br><b>CD20 :</b> Scattered lymphoid cells show positive staining for <b>CD20.</b><br><br><br><b>CD15 :</b> Large atypical cells show positive staining for <b>CD15. </b><br><br><br><b>CD30:</b>&nbsp; Large atypical cells show&nbsp; positive staining for<b> CD30.</b><br><br><br><h3><b><i>Conclusion: Immunostaining results favor the diagnosis of Hodgkin's lymphoma. </i></b></h3>";s:10:"add_doctor";s:1:"0";}i:10;a:15:{s:7:"immu_id";s:2:"73";s:5:"sl_no";s:3:"347";s:7:"test_id";s:13:"MIHC13:-17026";s:10:"reciv_date";s:10:"07/09/2013";s:12:"current_date";s:10:"2013-09-07";s:9:"deli_date";s:10:"15/09/2013";s:12:"patient_name";s:16:"Miss. Irin Nahar";s:3:"age";s:6:"18 Yrs";s:6:"ref_by";s:14:"S.M. Abu Taleb";s:3:"sex";s:6:"Female";s:13:"hospital_name";s:53:"Rangpur Community Medical College & Hospital Rangpur.";s:13:"specimen_name";s:74:"Tissue from pelvic region (Lt.) and inguinal lymphnode.Case No: MH13-13976";s:4:"note";s:109:"Result of Immunostaining  for HMB 45 of Case No: MH13-13976 , Block No: ( 02) from, DHL. Path. Lab. Dhaka<br>";s:15:"reporting_board";s:209:"<b><br><br>HMB-45:</b> Tumour cells show positive staining for <b>HMB-45<br><br><br><br><br><br></b><h3><b><i>Conclusion: Immunostaining results favor the diagnosis of metastatic melanoma.</i></b><br></h3><br>";s:10:"add_doctor";s:1:"0";}i:11;a:15:{s:7:"immu_id";s:2:"79";s:5:"sl_no";s:3:"370";s:7:"test_id";s:17:"MIHC13:-17851-854";s:10:"reciv_date";s:10:"17/09/2013";s:12:"current_date";s:10:"2013-09-17";s:9:"deli_date";s:10:"22/09/2013";s:12:"patient_name";s:18:"Mrs. Anowara Begum";s:3:"age";s:6:"40 Yrs";s:6:"ref_by";s:57:"S.M Noman Khaled Chowdhury MBBS, MS (Neurosurgery) IPGMR.";s:3:"sex";s:6:"Female";s:13:"hospital_name";s:45:"Chevron Clinical Lab (Pvt.) Ltd. Chittagong. ";s:13:"specimen_name";s:53:"Tissue from vertebral body (DIO), Case No: MH13-15851";s:4:"note";s:119:"Result of Immunostaining  for LCA , CD3 , CD20 &amp;&nbsp;CD138 of case No: MH13-15851 from DHL, Path. Lab, Dhaka. <br>";s:15:"reporting_board";s:529:"<b>LCA :</b> Scattered lymphoid cells show positive staining for<b> LCA. </b><br><br><b>CD3 :</b> Scattered lymphoid cells show positive staining for <b>CD3.</b><br><br><b>CD20:</b> No staining was observed for <b>CD20.</b><br><br><b>CD138:</b> Atypical cells show strong positivity for <b>CD138. </b><br><br><b><i>Conclusion: Immunostaining results favor the diagnosis of multiple myeloma. </i></b><br><br><b>Serum Protein Electrophoresis , Bone Marrow&nbsp; examination and bone scanning is suggested for confirmation. </b><br>";s:10:"add_doctor";s:1:"0";}i:12;a:15:{s:7:"immu_id";s:2:"83";s:5:"sl_no";s:3:"364";s:7:"test_id";s:13:"MIHC13:-15699";s:10:"reciv_date";s:10:"24/09/2013";s:12:"current_date";s:10:"2013-09-24";s:9:"deli_date";s:10:"22/09/2013";s:12:"patient_name";s:19:"Mrs. Sanjida Parvin";s:3:"age";s:6:"26 Yrs";s:6:"ref_by";s:0:"";s:3:"sex";s:6:"Female";s:13:"hospital_name";s:31:"Mukti Clinic Pvt. Ltd. Rajshahi";s:13:"specimen_name";s:19:"Tissue from breast.";s:4:"note";s:64:"Result of Immunostaining  for CK of Case No:___ Block No: ( )___";s:15:"reporting_board";s:62:"<b>CK </b><br><br><br><br><br><br><br><br><br><br><br><br><br>";s:10:"add_doctor";s:0:"";}i:13;a:15:{s:7:"immu_id";s:2:"86";s:5:"sl_no";s:3:"383";s:7:"test_id";s:17:"MIHC13:-18607-609";s:10:"reciv_date";s:10:"25/09/2013";s:12:"current_date";s:10:"2013-09-25";s:9:"deli_date";s:10:"06/10/2013";s:12:"patient_name";s:20:"Mrs. Shahanaz Parvin";s:3:"age";s:6:"30 Yrs";s:6:"ref_by";s:45:"Tapesh Kumar Paul,FCPS,MS (Oncology Surgery).";s:3:"sex";s:6:"Female";s:13:"hospital_name";s:3:"DHL";s:13:"specimen_name";s:59:"Tissue from back (Lt. scapular region). Case No: MH13-18317";s:4:"note";s:134:"Result of Immunostaining  for CD99 , CK &amp; Desmin of Case No: MH13-18317 , <br>Block No: (02)&nbsp; from DHL. Path. Lab. Dhaka.<br>";s:15:"reporting_board";s:339:"<b> CD99 :</b> Tumour cells show positive staining for <b>CD99</b>.<br><br><br><b>CK :</b>&nbsp; Scattered cells show positive staining for <b>CK.</b><br><br><br><b>Desmin :</b> Tumour cells show no staining for <b>Desmin</b>. <br><br>Comments: Immunostaining  results favor the diagnosis of primitive neuroectodermal tumour (PNET)<br><br>";s:10:"add_doctor";s:1:"0";}i:14;a:15:{s:7:"immu_id";s:2:"88";s:5:"sl_no";s:3:"398";s:7:"test_id";s:17:"MIHC13:-19143-144";s:10:"reciv_date";s:10:"03/10/2013";s:12:"current_date";s:10:"2013-10-03";s:9:"deli_date";s:10:"06/10/2013";s:12:"patient_name";s:18:"Mr. Jainal Abedin ";s:3:"age";s:6:"60 Yrs";s:6:"ref_by";s:31:"Lt. Col. M S Sarwar Alam (Rtd.)";s:3:"sex";s:6:"Female";s:13:"hospital_name";s:3:"DHL";s:13:"specimen_name";s:38:"One paraffin block, Case No: SH-133/13";s:4:"note";s:139:"Result of Immunostaining  for&nbsp; LCA &amp; CK of Case No: SH-133/13 Block No: (01 ), from Salauddin Specialized Hospital Ltd. Dhaka <br>";s:15:"reporting_board";s:335:"<b> </b><br><br><br><b>LCA:</b>&nbsp;  Tumour cell show diffuse staining for <b>LCA.</b><br><br><br><b>CK:</b>&nbsp; Epithelial cells show positive staining for <b>CK.</b><br><br><br><b><i>Conclusion:&nbsp; Immunostaining results confirm the diagnosis of Non-Hodgkin's lymphoma. </i></b><br><br><br><br><br><br><br><br><br><br><br><br>";s:10:"add_doctor";s:1:"0";}i:15;a:15:{s:7:"immu_id";s:2:"96";s:5:"sl_no";s:3:"415";s:7:"test_id";s:13:"MIHC13:-20185";s:10:"reciv_date";s:10:"22/10/2013";s:12:"current_date";s:10:"2013-10-22";s:9:"deli_date";s:10:"27/10/2013";s:12:"patient_name";s:20:"Ms. Sumani Khaleque ";s:3:"age";s:6:"30 Yrs";s:6:"ref_by";s:45:"Tapesh Kumar Paul,FCPS,MS (Oncology Surgery).";s:3:"sex";s:6:"Female";s:13:"hospital_name";s:11:"DHL, C -514";s:13:"specimen_name";s:19:"Tissue from thyroid";s:4:"note";s:98:"Result of Immunostaining  for Chromogranin of Case No: MH13-19872 , Block No: (03) Additional <br>";s:15:"reporting_board";s:276:"<br><br><b><br><br>Chromogranin :</b> Granular cytoplasmic staining is observed in the tumor cells. <br><br><br><h4><b>Conclusion: Immunostaining result favors the diagnosis of medullary carcinoma of thyroid with papillary structures. </b></h4><br><br><br><br><br><br><br><br>";s:10:"add_doctor";s:1:"0";}i:16;a:15:{s:7:"immu_id";s:2:"97";s:5:"sl_no";s:3:"419";s:7:"test_id";s:17:"MIHC13:-20280-282";s:10:"reciv_date";s:10:"24/10/2013";s:12:"current_date";s:10:"2013-10-24";s:9:"deli_date";s:10:"27/10/2013";s:12:"patient_name";s:7:"Mithila";s:3:"age";s:5:"11Yrs";s:6:"ref_by";s:9:"Abu Taleb";s:3:"sex";s:6:"Female";s:13:"hospital_name";s:24:"R.G. Hospital. Rangpur. ";s:13:"specimen_name";s:54:"Tissue from cervical lymph node. Case no: MH13-19818. ";s:4:"note";s:106:"Result of Immunostaining  for LCA , CD3 &amp; CD20 of Case No:MH13-19818, from DHL. Path. Lab. Dhaka. <br>";s:15:"reporting_board";s:403:"<br><br><b>LCA :</b> Lymphoid cells show positive staining for <b>LCA.</b><br><br><b>CD3 :</b> Majority of the atypical lymphoid cells show positive staining for <b>CD3.</b><br><br><b>CD20 :</b> Scattered clusters of lymphoid cells show positive staining for <b>CD20.</b><br><br><h4><b><i>Conclusion: Immunostaining results favor the diagnosis of non-Hodgkin's lymphoma of "T" cell origin. </i></b></h4>";s:10:"add_doctor";s:1:"0";}i:17;a:15:{s:7:"immu_id";s:3:"102";s:5:"sl_no";s:3:"436";s:7:"test_id";s:13:"MIHC13:-21145";s:10:"reciv_date";s:10:"04/11/2013";s:12:"current_date";s:10:"2013-11-04";s:9:"deli_date";s:10:"10/11/2013";s:12:"patient_name";s:16:"Mrs. Dawsanq Pru";s:3:"age";s:6:"46 Yrs";s:6:"ref_by";s:0:"";s:3:"sex";s:6:"Female";s:13:"hospital_name";s:16:"CSCR, Chittagong";s:13:"specimen_name";s:62:"Tissue from colonic polyp. Case No: MH13-20622, Block No: (01)";s:4:"note";s:116:"Result of Immunostaining  for CD117 of Case No:MH13-20622, Block No: (01) from DHL. Path. Lab. Dhaka.&nbsp; <br><br>";s:15:"reporting_board";s:146:"<b><br>CD117 </b>: Occasional spindle cells show positive staining for <b>CD117. </b><br><br><br><h3><b><i>Result : Inconclusive.</i></b></h3><br>";s:10:"add_doctor";s:1:"0";}i:18;a:15:{s:7:"immu_id";s:3:"103";s:5:"sl_no";s:3:"437";s:7:"test_id";s:17:"MIHC13:-21146-148";s:10:"reciv_date";s:10:"04/11/2013";s:12:"current_date";s:10:"2013-11-04";s:9:"deli_date";s:10:"10/11/2013";s:12:"patient_name";s:18:"Mrs. Monjura Begum";s:3:"age";s:6:"60 Yrs";s:6:"ref_by";s:0:"";s:3:"sex";s:6:"Female";s:13:"hospital_name";s:40:"Lancet Diagnostic & Research, Chittagong";s:13:"specimen_name";s:72:"Tissue from Rt. cervical lymph node. Case No: MH13-20138, Block No: (01)";s:4:"note";s:125:"Result of Immunostaining  for LCA , CD3 &amp; CD20 of Case No:MH13-20138. Block No: (01) from DHL. Path. Lab. Dhaka. <br><br>";s:15:"reporting_board";s:394:"<b> LCA :</b> Lymphoid cells show diffuse staining for <b>LCA.</b><br><br><b>CD3:</b> Scattered lymphoid cells show positive staining for <b>CD3.</b><br><br><b>CD20:</b> Majority of large atypical cells show positive staining for <b>CD20. </b><br><br><br><b><i>Conclusion: Immunostaining results&nbsp; favor the diagnosis of non-Hodgkin's lymphoma of&nbsp; "B" cell origin. </i></b><br><br><br>";s:10:"add_doctor";s:1:"0";}i:19;a:15:{s:7:"immu_id";s:3:"105";s:5:"sl_no";s:3:"443";s:7:"test_id";s:13:"MIHC13:-21285";s:10:"reciv_date";s:10:"06/11/2013";s:12:"current_date";s:10:"2013-11-06";s:9:"deli_date";s:10:"10/11/2013";s:12:"patient_name";s:17:"Mrs. Anwara Begum";s:3:"age";s:6:"47 Yrs";s:6:"ref_by";s:45:"Tapesh Kumar Paul,FCPS,MS (Oncology Surgery).";s:3:"sex";s:6:"Female";s:13:"hospital_name";s:10:"DHL C -510";s:13:"specimen_name";s:44:"Tissue from mesentery. Case No: MH13-21055. ";s:4:"note";s:109:"Result of Immunostaining  for CD117 of Case No: MH13-21055 , Block No: (02 ) from DHL, Path, Lab. Dhaka. <br>";s:15:"reporting_board";s:86:"<b><br><br>CD117:&nbsp; </b>Tumor cells show no staining for <b>CD117.</b><br><br><br>";s:10:"add_doctor";s:1:"0";}i:20;a:15:{s:7:"immu_id";s:3:"107";s:5:"sl_no";s:3:"449";s:7:"test_id";s:17:"MIHC13:-21544-545";s:10:"reciv_date";s:10:"10/11/2013";s:12:"current_date";s:10:"2013-11-10";s:9:"deli_date";s:10:"17/11/2013";s:12:"patient_name";s:11:"Mrs. Jesmin";s:3:"age";s:6:"19 Yrs";s:6:"ref_by";s:45:"Amin Lutful Kabir M.Phil , FCPS (Haematology)";s:3:"sex";s:6:"Female";s:13:"hospital_name";s:3:"DHL";s:13:"specimen_name";s:51:"Tissue from cervical lymph node.Case No: MH12-23133";s:4:"note";s:117:"Result of Immunostaining  for CD15 &amp; CD30 of Case No: MH12-23133, Block No: (02) from DHL. Path. Lab. Dhaka. <br>";s:15:"reporting_board";s:298:"<b><br>CD15:</b> Occasional large cells show positive staining for <b>CD15. </b><br><br><br><b>CD30:</b>&nbsp; Many large atypical cells show positive staining for <b>CD30. </b><br><br><h3><b><i>Conclusion: Immunostaining results favor the diagnosis of Hodgkin's lymphoma. </i></b></h3><br><br><br>";s:10:"add_doctor";s:1:"0";}i:21;a:15:{s:7:"immu_id";s:3:"109";s:5:"sl_no";s:3:"457";s:7:"test_id";s:15:"DIHC13:-2588-89";s:10:"reciv_date";s:10:"14/11/2013";s:12:"current_date";s:10:"2013-11-14";s:9:"deli_date";s:10:"17/11/2013";s:12:"patient_name";s:18:"Mrs. Shahida Begum";s:3:"age";s:6:"53 Yrs";s:6:"ref_by";s:21:"S.C. Dhar. FCPS. MD. ";s:3:"sex";s:6:"Female";s:13:"hospital_name";s:31:"Lab Aid Ltd. Dhanmondi, Dhaka. ";s:13:"specimen_name";s:41:"Tissue from stomach. Case No: DH13-2570, ";s:4:"note";s:95:"Result of Immunostaining  for  LCA & CK of Case No: DH13-2570, from DHL Path. Lab. Dhaka. <br>";s:15:"reporting_board";s:255:"<br><b>LCA :</b> Atypical cells show positive staining for <b>LCA.</b><br><br><br><b>CK : </b>Atypical cells show no staining for<b> CK.<br><br></b><h3><b><i>Conclusion: Immunostaining results confirm the diagnosis of non-Hodgkin's lymphoma. </i></b></h3>";s:10:"add_doctor";s:1:"0";}i:22;a:15:{s:7:"immu_id";s:3:"110";s:5:"sl_no";s:3:"458";s:7:"test_id";s:13:"MIHC13:-21751";s:10:"reciv_date";s:10:"14/11/2013";s:12:"current_date";s:10:"2013-11-14";s:9:"deli_date";s:10:"17/11/2013";s:12:"patient_name";s:4:"Runa";s:3:"age";s:6:"30 Yrs";s:6:"ref_by";s:18:"Md. Habibur Rahman";s:3:"sex";s:6:"Female";s:13:"hospital_name";s:30:"Himi Poly Clinic, Patuakhali. ";s:13:"specimen_name";s:47:"Soft tissue mass in caecum. Case No: MH13-21015";s:4:"note";s:112:"Result of Immunostaining  for CD117 of Case No: MH13-21015&nbsp; Block No: (02) from DHL. Path. Lab. Dhaka. <br>";s:15:"reporting_board";s:149:"<br><br><b>CD117:</b> Neoplastic spindle cells show no staining for <b>CD117.</b><br><br><h3><b><i>Conclusion: CD117 - Negative </i></b></h3><br><br>";s:10:"add_doctor";s:1:"0";}i:23;a:15:{s:7:"immu_id";s:3:"116";s:5:"sl_no";s:3:"466";s:7:"test_id";s:21:"MIHC13:-22284 & 22467";s:10:"reciv_date";s:10:"20/11/2013";s:12:"current_date";s:10:"2013-11-20";s:9:"deli_date";s:10:"01/12/2013";s:12:"patient_name";s:11:"Mrs. Champa";s:3:"age";s:6:"30 Yrs";s:6:"ref_by";s:45:"Tapesh Kumar Paul,FCPS,MS (Oncology Surgery).";s:3:"sex";s:6:"Female";s:13:"hospital_name";s:3:"DHL";s:13:"specimen_name";s:59:"Tissue from left breast. (Core biopsy) Case No: MH13-21902.";s:4:"note";s:102:"Result of Immunostaining  for LCA, CK and CD20 of Case No: MH13-21902 from DHL. Path. Lab. Dhaka. <br>";s:15:"reporting_board";s:442:"<b><br></b><b>LCA:&nbsp; </b>All the atypical lymphoid cell show positive staining for<b> LCA.&nbsp; </b><br><br><br><b>CK :</b> Epithelial cells lining normal ducts show positive staining for <b>CK.</b><br><br><br><b>CD20</b><b>:&nbsp; </b>Atypical lymphoid cells show positive staining for <b>CD20. </b><br><br><br><b><i>Conclusion: Immunostaining results confirm the diagnosis of Non-Hodgkin's lymphoma of "B" cell origin. </i></b><br><br>";s:10:"add_doctor";s:1:"0";}i:24;a:15:{s:7:"immu_id";s:3:"118";s:5:"sl_no";s:3:"476";s:7:"test_id";s:17:"MIHC13:-22574-576";s:10:"reciv_date";s:10:"24/11/2013";s:12:"current_date";s:10:"2013-11-24";s:9:"deli_date";s:10:"01/11/2013";s:12:"patient_name";s:20:"Mrs. Murshida Khanom";s:3:"age";s:6:"58 Yrs";s:6:"ref_by";s:45:"Amin Lutful Kabir M.Phil , FCPS (Haematology)";s:3:"sex";s:6:"Female";s:13:"hospital_name";s:3:"DHL";s:13:"specimen_name";s:60:"Tissue from axillary mass Case No: 130907603, Block No: (A6)";s:4:"note";s:128:"Result of Immunostaining  for BCL-2 , CD20 &amp; CD3 of Case No: 130907603 Block No: (A6) from a i khan Lab Ltd. Dhaka. <br><br>";s:15:"reporting_board";s:438:"<br><b>CD3 </b>: Scattered lymphoid cells show positive staining for <b>CD3. <br><br></b><b>CD20 </b>: Most of the follicular centre cells show positive staining for <b>CD20.</b><br><br><b>BCL-2 :</b> Most of the follicular center cells show positive staining for <b>BCL-2</b><br><br><br><br><br><h3><b><i>Conclusion: Immunostaining results favor the diagnosis of non-Hodgkin's lymphoma of low grade follicular type. </i></b></h3><br><br>";s:10:"add_doctor";s:1:"0";}i:25;a:15:{s:7:"immu_id";s:3:"120";s:5:"sl_no";s:3:"491";s:7:"test_id";s:17:"MIHC13:-23010-012";s:10:"reciv_date";s:10:"03/12/2013";s:12:"current_date";s:10:"2013-12-03";s:9:"deli_date";s:10:"08/12/2013";s:12:"patient_name";s:15:"Mr. Abdul Hakim";s:3:"age";s:6:"56 Yrs";s:6:"ref_by";s:47:"Parvin Akhter Banu, Chief Consultant (Oncology)";s:3:"sex";s:6:"Female";s:13:"hospital_name";s:3:"DHL";s:13:"specimen_name";s:62:"(Nasopharyngeal tissue) One paraffin block. Case No: 131109572";s:4:"note";s:133:"Result of Immunostaining  for LCA , CD3 &amp; CD20&nbsp; of Case No: 131109572 Block No (A1) from a i Khan. Lab. Ltd. Dhaka. <br><br>";s:15:"reporting_board";s:420:"<b><br></b><b>LCA :</b> Lymphoid cells show positive staining for<b> LCA.<br><br><br></b><b>CD3:</b>&nbsp;Scattered lymphoid cells show positive staining for <b>CD3</b>.<br><br><br><b>CD20 :</b> Majority of the atypical lymphoid cells show positive staining for <b>CD20. </b><br><br><br><b>Conclusion:</b> Immunostaining results confirm the diagnosis of <b>Non-Hodgkin's</b> lymphoma of&nbsp; <b>"B" cell origin.</b><br>";s:10:"add_doctor";s:1:"0";}i:26;a:15:{s:7:"immu_id";s:3:"124";s:5:"sl_no";s:3:"499";s:7:"test_id";s:17:"MIHC13:-23283-285";s:10:"reciv_date";s:10:"08/12/2013";s:12:"current_date";s:10:"2013-12-08";s:9:"deli_date";s:10:"15/12/2013";s:12:"patient_name";s:15:"Mrs. Bulbul Ara";s:3:"age";s:6:"70 Yrs";s:6:"ref_by";s:0:"";s:3:"sex";s:6:"Female";s:13:"hospital_name";s:34:"Chevron Clinical Lab , Chittagong.";s:13:"specimen_name";s:57:"Tissue from left inguinal lymph node.Case No: MH13-22855.";s:4:"note";s:131:"Result of Immunostaining  for CD3 , CD20&nbsp; &amp; CD30 of Case No: MH13-22855 , Block No: (02), from DHL. Path. Lab. Dhaka. <br>";s:15:"reporting_board";s:104:"<b>CD3 :</b><br><br><br><br><b>CD20:</b><br><br><br><br><b>CD30:</b><br><br><br><br><b>&nbsp;CK:</b><br>";s:10:"add_doctor";s:1:"0";}i:27;a:15:{s:7:"immu_id";s:3:"130";s:5:"sl_no";s:3:"520";s:7:"test_id";s:17:"MIHC13:-23671-672";s:10:"reciv_date";s:10:"16/12/2013";s:12:"current_date";s:10:"2013-12-16";s:9:"deli_date";s:10:"22/12/2013";s:12:"patient_name";s:17:"Mst. Arjina Begum";s:3:"age";s:6:"40 Yrs";s:6:"ref_by";s:4:"Self";s:3:"sex";s:6:"Female";s:13:"hospital_name";s:32:"Islami Bank Hospital , Rangpur. ";s:13:"specimen_name";s:47:"Tissue from neck swelling. Case No: MH13-22367.";s:4:"note";s:98:"Result of Immunostaining  for LCA &amp; CK of Case No: MH13-22367, from DHL, Path. Lab. Dhaka <br>";s:15:"reporting_board";s:251:"<b><br>LCA :</b> Atypical cells show positive staining for <b>LCA.</b><br><br><br><b>CK :</b> Atypical cells show no staining for <b>CK.</b><br><br><br><b><i>Conclusion: Immunostaining results favor the diagnosis of Non-Hodgkin's lymphoma.</i></b><br>";s:10:"add_doctor";s:1:"0";}i:28;a:15:{s:7:"immu_id";s:3:"131";s:5:"sl_no";s:1:" ";s:7:"test_id";s:11:"MIHC12:1369";s:10:"reciv_date";s:10:"24/01/2012";s:12:"current_date";s:10:"2013-01-24";s:9:"deli_date";s:10:"29/01/2012";s:12:"patient_name";s:17:"Mrs. Majeda Begum";s:3:"age";s:6:"65 Yrs";s:6:"ref_by";s:15:"Khademul Islam ";s:3:"sex";s:6:"Female";s:13:"hospital_name";s:29:"Lab Aid Specialized Hospital ";s:13:"specimen_name";s:34:" One paraffin block No H-145A/2012";s:4:"note";s:131:"<b><u>Result of immunostaining case no H-145A/2012, from Lab
Aid Diagnostic,</u></b>

<b><u>Dhanmondi for CD 117</u></b>

<br>";s:15:"reporting_board";s:333:"<span><b>CD 117&nbsp;&nbsp;&nbsp; </b>:&nbsp;
Tumour cells show positive staining for CD117. </span>

&nbsp;

<br><br><b>Summary
of results :

&nbsp;

</b><span><b>&nbsp;&nbsp;&nbsp;&nbsp;&nbsp;&nbsp;&nbsp;&nbsp;&nbsp;&nbsp;&nbsp;&nbsp; </b><br><br><b>CD 117 -&nbsp; Positive. </b></span><b>

&nbsp;

&nbsp;

</b><br>";s:10:"add_doctor";s:1:"0";}i:29;a:15:{s:7:"immu_id";s:3:"133";s:5:"sl_no";s:3:"533";s:7:"test_id";s:17:"MIHC13:-24206-208";s:10:"reciv_date";s:10:"26/12/2013";s:12:"current_date";s:10:"2013-12-26";s:9:"deli_date";s:10:"29/12/2013";s:12:"patient_name";s:15:"Mita Das Gupta ";s:3:"age";s:6:"50 Yrs";s:6:"ref_by";s:13:"Animesh Mitra";s:3:"sex";s:6:"Female";s:13:"hospital_name";s:39:"Metro Diagnostic Centre Ltd. Chittagong";s:13:"specimen_name";s:47:"Tissue from vaginal growth. Case No: MH13-23600";s:4:"note";s:100:"Result of Immunostaining  for S-100 , Vimentin &amp; SMA of Case No: MH13-23600 , Block No: (02)<br>";s:15:"reporting_board";s:404:"<b>S-100:</b>&nbsp; Tumor cells show strong positive staining for <b>S-100.</b><br><br><br><b>Vimentin :</b> Tumor cells show positive staining for <b>Vimentin. </b><br><br><br><b>SMA :</b> Tumor cells show no staining for <b>SMA.</b><br><br><br><h4><b><i>Conclusion: Immunostaining results favor the diagnosis of low grade malignant peripheral&nbsp; nerve sheath tumor (MPNST). </i></b></h4><br><br><br>";s:10:"add_doctor";s:1:"0";}i:30;a:15:{s:7:"immu_id";s:3:"134";s:5:"sl_no";s:3:"499";s:7:"test_id";s:17:"MIHC13:-23283-285";s:10:"reciv_date";s:10:"08/12/2013";s:12:"current_date";s:10:"2013-12-08";s:9:"deli_date";s:10:"29/12/2013";s:12:"patient_name";s:16:"Mrs. Bulbul Ara ";s:3:"age";s:6:"70 Yrs";s:6:"ref_by";s:0:"";s:3:"sex";s:6:"Female";s:13:"hospital_name";s:32:"Chevron Clinical Lab, Chittagong";s:13:"specimen_name";s:57:"Tissue from left inguinal lymph node. Case No: MH13-22855";s:4:"note";s:135:"Result of Immunostaining  for LCA, CD3 , CD20 &amp; CD30&nbsp; of Case No: MH13-22855 , Block No: (02) from DHL. Path. Lab. Dhaka. <br>";s:15:"reporting_board";s:548:"<b>LCA :&nbsp;</b> All the atypical cells show positive staining for<b> LCA. <br><br><br>CD3 :</b> Scattered cells show positive staining for <b>CD3.</b><br><br><br><b>CD20:&nbsp; </b>Most of the atypical cells including large atypical cells and multinucleated giant cells show&nbsp; positive staining for <b>CD20.</b><br><br><br><b>CD30 :</b> Occasional large atypical cells show positive staining for <b>CD30.</b><br><br><br><h4><b><i>Conclusion: Immunostaining results favor the diagnosis of NHL, diffuse large B-cell type. </i></b></h4><br><br>";s:10:"add_doctor";s:1:"0";}i:31;a:15:{s:7:"immu_id";s:3:"135";s:5:"sl_no";s:3:"527";s:7:"test_id";s:13:"MIHC13:-23987";s:10:"reciv_date";s:10:"22/12/2013";s:12:"current_date";s:10:"2013-12-22";s:9:"deli_date";s:10:"29/12/2013";s:12:"patient_name";s:5:"Ratri";s:3:"age";s:6:"13 Yrs";s:6:"ref_by";s:4:"Diba";s:3:"sex";s:6:"Female";s:13:"hospital_name";s:23:"NICRH, Mohakhali, Dhaka";s:13:"specimen_name";s:102:"Tisue from posterior aspect of right leg (In the plane of gastro-soleus muscle.). Case No: MH13-23516.";s:4:"note";s:107:"Result of Immunostaining  for CD99 of Case No: MH13-23516 , Block No: (02) from DHL. Path. Lab. Dhaka. <br>";s:15:"reporting_board";s:176:"<b>CD99 </b>: Tumor cells show positive staining for <b>CD99. </b><br><br><br><h4><b><i>Conclusion: Immunostaining result favors the diagnosis of Ewing's sarcoma. </i></b></h4>";s:10:"add_doctor";s:1:"0";}i:32;a:15:{s:7:"immu_id";s:3:"142";s:5:"sl_no";s:1:" ";s:7:"test_id";s:12:"MIHC12-05598";s:10:"reciv_date";s:10:"27/03/2012";s:12:"current_date";s:10:"2012-03-27";s:9:"deli_date";s:10:"03/05/2012";s:12:"patient_name";s:6:"Shrity";s:3:"age";s:6:"12 Yrs";s:6:"ref_by";s:47:"Mahtab Uddin Ahmed, MD, (Pathology) Thesis Part";s:3:"sex";s:6:"Female";s:13:"hospital_name";s:4:"SSMC";s:13:"specimen_name";s:27:"One paraffin block No- (14)";s:4:"note";s:195:"<span><b>Result of
CD30 Immunostaining, of sections prepared from paraffin block ID Code (14 ) supplied
by Dr. Mahtab Uddin Ahmed, MD. (Pathology) Thesis part. </b><b><u></u></b></span>

<br>";s:15:"reporting_board";s:85:"CD30
- Large atypical cells resembling RS cells show CD30 Positive staining.

<br>";s:10:"add_doctor";s:1:"0";}i:33;a:15:{s:7:"immu_id";s:3:"146";s:5:"sl_no";s:1:" ";s:7:"test_id";s:12:"MIHC12-05050";s:10:"reciv_date";s:10:"20/03/2012";s:12:"current_date";s:10:"2012-03-20";s:9:"deli_date";s:10:"03/05/2012";s:12:"patient_name";s:13:"Shamsun Nahar";s:3:"age";s:6:"60 Yrs";s:6:"ref_by";s:48:"Mahtab Uddin Ahmed,  MD. (Pathology) Thesis part";s:3:"sex";s:6:"Female";s:13:"hospital_name";s:8:"S.S.M.C.";s:13:"specimen_name";s:27:"One paraffin block No: (08)";s:4:"note";s:200:"<span><b>Result of CD30
Immunostaining, of sections prepared from paraffin block ID Code (08)supplied
by Dr. Mahtab Uddin Ahmed, MD. (Pathology) Thesis <u>part. </u></b><b><u></u></b></span>

<br>";s:15:"reporting_board";s:89:"CD30
- Large atypical cells resembling RS cells show Positive staining for CD30.

<br>";s:10:"add_doctor";s:1:"0";}i:34;a:15:{s:7:"immu_id";s:3:"152";s:5:"sl_no";s:1:" ";s:7:"test_id";s:13:"MH12-10459-61";s:10:"reciv_date";s:10:"04/06/2012";s:12:"current_date";s:10:"2012-06-04";s:9:"deli_date";s:10:"10/06/2013";s:12:"patient_name";s:17:"Mrs. Momtaz Begum";s:3:"age";s:6:"45 Yrs";s:6:"ref_by";s:24:"Amin Lutful Kabir , FCPS";s:3:"sex";s:6:"Female";s:13:"hospital_name";s:3:"DHL";s:13:"specimen_name";s:26:"One Paraffin Block K12-145";s:4:"note";s:244:"<b>Result of immunostaining for &nbsp;LCA, CD3 &amp; CD20 case No. IBCH-12/145 Block
No: K12-145(02) from </b><b>Islami</b><b> </b><b>Bank</b><b> </b><b>Central</b><b> </b><b>Hospital</b><b>, </b><b>Dhaka</b><b><span>&nbsp; <br></span></b><br>";s:15:"reporting_board";s:412:"LCA -&nbsp; show diffuse positive staining of lymphoid
cells.

&nbsp;

<span><br><br>CD3 -&nbsp; Scattered lymphoid cells show positive
staining.</span>

&nbsp;

<br><br><br>CD20- Most of the atypical
lymphoid cells show positive staining 

&nbsp;

&nbsp;

<br><br>Conclusion:- Considering the
immunostaining results, this case can be treated as non-Hodgkins lymphoma of
B cell origin.

<br>";s:10:"add_doctor";s:1:"0";}i:35;a:15:{s:7:"immu_id";s:3:"153";s:5:"sl_no";s:1:" ";s:7:"test_id";s:13:"MH12-10459-61";s:10:"reciv_date";s:10:"04/06/2012";s:12:"current_date";s:10:"2012-06-04";s:9:"deli_date";s:10:"10/06/2012";s:12:"patient_name";s:17:"Mrs. Momtaz Begum";s:3:"age";s:6:"45 Yrs";s:6:"ref_by";s:24:"Amin Lutful Kabir , FCPS";s:3:"sex";s:6:"Female";s:13:"hospital_name";s:3:"DHL";s:13:"specimen_name";s:26:"One Paraffin Block K12-145";s:4:"note";s:189:"<b>Result of immunostaining for &nbsp;LCA, CD3 &amp; CD20 case No. IBCH-12/145 Block
No: K12-145(02) from Islami
 Bank Central
 Hospital, Dhaka &nbsp;</b>

<b><u>&nbsp;</u></b>

<br>";s:15:"reporting_board";s:406:"LCA -&nbsp; show diffuse positive staining of lymphoid
cells.

&nbsp;

<span><br><br>CD3 -&nbsp; Scattered lymphoid cells show positive
staining.</span>

&nbsp;
<br><br>CD20- Most of the atypical
lymphoid cells show positive staining 

&nbsp;

&nbsp;

<br><br>Conclusion:- Considering the
immunostaining results, this case can be treated as non-Hodgkins lymphoma of
B cell origin.

<br>";s:10:"add_doctor";s:1:"0";}i:36;a:15:{s:7:"immu_id";s:3:"154";s:5:"sl_no";s:1:" ";s:7:"test_id";s:12:"MIHC12-10529";s:10:"reciv_date";s:10:"05/06/2012";s:12:"current_date";s:10:"2012-06-05";s:9:"deli_date";s:10:"10/06/2012";s:12:"patient_name";s:17:"Mrs. Lukna Rahman";s:3:"age";s:6:"33 Yrs";s:6:"ref_by";s:34:"M.M. Mafizur Rahman, MD, MS, Ph.D.";s:3:"sex";s:6:"Female";s:13:"hospital_name";s:25:"City Hospital Ltd, Dhaka ";s:13:"specimen_name";s:49:"Tissue from segment of transverse colon with lump";s:4:"note";s:97:"<b>Result of
immunostaining case no MH12-4416, Block No-(01) for &nbsp;CD&nbsp; 117 </b>

<br>";s:15:"reporting_board";s:302:"<span><b>CD 117&nbsp;&nbsp;&nbsp; </b>:&nbsp;
Tumour cells show no staining for&nbsp;
CD117. </span>

&nbsp;

<br><br>Summary
of results :

&nbsp;

<span>&nbsp;&nbsp;&nbsp;&nbsp;&nbsp;&nbsp;&nbsp;&nbsp;&nbsp;&nbsp;&nbsp;&nbsp;&nbsp; <br><br>CD 117 -&nbsp; Negative. </span>

&nbsp;

<br>";s:10:"add_doctor";s:1:"0";}i:37;a:15:{s:7:"immu_id";s:3:"156";s:5:"sl_no";s:2:"04";s:7:"test_id";s:16:"MIHC14:00124-126";s:10:"reciv_date";s:10:"02/01/2014";s:12:"current_date";s:10:"2014-01-02";s:9:"deli_date";s:10:"05/01/2014";s:12:"patient_name";s:11:"Mrs. Shafia";s:3:"age";s:6:"60 Yrs";s:6:"ref_by";s:47:"Tapesh Kumar Paul, FCPS, MS (Oncology Surgery).";s:3:"sex";s:6:"Female";s:13:"hospital_name";s:20:"DHL. Mirpur. Dhaka. ";s:13:"specimen_name";s:52:"Tissue from cervical lymph node. Case No: MH13-24504";s:4:"note";s:105:"Result of Immunostaining  for LCA, CD3 &amp; CD20 of Case No: MH13-24504 from DHL. Path. Lab. Dhaka. <br>";s:15:"reporting_board";s:423:"<b><br>LCA:</b> Lymphoid cells show positive staining for<b> </b><b>LCA</b><b>.</b><br><br><br><b>CD3:</b> Scattered lymphoid cells show positive staining for<b> </b><b>CD3.</b><br><br><br><b>CD20 :</b> Majority of the atypical lymphoid cells show positive staining for <b>CD20.</b><br><br><b><i>Conclusion: Immunostaining results favor the diagnosis of Non-Hodgkin's lymphoma of&nbsp; "B" cell origin. </i></b><br><br><br>";s:10:"add_doctor";s:1:"0";}i:38;a:15:{s:7:"immu_id";s:3:"157";s:5:"sl_no";s:3:"003";s:7:"test_id";s:13:"MIHC14:-24468";s:10:"reciv_date";s:10:"31/12/2013";s:12:"current_date";s:10:"2013-12-31";s:9:"deli_date";s:10:"05/01/2014";s:12:"patient_name";s:12:"Mrs. Lovely ";s:3:"age";s:6:"30 Yrs";s:6:"ref_by";s:26:"Nirmalendu Roy, MCPS, CAMS";s:3:"sex";s:6:"Female";s:13:"hospital_name";s:29:"Update Care Hospital , Ranpur";s:13:"specimen_name";s:41:"Tissue from stomach. Case No:____________";s:4:"note";s:65:"Result of Immunostaining  for CK &amp; CD-138 of Case No:____<br>";s:15:"reporting_board";s:46:"<b>CK :</b><br><br><br><br><b>CD-138 :</b><br>";s:10:"add_doctor";s:1:"0";}i:39;a:15:{s:7:"immu_id";s:3:"161";s:5:"sl_no";s:1:" ";s:7:"test_id";s:15:"MIHC12:12210-11";s:10:"reciv_date";s:10:"27/06/2012";s:12:"current_date";s:10:"2012-06-27";s:9:"deli_date";s:10:"01/07/2012";s:12:"patient_name";s:11:"Mrs. Rehana";s:3:"age";s:6:"48 Yrs";s:6:"ref_by";s:57:"Mahtab Uddin Ahmed, MD, (Pathology), Student, Thesis Part";s:3:"sex";s:6:"Female";s:13:"hospital_name";s:6:"SSMC&H";s:13:"specimen_name";s:36:"One paraffin block, ID Code (1088). ";s:4:"note";s:267:"<u>Result of LCA &amp; CD30 immunostaining of sections
prepared from paraffin block 

</u><span><u><span>ID code (1088) Supplied by<b> </b></span></u><b><u>Dr. Mahtab Uddin Ahmed, MD.
(Pathology), Student, Thesis Part. </u></b><b><u></u></b></span><u>

</u><br>";s:15:"reporting_board";s:134:"&nbsp;<span><b>LCA&nbsp;&nbsp;&nbsp;
</b>:&nbsp; No Lymphnodal tissue is seen and
no CD 30 positive cells are seen . </span>

<br>";s:10:"add_doctor";s:1:"0";}i:40;a:15:{s:7:"immu_id";s:3:"164";s:5:"sl_no";s:1:" ";s:7:"test_id";s:15:"MIHC12:12215-17";s:10:"reciv_date";s:10:"27/06/2012";s:12:"current_date";s:10:"2012-06-27";s:9:"deli_date";s:10:"01/07/2012";s:12:"patient_name";s:20:"Mrs. Khorshida Begum";s:3:"age";s:6:"30 Yrs";s:6:"ref_by";s:18:"Parvin Akhter Banu";s:3:"sex";s:6:"Female";s:13:"hospital_name";s:3:"DHL";s:13:"specimen_name";s:32:"One paraffin block  No. P- 8912 ";s:4:"note";s:153:"<b>Result of
immunostaining for LCA, CD3 &amp; CD20 &nbsp;of case no. P-8912 Block No. (02)&nbsp;</b><b> from
Modern Diagnostic Centre Ltd.</b>

<br>";s:15:"reporting_board";s:552:"<span><b>LCA &nbsp;&nbsp;</b>: &nbsp;Lymphoid cells show diffuse&nbsp; positive staining .</span>&nbsp;

<u><b><br><br></b></u><span><b>CD3</b>&nbsp;&nbsp; &nbsp;:&nbsp;&nbsp;
Scattered lymphoid cells show positive staining. </span>

<span><b><br><br>CD20</b>&nbsp; :&nbsp;&nbsp; Most
of the lymphoid cells show positive staining. </span>

&nbsp;

<span><br><br><b><i>Conclusion: Considering the
immunostaining results, this case can be treated as a case of non-Hodgkins
lymphoma of&nbsp; B cell origin.</i></b></span><b><i>

</i></b><br>";s:10:"add_doctor";s:1:"0";}i:41;a:15:{s:7:"immu_id";s:3:"165";s:5:"sl_no";s:1:" ";s:7:"test_id";s:13:"MH12-12215-17";s:10:"reciv_date";s:10:"27/06/2012";s:12:"current_date";s:10:"2012-06-27";s:9:"deli_date";s:10:"30/06/2012";s:12:"patient_name";s:20:"Mrs. Khorshida Begum";s:3:"age";s:6:"30 Yrs";s:6:"ref_by";s:18:"Parvin Akhter Banu";s:3:"sex";s:6:"Female";s:13:"hospital_name";s:0:"";s:13:"specimen_name";s:35:"Two slides and two paraffin blocks ";s:4:"note";s:97:"<b>Result of
immunostaining for CD3, CD2<i></i>0 &amp; LCA of case no. Lab No-P-8912</b>

<br>";s:15:"reporting_board";s:550:"<span><b>LCA&nbsp;&nbsp;
</b>:&nbsp; Lymphoid cells show diffuse&nbsp; positive staining .</span><br><br><span><b>CD3</b>&nbsp;&nbsp;&nbsp; :&nbsp;&nbsp;
Scattered lymphoid cells show positive staining. </span>

<span><b><br><br>CD20</b>&nbsp; :&nbsp;&nbsp;
Mostly of the lymphoid cells show positive staining. </span>

&nbsp;

<span><br><br><b><i>Conclusion: Consisting the
immunostaining results, this case can be treated as a case of non-Hodgkins
lymphoma of&nbsp; B cell origin.</i></b></span><b><i>

&nbsp;

&nbsp;

</i></b><br>";s:10:"add_doctor";s:1:"0";}i:42;a:15:{s:7:"immu_id";s:3:"167";s:5:"sl_no";s:1:" ";s:7:"test_id";s:13:"MIHC12: 11603";s:10:"reciv_date";s:10:"19/06/2012";s:12:"current_date";s:10:"2012-06-19";s:9:"deli_date";s:10:"01/07/2012";s:12:"patient_name";s:12:"Mrs. Jamila ";s:3:"age";s:6:"22 Yrs";s:6:"ref_by";s:57:"Mahtab Uddin Ahmed, MD, (Pathology), Student, Thesis Part";s:3:"sex";s:6:"Female";s:13:"hospital_name";s:4:"SSMC";s:13:"specimen_name";s:34:"One paraffin block, ID Code (24). ";s:4:"note";s:227:"Result of CD30 immunostaining of sections prepared
from paraffin block 

<span><span>ID code (24) Supplied by<b> </b></span><b>Dr. Mahtab Uddin Ahmed, MD.
(Pathology), Student, Thesis part. </b><b><u></u></b></span>

<br>";s:15:"reporting_board";s:94:"<span><b>CD30</b>&nbsp; :&nbsp;&nbsp;
Scattered CD30 positive cells are seen. </span>

<br>";s:10:"add_doctor";s:1:"0";}i:43;a:15:{s:7:"immu_id";s:3:"168";s:5:"sl_no";s:2:"  ";s:7:"test_id";s:16:"MIHC12: 13970-71";s:10:"reciv_date";s:10:"19/07/2012";s:12:"current_date";s:10:"2012-07-19";s:9:"deli_date";s:10:"29/07/2012";s:12:"patient_name";s:12:"Tazvi Rahman";s:3:"age";s:10:"4 Yrs. 6 m";s:6:"ref_by";s:31:"M. A. Mushfiqur Rahman, FCPS,MS";s:3:"sex";s:6:"Female";s:13:"hospital_name";s:14:"Sigma Lab, Ctg";s:13:"specimen_name";s:34:"Tissue from post auricular region.";s:4:"note";s:148:"<b>Result of Immunostaining for Vimentin, Desmin and S100 of case No. MH12:
13198, </b>

<span><b>Block No. (O1)</b><b><u></u></b></span>

<br>";s:15:"reporting_board";s:412:"Vimentin-
Tumour cells show positive staining for vimentin.&nbsp;

<br><br>Desmin
 Tumour cells show no staining for desmin.

&nbsp;

<span><br><br>S100:&nbsp; Tumour cell show positive staining for S100.</span>

&nbsp;

&nbsp;

<br><br>Conclusion:
Immunostaining result is suggestive of primitive neurocetodermal tumour (PNET).
Immunostaining for CD 99 can further clarify the diagnosis.

<br>";s:10:"add_doctor";s:1:"0";}i:44;a:15:{s:7:"immu_id";s:3:"169";s:5:"sl_no";s:1:" ";s:7:"test_id";s:16:"MIHC12:-14580-82";s:10:"reciv_date";s:10:"28/07/2012";s:12:"current_date";s:10:"2012-07-28";s:9:"deli_date";s:10:"05/08/2012";s:12:"patient_name";s:16:"Miss Munmun Erat";s:3:"age";s:6:"19 Yrs";s:6:"ref_by";s:18:"Parvin Akhter Banu";s:3:"sex";s:6:"Female";s:13:"hospital_name";s:24:"BIRDEM General Hospital ";s:13:"specimen_name";s:29:"One paraffin block BH-1967/12";s:4:"note";s:164:"<b>Result of
immunohistochemical study of case no BH-1967/2012 for</b>

<b>&nbsp;LCA, CD3 &amp; CD20 from BIRDEM General
 Hospital.</b>

<b>&nbsp;</b>

<br>";s:15:"reporting_board";s:481:"<span><b>LCA&nbsp;
</b><span>:&nbsp; Tumor cells show positive
staining for LCA.<br><br></span></span><span><b>CD3</b>&nbsp;&nbsp; :&nbsp;
Scattered lymphoid cells show positive staining</span>

<span><b><br><br>CD20</b>&nbsp; : Tumour cells show positive staining for
CD20.</span>

&nbsp;

<span><br><br>Conclusion:
Considering the immunostaining results this case should be treated as a case
of&nbsp;</span> Non-Hodgkins lymphoma of
B cell origin. 

&nbsp;

<br>";s:10:"add_doctor";s:1:"0";}i:45;a:15:{s:7:"immu_id";s:3:"171";s:5:"sl_no";s:1:" ";s:7:"test_id";s:16:"MIHC12:-15397-98";s:10:"reciv_date";s:10:"07/08/2012";s:12:"current_date";s:10:"2012-08-07";s:9:"deli_date";s:10:"12/08/2012";s:12:"patient_name";s:15:"Mr. Abdus Salam";s:3:"age";s:6:"55 Yrs";s:6:"ref_by";s:33:"Zahidul Haq, FCPS, FRCS, MS, FICS";s:3:"sex";s:6:"Female";s:13:"hospital_name";s:61:"Popular Medical College Hospital, Consultation Centre ,Dhaka ";s:13:"specimen_name";s:32:"One paraffin block Sp No. QD-419";s:4:"note";s:152:"<b><u>Result of
immunohistochemical study of case no SP NO.QD-419 for</u></b>

<b><u>&nbsp;CK &amp; Chromogranin from The Laboratory.</u></b>

<br>";s:15:"reporting_board";s:422:"<span><b>Chromogranin- </b>Most of the tumour cells show strong
cytoplasmic granular staining.</span>

&nbsp;

<span><b><br><br>CK</b> &nbsp;:&nbsp;
Scattered cells show non specific staining for CK.</span>

&nbsp;<br><br>&nbsp;Conclusion:
Considering the immunostaining results this case can be treated as a carcinoid
tumour.&nbsp; 

&nbsp;&nbsp;&nbsp;&nbsp;&nbsp;&nbsp;&nbsp;&nbsp;&nbsp;&nbsp;&nbsp; 

<br>";s:10:"add_doctor";s:1:"0";}i:46;a:15:{s:7:"immu_id";s:3:"173";s:5:"sl_no";s:2:"07";s:7:"test_id";s:17:"MIHC14:-00212-213";s:10:"reciv_date";s:10:"06/01/2014";s:12:"current_date";s:10:"2014-01-06";s:9:"deli_date";s:10:"12/01/2014";s:12:"patient_name";s:4:"Moni";s:3:"age";s:6:"20 Yrs";s:6:"ref_by";s:0:"";s:3:"sex";s:6:"Female";s:13:"hospital_name";s:42:"(Corporate Name: Badal Pharmacy, Rangpur.)";s:13:"specimen_name";s:59:"Tissue from supraclavicular lymph node. Case No: MH13-23939";s:4:"note";s:125:"Result of Immunostaining  for S-100 &amp;&nbsp; Vimentin&nbsp; of Case No: MH13-23939. from&nbsp; DHL, Path. Lab. Dhaka. <br>";s:15:"reporting_board";s:323:"<b>S-100 :</b> Tumor cells show positive staining for <b>S-100. </b><br><br><br><b>Vimentin :</b> Tumor cells show positive staining for <b>Vimentin. </b><br><br><br><h4><b><i>Conclusion: Immunostaining results favor the diagnosis of low grade malignant&nbsp; neoplasm of peripheral nerve&nbsp; sheath origin. </i></b></h4>";s:10:"add_doctor";s:1:"0";}i:47;a:15:{s:7:"immu_id";s:3:"176";s:5:"sl_no";s:3:"014";s:7:"test_id";s:18:"MIHC13:-00492-494 ";s:10:"reciv_date";s:10:"12/01/2013";s:12:"current_date";s:10:"2013-01-12";s:9:"deli_date";s:10:"20/01/2013";s:12:"patient_name";s:11:"Mrs. Majeda";s:3:"age";s:6:"47 Yrs";s:6:"ref_by";s:48:"Parvin Akhter Banu, Senior Consultant (Oncology)";s:3:"sex";s:6:"Female";s:13:"hospital_name";s:5:"DLMCH";s:13:"specimen_name";s:27:"One paraffin block (QF-830)";s:4:"note";s:120:"Result of Immunostaining&nbsp; for LCA , CK &amp; Vimentin of case No: QF-830 <br>Block No: (02) from The Laboratory<br>";s:15:"reporting_board";s:161:"<br>LCA:-Scattered inflammatory cells show positive staining. However tumour cells show no staining. <br><br><br><br>CK:-Focal positive staining is seen.<br><br>";s:10:"add_doctor";s:1:"0";}i:48;a:15:{s:7:"immu_id";s:3:"177";s:5:"sl_no";s:3:"018";s:7:"test_id";s:17:"MIHC13:-00875-877";s:10:"reciv_date";s:10:"19/01/2013";s:12:"current_date";s:10:"2013-01-19";s:9:"deli_date";s:10:"27/01/2013";s:12:"patient_name";s:11:"Ranu Sushil";s:3:"age";s:6:"45 Yrs";s:6:"ref_by";s:0:"";s:3:"sex";s:6:"Female";s:13:"hospital_name";s:20:"The Lab, Chittagong.";s:13:"specimen_name";s:21:"Tissue from left leg.";s:4:"note";s:99:"Result of Immunostaining&nbsp; for Vimentin &amp; Desmin of case No:MH13-110<br>Block No: ( 02)<br>";s:15:"reporting_board";s:239:"<br><br>Vimentin:- Tumour cell show positive staining for Vimentin.<br><br>Desmin:- Some of the tumour cell show cytoplasmic staining for desmin. <br><br>Conclusion: Immunostaining results favours the diagnosis of Rhabdomyosarcoma.<br><br>";s:10:"add_doctor";s:1:"0";}i:49;a:15:{s:7:"immu_id";s:3:"182";s:5:"sl_no";s:3:"044";s:7:"test_id";s:17:"MIHC13:-01888-889";s:10:"reciv_date";s:10:"04/02/2013";s:12:"current_date";s:10:"0000-00-00";s:9:"deli_date";s:10:"10/02/2013";s:12:"patient_name";s:12:"Selina Begum";s:3:"age";s:6:"45 Yrs";s:6:"ref_by";s:34:"Swapan Kumar (Oncologist), Rangpur";s:3:"sex";s:6:"Female";s:13:"hospital_name";s:53:"Rangpur Community Medical College & Hospital Rangpur.";s:13:"specimen_name";s:31:"Tissue from ovarian tumor (Rt.)";s:4:"note";s:95:"Result of Immunostaining&nbsp; for LCA &amp; CD20 of case No: MH13-01019<br>Block No: (03 )<br>";s:15:"reporting_board";s:212:"LCA :- Tumour cells show positive staining for LCA<br><br>CD20:- Tumour cells show positive staining for CD20.<br><br><br>Conclusion : Immunostaining results favor the diagnosis of NHL of "B" cell origin.<br><br>";s:10:"add_doctor";s:1:"0";}i:50;a:15:{s:7:"immu_id";s:3:"192";s:5:"sl_no";s:2:"11";s:7:"test_id";s:13:"MIHC14:-01379";s:10:"reciv_date";s:10:"27/01/2013";s:12:"current_date";s:10:"0000-00-00";s:9:"deli_date";s:10:"19/01/2014";s:12:"patient_name";s:19:"Miss. Sweety Akhter";s:3:"age";s:6:"15 Yrs";s:6:"ref_by";s:0:"";s:3:"sex";s:6:"Female";s:13:"hospital_name";s:20:"The Lab, Chittagong.";s:13:"specimen_name";s:54:"Tissue from Swelling of Rt. thigh. Case No: MH13-01379";s:4:"note";s:89:"Result of Immunostaining  for LCA , CD3 , CD20 &amp; CD99 of Case No:MH13-01379. <br><br>";s:15:"reporting_board";s:91:"<b>LCA :</b><br><br><br><b>CD3 :</b><br><br><br><b>CD20 :</b><br><br><br><b>CD99 : </b><br>";s:10:"add_doctor";s:1:"0";}i:51;a:15:{s:7:"immu_id";s:3:"194";s:5:"sl_no";s:2:"72";s:7:"test_id";s:13:"MIHC13:-03607";s:10:"reciv_date";s:10:"04/03/2013";s:12:"current_date";s:10:"0000-00-00";s:9:"deli_date";s:10:"10/03/2013";s:12:"patient_name";s:14:"Ms. Rama Dutta";s:3:"age";s:6:"37 Yrs";s:6:"ref_by";s:38:"Ali Asgar Chowdhury , FCPS, Oncologist";s:3:"sex";s:6:"Female";s:13:"hospital_name";s:42:"Surgiscope Hospital Ltd. Unit-2,Chittagong";s:13:"specimen_name";s:38:"One Paraffine Block (R002/N-4752/2012)";s:4:"note";s:143:"Result of Immunostaining&nbsp; for ER of case No:R002/N-4752/2012<br>Block No: (R2/13) from Surgiscope Hospital Ltd. Unit-2, Chittagong<br><br>";s:15:"reporting_board";s:120:"<br>ER:- Tumour cells nuclei show no staining. <br>Quick Score "0"<br><br><br><br>Summary of result: ER-Negative<br><br>";s:10:"add_doctor";s:1:"0";}i:52;a:15:{s:7:"immu_id";s:3:"195";s:5:"sl_no";s:2:"76";s:7:"test_id";s:16:"MIHC13:-3639-640";s:10:"reciv_date";s:10:"05/03/2013";s:12:"current_date";s:10:"0000-00-00";s:9:"deli_date";s:10:"10/03/2013";s:12:"patient_name";s:18:"Mrs. Tasrina Jahan";s:3:"age";s:6:"27 Yrs";s:6:"ref_by";s:48:"Parvin Akhter Banu, Senior Consultant (Oncology)";s:3:"sex";s:6:"Female";s:13:"hospital_name";s:3:"DHL";s:13:"specimen_name";s:28:"One Paraffin Block (1311800)";s:4:"note";s:112:"Result of Immunostaining&nbsp; for GFAP &amp; Cytokeratin of case No:1311800 from The Laboratory , Dhaka<br><br>";s:15:"reporting_board";s:234:"GFAP :- Tumour cells show strong positive staining for GFAP. <br><br>Cytokeratin:- Tumour cells show no specific staining for CK. <br><br>Conclusion:&nbsp; Immunostaining results favor the diagnosis of glioblastoma multiforme.<br><br>";s:10:"add_doctor";s:1:"0";}i:53;a:15:{s:7:"immu_id";s:3:"196";s:5:"sl_no";s:2:"73";s:7:"test_id";s:14:"MIHC134:-03608";s:10:"reciv_date";s:10:"04/03/2013";s:12:"current_date";s:10:"0000-00-00";s:9:"deli_date";s:10:"10/03/2013";s:12:"patient_name";s:12:"Mrs. Ruksana";s:3:"age";s:6:"35 Yrs";s:6:"ref_by";s:38:"Ali Asgar Chowdhury , FCPS, Oncologist";s:3:"sex";s:6:"Female";s:13:"hospital_name";s:42:"Surgiscope Hospital Ltd. Unit-2,Chittagong";s:13:"specimen_name";s:38:"One Paraffine Block (R003/N-4924/2012)";s:4:"note";s:146:"Result of Immunostaining&nbsp; for ER of case No:R003/N-4924/2012<br>Block No: (R-3-1/13) from Surgiscope Hospital Ltd. Unit-2, Chittagong<br><br>";s:15:"reporting_board";s:124:"ER:- Tumour cells nuclei show no staining. <br>Quick Score "0"<br><br>Summary of Result :&nbsp;&nbsp; ER - Negative.<br><br>";s:10:"add_doctor";s:1:"0";}i:54;a:15:{s:7:"immu_id";s:3:"199";s:5:"sl_no";s:3:"105";s:7:"test_id";s:17:"MIHC13:-00751-753";s:10:"reciv_date";s:10:"31/03/2013";s:12:"current_date";s:10:"0000-00-00";s:9:"deli_date";s:10:"07/04/2013";s:12:"patient_name";s:12:"Mrs. Shahida";s:3:"age";s:6:"60 Yrs";s:6:"ref_by";s:9:"A.K. Azad";s:3:"sex";s:6:"Female";s:13:"hospital_name";s:29:"C S C R Hospital, Chittagong.";s:13:"specimen_name";s:10:"Lymph node";s:4:"note";s:111:"Result of Immunostaining&nbsp; for LCA(CD45), CD3 &amp; CD20 of case No:&nbsp; DH13-00666<br>Block No: (01)<br>";s:15:"reporting_board";s:363:"LCA(CD45): Neoplastic cells show diffuse staining for LCA. <br><br><br>CD3: Most of the neoplastic cells show positive staining for CD3.<br><br><br>CD20: Scattered lymphoid cells show positive staining for CD20.<br><br><br>Conclusion: Considering the immunostaining results, this case can be treated as malignant non-Hodgkin's lymphoma of "T" cell origin.<br><br>";s:10:"add_doctor";s:1:"0";}i:55;a:15:{s:7:"immu_id";s:3:"200";s:5:"sl_no";s:2:"76";s:7:"test_id";s:16:"MIHC13:-3639-640";s:10:"reciv_date";s:10:"05/03/2013";s:12:"current_date";s:10:"0000-00-00";s:9:"deli_date";s:10:"10/03/2013";s:12:"patient_name";s:18:"Mrs. Tasrina Jahan";s:3:"age";s:6:"27 Yrs";s:6:"ref_by";s:48:"Parvin Akhter Banu, Senior Consultant (Oncology)";s:3:"sex";s:6:"Female";s:13:"hospital_name";s:3:"DHL";s:13:"specimen_name";s:28:"One Paraffin Block (1311800)";s:4:"note";s:108:"Result of Immunostaining&nbsp; for GFAP &amp; Cytokeratin of case No:1311800 from The Laboratory , Dhaka<br>";s:15:"reporting_board";s:150:"GFAP :- Tumour cells show strong positive staining for GFAP. <br><br><br><br>Cytokeratin:- Tumour cells show no specific staining for CK. <br><br><br>";s:10:"add_doctor";s:1:"0";}i:56;a:15:{s:7:"immu_id";s:3:"203";s:5:"sl_no";s:3:"118";s:7:"test_id";s:13:"MIHC13:-06169";s:10:"reciv_date";s:10:"11/04/2013";s:12:"current_date";s:10:"2013-04-11";s:9:"deli_date";s:10:"11/04/2013";s:12:"patient_name";s:19:"Mrs. Josna Ferdousi";s:3:"age";s:6:"29 Yrs";s:6:"ref_by";s:0:"";s:3:"sex";s:6:"Female";s:13:"hospital_name";s:41:"Surgiscope Hospital (Unit-2), Chittagong.";s:13:"specimen_name";s:34:"One paraffin block case No: R-5/13";s:4:"note";s:111:"Result of Immunostaining&nbsp; for ER of case No: R-5/13 from Surgiscope Hospital <br>(Unit-2), Chittagong.<br>";s:15:"reporting_board";s:87:"ER:- About 40 % of the ductal epithelial cells show moderate positive staining.<br><br>";s:10:"add_doctor";s:1:"0";}i:57;a:15:{s:7:"immu_id";s:3:"204";s:5:"sl_no";s:3:"118";s:7:"test_id";s:12:"MIHC13-06169";s:10:"reciv_date";s:10:"11/04/2013";s:12:"current_date";s:10:"2013-04-11";s:9:"deli_date";s:10:"21/04/2013";s:12:"patient_name";s:19:"Mrs. Josna Ferdousi";s:3:"age";s:6:"29 Yrs";s:6:"ref_by";s:0:"";s:3:"sex";s:6:"Female";s:13:"hospital_name";s:0:"";s:13:"specimen_name";s:0:"";s:4:"note";s:246:"Result of Immunostaining&nbsp; for ER, PR &amp; HER-2 of case No:&nbsp;&nbsp;&nbsp;&nbsp;&nbsp;&nbsp;&nbsp;&nbsp;&nbsp;&nbsp;&nbsp;&nbsp;&nbsp;&nbsp;&nbsp;&nbsp;&nbsp;&nbsp;&nbsp;&nbsp;&nbsp; Block No: (&nbsp;&nbsp;&nbsp;&nbsp;&nbsp;&nbsp; ) <br>";s:15:"reporting_board";s:180:"ER:-Tumor cell nuclei show no staining. <br><br>Quick Score : "O"<br><br><br><br>Summary of result :- <br><br>&nbsp;&nbsp;&nbsp;&nbsp;&nbsp;&nbsp; ER&nbsp;&nbsp; : Negative<br><br>";s:10:"add_doctor";s:1:"0";}i:58;a:15:{s:7:"immu_id";s:3:"206";s:5:"sl_no";s:3:"130";s:7:"test_id";s:17:"MIHC13:-06922-923";s:10:"reciv_date";s:10:"21/04/2013";s:12:"current_date";s:10:"2013-04-21";s:9:"deli_date";s:10:"28/04/2013";s:12:"patient_name";s:17:"Mrs. Priyanka Das";s:3:"age";s:6:"20 Yrs";s:6:"ref_by";s:18:"Parvin Akhter Banu";s:3:"sex";s:6:"Female";s:13:"hospital_name";s:3:"DHL";s:13:"specimen_name";s:31:"Tissue from inguinal lymph node";s:4:"note";s:102:"Result of Immunostaining&nbsp; for LCA (CD45) &amp; Cytokeratin (CK) of case No:<br>Block No: (03)<br>";s:15:"reporting_board";s:246:"LCA (CD45): Tumor cells show positive staining for LCA. <br><br><br>Cytokeratin (CK) : Tumour cells show no staining for CK. <br><br>Conclusion: Considering the immunostaining results this case should be treated as Non-Hodgkin's lymphoma.<br><br>";s:10:"add_doctor";s:1:"0";}i:59;a:15:{s:7:"immu_id";s:3:"207";s:5:"sl_no";s:3:"131";s:7:"test_id";s:17:"MIHC13:-06934-935";s:10:"reciv_date";s:10:"21/04/2013";s:12:"current_date";s:10:"2013-04-21";s:9:"deli_date";s:10:"28/04/2013";s:12:"patient_name";s:25:"Umme Hasan Nurjahan Begum";s:3:"age";s:6:"68 Yrs";s:6:"ref_by";s:41:"Azizul Islam, Col, CLMED SPL & ONCOLOGIST";s:3:"sex";s:6:"Female";s:13:"hospital_name";s:10:"CMH, DHAKA";s:13:"specimen_name";s:34:"One Paraffin Block case no: 2468/B";s:4:"note";s:96:"Result of Immunostaining&nbsp; for CD15 &amp; CD30&nbsp; of case No: 2468<br>Block No: ( A3)<br>";s:15:"reporting_board";s:241:"CD15: Scattered large atypical cell show positive staining for CD15.<br><br>CD30: Scattered large atypial cells show positive staining for CD30.<br><br><br>Conclusion: Immunostaining result favors the diagnosis of Hodgkin's lymphoma.<br><br>";s:10:"add_doctor";s:1:"0";}i:60;a:15:{s:7:"immu_id";s:3:"208";s:5:"sl_no";s:3:"137";s:7:"test_id";s:17:"MIHC13:-07178-180";s:10:"reciv_date";s:10:"25/04/2013";s:12:"current_date";s:10:"2013-04-25";s:9:"deli_date";s:10:"28/04/2013";s:12:"patient_name";s:16:"Mrs. Laily Begum";s:3:"age";s:6:"45 Yrs";s:6:"ref_by";s:0:"";s:3:"sex";s:6:"Female";s:13:"hospital_name";s:21:"Prime Medical College";s:13:"specimen_name";s:10:"Lymph node";s:4:"note";s:100:"Result of Immunostaining&nbsp; for&nbsp; LCA (CD45) , CD3 &amp; CD20&nbsp; of case No: MH13-3920<br>";s:15:"reporting_board";s:344:"LCA (CD45) : Lymphoid cells show diffuse staining for LCA. <br><br>CD3 : Scattered lymphoid cells show positive staining for CD3.<br><br><br>CD20: Lymphoid cells show diffuse staining for CD20.<br><br>Conclusion: Considering the immunostaining resutls , this case can be&nbsp; treated as non-Hodgkin's lymphoma of&nbsp; "B" cell origin.<br><br>";s:10:"add_doctor";s:1:"0";}i:61;a:15:{s:7:"immu_id";s:3:"209";s:5:"sl_no";s:3:"138";s:7:"test_id";s:17:"MIHC13:-07268-269";s:10:"reciv_date";s:10:"25/04/2013";s:12:"current_date";s:10:"2013-04-25";s:9:"deli_date";s:10:"28/04/2013";s:12:"patient_name";s:12:"Jashim Uddin";s:3:"age";s:6:"24 Yrs";s:6:"ref_by";s:4:"Self";s:3:"sex";s:6:"Female";s:13:"hospital_name";s:31:"Tissue from cervical lymph node";s:13:"specimen_name";s:0:"";s:4:"note";s:78:"Result of Immunostaining&nbsp; for LCA (CD45) &amp; CD20 of case No: 06364<br>";s:15:"reporting_board";s:328:"LCA (CD45):Lymphoid cells show diffuse staining for LCA. <br><br><br>CD20: Scattered lymphoid cells show positive staining for CD20.<br><br>CD3: Lymphoid cells show diffuse staining for CD3. <br><br>Conclusion: Considering the immunostaining results this case can be treated as non-Hodgkin's lymphoma of "T" cell origin.<br><br>";s:10:"add_doctor";s:1:"0";}i:62;a:15:{s:7:"immu_id";s:3:"212";s:5:"sl_no";s:3:"143";s:7:"test_id";s:17:"MIHC13:-07596-597";s:10:"reciv_date";s:10:"30/04/2013";s:12:"current_date";s:10:"2013-04-30";s:9:"deli_date";s:10:"12/05/2013";s:12:"patient_name";s:4:"Mina";s:3:"age";s:6:"09 Yrs";s:6:"ref_by";s:19:"Al-Amin , A/R , POU";s:3:"sex";s:6:"Female";s:13:"hospital_name";s:23:"NICRH, Mohakhali, Dhaka";s:13:"specimen_name";s:26:"Tissue from axillary mass.";s:4:"note";s:157:"Result of Immunostaining&nbsp; for S-100 ,CD68 , Vimentin, LCA , CD3 , CD20, Desmin, Myogenin&nbsp; &amp; CK&nbsp; of case No: MH13-6972 , Block No: (02)<br>";s:15:"reporting_board";s:701:"S-100: Most of the atypical cells show cytoplasmic staining for S100.<br><br>CD68: Scatterted atypical cells show positive staining for CD68. <br><br>Vimentin: Atypical cells show weak cytoplasmic staining for Vimentin. <br><br>LCA:&nbsp; Atypical cells show membrane staining for LCA. <br><br>CD3: Scatterted lymphoid cells show positive staining for CD3.<br><br>CD20: Atypical lymphoid cells show no staining for CD20. <br><br>Desmin: Atypical cells show no staining for Desmin.<br><br>Myogenin: Atypical cells show no staining for Myogenin. <br><br>CK : Atypical cells show no staining for CK.<br><br>Conclusion: Immunostaining results favor the diagnosis of Langerhans cell histiocytosis .<br><br>";s:10:"add_doctor";s:1:"0";}i:63;a:15:{s:7:"immu_id";s:3:"213";s:5:"sl_no";s:3:"148";s:7:"test_id";s:13:"MIHC13:-07649";s:10:"reciv_date";s:10:"01/05/2013";s:12:"current_date";s:10:"2013-05-01";s:9:"deli_date";s:10:"05/05/2013";s:12:"patient_name";s:17:"Mrs. Zaheda Shams";s:3:"age";s:6:"58 Yrs";s:6:"ref_by";s:12:"Nurur Rahman";s:3:"sex";s:6:"Female";s:13:"hospital_name";s:0:"";s:13:"specimen_name";s:38:"One Paraffin block Lab no: 13-001-2403";s:4:"note";s:133:"Result of Immunostaining&nbsp; for HER-2 of case No:&nbsp; MH13-001-2403<br>Block No: (03 ) from Anowara Medical Services , Dhaka<br>";s:15:"reporting_board";s:229:"HER-2:-<br><br>Weak to moderate complete membrane staining is observed in more than 10 % of the tumor cells <br>Score : 2+<br><br>Summary of result :- <br><br>&nbsp;&nbsp;&nbsp;&nbsp;&nbsp;&nbsp; HER-2&nbsp; : Borderline.<br><br>";s:10:"add_doctor";s:1:"0";}i:64;a:15:{s:7:"immu_id";s:3:"214";s:5:"sl_no";s:3:"151";s:7:"test_id";s:13:"MIHC13:-07961";s:10:"reciv_date";s:10:"04/05/2013";s:12:"current_date";s:10:"2013-05-04";s:9:"deli_date";s:10:"12/05/2013";s:12:"patient_name";s:6:"Bristi";s:3:"age";s:6:"18 Yrs";s:6:"ref_by";s:36:"A B M Khorshid Alam, FCPS , FRCS, MS";s:3:"sex";s:6:"Female";s:13:"hospital_name";s:22:"Doctor's Lab, Comilla.";s:13:"specimen_name";s:30:"One paraffin block. (H-677/13)";s:4:"note";s:110:"Result of Immunostaining&nbsp; for CD-99 of case No:H-677/13<br>Block No: (02) from Doctor's Lab, Comilla.<br>";s:15:"reporting_board";s:141:"CD-99: Tumor cells show positive staining for CD99.<br><br>Conclusion: Immunostaining result favors the diagnosis of Ewing's sarcoma.<br><br>";s:10:"add_doctor";s:1:"0";}i:65;a:15:{s:7:"immu_id";s:3:"218";s:5:"sl_no";s:3:"161";s:7:"test_id";s:17:"MIHC13:-08705-709";s:10:"reciv_date";s:10:"15/05/2013";s:12:"current_date";s:10:"2013-05-15";s:9:"deli_date";s:10:"19/05/2013";s:12:"patient_name";s:19:"Mrs. Mahluda Khatun";s:3:"age";s:6:"45 Yrs";s:6:"ref_by";s:28:"Md. Zillur Rahman , FCPS, MS";s:3:"sex";s:6:"Female";s:13:"hospital_name";s:3:"DHL";s:13:"specimen_name";s:23:"Tissue from Rt. Tonsil.";s:4:"note";s:118:"Result of Immunostaining&nbsp; for&nbsp; LCA , CD3 , CD20 , CD15 &amp; CD30<br>case No: MH13-08482. Block No (01).<br>";s:15:"reporting_board";s:450:"LCA : Lymphoid cells show diffuse staining for LCA. <br><br>CD3 : Scattered lymphoid cells show positive staining for CD3. <br><br>CD20 : Neoplastic lymphoid cells show diffuse staining for CD20.<br><br>CD15 : Occasional cells show positive staining for CD15. <br><br>CD30: No CD 30 staining is observed. <br><br><br>Conclusion: Considering the Immunostining results. This case should be treated as non-Hodgking's lymphoma of "B" cell origin.<br><br>";s:10:"add_doctor";s:1:"0";}i:66;a:15:{s:7:"immu_id";s:3:"220";s:5:"sl_no";s:3:"172";s:7:"test_id";s:13:"MIHC13:-09197";s:10:"reciv_date";s:10:"22/05/2013";s:12:"current_date";s:10:"2013-05-22";s:9:"deli_date";s:10:"26/05/2013";s:12:"patient_name";s:16:"Mrs. Baby Akhter";s:3:"age";s:6:"40 Yrs";s:6:"ref_by";s:18:"P.B. Roy. FRCS (S)";s:3:"sex";s:6:"Female";s:13:"hospital_name";s:41:"Surgiscope Hospital (Unit-2), Chittagong.";s:13:"specimen_name";s:41:"One slide and one parffain block (R-6/13)";s:4:"note";s:146:"Result of Immunostaining&nbsp; for ER of case No: H-334/N-12037/13 <br>Block No (R-06/13) from Surgiscope Hospital Ltd. (Unit -2), Chittagong.<br>";s:15:"reporting_board";s:172:"ER:-Tumor cell nuclei show no staining. <br><br>Quick Score : "O"<br><br>Summary of result :- <br><br>&nbsp;&nbsp;&nbsp;&nbsp;&nbsp;&nbsp; ER&nbsp;&nbsp; : Negative<br><br>";s:10:"add_doctor";s:1:"0";}i:67;a:15:{s:7:"immu_id";s:3:"221";s:5:"sl_no";s:3:"177";s:7:"test_id";s:13:"MIHC13:-09449";s:10:"reciv_date";s:10:"26/05/2013";s:12:"current_date";s:10:"2013-05-26";s:9:"deli_date";s:10:"02/06/2013";s:12:"patient_name";s:23:"Sreemoti Duli Rani Gosh";s:3:"age";s:6:"40 Yrs";s:6:"ref_by";s:52:"Biswajit Bhattacharjee. MBBS, M.Phil, (Radiotherapy)";s:3:"sex";s:6:"Female";s:13:"hospital_name";s:17:"KYAMCH, Sirajgonj";s:13:"specimen_name";s:36:"One paraffin block case no-H-466/13 ";s:4:"note";s:114:"Result of Immunostaining&nbsp; for CD117&nbsp; of case No: H-466/13<br>Block No: (01 ) from KYAMCH, Sirajgonj.<br>";s:15:"reporting_board";s:202:"CD117 :- Neopalstic cells show positive staining for CD 117.<br><br><br>Summary of result:<br>&nbsp;&nbsp;&nbsp;&nbsp;&nbsp; <br>&nbsp;&nbsp;&nbsp;&nbsp;&nbsp;&nbsp;&nbsp;&nbsp; CD117- Positive.<br><br>";s:10:"add_doctor";s:1:"0";}i:68;a:15:{s:7:"immu_id";s:3:"226";s:5:"sl_no";s:3:"173";s:7:"test_id";s:13:"MIHC13:-09198";s:10:"reciv_date";s:10:"22/05/2013";s:12:"current_date";s:10:"2013-05-22";s:9:"deli_date";s:10:"26/05/2013";s:12:"patient_name";s:18:"Mrs. Anowara Begum";s:3:"age";s:6:"60 Yrs";s:6:"ref_by";s:0:"";s:3:"sex";s:6:"Female";s:13:"hospital_name";s:43:"Surgiscope Hospital Ltd.(Unit2), Chittagong";s:13:"specimen_name";s:52:"One Paraffin block case no: 870, Block No: (R-7/13).";s:4:"note";s:132:"Result of Immunostaining&nbsp; for ER of case No: 870-Block No:&nbsp; (R-7/13) from Surgiscope Hospital Ltd.(Unit2), Chittagong.<br>";s:15:"reporting_board";s:108:"Tumor cells show no staining.<br>Score : O<br><br><br>Summary of result: -<br><br><br>ER : Negative <br><br>";s:10:"add_doctor";s:1:"0";}i:69;a:15:{s:7:"immu_id";s:3:"229";s:5:"sl_no";s:3:"198";s:7:"test_id";s:13:"MIHC13:-10169";s:10:"reciv_date";s:10:"05/06/2013";s:12:"current_date";s:10:"2013-06-05";s:9:"deli_date";s:10:"09/06/2013";s:12:"patient_name";s:20:"Mrs. Jahanara Begum.";s:3:"age";s:6:"50 Yrs";s:6:"ref_by";s:14:"Zillur Rahman.";s:3:"sex";s:6:"Female";s:13:"hospital_name";s:40:"Surgiscope Hospital (Unit-2), Chittagong";s:13:"specimen_name";s:29:"One paraffin block (R-008/13)";s:4:"note";s:131:"Result of Immunostaining&nbsp; for ER of case No:&nbsp; R-008/13 Block (02) from Surgiscope Hospital Ltd. (Unit-2), Chittagong.<br>";s:15:"reporting_board";s:165:"ER:- About 30 % of the tumor cell nuclei show weak staining.<br><br>Quick Score :3+1= 4/8<br><br>Summary of result :- <br><br>ER&nbsp;&nbsp; :&nbsp; Positive<br><br>";s:10:"add_doctor";s:1:"0";}i:70;a:15:{s:7:"immu_id";s:3:"233";s:5:"sl_no";s:3:"214";s:7:"test_id";s:17:"MIHC13:-10643-647";s:10:"reciv_date";s:10:"12/06/2013";s:12:"current_date";s:10:"2013-06-12";s:9:"deli_date";s:10:"16/06/2013";s:12:"patient_name";s:13:"Bilkis Khatun";s:3:"age";s:6:"14 Yrs";s:6:"ref_by";s:46:"Saumen Basu MBBS, MD, DNB (Radiation Oncology)";s:3:"sex";s:6:"Female";s:13:"hospital_name";s:18:"KYAMC&H, Sirajgonj";s:13:"specimen_name";s:32:"Tissue from cervical lymph node.";s:4:"note";s:114:"Result of Immunostaining&nbsp; for LCA , CD3 , CD20 , CD15, &amp; CD30 of <br>case No:MH13-9864 Block no: (01)<br>";s:15:"reporting_board";s:477:"LCA :-Lymphoid cells show diffuse staining for LCA. <br><br>CD3 :- Most of the atypical lymphoid cells show positive staining for CD3. <br><br>CD20:- Scattered nests of lymphoid cells show positive staining for CD20. <br><br>CD15:- Lymphoid cells show no staining for CD15. <br><br>CD30 :- Scattered cells show positive staining for CD30. <br><br>Conclusion: Immunostaining results favor the diagnosis of non-Hodgkin's lymphoma of "T"&nbsp;&nbsp;&nbsp; <br>cell origin.<br><br>";s:10:"add_doctor";s:1:"0";}i:71;a:15:{s:7:"immu_id";s:3:"234";s:5:"sl_no";s:3:"032";s:7:"test_id";s:17:"MIHC14:-01297-300";s:10:"reciv_date";s:10:"25/01/2014";s:12:"current_date";s:10:"2014-01-25";s:9:"deli_date";s:10:"02/02/2014";s:12:"patient_name";s:15:"Mrs. Renu Begum";s:3:"age";s:6:"50 Yrs";s:6:"ref_by";s:31:"Lt. Col. M S Sarwar Alam (Rtd.)";s:3:"sex";s:6:"Female";s:13:"hospital_name";s:40:"Delta Medical College & Hospital. Dhaka.";s:13:"specimen_name";s:58:"(Tissue from Rt.neck) One paraffin block. Case No: 1400246";s:4:"note";s:116:"Result of Immunostaining  for LCA , CD3 , CD20&nbsp; &amp; BCL2 of Case No:140-0246 from The Laboratory, Dhaka. <br>";s:15:"reporting_board";s:588:"<b>LCA :</b> Lymphoid cells show positive staining for <b>LCA. </b><br><br><br><b>CD3 :</b> Perifollicular&nbsp; lymphoid cells show positive staining for <b>CD3.</b><br><br><br><b>CD20 :</b> Lymphoid cells of the follicles as well as scattered lymphoid cells of other areas show positive staining for <b>CD20.</b><br><br><br><b>BCL2 </b>: Follicular cells as well as scattered other lymphoid cells show positive staining for<b> BCL2.</b><br><br><br><h3><b><i>Conclusion: Immunostaining results favor the diagnosis of Non-Hodgkin's lymphoma of low grade follicular type. </i></b></h3><br>";s:10:"add_doctor";s:1:"0";}i:72;a:15:{s:7:"immu_id";s:3:"235";s:5:"sl_no";s:3:"033";s:7:"test_id";s:17:"MIHC14:-01321-323";s:10:"reciv_date";s:10:"26/01/2014";s:12:"current_date";s:10:"2014-01-26";s:9:"deli_date";s:10:"02/02/2014";s:12:"patient_name";s:17:"Mrs. Nibedita Das";s:3:"age";s:6:"59 Yrs";s:6:"ref_by";s:50:"Ali Asgar Chowdhury,MBBS,FCPS,Clinical Onchologist";s:3:"sex";s:6:"Female";s:13:"hospital_name";s:16:"CMCH, Chittagong";s:13:"specimen_name";s:50:"Tissue from Rt. Cervical mass. Case No: MH14-00632";s:4:"note";s:139:"Result of Immunostaining  for LCA , CK , CD3 &amp; CD20&nbsp; of Case No:MH14-00632 ,&nbsp; Block No: (01) from DHL, Path. Lab. Dhaka. <br>";s:15:"reporting_board";s:459:"<b>LCA:</b> Lymphoid cells show positive staining for <b>LCA.</b><br><br><b>CK :</b> Tumor cells show no staining for<b> CK. </b><br><br><b>CD3 :</b> Majority of the atypical lymphoid cells show positive staining for <b>CD3.</b><br><br><b>CD20:&nbsp; </b>Scattered lymphoid cells show positive staining for <b>CD20.</b><br><br><br><h3><b><i>Conclusion: Immunostaining results favor the diagnosis of Non-Hodgkin's lymphoma of "T" cell origin. </i></b></h3><br>";s:10:"add_doctor";s:1:"0";}i:73;a:15:{s:7:"immu_id";s:3:"237";s:5:"sl_no";s:3:"040";s:7:"test_id";s:13:"MIHC14:-01195";s:10:"reciv_date";s:10:"23/01/2014";s:12:"current_date";s:10:"2014-01-23";s:9:"deli_date";s:10:"03/02/2014";s:12:"patient_name";s:20:"Sreemoti Sandha Rani";s:3:"age";s:6:"15 Yrs";s:6:"ref_by";s:11:"Rezaul Alam";s:3:"sex";s:6:"Female";s:13:"hospital_name";s:27:"Max Care Hospital, Rangpur.";s:13:"specimen_name";s:53:"Tissue from Lt. parieto-temporal SOL . Case No: _____";s:4:"note";s:84:"Result of Immunostaining  for S-100 , Desmin &amp; Myogenin of Case No: ______. <br>";s:15:"reporting_board";s:91:"<b>S-100 :</b><br><br><br><br><br><b>Desmin :</b><br><br><br><br><br><b>Myogenin : </b><br>";s:10:"add_doctor";s:1:"0";}i:74;a:15:{s:7:"immu_id";s:3:"238";s:5:"sl_no";s:3:"041";s:7:"test_id";s:13:"MIHC14:-01283";s:10:"reciv_date";s:10:"25/01/2014";s:12:"current_date";s:10:"2014-01-25";s:9:"deli_date";s:10:"03/02/2014";s:12:"patient_name";s:19:"Mrs. Jahanara Begum";s:3:"age";s:6:"65 Yrs";s:6:"ref_by";s:5:"Self ";s:3:"sex";s:6:"Female";s:13:"hospital_name";s:0:"";s:13:"specimen_name";s:81:"Two H & E stained slides and two paraffin block received for review. Case NO: ___";s:4:"note";s:90:"Result of Immunostaining  for CK &amp; CD117 &amp; Desmin of Case No:_____ Block No: ( __)";s:15:"reporting_board";s:72:"<b>CK :</b><br><br><br><br><b>CD117 :</b><br><br><br><b>Desmin :</b><br>";s:10:"add_doctor";s:1:"0";}i:75;a:15:{s:7:"immu_id";s:3:"246";s:5:"sl_no";s:1:" ";s:7:"test_id";s:16:"MIHC12:  3113-15";s:10:"reciv_date";s:10:"22/02/2012";s:12:"current_date";s:10:"2012-02-22";s:9:"deli_date";s:10:"04/03/2012";s:12:"patient_name";s:13:"Mrs.  Khaleda";s:3:"age";s:6:"25 Yrs";s:6:"ref_by";s:0:"";s:3:"sex";s:6:"Female";s:13:"hospital_name";s:10:"CSCR, Ctg.";s:13:"specimen_name";s:19:"Tissue from omentum";s:4:"note";s:134:"<b>Result of immunostaining for LCA, CK, CD3 &amp; CD20
of case no. MH12-02263, Block (1) &amp; R/G  2263, Block No. (2).</b>

<br>";s:15:"reporting_board";s:653:"<span><b>LCA&nbsp;&nbsp;
</b>: Tumor cells are&nbsp; positive for
LCA. </span>

<span><b><br><br>CK</b>&nbsp;&nbsp;&nbsp;&nbsp;&nbsp; :&nbsp;
Lining epithelial cells show positive staining. </span>

<span><b><br><br>CD3</b>&nbsp;&nbsp;&nbsp; :&nbsp;
Scattered lymphoid cells&nbsp; show
positive staining. </span>

<span><b><br><br>CD20</b>&nbsp; :&nbsp; Most
of the lymphoid cells&nbsp; show positive
staining. </span>

&nbsp;

&nbsp;

&nbsp;

<span><br><br>Conclusion:- &nbsp;Considering the immunostaining results, this
case should be &nbsp;treated as &nbsp;non-Hodgkins</span>&nbsp; lymphoma of&nbsp; Bcell &nbsp;origin.

<br>";s:10:"add_doctor";s:1:"0";}i:76;a:15:{s:7:"immu_id";s:3:"248";s:5:"sl_no";s:1:" ";s:7:"test_id";s:10:"DH-0037/11";s:10:"reciv_date";s:10:"04/01/2011";s:12:"current_date";s:10:"2011-01-04";s:9:"deli_date";s:10:"09/01/2011";s:12:"patient_name";s:11:"Mrs. Joshna";s:3:"age";s:6:"65 Yrs";s:6:"ref_by";s:24:"Sk. Md. Abu Zafar, FCPS ";s:3:"sex";s:6:"Female";s:13:"hospital_name";s:22:"Gastro Liver Hospital ";s:13:"specimen_name";s:20:"Tissue from stomach ";s:4:"note";s:43:"<b>Result of immunostaining for LCA</b><br>";s:15:"reporting_board";s:208:"Tumor cell show strong immunoreactivity for LCA

 

 

<br><br>Conclusion: Considering the immunostaining result.

This case should be treated as a case of malignant
non-Hodgkins lymphoma. 

<br>";s:10:"add_doctor";s:1:"0";}i:77;a:15:{s:7:"immu_id";s:3:"250";s:5:"sl_no";s:1:".";s:7:"test_id";s:11:"MH - 844/11";s:10:"reciv_date";s:10:"19/01/2011";s:12:"current_date";s:10:"2011-01-19";s:9:"deli_date";s:10:"12/02/2011";s:12:"patient_name";s:13:"Shanti Sahani";s:3:"age";s:6:"58 Yrs";s:6:"ref_by";s:0:"";s:3:"sex";s:6:"Female";s:13:"hospital_name";s:0:"";s:13:"specimen_name";s:20:"Tissue from  Breast ";s:4:"note";s:61:"<b>Her -2 Immunostaining Report
for Block No. 03</b>

<br>";s:15:"reporting_board";s:306:"More than 10 %&nbsp; tumor cells show moderate complete membrane
staining for Her-2.

<span>&nbsp;&nbsp;&nbsp;&nbsp;&nbsp;&nbsp; <br><br>Score &nbsp;- 2+ </span>

&nbsp;

<span>&nbsp;&nbsp;&nbsp;&nbsp;&nbsp;&nbsp; <br>Summary: &nbsp;&nbsp;Her - 2 - &nbsp;Border line </span>

<b>&nbsp;</b>

<br>";s:10:"add_doctor";s:1:"0";}i:78;a:15:{s:7:"immu_id";s:3:"251";s:5:"sl_no";s:1:" ";s:7:"test_id";s:11:"MH - 845/11";s:10:"reciv_date";s:10:"19/01/2011";s:12:"current_date";s:10:"2011-01-19";s:9:"deli_date";s:10:"12/02/2011";s:12:"patient_name";s:9:"Moni Moti";s:3:"age";s:6:"50 Yrs";s:6:"ref_by";s:0:"";s:3:"sex";s:6:"Female";s:13:"hospital_name";s:0:"";s:13:"specimen_name";s:20:"Tissue from  Breast ";s:4:"note";s:60:"<b>Her -2 Immunostaining Report
of Block No. 16</b>

<br>";s:15:"reporting_board";s:260:"More than 10 %&nbsp;
tumor cells show faint membrane staining for Her-2.

<span>&nbsp;&nbsp;&nbsp;&nbsp; <br><br>&nbsp;Score &nbsp;-1+ </span>

&nbsp;

<span>&nbsp;&nbsp;&nbsp; <br>Summary: &nbsp;&nbsp;Her - 2 - Negative </span>

<b>&nbsp;</b>

<br>";s:10:"add_doctor";s:1:"0";}i:79;a:15:{s:7:"immu_id";s:3:"252";s:5:"sl_no";s:1:" ";s:7:"test_id";s:10:"MH  846/11";s:10:"reciv_date";s:10:"19/01/2011";s:12:"current_date";s:10:"2011-01-19";s:9:"deli_date";s:10:"12/02/2011";s:12:"patient_name";s:4:"Afia";s:3:"age";s:6:"45 Yrs";s:6:"ref_by";s:0:"";s:3:"sex";s:6:"Female";s:13:"hospital_name";s:0:"";s:13:"specimen_name";s:20:"Tissue from  Breast ";s:4:"note";s:63:"<b>Her -2 Immunostaining Report
for Block No. 1645</b>

<br>";s:15:"reporting_board";s:292:"<span>More than 10 %&nbsp; tumor cells show
moderate complete membrane staining for <br><br>Her-2.</span>

<span>&nbsp;&nbsp;&nbsp;&nbsp;&nbsp;&nbsp;&nbsp;&nbsp;&nbsp;&nbsp;&nbsp; <br>Score &nbsp;- 2+ </span>

&nbsp;

<span>Summary: &nbsp; <br>Her - 2 &nbsp;Border line </span>

<br>";s:10:"add_doctor";s:1:"0";}i:80;a:15:{s:7:"immu_id";s:3:"253";s:5:"sl_no";s:2:"90";s:7:"test_id";s:10:"MH  847/11";s:10:"reciv_date";s:10:"19/01/2011";s:12:"current_date";s:10:"2011-01-19";s:9:"deli_date";s:10:"12/02/2011";s:12:"patient_name";s:6:"Champa";s:3:"age";s:6:"38 Yrs";s:6:"ref_by";s:0:"";s:3:"sex";s:6:"Female";s:13:"hospital_name";s:0:"";s:13:"specimen_name";s:20:"Tissue from  Breast ";s:4:"note";s:62:"<b>Her -2 Immunostaining Report
of Block No. 1651</b>

<br>";s:15:"reporting_board";s:297:"<span>Less than 10 %&nbsp; tumor cells show faint
&nbsp;membrane staining for <br><br>Her-2.</span>

<span>&nbsp;&nbsp;&nbsp;&nbsp;&nbsp;&nbsp;&nbsp;&nbsp;&nbsp;&nbsp;&nbsp; <br><br>Score &nbsp;&nbsp;-&nbsp; 0 </span>

&nbsp;

Summary: &nbsp;&nbsp;HER-2 - Negative 

<b>&nbsp;</b>

<br>";s:10:"add_doctor";s:1:"0";}i:81;a:15:{s:7:"immu_id";s:3:"254";s:5:"sl_no";s:2:"43";s:7:"test_id";s:17:"MIHC14:-01701-704";s:10:"reciv_date";s:10:"31/01/2014";s:12:"current_date";s:10:"2014-01-31";s:9:"deli_date";s:10:"16/02/2014";s:12:"patient_name";s:12:"Marium Begum";s:3:"age";s:6:"60 Yrs";s:6:"ref_by";s:49:"Sajjad Mohammad Yusuff, MCPS, FCPS (Radiotherapy)";s:3:"sex";s:6:"Female";s:13:"hospital_name";s:26:"Chittagon Lab, Chittagong.";s:13:"specimen_name";s:52:"Tissue from cervical lymph node. Case No: MH14-01135";s:4:"note";s:120:"Result of Immunostaining  for CD3 , CD20 , CD15 &amp; CD30&nbsp; of Case No:MH14-01135, from DHL, Path. Lab. Dhaka. <br>";s:15:"reporting_board";s:427:"<b>CD3 :</b> Scattered lymphoid cells show positive staining for<b> CD3.</b><br><br><b>CD20 :</b> Atypical lymphoid cells show positive staining for <b>CD20.</b><br><br><b>CD15 :</b> Scattered CD15 positive cells are seen. <br><br><b>CD30 :</b> Scattered CD30 positive cells are seen. <br><br><h4><b><i>Conclusion: Immunostaining results favor the diagnosis of Non-Hodkin's lymphoma of&nbsp; "B"&nbsp; cell origin.</i></b></h4>";s:10:"add_doctor";s:1:"0";}i:82;a:15:{s:7:"immu_id";s:3:"257";s:5:"sl_no";s:1:".";s:7:"test_id";s:13:"MH-2334-38/11";s:10:"reciv_date";s:10:"19/02/2011";s:12:"current_date";s:10:"2011-02-19";s:9:"deli_date";s:10:"25/02/2011";s:12:"patient_name";s:18:"Mrs. Farhana Dina ";s:3:"age";s:6:"35 Yrs";s:6:"ref_by";s:10:"P.A. Banu ";s:3:"sex";s:6:"Female";s:13:"hospital_name";s:0:"";s:13:"specimen_name";s:37:"Lymph node from Rt. inguinal region. ";s:4:"note";s:104:"<b>Result of immunostaining for CD3, CD20, CD15, CD30,
LCA &amp; CK of case no. MH-1960/11.</b>

<br>";s:15:"reporting_board";s:999:"<span><b>CD3</b>&nbsp;&nbsp; &nbsp;:&nbsp; &nbsp;Good number of lymphoid cells show positive
staining. </span>

<span><b><br><br>CD20</b>&nbsp; :&nbsp;&nbsp;
Many lymphoid cells show positive staining. </span>

<span><b><br><br>CD15</b>&nbsp; :&nbsp;&nbsp;
Scattered large atypical cell show positive staining. </span>

<span><b><br><br>CD30</b>&nbsp; :&nbsp;&nbsp;
Scattered large atypical cells show positive staining. </span>

<span><b><br><br>LCA (CD</b><b>45</b><b>) </b>: All the lymphoid cells
show  positive staining except those scattered&nbsp; </span>

large
atypical&nbsp; cells showing positive staining
for CD15 &amp; CD30. 

<span>&nbsp;<b><br><br>CK</b>&nbsp;&nbsp;&nbsp;&nbsp;&nbsp; :&nbsp;&nbsp;
Sections show no staining for CK. </span>

&nbsp;

<br><br><h4><b><i>Conclusion: Considering the
immunostaining results, this case should be treated as&nbsp; 

</i></b><b><i>Hodgkins disease. </i></b><b><i>

&nbsp;

&nbsp;

</i></b></h4><br>

<br><br>";s:10:"add_doctor";s:1:"0";}i:83;a:15:{s:7:"immu_id";s:3:"261";s:5:"sl_no";s:1:" ";s:7:"test_id";s:10:"MH-5220/11";s:10:"reciv_date";s:10:"07/04/2011";s:12:"current_date";s:10:"2011-04-07";s:9:"deli_date";s:10:"10/04/2011";s:12:"patient_name";s:21:"Mrs. Jahan Ara Begum ";s:3:"age";s:6:"47 Yrs";s:6:"ref_by";s:27:"Lt. Col. M. S. Sarwar Alam ";s:3:"sex";s:6:"Female";s:13:"hospital_name";s:0:"";s:13:"specimen_name";s:37:"Tissue from Lt. submandibular growth ";s:4:"note";s:93:"Result of immunostaining
for&nbsp; CD20 &amp;&nbsp; CD3 of case No.&nbsp; MH 4035/11

<br>";s:15:"reporting_board";s:360:"CD20  Most of the lymphoid
cells show positive staining for CD20.

&nbsp;

&nbsp;

<br><br>CD3  Scattered lymphoid
cells show positive staining.

&nbsp;

&nbsp;

&nbsp;

<span><br><br>Conclusion:&nbsp; Considering the immunostaining results this
case should be treated as a case of&nbsp;</span>CD20 positive, B cell lymphoma.

&nbsp;

<br>";s:10:"add_doctor";s:1:"0";}i:84;a:15:{s:7:"immu_id";s:3:"264";s:5:"sl_no";s:1:" ";s:7:"test_id";s:11:"MH- 7315/11";s:10:"reciv_date";s:10:"08/05/2011";s:12:"current_date";s:10:"2011-05-08";s:9:"deli_date";s:10:"16/05/2011";s:12:"patient_name";s:10:"Mrs. Asia ";s:3:"age";s:6:"40 Yrs";s:6:"ref_by";s:20:"Shamsun Nahar, FCPS ";s:3:"sex";s:6:"Female";s:13:"hospital_name";s:0:"";s:13:"specimen_name";s:32:"Tissue from cervical lymph node ";s:4:"note";s:92:"<b>Result of
immunostaining for CD20 &amp; CD3 of case no. MH11-6898, Block (1)</b>

<br>";s:15:"reporting_board";s:358:"CD20:&nbsp;&nbsp; Tumor cells show strong
reactivity. 

<span><br><br>CD3&nbsp; :&nbsp;&nbsp; Scattered lymphoid cells show positive
staining.</span>

&nbsp;&nbsp;

\<br><br>Summary of results: 

&nbsp;

Considering
the immunostaining pattern, this case should be treated as a case of CD20
positive B-cell lymphoma. 

&nbsp;

&nbsp;

<br>";s:10:"add_doctor";s:1:"0";}i:85;a:15:{s:7:"immu_id";s:3:"266";s:5:"sl_no";s:3:"059";s:7:"test_id";s:17:"MIHC14:-02526-528";s:10:"reciv_date";s:10:"12/02/2014";s:12:"current_date";s:10:"2014-02-12";s:9:"deli_date";s:10:"16/02/2014";s:12:"patient_name";s:15:"Mrs. Rubi Akter";s:3:"age";s:6:"16 Yrs";s:6:"ref_by";s:0:"";s:3:"sex";s:6:"Female";s:13:"hospital_name";s:31:"Chittagong Lab Ltd., Chittagong";s:13:"specimen_name";s:55:"Tissue from  left tonsillar growth. Case No: MH14-00396";s:4:"note";s:120:"Result of Immunostaining  for LCA , CK &amp; CD20 of Case No: MH14-00396, Block No: (02) from DHL Path. Lab. Dhaka. <br>";s:15:"reporting_board";s:373:"<b> LCA :</b> Atypical lymphoid cells show positive staining for <b>LCA.</b><br><br><b>CK :</b> Tumor cells show no specific staining for <b>CK.</b><br><br><b>CD20 :</b> Atypical lymphoid cells show positive staining for <b>CD20.</b><br><br><h4><b><i>Conclusion: Immunostaining results confirm the diagnosis of Non-Hodgkin's lymphoma of "B"&nbsp; cell origin. </i></b></h4>";s:10:"add_doctor";s:1:"0";}i:86;a:15:{s:7:"immu_id";s:3:"268";s:5:"sl_no";s:3:"066";s:7:"test_id";s:13:"MIHC14:-02319";s:10:"reciv_date";s:10:"10/02/2014";s:12:"current_date";s:10:"2014-02-10";s:9:"deli_date";s:10:"16/02/2014";s:12:"patient_name";s:17:"Mrs. Shilpi Begum";s:3:"age";s:6:"23 Yrs";s:6:"ref_by";s:6:"Urme. ";s:3:"sex";s:6:"Female";s:13:"hospital_name";s:33:"Chevron Clinical Lab , Chittagong";s:13:"specimen_name";s:54:"Tissue from Lt. ovary and omentum. Case No: MH14-2319.";s:4:"note";s:104:"Result of Immunostaining  for CK &amp; EMA ,of Case No: MH14- 2319. from DHL, Path. Lab. Dhaka. <br><br>";s:15:"reporting_board";s:49:"<b>CK :</b><br><br><br><br><b>&nbsp;EMA :</b><br>";s:10:"add_doctor";s:1:"0";}i:87;a:15:{s:7:"immu_id";s:3:"271";s:5:"sl_no";s:1:" ";s:7:"test_id";s:13:"MH11-13031-32";s:10:"reciv_date";s:10:"03/08/2011";s:12:"current_date";s:10:"2011-08-03";s:9:"deli_date";s:10:"06/08/2011";s:12:"patient_name";s:7:"Promila";s:3:"age";s:6:"50 Yrs";s:6:"ref_by";s:7:"Rangpur";s:3:"sex";s:6:"Female";s:13:"hospital_name";s:0:"";s:13:"specimen_name";s:7:"Rangpur";s:4:"note";s:109:"<b><u>Immunostaining results of Case No- HN:R 0/1107059/22
from&nbsp; Kyamch Cancer
 Center</u></b>

<br>";s:15:"reporting_board";s:1487:"<span><b>LCA&nbsp;&nbsp;
</b><span>: Tumor cells show no staining for&nbsp;
LCA. <br></span></span>

<span><b>CK</b>&nbsp;&nbsp;&nbsp;&nbsp;&nbsp; :&nbsp; Tumor
cells show no staining for CK. </span>

&nbsp;

<br>Chromogranin A- Tumor cells show positive granular cytoplasmic staining.

<br>HMB45  Tumor cells show no staining.

&nbsp;

<br><br>Summary of results :-&nbsp; 

<span><br>LCA&nbsp;&nbsp;&nbsp;&nbsp;&nbsp;&nbsp;&nbsp;&nbsp; &nbsp;&nbsp;&nbsp;&nbsp;&nbsp;&nbsp;&nbsp;&nbsp;&nbsp;&nbsp;&nbsp; : Negative.</span>

<span>&nbsp;&nbsp;&nbsp;&nbsp;&nbsp;&nbsp;&nbsp;&nbsp;&nbsp;&nbsp;&nbsp;&nbsp;&nbsp;&nbsp;&nbsp;&nbsp;&nbsp;&nbsp; <br>CK&nbsp;&nbsp;&nbsp;&nbsp;&nbsp;&nbsp;&nbsp;&nbsp;&nbsp;&nbsp; &nbsp;&nbsp;&nbsp;&nbsp;&nbsp;&nbsp;&nbsp;&nbsp;&nbsp;&nbsp;&nbsp; :
Negative</span>

<span>&nbsp;&nbsp;&nbsp;&nbsp;&nbsp;&nbsp;&nbsp;&nbsp;&nbsp;&nbsp;&nbsp;&nbsp;&nbsp;&nbsp;&nbsp;&nbsp;&nbsp;&nbsp; <br>Chromogranin A-&nbsp;&nbsp; : Positive</span>

<span>&nbsp;&nbsp;&nbsp;&nbsp;&nbsp;&nbsp;&nbsp;&nbsp;&nbsp;&nbsp;&nbsp;&nbsp;&nbsp;&nbsp;&nbsp;&nbsp;&nbsp;&nbsp;&nbsp; <br>HMB45 &nbsp; &nbsp;&nbsp;&nbsp;&nbsp;&nbsp;&nbsp;&nbsp;&nbsp;&nbsp;&nbsp;&nbsp; &nbsp;: Negative</span>

&nbsp;

<br>Conclusion:
Considering the immunostaining results this tumor is considered neuroendocrine
origin, 

possibly&nbsp; malignant carcinoid.Please correlated with
clinical and other investigation findings for the management of&nbsp;patient.

&nbsp;

<br>";s:10:"add_doctor";s:1:"0";}i:88;a:15:{s:7:"immu_id";s:3:"277";s:5:"sl_no";s:1:" ";s:7:"test_id";s:15:"MICH11-17524-27";s:10:"reciv_date";s:10:"19/10/2011";s:12:"current_date";s:10:"2011-10-19";s:9:"deli_date";s:10:"23/10/2011";s:12:"patient_name";s:12:"Mrs.  Nasima";s:3:"age";s:6:"35 Yrs";s:6:"ref_by";s:10:"P.A. Banu ";s:3:"sex";s:6:"Female";s:13:"hospital_name";s:3:"DHL";s:13:"specimen_name";s:0:"";s:4:"note";s:86:"<b>Result of immunostaining for CD3, CD20, CD15, CD30, of
case no. LI-169</b>

<br>";s:15:"reporting_board";s:635:"C<span><b>D3</b><span>&nbsp;&nbsp;&nbsp; :&nbsp;&nbsp;
About 50% of the cells are CD3 positive cells. <br><br></span></span><span><b>CD20</b>&nbsp; :&nbsp;&nbsp;
Rest of the cells show CD20 staining with scattered well found
follicles.</span>

<span><b><br><br>CD15</b>&nbsp; :&nbsp;&nbsp;
Scattered atypical cells show positive staining for CD15.</span>

<span><b><br><br>CD30</b>&nbsp; :&nbsp;&nbsp;
Most of cells resembling RS cells are positive for CD30. </span>

&nbsp;
<br><br>Summary: Considering the immunostaining
results, this case can be treated as a case of&nbsp; Hodgkins disease. 

&nbsp;

&nbsp;

<br>";s:10:"add_doctor";s:1:"0";}i:89;a:15:{s:7:"immu_id";s:3:"278";s:5:"sl_no";s:1:" ";s:7:"test_id";s:15:"MICH11-17333-34";s:10:"reciv_date";s:10:"16/10/2011";s:12:"current_date";s:10:"2011-10-16";s:9:"deli_date";s:10:"24/10/2011";s:12:"patient_name";s:21:"Mrs.  Hosne Ara Begum";s:3:"age";s:6:"50 Yrs";s:6:"ref_by";s:27:"Sajjad Mohammad Yusuf, FCPS";s:3:"sex";s:6:"Female";s:13:"hospital_name";s:9:"CSCR, Ctg";s:13:"specimen_name";s:19:"Inguinal lymph node";s:4:"note";s:92:"<b>Result of immunostaining for CD3, CD20, of case no. MH11-16721,Block
No-(02)</b>

<br>";s:15:"reporting_board";s:482:"<span><b>CD3</b> :&nbsp; Parafollicular lymphocytes and scattered
lymphocytes in the follicles are CD3 positive. </span>

<b>&nbsp;</b>

<span><b><br><br>CD20</b> :&nbsp;&nbsp; Most of the lymphocytes in the follicles are
positive of &nbsp;CD20.</span>

&nbsp;

<span><span><br><br>Conclusion: Considering the
immunostaining results, this case should be considered as a case of &nbsp;follicular hyperplasia, rather than follicular
lymphoma. </span><b></b></span>

<br>";s:10:"add_doctor";s:1:"0";}i:90;a:15:{s:7:"immu_id";s:3:"279";s:5:"sl_no";s:3:"069";s:7:"test_id";s:16:"MIHC14:02663-664";s:10:"reciv_date";s:10:"15/02/2014";s:12:"current_date";s:10:"2014-02-15";s:9:"deli_date";s:10:"23/02/2014";s:12:"patient_name";s:18:"Mrs. Shahida Begum";s:3:"age";s:6:"53 Yrs";s:6:"ref_by";s:12:"Yousuf Ali. ";s:3:"sex";s:6:"Female";s:13:"hospital_name";s:49:"Ahsania Mission Cancer & General Hospital , Dhaka";s:13:"specimen_name";s:41:"Tissue from stomach. Case No: DH13-2570. ";s:4:"note";s:98:"Result of Immunostaining  for CD3 &amp; CD20 of Case No: DH13-2570 from DHL Path. Lab. Dhaka. <br>";s:15:"reporting_board";s:321:"<b>CD3:</b>&nbsp; Scattered lymphoid cells show positive staining for<b> CD3.</b><br><br><b>CD20:</b> Majority of the atypical lymphoid cells show positive staining for<b> CD20.</b><br><br><h4><b><i>Conclusion:&nbsp; Immunostaining results confirm the diagnosis of non-Hodgkin's lymphoma of "B" cell origin. </i></b></h4>";s:10:"add_doctor";s:1:"0";}i:91;a:15:{s:7:"immu_id";s:3:"283";s:5:"sl_no";s:1:" ";s:7:"test_id";s:14:"MH-20307-10/11";s:10:"reciv_date";s:10:"06/12/2011";s:12:"current_date";s:10:"2011-12-06";s:9:"deli_date";s:10:"10/12/2011";s:12:"patient_name";s:24:"Mr. Sharat Kumar Singha ";s:3:"age";s:6:"54 Yrs";s:6:"ref_by";s:26:"Md. Jannatul Islam Jinnah ";s:3:"sex";s:6:"Female";s:13:"hospital_name";s:11:"DHL, C- 513";s:13:"specimen_name";s:18:"Rt. hemicolectomy ";s:4:"note";s:100:"<b><u>Result of immunostaining for LCA, CK, CD3 &amp; DC20
of case no. MH-19765/11.</u></b>

<br>";s:15:"reporting_board";s:724:"<span><b>LCA (CD</b><b>45</b><b>) </b>: Majority of the tumor
cells show positive staining.<br><br></span><span><b>CK</b>&nbsp;&nbsp;&nbsp;&nbsp;&nbsp; :&nbsp;&nbsp;
Tumor cells show no staining.</span>

<br><br><span><b>CD3</b>&nbsp;&nbsp;&nbsp; :&nbsp;&nbsp; Scattered
lymphoid cells show positive staining.</span>

<br><br><span><b>CD20</b>&nbsp; :&nbsp;&nbsp; Majority
of the tumor cells show positive staining. </span>

&nbsp;

<br><br>Conclusion: Considering the
immunostaining results, this case can be treated as well as a case of non-Hodgkins lymphoma of
B cell origin, rather than carcinoma. 

&nbsp;

&nbsp;

&nbsp;

&nbsp;

&nbsp;

&nbsp;

&nbsp;

&nbsp;

&nbsp;

&nbsp;

<br>";s:10:"add_doctor";s:1:"0";}i:92;a:15:{s:7:"immu_id";s:3:"284";s:5:"sl_no";s:2:"  ";s:7:"test_id";s:14:"MH-20307-10/11";s:10:"reciv_date";s:10:"06/12/2011";s:12:"current_date";s:10:"2011-12-06";s:9:"deli_date";s:10:"10/12/2011";s:12:"patient_name";s:24:"Mr. Sharat Kumar Singha ";s:3:"age";s:6:"54 Yrs";s:6:"ref_by";s:26:"Md. Jannatul Islam Jinnah ";s:3:"sex";s:6:"Female";s:13:"hospital_name";s:11:"DHL, C- 513";s:13:"specimen_name";s:18:"Rt. hemicolectomy ";s:4:"note";s:100:"<b><u>Result of immunostaining for LCA, CK, CD3 &amp; DC20
of case no. MH-19765/11.</u></b>

<br>";s:15:"reporting_board";s:658:"<span><b>LCA&nbsp;
&nbsp;</b>: Majority
of the tumor cells show positive staining. </span>

<span><b><br><br>CK</b>&nbsp;&nbsp;&nbsp;&nbsp;&nbsp; :&nbsp;&nbsp;
Tumor cells show no staining.</span>

<span><b><br><br>CD3</b>&nbsp;&nbsp;&nbsp; :&nbsp;&nbsp;
Scattered lymphoid cells show positive staining.</span>

<span><b><br><br>CD20</b>&nbsp; :&nbsp;&nbsp;
Majority of the tumor cells show positive staining. </span>

&nbsp;

<br><br>Conclusion: Considering the
immunostaining results this case can be treated as a case of&nbsp; non-Hodgkins lymphoma of
B cell origin, rather than carcinoma. 

&nbsp;

&nbsp;

&nbsp;

&nbsp;

<br>";s:10:"add_doctor";s:1:"0";}i:93;a:15:{s:7:"immu_id";s:3:"286";s:5:"sl_no";s:3:"086";s:7:"test_id";s:17:"MIHC14:-03578-580";s:10:"reciv_date";s:10:"26/02/2014";s:12:"current_date";s:10:"2014-02-26";s:9:"deli_date";s:10:"02/03/2014";s:12:"patient_name";s:18:"Mrs. Sabekun Nahar";s:3:"age";s:6:"34 Yrs";s:6:"ref_by";s:0:"";s:3:"sex";s:6:"Female";s:13:"hospital_name";s:41:"Chittagong Belle Vue Unit-1, Chittagong. ";s:13:"specimen_name";s:51:"Tissue from mesenteric growth. Case No: MH14-02901.";s:4:"note";s:153:"Result of Immunostaining  for&nbsp; LCA , CD3,&nbsp; CD20&nbsp; &amp; BCL-2&nbsp; of Case No: MH14-02901. Block No: (03). from DHL, Path. Lab. Dhaka.<br>";s:15:"reporting_board";s:550:"<b>LCA :</b> Lymphoid cells show positive staining for <b>LCA. </b><br><br><b>CD3 :</b> Perifollicular cells show positive&nbsp; staining for <b>CD3. </b><br><br><b>CD20 :</b> Mostly follicular cells show positive staining for <b>CD20. </b><br><br><b>BCL-2&nbsp; :</b> Follicular cells and scattered perifollicular cells show positive staining for&nbsp; <b>BCL-2 .<br><br></b><h3><b><i>Conclusion: Immunostaining results favor the diagnosis of non-Hodgkin's lymphoma of low grade follicular type (B cell origin).</i> </b></h3><br><br><br><br><br><br>";s:10:"add_doctor";s:1:"0";}i:94;a:15:{s:7:"immu_id";s:3:"287";s:5:"sl_no";s:2:"88";s:7:"test_id";s:13:"MIHC14:-03317";s:10:"reciv_date";s:10:"23/02/2014";s:12:"current_date";s:10:"2014-02-23";s:9:"deli_date";s:10:"02/03/2014";s:12:"patient_name";s:18:"Mst. Latifa Begum.";s:3:"age";s:6:"55 Yrs";s:6:"ref_by";s:25:" Hera Mbo Kumar Roy,MBBS.";s:3:"sex";s:6:"Female";s:13:"hospital_name";s:40:"New Life Clinic & Nursing Home, Rangpur.";s:13:"specimen_name";s:33:"Tissue from omental. Case No:____";s:4:"note";s:68:"Result of Immunostaining  for CD68 &amp; CD138 of Case No: ____.<br>";s:15:"reporting_board";s:47:"<b>CD68 :</b><br><br><br><br><b>CD138 :</b><br>";s:10:"add_doctor";s:1:"0";}i:95;a:15:{s:7:"immu_id";s:3:"288";s:5:"sl_no";s:3:"087";s:7:"test_id";s:13:"MIHC14:-03232";s:10:"reciv_date";s:10:"26/02/2014";s:12:"current_date";s:10:"2014-02-26";s:9:"deli_date";s:10:"02/03/2014";s:12:"patient_name";s:12:"Rokeya Begum";s:3:"age";s:7:"50 Yrs.";s:6:"ref_by";s:0:"";s:3:"sex";s:6:"Female";s:13:"hospital_name";s:39:"Mother Clinic & Nursing Home, Kurigram.";s:13:"specimen_name";s:36:"Tissue from left leg. Case No: ____-";s:4:"note";s:63:"Result of Immunostaining  for CD68 &amp; HMB45 of Case No: ____";s:15:"reporting_board";s:53:"<b>CD68 :</b><br><br><br><br><b>&nbsp;HMB45 :</b><br>";s:10:"add_doctor";s:1:"0";}i:96;a:15:{s:7:"immu_id";s:3:"291";s:5:"sl_no";s:1:" ";s:7:"test_id";s:16:"MIHC:4497-500/12";s:10:"reciv_date";s:10:"14/03/2012";s:12:"current_date";s:10:"2012-03-14";s:9:"deli_date";s:10:"18/03/2012";s:12:"patient_name";s:19:"Mrs. Rabeya Khatun ";s:3:"age";s:6:"60 Yrs";s:6:"ref_by";s:15:"Anowar Hossain ";s:3:"sex";s:6:"Female";s:13:"hospital_name";s:24:"Kurigram Sadar Hospital ";s:13:"specimen_name";s:23:"Tissue from thigh (Rt.)";s:4:"note";s:86:"<b><u>Result of immunostaining for LCA, CK, CD3, CD20
of case no H12-4124</u></b><br>";s:15:"reporting_board";s:657:"<span><b>LCA</b>&nbsp;&nbsp;&nbsp; :&nbsp;&nbsp; Tumor
cell show positive staining.</span>

<span><b><span><br><br>CK&nbsp;&nbsp;&nbsp;&nbsp;&nbsp;&nbsp; </span></b>:<b>&nbsp;&nbsp; </b>Tumor cell show no staining. </span>

<span><b><br><br>CD3</b><span>&nbsp;&nbsp;&nbsp; :&nbsp;&nbsp;
Scattered lymphoid cells show positive staining. <br><br></span></span><span><b>CD20</b>&nbsp; :&nbsp;&nbsp;&nbsp;
Most of the tumor cells show positive staining. </span><u><b><br></b></u> <span><br>Conclusion:-&nbsp; Considering the immunostaining results, this
case can be treated as non-Hodgkins&nbsp;</span>lymphoma of&nbsp; B cell origin. 

&nbsp;

<br>";s:10:"add_doctor";s:1:"0";}i:97;a:15:{s:7:"immu_id";s:3:"292";s:5:"sl_no";s:1:" ";s:7:"test_id";s:13:"MH-6505-06/12";s:10:"reciv_date";s:9:"07/042012";s:12:"current_date";s:10:"2012-04-07";s:9:"deli_date";s:10:"22/04/2012";s:12:"patient_name";s:20:"Mrs. Mahmuda Khatun ";s:3:"age";s:6:"80 Yrs";s:6:"ref_by";s:17:"Md. Mukitul Huda ";s:3:"sex";s:6:"Female";s:13:"hospital_name";s:3:"DHL";s:13:"specimen_name";s:42:"Tissue from Rt. submandibular lymph node. ";s:4:"note";s:91:"<b>Result of
immunostaining for CD3, CD20, CD15, CD30 of case no. MH 12-06160.</b>

<br>";s:15:"reporting_board";s:565:"<span><b>CD3</b>&nbsp;&nbsp;&nbsp; :&nbsp;&nbsp;
Scattered cell show positive staining. </span>

<span><b><br><br>CD20</b><span>&nbsp; :&nbsp;&nbsp;
Scattered cells show positive staining. <br><br></span></span><span><b>CD15</b><span>&nbsp; :&nbsp;&nbsp;
Good number of CD15 positive cells are detected.<br><br></span></span><span><b>CD30</b>&nbsp; :&nbsp;&nbsp; Small
number of cells show CD30 staining. </span>

&nbsp;

&nbsp;
<br><br>Conclusion: Considering the
immunostaining results, we suggest to treat the case as&nbsp; Hodgkins disease. 

<br>";s:10:"add_doctor";s:1:"0";}i:98;a:15:{s:7:"immu_id";s:3:"294";s:5:"sl_no";s:1:" ";s:7:"test_id";s:14:"MMIHC12  06156";s:10:"reciv_date";s:10:"03/04/2012";s:12:"current_date";s:10:"2012-04-03";s:9:"deli_date";s:10:"03/05/2012";s:12:"patient_name";s:16:"Mrs. Rejia Begum";s:3:"age";s:6:"16 Yrs";s:6:"ref_by";s:46:"Mahtab Uddin Ahmed, MD (Pathology) Thesis part";s:3:"sex";s:6:"Female";s:13:"hospital_name";s:8:"S.S.M.C.";s:13:"specimen_name";s:27:"One paraffin block No. (20)";s:4:"note";s:176:"Result of CD30 immunostaining of sections prepared
from paraffin block ID Code-(20), supplied&nbsp;
by&nbsp; Dr. Mahtab Uddin Ahmed,
MD(Pathology)&nbsp; Thesis part.

<br>";s:15:"reporting_board";s:135:"<span><b>CD30</b>&nbsp; -&nbsp;
CD30&nbsp; stained cells are seen.</span>&nbsp;

<br><br>&nbsp;Note: Tissue is poorly fixed.

<br>";s:10:"add_doctor";s:1:"0";}i:99;a:15:{s:7:"immu_id";s:3:"301";s:5:"sl_no";s:3:"100";s:7:"test_id";s:13:"MIHC14:-04112";s:10:"reciv_date";s:10:"06/03/2014";s:12:"current_date";s:10:"2014-03-06";s:9:"deli_date";s:10:"09/03/2014";s:12:"patient_name";s:14:"Jannatul Busra";s:3:"age";s:8:"9 M 25 D";s:6:"ref_by";s:32:"Al-Amin, (Assistant Registrarar)";s:3:"sex";s:6:"Female";s:13:"hospital_name";s:25:"NICRH, Mohakhali, Dhaka. ";s:13:"specimen_name";s:56:"Soft tissue swelling over Lt. flank. Case No: MH14-03407";s:4:"note";s:107:"Result of Immunostaining  for CD99 of Case No: MH14-03407, Block No: (01) from DHL , Path. Lab. Dhaka. <br>";s:15:"reporting_board";s:224:"<b>CD99 :</b> Neoplastic cells show weak membrane staining for<b> CD99.</b><br><br><br><h3><b><i>Conclusion: Immunostaining results favor the diagnosis of Ewing's sarcoma / PNET.</i></b></h3><br><br><br><b>&nbsp;</b><br><br>";s:10:"add_doctor";s:1:"0";}i:100;a:15:{s:7:"immu_id";s:3:"302";s:5:"sl_no";s:3:"095";s:7:"test_id";s:17:"MIHC14:-03902-903";s:10:"reciv_date";s:10:"03/03/2014";s:12:"current_date";s:10:"2014-03-03";s:9:"deli_date";s:10:"16/03/2014";s:12:"patient_name";s:9:"Miss. Mim";s:3:"age";s:6:"11 Yrs";s:6:"ref_by";s:47:"Parvin Akhter Banu, Chief Consultant (Oncology)";s:3:"sex";s:6:"Female";s:13:"hospital_name";s:49:"W-521/4, Delta Medical College & Hospital, Dhaka.";s:13:"specimen_name";s:67:"Tissue from infratemporal lesion. Case No: MH14-03386 &  (140-1389)";s:4:"note";s:151:"Result of Immunostaining  for&nbsp; LCA &amp; CD99 of Case No: MH14-03386 &amp; (140-1389) from DHL, Path. Lab. Dhaka. &amp; The Laboratory Dhaka. <br>";s:15:"reporting_board";s:285:"<b>LCA:</b> Tumor cells show no staining for <b>LCA.</b><br><br><b>CD99 :</b>&nbsp; Atypical round cells show positive staining for <b>CD99.</b><br><br><br><h3><b><i>Conclusion: Immunostaining results favor the diagnosis of Ewing's sarcoma /&nbsp;PNET.</i></b></h3><br><br><br><br><br>";s:10:"add_doctor";s:1:"0";}i:101;a:15:{s:7:"immu_id";s:3:"305";s:5:"sl_no";s:0:"";s:7:"test_id";s:12:"MIHC12  6155";s:10:"reciv_date";s:10:"03/04/2012";s:12:"current_date";s:10:"2012-04-03";s:9:"deli_date";s:10:"05/05/2012";s:12:"patient_name";s:17:"Mrs. Amena Tazrin";s:3:"age";s:6:"16 Yrs";s:6:"ref_by";s:48:"Mahtab Uddin Ahmed,  MD. (Pathology) Thesis part";s:3:"sex";s:6:"Female";s:13:"hospital_name";s:8:"S.S.M.C.";s:13:"specimen_name";s:28:"One paraffin block No:  (19)";s:4:"note";s:188:"<b>&nbsp;</b>

Result of CD30 immunostaining of sections prepared
from paraffin block ID Code-(19), supplied&nbsp;
by&nbsp; Dr. Mahtab Uddin Ahmed, MD (Pathology)
Thesis part.

<br>";s:15:"reporting_board";s:226:"<span><b>CD30</b>&nbsp; -&nbsp;&nbsp; Large
atypical cells resembling RS cells show&nbsp;
positive staining for CD30&nbsp;</span><b><br><br>&nbsp;</b>

<span><b>Note:&nbsp;&nbsp; </b>Tissue is poorly fixed. </span>

<br>";s:10:"add_doctor";s:1:"0";}i:102;a:15:{s:7:"immu_id";s:3:"306";s:5:"sl_no";s:1:" ";s:7:"test_id";s:12:"MIHC12  6158";s:10:"reciv_date";s:10:"03/04/2012";s:12:"current_date";s:10:"2012-04-03";s:9:"deli_date";s:10:"05/05/2012";s:12:"patient_name";s:14:"Mrs. Jahanara ";s:3:"age";s:6:"61 Yrs";s:6:"ref_by";s:48:"Mahtab Uddin Ahmed,  MD. (Pathology) Thesis part";s:3:"sex";s:6:"Female";s:13:"hospital_name";s:8:"S.S.M.C.";s:13:"specimen_name";s:28:"One paraffin block No:  (26)";s:4:"note";s:175:"Result of CD30 immunostaining of sections prepared
from paraffin block ID Code-(26), supplied&nbsp;
by&nbsp; Dr. Mahtab Uddin Ahmed, MD(Pathology)&nbsp; Thesis part.

<br>";s:15:"reporting_board";s:207:"<span><b>CD30</b>&nbsp; - &nbsp;Sections reveal no CD30 positive cells. </span>

&nbsp;

<span><br><br>Note:&nbsp; Tissue is poorly fixed. Poor
fixation may influence the immunostaining. </span>

<br>";s:10:"add_doctor";s:1:"0";}i:103;a:15:{s:7:"immu_id";s:3:"307";s:5:"sl_no";s:1:" ";s:7:"test_id";s:12:"MIHC12  7179";s:10:"reciv_date";s:10:"17/04/2012";s:12:"current_date";s:10:"2012-04-17";s:9:"deli_date";s:10:"05/05/2012";s:12:"patient_name";s:18:"Mrs. Nazmun Nahar ";s:3:"age";s:6:"15 Yrs";s:6:"ref_by";s:48:"Mahtab Uddin Ahmed,  MD. (Pathology) Thesis part";s:3:"sex";s:6:"Female";s:13:"hospital_name";s:8:"S.S.M.C.";s:13:"specimen_name";s:28:"One paraffin block No:  (30)";s:4:"note";s:176:"Result of CD30 immunostaining of sections prepared
from paraffin block ID Code-(30), supplied&nbsp;
by&nbsp; Dr. Mahtab Uddin Ahmed,
MD(Pathology)&nbsp; Thesis part.

<br>";s:15:"reporting_board";s:133:"<span><b>CD30</b>&nbsp; - &nbsp;&nbsp;Large atypical cells resembling RS cells
show&nbsp; positive staining for CD30 </span>

<br>";s:10:"add_doctor";s:1:"0";}i:104;a:15:{s:7:"immu_id";s:3:"308";s:5:"sl_no";s:1:" ";s:7:"test_id";s:12:"MIHC12  7180";s:10:"reciv_date";s:10:"17/04/2012";s:12:"current_date";s:10:"2012-04-17";s:9:"deli_date";s:10:"09/03/2012";s:12:"patient_name";s:18:"Mrs. Rahima Begum ";s:3:"age";s:6:"20 Yrs";s:6:"ref_by";s:48:"Mahtab Uddin Ahmed,  MD. (Pathology) Thesis part";s:3:"sex";s:6:"Female";s:13:"hospital_name";s:8:"S.S.M.C.";s:13:"specimen_name";s:28:"One paraffin block No:  (31)";s:4:"note";s:183:"<u>Result of CD30 immunostaining of sections prepared
from paraffin block ID Code-(31), supplied&nbsp;
by&nbsp; Dr. Mahtab Uddin Ahmed,
MD(Pathology)&nbsp; Thesis part.

</u><br>";s:15:"reporting_board";s:128:"<span><b>CD30</b>&nbsp; - &nbsp;Large atypical cells resembling RS cells
show&nbsp; positive staining for CD30. </span>

<br>";s:10:"add_doctor";s:1:"0";}i:105;a:15:{s:7:"immu_id";s:3:"309";s:5:"sl_no";s:1:" ";s:7:"test_id";s:12:"MIHC12  6777";s:10:"reciv_date";s:10:"10/04/2012";s:12:"current_date";s:10:"2012-04-10";s:9:"deli_date";s:10:"05/05/2012";s:12:"patient_name";s:18:"Mrs. Lutfun Nahar ";s:3:"age";s:6:"66 Yrs";s:6:"ref_by";s:48:"Mahtab Uddin Ahmed,  MD. (Pathology) Thesis part";s:3:"sex";s:6:"Female";s:13:"hospital_name";s:8:"S.S.M.C.";s:13:"specimen_name";s:28:"One paraffin block No:  (29)";s:4:"note";s:172:"Result of CD30 immunostaining of sections prepared
from paraffin block ID Code-(29), supplied&nbsp;
by&nbsp; Dr. Mahtab Uddin Ahmed,
MD(Pathology)&nbsp; Thesis part.

";s:15:"reporting_board";s:128:"<span><b>CD30</b>&nbsp; - &nbsp;Large atypical cells resembling RS cells
show&nbsp; positive staining for CD30. </span>

<br>";s:10:"add_doctor";s:1:"0";}i:106;a:15:{s:7:"immu_id";s:3:"311";s:5:"sl_no";s:1:" ";s:7:"test_id";s:12:"MIHC12  6776";s:10:"reciv_date";s:10:"10/04/2012";s:12:"current_date";s:10:"2012-04-10";s:9:"deli_date";s:10:"05/05/2012";s:12:"patient_name";s:19:"Mrs. Anowara Begum ";s:3:"age";s:6:"28 Yrs";s:6:"ref_by";s:48:"Mahtab Uddin Ahmed,  MD. (Pathology) Thesis part";s:3:"sex";s:6:"Female";s:13:"hospital_name";s:8:"S.S.M.C.";s:13:"specimen_name";s:28:"One paraffin block No:  (28)";s:4:"note";s:176:"Result of CD30 immunostaining of sections prepared
from paraffin block ID Code-(28), supplied&nbsp;
by&nbsp; Dr. Mahtab Uddin Ahmed,
MD(Pathology)&nbsp; Thesis part.

<br>";s:15:"reporting_board";s:128:"<span><b>CD30</b>&nbsp; - &nbsp;Large atypical cells resembling RS cells
show&nbsp; positive staining for CD30. </span>

<br>";s:10:"add_doctor";s:1:"0";}i:107;a:15:{s:7:"immu_id";s:3:"312";s:5:"sl_no";s:1:" ";s:7:"test_id";s:12:"MIHC12  7119";s:10:"reciv_date";s:10:"16/04/2012";s:12:"current_date";s:10:"2012-04-16";s:9:"deli_date";s:10:"07/05/2012";s:12:"patient_name";s:7:"Jamila ";s:3:"age";s:6:"22 Yrs";s:6:"ref_by";s:48:"Mahtab Uddin Ahmed,  MD. (Pathology) Thesis part";s:3:"sex";s:6:"Female";s:13:"hospital_name";s:8:"S.S.M.C.";s:13:"specimen_name";s:28:"One paraffin block No:  (24)";s:4:"note";s:175:"Result of LCA immunostaining of sections prepared
from paraffin block ID Code-(24), supplied&nbsp;
by&nbsp; Dr. Mahtab Uddin Ahmed,
MD(Pathology)&nbsp; Thesis part.

<br>";s:15:"reporting_board";s:113:"<span>LCA&nbsp; - &nbsp;Large atypical cells resembling RS cells show Positive
staining for LCA. </span>

<br>";s:10:"add_doctor";s:1:"0";}i:108;a:15:{s:7:"immu_id";s:3:"315";s:5:"sl_no";s:1:" ";s:7:"test_id";s:12:"MIHC12  7115";s:10:"reciv_date";s:10:"16/04/2012";s:12:"current_date";s:10:"2012-04-16";s:9:"deli_date";s:10:"07/05/2012";s:12:"patient_name";s:12:"Mrs. Afsana ";s:3:"age";s:6:"22 Yrs";s:6:"ref_by";s:48:"Mahtab Uddin Ahmed,  MD. (Pathology) Thesis part";s:3:"sex";s:6:"Female";s:13:"hospital_name";s:8:"S.S.M.C.";s:13:"specimen_name";s:28:"One paraffin block No:  (21)";s:4:"note";s:170:"Result of LCA immunostaining of sections prepared
from paraffin block ID Code-(21), supplied&nbsp;
by&nbsp; Dr. Mahtab Uddin Ahmed, MD (Pathology)
Thesis part.

<br>";s:15:"reporting_board";s:113:"<span>LCA&nbsp; - &nbsp;Large atypical cells resembling RS cells show Positive
staining for LCA. </span>

<br>";s:10:"add_doctor";s:1:"0";}i:109;a:15:{s:7:"immu_id";s:3:"319";s:5:"sl_no";s:1:" ";s:7:"test_id";s:17:"MIHC12: 11408-411";s:10:"reciv_date";s:10:"18/06/2012";s:12:"current_date";s:10:"2012-06-18";s:9:"deli_date";s:10:"24/06/2012";s:12:"patient_name";s:17:"Mrs. Zohura Begum";s:3:"age";s:6:"70 Yrs";s:6:"ref_by";s:43:"Saumen Basu, MBBS, MD, DNB (Radiation Onco)";s:3:"sex";s:6:"Female";s:13:"hospital_name";s:43:"Khwaja Yunus Ali Medical College & Hospital";s:13:"specimen_name";s:45:"One paraffin Block No (02), Case No:-H12-1912";s:4:"note";s:182:"<b><u>Result of immunostaining for &nbsp;CK, EMA, S100 &amp; CD 117 of case no. H12-1912,
from Apollo Hospital , Dhaka,
&nbsp;Block No. (2).</u></b>

<b><u>&nbsp;</u></b>

<br>";s:15:"reporting_board";s:548:"<span><b>CK</b>&nbsp;&nbsp;&nbsp;&nbsp;&nbsp; :&nbsp; Tumor
cells show no staining for CK.</span>

<span><br><br>EMA&nbsp;&nbsp;&nbsp; : &nbsp;Tumor cells show no staining for EMA</span>

<span><br><br>S100&nbsp; :&nbsp; Tumor cells&nbsp;
show positive staining for S100</span>

<span><br><br>CD117:&nbsp; Tumor cells show no staining for CD117. </span>

&nbsp;

&nbsp;

<br><br>Considering the
immunostaining results this case can be treated as a case of sarcoma (possibly
of neural origin) rather than carcinoma.

&nbsp;

<br>";s:10:"add_doctor";s:1:"0";}i:110;a:15:{s:7:"immu_id";s:3:"320";s:5:"sl_no";s:3:"114";s:7:"test_id";s:13:"MIHC14:-04193";s:10:"reciv_date";s:10:"08/03/2014";s:12:"current_date";s:10:"2014-03-08";s:9:"deli_date";s:10:"16/03/2014";s:12:"patient_name";s:16:"Mrs. Jabun Nahar";s:3:"age";s:6:"45 Yrs";s:6:"ref_by";s:25:"Ferdous Ara Shuchi , FCPS";s:3:"sex";s:6:"Female";s:13:"hospital_name";s:11:"DHL, C- 513";s:13:"specimen_name";s:45:"Uterus with both adnexae. Case No: MH14-04193";s:4:"note";s:102:"Result of Immunostaining  for S-100 of Case No: MH14-04193, Block No: (01) DHL, Path. Lab. Dhaka. <br>";s:15:"reporting_board";s:18:"<b>S-100 :</b><br>";s:10:"add_doctor";s:1:"0";}i:111;a:15:{s:7:"immu_id";s:3:"329";s:5:"sl_no";s:3:"115";s:7:"test_id";s:13:"MIHC14:-04475";s:10:"reciv_date";s:10:"11/03/2014";s:12:"current_date";s:10:"2014-03-11";s:9:"deli_date";s:10:"16/03/2014";s:12:"patient_name";s:16:"Mrs. Amena Begum";s:3:"age";s:6:"30 Yrs";s:6:"ref_by";s:0:"";s:3:"sex";s:6:"Female";s:13:"hospital_name";s:4:"CSCR";s:13:"specimen_name";s:38:"One paraffin block case no: MH14-04475";s:4:"note";s:98:"Result of Immunostaining  for CK &amp; CD31of Case No: MH14-04475 from DHL. Path. Lab. Dhaka. <br>";s:15:"reporting_board";s:43:"<b>CK :</b><br><br><br><br><b>CD31:</b><br>";s:10:"add_doctor";s:1:"0";}i:112;a:15:{s:7:"immu_id";s:3:"331";s:5:"sl_no";s:1:" ";s:7:"test_id";s:11:"MH-16254/12";s:10:"reciv_date";s:10:"28/08/2012";s:12:"current_date";s:10:"2012-08-28";s:9:"deli_date";s:10:"02/09/2012";s:12:"patient_name";s:20:"Miss Afreen Sultana ";s:3:"age";s:6:"12 Yrs";s:6:"ref_by";s:49:"Parvin Akhter Banu , Senior Consultant (Oncology)";s:3:"sex";s:6:"Female";s:13:"hospital_name";s:4:"DHL ";s:13:"specimen_name";s:54:"(Inguinal lymph node) One kparaffin block ( 5573/12). ";s:4:"note";s:125:"<b>&nbsp;Result of immunostaining of Case no. 5573/12,
for CD20 from ARMED FORCES INSTITUTE Of PATHOLOGY, Dhaka.</b>

<br>";s:15:"reporting_board";s:203:"CD20:&nbsp;&nbsp; Tumor cells show no
staining for CD20

<br><br><br><br>

<b><u>Summary :</u></b>

&nbsp;

<span><b>CD20  Negative . </b><b></b></span>

&nbsp;

&nbsp;

&nbsp;

<br><br>";s:10:"add_doctor";s:1:"0";}i:113;a:15:{s:7:"immu_id";s:3:"332";s:5:"sl_no";s:3:"353";s:7:"test_id";s:15:"MIHC12-23026-27";s:10:"reciv_date";s:10:"22/11/2012";s:12:"current_date";s:10:"2012-11-22";s:9:"deli_date";s:10:"25/11/2012";s:12:"patient_name";s:21:"Mrs. Khurshida Begum ";s:3:"age";s:6:"65 Yrs";s:6:"ref_by";s:40:"M.N Huda, Chief Consultant (Oncologist) ";s:3:"sex";s:6:"Female";s:13:"hospital_name";s:3:"DHL";s:13:"specimen_name";s:32:"Tissue from Cervical lymph node ";s:4:"note";s:114:"<b>Result of immunostaining
for&nbsp; CD20 &amp; CD3 case No MH12-22731.&nbsp;</b><b> Block No:
(02)</b>

<br>";s:15:"reporting_board";s:496:"CD20- Most of the tumor
cells show positive staining.

&nbsp;

&nbsp;

&nbsp;
<br><br>CD3 -&nbsp; Scattered lymphoid cells show positive
staining. 

&nbsp;

&nbsp;&nbsp;

<br><br>&nbsp;Summary of results :- 

&nbsp;

<span>&nbsp;&nbsp;&nbsp;&nbsp;&nbsp;&nbsp;&nbsp;&nbsp;&nbsp;&nbsp;&nbsp;&nbsp; <br><br>Considering the immunostaining
results, this case should be&nbsp;</span>treated as a case of malignant
non-Hodgkins lymphoma of B cell origin. 

&nbsp;

&nbsp;

<br>";s:10:"add_doctor";s:1:"0";}i:114;a:15:{s:7:"immu_id";s:3:"335";s:5:"sl_no";s:1:" ";s:7:"test_id";s:16:"MIHC:12-17144-46";s:10:"reciv_date";s:10:"08/09/2012";s:12:"current_date";s:10:"2012-09-08";s:9:"deli_date";s:10:"16/09/2012";s:12:"patient_name";s:11:"Kusum Bala ";s:3:"age";s:6:"60 Yrs";s:6:"ref_by";s:33:"Metro Diagnostic Centre Ltd, Ctg.";s:3:"sex";s:6:"Female";s:13:"hospital_name";s:29:"Desh Medical Services, Ctg.  ";s:13:"specimen_name";s:20:"Cervical lymph node ";s:4:"note";s:100:"<b><u>Result of immunostaining for CD3, CD20, CD30 of  case no. MH-16676/12, Block (02)</u></b><br>";s:15:"reporting_board";s:462:"<span><b>CD3</b>    :  
Majority of the lymphoid cells show positive staining for CD3</span><br><br> <span><b>CD20</b>  :  
Some of the lymphoid cells forming aggregates show positive staining. </span>

<span><b><br><br>CD30</b>  :  
Many large atypical cells show positive staining for CD30.</span>

 

 

<br><br>Conclusion: Considering the
immunostaining results, this case should be treated as Hodgkins disease. 

 

 

<br>";s:10:"add_doctor";s:1:"0";}i:115;a:15:{s:7:"immu_id";s:3:"336";s:5:"sl_no";s:3:"119";s:7:"test_id";s:17:"MIHC14:-04673-676";s:10:"reciv_date";s:10:"13/03/2014";s:12:"current_date";s:10:"2014-03-13";s:9:"deli_date";s:10:"23/03/2014";s:12:"patient_name";s:17:"Mrs. Rahima Begum";s:3:"age";s:6:"69 Yrs";s:6:"ref_by";s:37:"Belayet Hossain Siddique.FCPS, FICS. ";s:3:"sex";s:6:"Female";s:13:"hospital_name";s:34:"Medinet. Medical Services. Dhaka. ";s:13:"specimen_name";s:59:"One paraffin block (Rt.Neck mass tissue) Case No: 140301998";s:4:"note";s:134:"Result of Immunostaining  for LCA, CK , CD3 &amp; CD20 of Case No: 140301998, Block No: (A3) from&nbsp; a i Khan Lab. Ltd. Dhaka. <br>";s:15:"reporting_board";s:437:"<b>LCA :</b> Tumor cells show positive staining for <b>LCA .</b><br><br><b>CK :</b> Tumor cells show no staining for <b>CK.</b><br><br><b>CD3:</b> Scattered lymphoid cells show positive staining for <b>CD3.</b><br><br><b>CD20: </b>Atypical lymphoid cells show positive staining for<b> CD20.</b><br><br><h2><b><i>Conclusion: Immunostaining results favor the diagnosis of Non-Hodgkin's lymphoma of "B" cell origin.</i></b></h2><br><br><br>";s:10:"add_doctor";s:1:"0";}i:116;a:15:{s:7:"immu_id";s:3:"337";s:5:"sl_no";s:3:"123";s:7:"test_id";s:17:"MIHC14:-04749-751";s:10:"reciv_date";s:10:"15/03/2014";s:12:"current_date";s:10:"2014-03-15";s:9:"deli_date";s:10:"25/03/2014";s:12:"patient_name";s:7:"Jannat ";s:3:"age";s:6:"11 Yrs";s:6:"ref_by";s:36:"Assot. Prof. Dr. Md. Arifur Rahman. ";s:3:"sex";s:6:"Female";s:13:"hospital_name";s:71:"Institute of Child Health & Shishu Sasthya Foundation Hospital. Dhaka. ";s:13:"specimen_name";s:69:"Tissue from left sided cervical lymph node. Case No: MH14-04178 (R/G)";s:4:"note";s:135:"Result of Immunostaining  for CD3 , CD20&nbsp; &amp; BCL2 of Case No: MH14-04178 (R/G), Block No: (01) from DHL, Path. Lab. Dhaka. <br>";s:15:"reporting_board";s:413:"<b>CD3 :</b> Majority of the lymphoid cells show positive staining for<b> CD3.</b><br><br><b>CD20 :</b> Majority of the lymphoid cells show positive staining for <b>CD20.</b><br><br><b>BCL2 :</b> Follicular centre cells show no staining for <b>BCL2.<br><br></b><h4><b><i>Conclusion: Immunostaining results favor the diagnosis of reactive hyperplasia&nbsp; rather then Non-Hodgkin's lymphoma. </i></b></h4><br><br>";s:10:"add_doctor";s:1:"0";}i:117;a:15:{s:7:"immu_id";s:3:"341";s:5:"sl_no";s:3:"129";s:7:"test_id";s:13:"MIHC14:-05158";s:10:"reciv_date";s:10:"22/03/2014";s:12:"current_date";s:10:"2014-03-22";s:9:"deli_date";s:10:"30/03/2014";s:12:"patient_name";s:12:"Momtaz Begum";s:3:"age";s:6:"15 Yrs";s:6:"ref_by";s:0:"";s:3:"sex";s:6:"Female";s:13:"hospital_name";s:25:"NICRH, Mohakhali, Dhaka. ";s:13:"specimen_name";s:45:"Tissue from cervical mass. Case No: MH14-3165";s:4:"note";s:112:"Result of Immunostaining  for&nbsp; Desmin of Case No: MH14-3165, Block No: (02) from DHL Path. Lab. Dhaka. <br>";s:15:"reporting_board";s:219:"<b><br>Desmin :</b> Scattered neoplastic cells show strong positive reaction for&nbsp; <b>Desmin.</b><br><br><br><h4><b><i>Conclusion: Immunostaining result favors the diagnosis of rhabdomyosarcoma.</i></b></h4><br><br>";s:10:"add_doctor";s:1:"0";}i:118;a:15:{s:7:"immu_id";s:3:"342";s:5:"sl_no";s:3:"138";s:7:"test_id";s:13:"MIHC14:-05495";s:10:"reciv_date";s:10:"26/03/2014";s:12:"current_date";s:10:"2014-03-26";s:9:"deli_date";s:10:"30/03/2014";s:12:"patient_name";s:10:"Hena Begum";s:3:"age";s:6:"40 Yrs";s:6:"ref_by";s:11:"A B M Jamal";s:3:"sex";s:6:"Female";s:13:"hospital_name";s:42:"Dhaka Medical College  & Hospital. Dhaka. ";s:13:"specimen_name";s:45:"Tissue from gastric polyp. Case No: MH14-5185";s:4:"note";s:108:"Result of Immunostaining  for CD117 of Case No: MH14-5185 , Block No: (02) from DHL , Path. Lab. Dhaka. <br>";s:15:"reporting_board";s:130:"<b><br>CD117 :</b> Tumor cells show positive staining for<b> CD117.</b><br><br><h4><b><i>Conclusion: CD117 Positive. </i></b></h4>";s:10:"add_doctor";s:1:"0";}i:119;a:15:{s:7:"immu_id";s:3:"343";s:5:"sl_no";s:3:"131";s:7:"test_id";s:17:"	MIHC14:05283-285";s:10:"reciv_date";s:10:"23/03/2014";s:12:"current_date";s:10:"2014-03-23";s:9:"deli_date";s:10:"30/03/2014";s:12:"patient_name";s:17:"Mrs. Mazeda Begum";s:3:"age";s:6:"48 Yrs";s:6:"ref_by";s:47:"Parvin Akhter Banu, Chief Consultant (Oncology)";s:3:"sex";s:6:"Female";s:13:"hospital_name";s:13:"DLMCH, Dhaka.";s:13:"specimen_name";s:50:"Rt. sided mastectomy specimen. Case No: MH14-04057";s:4:"note";s:125:"Result of Immunostaining  for ER, PR &amp; HER-2 of Case No:      MH14-04057, Block No: (02) from DHL, Path. Lab. Dhaka. <br>";s:15:"reporting_board";s:198:"Immunostaining for ER, PR &amp; HER2 is done. But 
due to extensive necrosis , no viable malignant cell persists and we can&nbsp; not give any conclusive opinion from the section examined. <br><br>";s:10:"add_doctor";s:1:"0";}i:120;a:15:{s:7:"immu_id";s:3:"352";s:5:"sl_no";s:3:"173";s:7:"test_id";s:17:"MIHC14:-06649-650";s:10:"reciv_date";s:10:"17/04/2014";s:12:"current_date";s:10:"2014-04-17";s:9:"deli_date";s:10:"20/04/2014";s:12:"patient_name";s:7:"Parvin ";s:3:"age";s:6:"25 Yrs";s:6:"ref_by";s:36:"Rita Paul, MD. (Student Thesis Part)";s:3:"sex";s:6:"Female";s:13:"hospital_name";s:14:"SSMCH. Dhaka. ";s:13:"specimen_name";s:31:"One paraffin block.Case No: R75";s:4:"note";s:85:"Result of Immunostaining  for LCA &amp; CD99 of Case No: R75. from SSMCH. Dhaka. <br>";s:15:"reporting_board";s:276:"<b>LCA: </b>Neoplastic cells show positive staining for <b>LCA.</b><br><br><b>CD99 :</b> Neoplastic cells show no staining for <b>CD99 .<br><br></b><h4><b><i>Conclusion: Immunostaining results favor the diagnosis of Non-Hodgkin's lymphoma. </i></b></h4><b><br></b><br><br><br>";s:10:"add_doctor";s:1:"0";}i:121;a:15:{s:7:"immu_id";s:3:"355";s:5:"sl_no";s:3:"183";s:7:"test_id";s:17:"MIHC14:-07161-164";s:10:"reciv_date";s:10:"16/04/2014";s:12:"current_date";s:10:"2014-04-16";s:9:"deli_date";s:10:"20/04/2014";s:12:"patient_name";s:17:"Mrs. Safia Khatun";s:3:"age";s:6:"40 Yrs";s:6:"ref_by";s:46:"Lt. Col. Lutfunnahar Khan. FCPS (Haematology).";s:3:"sex";s:6:"Female";s:13:"hospital_name";s:33:"Modern Diagnostic Centre. Jesore.";s:13:"specimen_name";s:37:"One paraffin block.Case No: VH-317/14";s:4:"note";s:131:"Result of Immunostaining  for LCA , CD3 ,CD20 , BCL2 of Case No: VH-317/14, Block No: (01) from Modern Diagnostic Center. Dhaka<br>";s:15:"reporting_board";s:480:"<b>LCA :</b> Lymphoid cells show positive staining for <b>LCA.<br></b><br><b>CD3 :</b> Scattered lymphoid cells show positive staining for <b>CD3.</b><br><br><b>CD20:</b> Majority of the atypical lymphoid cells show positive staining for <b>CD20.<br></b><br><b>BCL2 :</b> No specific stain is observed for <b>BCL2.<br><br></b><h4><b><i>Conclusion: Immunostaining results favor the diagnosis of Non-Hodgkin's lymphoma of "B"&nbsp; cell origin. </i></b></h4><br><br><br><br><br><br>";s:10:"add_doctor";s:1:"0";}i:122;a:15:{s:7:"immu_id";s:3:"359";s:5:"sl_no";s:3:"191";s:7:"test_id";s:17:"MIHC14:-07391-393";s:10:"reciv_date";s:10:"20/04/2014";s:12:"current_date";s:10:"2014-04-20";s:9:"deli_date";s:10:"27/04/2014";s:12:"patient_name";s:19:"Mrs. Dawlatun Nessa";s:3:"age";s:6:"62 Yrs";s:6:"ref_by";s:50:"Parvin Akhter Banu, Chief Consultant (Oncologist).";s:3:"sex";s:6:"Female";s:13:"hospital_name";s:12:"DLMCH, Dhaka";s:13:"specimen_name";s:47:"Tissue from sacral region. Case No:  MH14-06420";s:4:"note";s:110:"Result of Immunostaining  for LCA, CD3 &amp; CD20&nbsp; of Case No: MH14-06420 from DHL, Path. Lab Dhaka. <br>";s:15:"reporting_board";s:396:"<b>LCA:</b> Lymphoid cells show positive staining for <b>LCA.</b><br><br><b>CD3 :</b> Scattered lymphoid cells show positive staining for <b>CD3.<br></b><br><b>CD20 :</b> Atypical lymphoid cells show positive staining for <b>CD20.<br><br></b><h4><b><i>Conclusion: Immunostaining results favor the diagnosis of Non-Hodgkin's lymphoma of "B"&nbsp; cell origin. </i></b></h4><br><br><br><br><br><br>";s:10:"add_doctor";s:1:"0";}i:123;a:15:{s:7:"immu_id";s:3:"361";s:5:"sl_no";s:3:"194";s:7:"test_id";s:17:"MIHC14:-07477-478";s:10:"reciv_date";s:10:"20/04/2014";s:12:"current_date";s:10:"2014-04-20";s:9:"deli_date";s:10:"27/04/2014";s:12:"patient_name";s:14:"Mrs. Del Afroz";s:3:"age";s:6:"42 Yrs";s:6:"ref_by";s:38:"Md. Mohoshin Sarker, D.ortho (DU) R.S.";s:3:"sex";s:6:"Female";s:13:"hospital_name";s:43:"Delta Medical College & Hospital Ltd. Dhaka";s:13:"specimen_name";s:63:"Soft tissue from dorsal aspect of Rt. foot. Case No:  MH14-6985";s:4:"note";s:116:"Result of Immunostaining  for CD99 &amp; Desmin of Case No: MH14-6985, Block No: (02) from DHL, Path. Lab. Dhaka<br>";s:15:"reporting_board";s:291:"<b>CD99 :</b> Tumor cells show positive staining for <b>CD99.</b><br><br><b>Desmin :</b> Tumor cells show no staining for&nbsp; <b>Desmin .<br><br></b><h4><b><i>Conclusion:&nbsp; Immunostaining results favor the </i></b><b><i>diagnosis</i></b><b><i> of Ewing's sarcoma. </i></b></h4><br><br>";s:10:"add_doctor";s:1:"0";}i:124;a:15:{s:7:"immu_id";s:3:"365";s:5:"sl_no";s:3:"216";s:7:"test_id";s:13:"MIHC14:-08327";s:10:"reciv_date";s:10:"30/04/2014";s:12:"current_date";s:10:"2014-04-30";s:9:"deli_date";s:10:"04/05/2014";s:12:"patient_name";s:12:"Fatema Begum";s:3:"age";s:6:"50 Yrs";s:6:"ref_by";s:0:"";s:3:"sex";s:6:"Female";s:13:"hospital_name";s:20:"The Lab, Chittagong.";s:13:"specimen_name";s:31:"Lymph node. Case No: MH14-07452";s:4:"note";s:93:"Result of Immunostaining  for CD20 of Case No: MH14-07452, from DHL, Path. Lab. Dhaka<br><br>";s:15:"reporting_board";s:214:"<b>CD20:</b> Most of the neoplastic cells show positive staining for <b>CD20.<br><br></b><h4><b><i>Conclusion : Immunostaining results favor the diagnosis of Non-Hodgkin's lymphoma of "B" cell origin. </i></b></h4>";s:10:"add_doctor";s:1:"0";}i:125;a:15:{s:7:"immu_id";s:3:"367";s:5:"sl_no";s:3:"233";s:7:"test_id";s:13:"MIHC14:-08599";s:10:"reciv_date";s:10:"05/05/2014";s:12:"current_date";s:10:"2014-05-05";s:9:"deli_date";s:10:"11/05/2014";s:12:"patient_name";s:11:"Mrs. Nargis";s:3:"age";s:6:"40 Yrs";s:6:"ref_by";s:0:"";s:3:"sex";s:6:"Female";s:13:"hospital_name";s:34:"Popular Community Hospita, Rangpur";s:13:"specimen_name";s:34:"Tissue from breast. Case No: 08599";s:4:"note";s:107:"Result of Immunostaining  for LCA &amp; CK of Case No:08599 Block No: (03) from DHL, Path. Lab. Dhaka. <br>";s:15:"reporting_board";s:47:"<b>LCA :</b><br><br><br><br><b>CK :</b><br><br>";s:10:"add_doctor";s:1:"0";}i:126;a:15:{s:7:"immu_id";s:3:"369";s:5:"sl_no";s:3:"239";s:7:"test_id";s:17:"MIHC14:-09158-163";s:10:"reciv_date";s:10:"12/05/2014";s:12:"current_date";s:10:"2014-05-12";s:9:"deli_date";s:10:"25/05/2014";s:12:"patient_name";s:18:"Mrs. Rekha Akhter.";s:3:"age";s:6:"25 Yrs";s:6:"ref_by";s:63:"Naheed Rukhsana , FCPS, (Radiotherapy). Consultant. oncologist.";s:3:"sex";s:6:"Female";s:13:"hospital_name";s:49:"Delta Medical College & Hospital, W-521/8. Dhaka.";s:13:"specimen_name";s:32:"Spinal Tissue. Case No: DH14-339";s:4:"note";s:147:"Result of Immunostaining  for LCA, CD3, CD20, CD138, Kappa &amp; Lambda&nbsp; of Case No: DH14-339, Block No: (01) from DHL, Path. Lab. Dhaka. <br>";s:15:"reporting_board";s:579:"<b>LCA :</b> Occasional cells show positive staining for <b>LCA.</b><br><br><b>CD3 :</b> Occasional cells show positive staining for <b>CD3,</b><br><br><b>CD20 :</b> Occasional cells show positive staining for <b>CD20.</b><br><br><b>CD138 :</b> Neoplastic cells show positive staining for <b>CD138.</b><br><br><b>Kappa :</b>&nbsp; Neoplastic cells show positive staining for <b>Kappa.</b><br><br><b>Lambda :</b> Neoplastic cells show positive staining for <b>Lambda.<br><br>&nbsp;</b><br><b><i>Conclusion : Immunostaining results favor the diagnosis of plasmacytoma. </i></b><br>";s:10:"add_doctor";s:1:"0";}i:127;a:15:{s:7:"immu_id";s:3:"381";s:5:"sl_no";s:3:"275";s:7:"test_id";s:17:"MIHC14:-10387-389";s:10:"reciv_date";s:10:"26/05/2014";s:12:"current_date";s:10:"2014-05-26";s:9:"deli_date";s:10:"01/06/2014";s:12:"patient_name";s:12:"Mrs. Dipali.";s:3:"age";s:6:"55 Yrs";s:6:"ref_by";s:60:"Lt. Col. M.S. Sarwar Alam (Rtd.), FCPS, Clinical oncologist.";s:3:"sex";s:6:"Female";s:13:"hospital_name";s:48:"Delta Medical College & Hospital (Oncology Unit)";s:13:"specimen_name";s:64:"One paraffin block received (Deltoid muscle).Case No: MH-2473/14";s:4:"note";s:138:"Result of Immunostaining  for CD99 , Desmin&nbsp; &amp; Myogenin of Case No: MH-2473/14, Block No: (B) from Medinova Diagnostic Dhaka.<br>";s:15:"reporting_board";s:322:"<b>CD99 : </b>Neoplastic cell show positive staining for <b><b>CD99.<br><br>Desmin : </b></b>Neoplastic cells show no staining for <b><b><b>Desmin</b>.<br><br>Myogenin : </b></b>Neoplastic cell show no staining<b> for <b>Myogenin.<br><br>Conclusion : Immunostaining results favor the diagnosis of Ewing's sarcoma. </b></b>";s:10:"add_doctor";s:1:"0";}i:128;a:15:{s:7:"immu_id";s:3:"382";s:5:"sl_no";s:3:"280";s:7:"test_id";s:13:"MIHC14:-10343";s:10:"reciv_date";s:10:"26/05/2014";s:12:"current_date";s:10:"2014-05-26";s:9:"deli_date";s:10:"01/06/2014";s:12:"patient_name";s:19:"Most. Zamela Khatun";s:3:"age";s:6:"45 Yrs";s:6:"ref_by";s:0:"";s:3:"sex";s:6:"Female";s:13:"hospital_name";s:32:"New Sonag Bangla Clinic, Rangpur";s:13:"specimen_name";s:29:"Appendix. Case No: MH14-10343";s:4:"note";s:89:"Result of Immunostaining  for CK &amp; Chromogranin of Case No: Block No: ( ___) from<br>";s:15:"reporting_board";s:53:"<b>CK :</b><br><br><br><br><b>Chromogranin : </b><br>";s:10:"add_doctor";s:1:"0";}i:129;a:15:{s:7:"immu_id";s:3:"383";s:5:"sl_no";s:3:"281";s:7:"test_id";s:17:"MIHC14:-10266-267";s:10:"reciv_date";s:10:"25/05/2014";s:12:"current_date";s:10:"2014-05-25";s:9:"deli_date";s:10:"01/06/2014";s:12:"patient_name";s:5:"Sufia";s:3:"age";s:6:"30 Yrs";s:6:"ref_by";s:0:"";s:3:"sex";s:6:"Female";s:13:"hospital_name";s:39:"The Lab Aid Diagnostic, Brahammanbaria.";s:13:"specimen_name";s:56:"Tissue from cervical lymph node. Case No: MH14-10266-267";s:4:"note";s:84:"Result of Immunostaining  for S-100 of Case No: MH14-10266-267 , Block No: ( __)<br>";s:15:"reporting_board";s:17:"<b>S-100:</b><br>";s:10:"add_doctor";s:1:"0";}i:130;a:15:{s:7:"immu_id";s:3:"385";s:5:"sl_no";s:3:"284";s:7:"test_id";s:17:"MIHC14:-10838-840";s:10:"reciv_date";s:10:"01/06/2014";s:12:"current_date";s:10:"2014-06-01";s:9:"deli_date";s:10:"08/06/2014";s:12:"patient_name";s:18:"Mrs. Salma Rahman.";s:3:"age";s:6:"60 Yrs";s:6:"ref_by";s:48:"Parvin Akhter Banu, Chief Consultant Oncologist.";s:3:"sex";s:6:"Female";s:13:"hospital_name";s:33:"Delta Medical College & Hospital.";s:13:"specimen_name";s:47:"Tissue from left upper leg. Case No: MH14-10569";s:4:"note";s:118:"Result of Immunostaining  for LCA, CD3 & CD20  of Case No: MH14-10569, Block No: (02) from DHL Path. Lab. Dhaka. <br>";s:15:"reporting_board";s:363:"<b>LCA :</b> Lymphoid cells show positive staining for <b>LCA.</b><br><br><b>CD3 :</b> Scattered lymphoid cells show positive staining for <b>CD3.</b><br><br><b>CD20 :</b> Neoplastic lymphoid cells show positive staining for <b>CD20.<br><br><h4><b>Conclusion : Immunostaining results favor the diagnosis of Non-Hodgkin's lymphoma of "B" cell origin. </b></h4></b>";s:10:"add_doctor";s:1:"0";}i:131;a:15:{s:7:"immu_id";s:3:"388";s:5:"sl_no";s:3:"297";s:7:"test_id";s:13:"MIHC14:-09999";s:10:"reciv_date";s:10:"21/06/2014";s:12:"current_date";s:10:"2014-06-21";s:9:"deli_date";s:10:"04/06/2014";s:12:"patient_name";s:13:"Parvin Akhter";s:3:"age";s:6:"12 Yrs";s:6:"ref_by";s:10:"Dr. Sumon ";s:3:"sex";s:6:"Female";s:13:"hospital_name";s:31:"Prime Medical College, Rangpur.";s:13:"specimen_name";s:45:"Tisue from sigmoid colon. Case No: MH14-09999";s:4:"note";s:83:"Result of Immunostaining  for CD117 , CK &amp; Vimentin of Case No: MH14-09999,<br>";s:15:"reporting_board";s:82:"<b>CD117 :</b><br><br><br><b>&nbsp;CK :</b><br><br><br><b>&nbsp;Vimentin :</b><br>";s:10:"add_doctor";s:1:"0";}i:132;a:15:{s:7:"immu_id";s:3:"393";s:5:"sl_no";s:3:"310";s:7:"test_id";s:13:"MIHC14:-11590";s:10:"reciv_date";s:10:"10/06/2014";s:12:"current_date";s:10:"2014-06-10";s:9:"deli_date";s:10:"15/06/2014";s:12:"patient_name";s:18:"Mrs. Kasmiri Begum";s:3:"age";s:6:"65 Yrs";s:6:"ref_by";s:43:"Abu Naser Siddidue, Asstt. Prof. (Medicine)";s:3:"sex";s:6:"Female";s:13:"hospital_name";s:41:"Chittagong Medical Collage Hospital. Ctg.";s:13:"specimen_name";s:40:"Tissue from stomach. Case No: MH14-09786";s:4:"note";s:90:"Result of Immunostaining  for HER-2 of Case No: MH14-09786 from DHL, Path. Lab. Dhaka.<br>";s:15:"reporting_board";s:234:"Weak to moderate complete membrane staining is observed in more than 10 % of the tumor cells.<br>Score : 2+<br><br><b>Summary of result: </b><br><b>                           HER-2 : Borderline</b><br><br><br>";s:10:"add_doctor";s:1:"0";}i:133;a:15:{s:7:"immu_id";s:3:"398";s:5:"sl_no";s:3:"340";s:7:"test_id";s:12:"MIHC14:11681";s:10:"reciv_date";s:10:"11-06-2014";s:12:"current_date";s:10:"2014-06-25";s:9:"deli_date";s:10:"29-06-2014";s:12:"patient_name";s:22:"Mrs. Nurun Nahar Begum";s:3:"age";s:6:"70 Yrs";s:6:"ref_by";s:0:"";s:3:"sex";s:6:"Female";s:13:"hospital_name";s:40:"Lancet Diagnostic & Research, Chittagong";s:13:"specimen_name";s:55:"Tisue from anterior wall of cervix. Case No: MH14-11681";s:4:"note";s:119:"Result of Immunostaining for LCA , CK , CD3 & CD20 of Case No: MH14-11681, Block No: (___) from DHL, Path. Lab. Dhaka. ";s:15:"reporting_board";s:54:"LCA :<br><br><br>CK :<br><br><br>CD3:<br><br><br>CD20:";s:10:"add_doctor";s:1:"0";}i:134;a:15:{s:7:"immu_id";s:3:"399";s:5:"sl_no";s:3:"341";s:7:"test_id";s:12:"MIHC14:11794";s:10:"reciv_date";s:10:"12-06-2014";s:12:"current_date";s:10:"2014-06-25";s:9:"deli_date";s:10:"29-06-2014";s:12:"patient_name";s:12:"Ms. Monsera ";s:3:"age";s:6:"35 Yrs";s:6:"ref_by";s:27:"Md. Lutfor Rahman, FCPS, MS";s:3:"sex";s:6:"Female";s:13:"hospital_name";s:25:"Mahangar Clinic, Rajshani";s:13:"specimen_name";s:88:"Two H & E stained slides and Two paraffin block received for review. Case No: MH14-11794";s:4:"note";s:98:"Result of Immunostaining for LCA, CK & GFAP of Case No: MH14-11794, LCA, CK & GFAP Block No: (___)";s:15:"reporting_board";s:37:"LCA :<br><br><br>CK:<br><br><br>GFAP:";s:10:"add_doctor";s:1:"0";}i:135;a:15:{s:7:"immu_id";s:3:"402";s:5:"sl_no";s:3:"350";s:7:"test_id";s:17:"MIHC14: 13353-55 ";s:10:"reciv_date";s:10:"03-07-2014";s:12:"current_date";s:10:"2014-07-02";s:9:"deli_date";s:10:"06-07-2014";s:12:"patient_name";s:7:"Dulali ";s:3:"age";s:6:"30 Yrs";s:6:"ref_by";s:35:"Fatema Ashraf, FCPS, (Gynae & Obs.)";s:3:"sex";s:6:"Female";s:13:"hospital_name";s:10:"Sh.S.M.C.H";s:13:"specimen_name";s:24:"Tissue from pelvic mass ";s:4:"note";s:113:"Result of Immunostaining for Desmin, Myogenin & S-100 of Case No: MH14-12141, Block No: (02) from DHL, Path. Lab.";s:15:"reporting_board";s:405:"<b>Desmin:  </b>Neoplastic cells show no specific staining for <b>desmin.</b><br><br><br><b>Myogenin:</b> Neoplastic cells show no specific staining for <b>myogenin.</b><br><br><br><b>S-100:  </b>Neoplastic cells show positive staining for <b>S-100.</b><br><br><br><i><b>Conclusion: Immunostaining results favor the diagnosis of neoplasm of nerve sheath origin rather than rhabdomyosarcoma. </b></i><br>";s:10:"add_doctor";s:1:"0";}i:136;a:15:{s:7:"immu_id";s:3:"404";s:5:"sl_no";s:3:"370";s:7:"test_id";s:17:"MIHC14: 13663-666";s:10:"reciv_date";s:10:"08-07-2014";s:12:"current_date";s:10:"2014-07-09";s:9:"deli_date";s:10:"13-07-2014";s:12:"patient_name";s:17:"Mrs. Josna Begum ";s:3:"age";s:6:"40 Yrs";s:6:"ref_by";s:19:"Al Mamoon Ferdousi ";s:3:"sex";s:6:"Female";s:13:"hospital_name";s:43:"Delta Medical College & Dental Unit, Dhaka.";s:13:"specimen_name";s:50:"Tissue from Lt. buccal area, Case No : MH14-13291.";s:4:"note";s:120:"Result of Immunostaining for LCA (CD45), CD20, CD3 & Cytokeratin (CK) of Case No: MH14-13291,From DHL, Path, Lab, Dhaka.";s:15:"reporting_board";s:479:"<b><br>LCA (CD45):  </b>Lymphoid cells show positive staining for <b>LCA.</b> <br><br><b>CD20 :  </b>Majority of atypical lymphoid cells show positive staining for <b>CD20</b>.<br><br><b>CD3 :</b>  Scattered lymphoid cells show positive staining for <b>CD3.</b><br><br><b>Cytokeratin (CK):  </b>Tumour cells show no staining for <b>CK. </b><br><br><br><i><b>Conclusion:  Immunostaining results confirm the diagnosis of Non-Hodgkin's lymphoma of "B" cell origin. </b></i><br>";s:10:"add_doctor";s:1:"0";}i:137;a:15:{s:7:"immu_id";s:3:"408";s:5:"sl_no";s:3:"374";s:7:"test_id";s:12:"MIHC14:13793";s:10:"reciv_date";s:10:"09-07-2014";s:12:"current_date";s:10:"2014-07-09";s:9:"deli_date";s:10:"13-07-2014";s:12:"patient_name";s:17:"Mrs. Bedura Begum";s:3:"age";s:6:"40 Yrs";s:6:"ref_by";s:0:"";s:3:"sex";s:6:"Female";s:13:"hospital_name";s:33:"Chevron Clinical Lab , Chittagong";s:13:"specimen_name";s:49:"Partial gastrectomy specimen. Case No: MH14-13635";s:4:"note";s:102:"Result of Immunostaining for HER-2 of Case No: MH14-13635, Block No: (02) from DHL, Path. Lab. Dhaka. ";s:15:"reporting_board";s:189:"<b><br><br>HER-2</b> : Weak incomplete membrane staining is observed in more than 10 % of the tumor cells.<br>Score&nbsp; : 1+<br><br><b>Conclusion:</b>&nbsp; HER-2:&nbsp; Negative.<br><br>";s:10:"add_doctor";s:1:"0";}i:138;a:15:{s:7:"immu_id";s:3:"409";s:5:"sl_no";s:3:"381";s:7:"test_id";s:16:"MIHC14:14087-089";s:10:"reciv_date";s:10:"14-07-2014";s:12:"current_date";s:10:"2014-07-16";s:9:"deli_date";s:10:"20-07-2014";s:12:"patient_name";s:17:"Miss Sadia Karim ";s:3:"age";s:6:"17 Yrs";s:6:"ref_by";s:64:"Dr. Sajjad Mohammad Yusuf, Oncologist, MCPS, FCPS (Radiotherapy)";s:3:"sex";s:6:"Female";s:13:"hospital_name";s:26:"CSCR Hospital , Chittagong";s:13:"specimen_name";s:53:"Tissue from cervical lymph node, Case No: MH14-13461.";s:4:"note";s:113:"Result of Immunostaining for CD3, CD20 & CD30 of Case No: MH14-13461, Block No: (02), From DHL, Path, Lab. Dhaka ";s:15:"reporting_board";s:366:"<b>CD3:</b> Some of the lymphoid cells show positive staining for <b>CD3.</b><br><br><br><b>CD20:  </b>Some of the lymphoid cells show positive staining for <b>CD20</b>.<br><br><br><b>CD30:  </b>Scattered large cells show positive staining for <b>CD30</b>.<br><br><br><b><i>Conclusion: Immunostaining results favor the diagnosis of Hodgkin's lymphoma.</i></b> <br>";s:10:"add_doctor";s:1:"0";}i:139;a:15:{s:7:"immu_id";s:3:"411";s:5:"sl_no";s:3:"392";s:7:"test_id";s:11:"MIHC14:1520";s:10:"reciv_date";s:10:"20-07-2014";s:12:"current_date";s:10:"2014-07-24";s:9:"deli_date";s:10:"27-07-2014";s:12:"patient_name";s:13:"Mrs. Shamima ";s:3:"age";s:6:"50 Yrs";s:6:"ref_by";s:24:"Md. Anisur Rahman, FCPS ";s:3:"sex";s:6:"Female";s:13:"hospital_name";s:30:"Popular Diagnostic Centre Ltd.";s:13:"specimen_name";s:18:"Tissue from lesion";s:4:"note";s:73:"Result of Immunostaining for LCA & CK of Case No:DH14-1520, Block No: ( )";s:15:"reporting_board";s:56:"<br><b>LCA:</b><br><br><br><b>CK:&nbsp; </b><br><br><br>";s:10:"add_doctor";s:1:"0";}i:140;a:15:{s:7:"immu_id";s:3:"412";s:5:"sl_no";s:3:"389";s:7:"test_id";s:16:"MIHC14:14686-688";s:10:"reciv_date";s:10:"22-07-2014";s:12:"current_date";s:10:"2014-07-26";s:9:"deli_date";s:10:"27-07-2014";s:12:"patient_name";s:11:"Rezia Begum";s:3:"age";s:6:"65 Yrs";s:6:"ref_by";s:24:"Dr. Suraiya Begum, FCPS ";s:3:"sex";s:6:"Female";s:13:"hospital_name";s:40:"IBN SINA  Hospital and Diagnostic center";s:13:"specimen_name";s:62:"Three paraffin blocks (Uterus)  recived, Case No: E 121749/14.";s:4:"note";s:126:"Result of Immunostaining for  ER & PR of Case No: E 121749/14, Block No: (02) , from IBN SINA  Hospital and Diagnostic center.";s:15:"reporting_board";s:322:"<b>ER: </b>Tumor cell nuclei show no staining.<br>       Quick Score: "O"<br><br><b>PR:</b> Tumor cell nuclei show no staining.<br>       Quick Score: "O"<br><br>Summary of result: <br>                    <b> ER : </b>Negative <br>                     <b>PR :</b> Negative <br>";s:10:"add_doctor";s:1:"0";}i:141;a:15:{s:7:"immu_id";s:3:"419";s:5:"sl_no";s:3:"406";s:7:"test_id";s:16:"MIHC14:15642-645";s:10:"reciv_date";s:10:"09-08-2014";s:12:"current_date";s:10:"2014-08-13";s:9:"deli_date";s:10:"17-08-2014";s:12:"patient_name";s:19:"Mrs. Shimul Akhter ";s:3:"age";s:6:"34 Yrs";s:6:"ref_by";s:62:"(Lt. Col.) M.S. Sarwar Alam (Rtd.), FCPS, Clinical Oncologist.";s:3:"sex";s:6:"Female";s:13:"hospital_name";s:18:"Delta Hospital Ltd";s:13:"specimen_name";s:70:"One paraffin block (Tissue from mass of rt toe). Case No: 14-052-12339";s:4:"note";s:83:"Result of Immunostaining for S-100, CK , Vimentin & HMB45 of Case No: 14-052-12339.";s:15:"reporting_board";s:539:"<b>CK :</b>Tumor cells show positive staining&nbsp; for<b> CK. <br><br>S-100 : </b>Tumor cells show positive staining for<b><b> S-100</b>.<br><b><b><br>Vimentin :</b></b> T</b>umor cells show no staining for<b><b><b><b><b> Vimentin </b></b>.<b><br><br>HMB45 :&nbsp; </b></b></b></b>Tumor cells show no staining for <b><b><b><b>HMB45.</b><b><br><br><i>Conclusion: Immunostaining&nbsp; results favor the diagnosis of squamous cell carcinoma rather than melanoma. </i></b><i><br><br></i><b>Note: Tissue is poorly fixed.</b><i><br></i></b></b>";s:10:"add_doctor";s:1:"0";}i:142;a:15:{s:7:"immu_id";s:3:"426";s:5:"sl_no";s:3:"425";s:7:"test_id";s:17:"MIHC14:-16341-342";s:10:"reciv_date";s:10:"18/08/2014";s:12:"current_date";s:10:"2014-08-18";s:9:"deli_date";s:10:"24/08/2014";s:12:"patient_name";s:11:"Miss Jannat";s:3:"age";s:6:"24 Yrs";s:6:"ref_by";s:59:"Tapesh Kumar Paul, FCPS, (Surgery), MS (Surgical Oncology).";s:3:"sex";s:6:"Female";s:13:"hospital_name";s:39:"Delta Medical College & Hospital, Dhaka";s:13:"specimen_name";s:63:"4 (Four) paraffin blocks. Case No: 14-01-5535,  Block No: (02) ";s:4:"note";s:124:"Result of Immunostaining  for LCA &amp; CK of Case No: 14-01-5535, Block No: (02) from Anowara Medical Services, Dhaka. <br>";s:15:"reporting_board";s:240:"<b>LCA : </b>Tumor cells show no staining for<b> LCA.<br><br>CK :</b> Tumor cells show no staining for <b>CK.<br><br>Inconclusive immunostaining result. <br><br>Further panel of antibodies is necessary to determine the histogenesis.<br></b>";s:10:"add_doctor";s:1:"0";}i:143;a:15:{s:7:"immu_id";s:3:"429";s:5:"sl_no";s:3:"431";s:7:"test_id";s:13:"MIHC14:-15773";s:10:"reciv_date";s:10:"10/08/2014";s:12:"current_date";s:10:"2014-08-10";s:9:"deli_date";s:10:"24/08/2014";s:12:"patient_name";s:17:"Mrs. Rabeya Begum";s:3:"age";s:6:"40 Yrs";s:6:"ref_by";s:13:"Faruque Ahmed";s:3:"sex";s:6:"Female";s:13:"hospital_name";s:24:"Khidma Hospital. Dhaka. ";s:13:"specimen_name";s:37:"Tissue from mode. Case No: MH14-15773";s:4:"note";s:79:"Result of Immunostaining  for CK &amp; HMB45 of Case No: MH14-15773 from...<br>";s:15:"reporting_board";s:34:"<b>CK :<br><br><br>HMB45 :</b><br>";s:10:"add_doctor";s:1:"0";}i:144;a:15:{s:7:"immu_id";s:3:"430";s:5:"sl_no";s:3:"427";s:7:"test_id";s:17:"MIHC14:-16577-580";s:10:"reciv_date";s:10:"19/08/2014";s:12:"current_date";s:10:"2014-08-19";s:9:"deli_date";s:10:"24/08/2014";s:12:"patient_name";s:15:"Hosne Ara Begum";s:3:"age";s:6:"35 Yrs";s:6:"ref_by";s:0:"";s:3:"sex";s:6:"Female";s:13:"hospital_name";s:26:"Medical Center, Chittagong";s:13:"specimen_name";s:40:"Inguinal lymph node. Case No: MH14-14807";s:4:"note";s:122:"Result of Immunostaining  for LCA, CD3 , CD20 , BCL, CD15 & CD30  of Case No: MH14-14807 from DHL, Path. Lab. Dhaka. <br>";s:15:"reporting_board";s:110:"<b>LCA :<br><br><br>CD3: <br><br><br>CD20 :<br><br><br>BCL :<br><br><br>CD15:  <br><br><br>CD30 :</b><br><br>";s:10:"add_doctor";s:1:"0";}i:145;a:15:{s:7:"immu_id";s:3:"431";s:5:"sl_no";s:3:"425";s:7:"test_id";s:28:"MIHC14:-16341-342, 17715-716";s:10:"reciv_date";s:10:"18/08/2014";s:12:"current_date";s:10:"2014-08-18";s:9:"deli_date";s:10:"31/08/2014";s:12:"patient_name";s:11:"Miss Jannat";s:3:"age";s:6:"24 Yrs";s:6:"ref_by";s:59:"Tapesh Kumar Paul, FCPS, (Surgery), MS (Surgical Oncology).";s:3:"sex";s:6:"Female";s:13:"hospital_name";s:39:"Delta Medical College & Hospital. Dhaka";s:13:"specimen_name";s:44:"4 (Four) Paraffin blocks.Case No: 14-01-5535";s:4:"note";s:156:"Result of Immunostaining  for LCA, CK, CD99 &amp; Chromogranin&nbsp; of Case No: 14-01-5535, Block No: (02) from Anowara Medical Services,&nbsp; Dhaka. <br>";s:15:"reporting_board";s:463:"<b> LCA :</b> Tumor cells show no staining for <b>LCA.</b><br><br><b>CK:&nbsp; </b>Tumor cells show no staining for <b>CK. </b><br><br><b>CD99 :</b> Tumor cells show strong positive staining for <b>CD99.</b><br><br><b><b>Chromogranin</b>:</b> Tumor cells show no staining for <b>Chromogranin.</b><br><br><br><b>Conclusion: Immunostaining results favor the diagnosis of Primitive&nbsp; neuroectodermal tumor (PNET) rather than ductal carcinoma.</b><br><br><br><br>";s:10:"add_doctor";s:1:"0";}i:146;a:15:{s:7:"immu_id";s:3:"433";s:5:"sl_no";s:3:"440";s:7:"test_id";s:17:"DIHC14:-01743-747";s:10:"reciv_date";s:10:"25/08/2014";s:12:"current_date";s:10:"2014-08-25";s:9:"deli_date";s:10:"31/08/2014";s:12:"patient_name";s:18:"Mrs. Hena Majumdar";s:3:"age";s:6:"65 Yrs";s:6:"ref_by";s:42:"M.A. Khan.  FCPS (Haematology) , FRCP (UK)";s:3:"sex";s:6:"Female";s:13:"hospital_name";s:33:"Lab  aid cardiac Hospital , Dhaka";s:13:"specimen_name";s:39:"Tissue from stomach. Case No: DH14-1665";s:4:"note";s:116:"Result of Immunostaining  for LCA, CD3, CD20, CD15 &amp; CD30&nbsp;of Case No:DH14-1665, from DHL, Path. Lab. Dhaka.";s:15:"reporting_board";s:468:"<b>LCA : </b>Tumour cells show positive staining for <b>LCA</b>.<br><b><br>CD3: </b>Scattered lymphoid cells show positive staining for<b> CD3.<br><br>CD20:</b> Tumour cells show positive staining for <b>CD20.<br><br>CD15 : </b>Tumour cells show no staining for <b>CD15</b>.<br><b><br>CD30 :</b> Tumour cells show no staining for <b>CD30.</b><br><br><b><i>Conclusion: Immunostaining results confirm the diagnosis of Non-Hodgkin's lymphoma of B-cell origin.</i></b><br>";s:10:"add_doctor";s:1:"0";}i:147;a:15:{s:7:"immu_id";s:3:"435";s:5:"sl_no";s:3:"449";s:7:"test_id";s:17:"MIHC14:-17398-400";s:10:"reciv_date";s:10:"28/08/2014";s:12:"current_date";s:10:"2014-08-28";s:9:"deli_date";s:10:"07/09/2014";s:12:"patient_name";s:17:"Mrs. Juleka Begum";s:3:"age";s:6:"48 Yrs";s:6:"ref_by";s:44:"Saumen Basu, MBBS, MD (Cal.). DNB, Oncology.";s:3:"sex";s:6:"Female";s:13:"hospital_name";s:20:"KYAMCH. Siragjgonj. ";s:13:"specimen_name";s:40:"Tissue from stomach. Case No: MH14-13550";s:4:"note";s:112:"Result of Immunostaining  for HER-2 , LCA , CD20 &amp; CK of Case No: MH14-13550, from DHL ,Path. Lab. Dhaka<br>";s:15:"reporting_board";s:427:"<b>HER-2 :</b> Score +2 (Borderline)<br><b><br>LCA : </b>Lymphoid cells show positive staining for<b><b> LCA. </b><br><br><b>CD20&nbsp; :&nbsp; </b></b>CD20 Staining is negative. <b><br><br><b><b>CK:&nbsp;</b></b></b> Staining was done on academic interest and tumor cells show positive staining for <b>CK.<b><br><br><b>Conclusion: Immunostaining results favor the diagnosis of adenocarcinoma rather than lymphoma. </b></b></b>";s:10:"add_doctor";s:1:"0";}i:148;a:15:{s:7:"immu_id";s:3:"439";s:5:"sl_no";s:3:"477";s:7:"test_id";s:17:"MIHC14:-18728-731";s:10:"reciv_date";s:10:"10/09/2014";s:12:"current_date";s:10:"2014-09-10";s:9:"deli_date";s:10:"21/09/2014";s:12:"patient_name";s:12:"Mrs. Nilufa ";s:3:"age";s:6:"45 Yrs";s:6:"ref_by";s:49:"Parvin Akhter Banu, Chief Consultant (Oncologist)";s:3:"sex";s:6:"Female";s:13:"hospital_name";s:44:"Delta Medical College & Hospital Ltd. Dhaka.";s:13:"specimen_name";s:48:"Tissue from Tonsillar growth. Case No: 140809128";s:4:"note";s:122:"Result of Immunostaining  for LCA, CK, CD3 & CD20 of Case No: 140809128, Block No: (A1) from a i Khan Lab Ltd. Dhaka. <br>";s:15:"reporting_board";s:435:"<b>LCA : </b>Lymphoid cells show positive staining for <b><b>LCA </b>.<br><br>CK : </b>Lining epithelium show positive staining for<b><b> CK. </b><br><br>CD3:</b> Scattered lymphoid cells show positive staining for<b><b> CD3</b><br><br>CD20 :</b> Majority of the atypical lymphoid cells show positive staining for <b>CD20.<br><br>Conclusion: Immunostaining results favor the diagnosis of Non-Hodgkin's lymphoma of "B" cell origin. </b>";s:10:"add_doctor";s:1:"0";}i:149;a:15:{s:7:"immu_id";s:3:"441";s:5:"sl_no";s:3:"484";s:7:"test_id";s:13:"MIHC14:-19173";s:10:"reciv_date";s:10:"15/09/2014";s:12:"current_date";s:10:"2014-09-15";s:9:"deli_date";s:10:"21/09/2014";s:12:"patient_name";s:17:"Mrs. Kawser Begum";s:3:"age";s:6:"34 Yrs";s:6:"ref_by";s:18:"A F M  Kamal Uddin";s:3:"sex";s:6:"Female";s:13:"hospital_name";s:0:"";s:13:"specimen_name";s:41:"Tissue from stomach. Case No: MH14-18130 ";s:4:"note";s:93:"Result of Immunostaining  for HER-2 of Case No: MH14-18130 from,  DHL, Path. Lab. Dhaka.<br>";s:15:"reporting_board";s:304:"<b>HER-2</b> :  Weak incomplete membrane staining is observed in more than 10 % of the tumor cells.<br>               Score : 1+<br><br><br><span>Summary
of result <b>:</b><br></span><b>                                  HER-2:</b> Negative<br><br><br><br><br>";s:10:"add_doctor";s:1:"0";}i:150;a:15:{s:7:"immu_id";s:3:"442";s:5:"sl_no";s:3:"485";s:7:"test_id";s:17:"MIHC14:-19183-184";s:10:"reciv_date";s:10:"15/09/2014";s:12:"current_date";s:10:"2014-09-15";s:9:"deli_date";s:10:"21/09/2014";s:12:"patient_name";s:19:"Most. Zamela Khatun";s:3:"age";s:6:"45 Yrs";s:6:"ref_by";s:0:"";s:3:"sex";s:6:"Female";s:13:"hospital_name";s:15:"Haragach Clinic";s:13:"specimen_name";s:29:"Appendix. Case No: MH14-10343";s:4:"note";s:103:"Result of Immunostaining  for CK & Chromagranin of Case No: MH14-10343 from DHL, Path. Lab. Dhaka. <br>";s:15:"reporting_board";s:275:"<b><br>CK : </b>Neoplastic&nbsp; cell show nonspecific staining for<b> CK.</b><br><b><br>Chromagranin :</b> Neoplastic cells show strong positive staining for <b>Chromagranin. <br><br><b>Conclusion: Immunostaining results favor the diagnosis of Carcinoid&nbsp; tumor </b></b>";s:10:"add_doctor";s:1:"0";}i:151;a:15:{s:7:"immu_id";s:3:"444";s:5:"sl_no";s:3:"487";s:7:"test_id";s:17:"MIHC14:-19297-300";s:10:"reciv_date";s:10:"16/09/2014";s:12:"current_date";s:10:"2014-09-16";s:9:"deli_date";s:10:"21/09/2014";s:12:"patient_name";s:7:"Khaleda";s:3:"age";s:6:"09 Yrs";s:6:"ref_by";s:23:"Mohammad Moniul Huque. ";s:3:"sex";s:6:"Female";s:13:"hospital_name";s:0:"";s:13:"specimen_name";s:43:"Tissue from pelvic mass. Case No: MH14-7139";s:4:"note";s:145:"Result of Immunostaining  for NSE, Chromagranin , CD117 , Desmin , CK & EMA of Case No:MH14-7139, Block No: (02) from DHL, Path. Lab. Dhaka. <br>";s:15:"reporting_board";s:619:"<b><br>NSE : </b>Neoplastic cells show positive staining for <b><b>NSE </b>.<br><br>Chromagranin : </b>Neoplastic cells show no staining for <b><b>Chromagranin. </b><br><br>CD117 :</b> Neoplastic cells show positive&nbsp; staining for<b><b>CD117</b>.<br><br>Desmin :</b> Neoplastic cells show no staining&nbsp; for&nbsp; <b>Desmin. </b><br><br><b>CK: </b>Neoplastic cells show no staining&nbsp; for <b>CK</b>.<br><br><b>EMA: </b>Neoplastic cells show no staining&nbsp; for<b> EMA</b>.<br><i><b><br>Conclusion: Immunostaining results favor the diagnosis of neuroblastoma. </b></i><br><br><br><br><br><br><br><br><br><br>";s:10:"add_doctor";s:1:"0";}i:152;a:15:{s:7:"immu_id";s:3:"447";s:5:"sl_no";s:3:"494";s:7:"test_id";s:16:"MIHC14:19513-515";s:10:"reciv_date";s:10:"20-09-2014";s:12:"current_date";s:10:"2014-09-24";s:9:"deli_date";s:10:"28-09-2014";s:12:"patient_name";s:18:"Mrs. Nafisa Naznin";s:3:"age";s:6:"58 Yrs";s:6:"ref_by";s:59:"Tapesh Kumar Paul, FCPS, (Surgery), MS (Surgical Oncology).";s:3:"sex";s:6:"Female";s:13:"hospital_name";s:40:"Delta Medical College & Hospital. Dhaka ";s:13:"specimen_name";s:53:"Cervical lymph node (Rt. upper), Case No:- MH14-19201";s:4:"note";s:112:"Result of Immunostaining for LCA, CD3 & CD20 of Case No: MH14-19201, Block No: (02), From DHL, Path, Lab. Dhaka.";s:15:"reporting_board";s:367:"<b><br>LCA: </b>Neoplastic lymphoid cells show positive staining for<b> LCA.<br><br>CD3: </b>Scattered lymphoid cells show  positive staining for <b>CD3.<br><br>CD20: </b>Majority of the neoplastic lymphoid cells show positive staining for <b>CD20.<br><br><i>Conclusion: Immunostaining results confirm the diagnosis of Non-Hodgkin's lymphoma of "B" cell origin. </i>";s:10:"add_doctor";s:1:"0";}i:153;a:15:{s:7:"immu_id";s:3:"452";s:5:"sl_no";s:3:"511";s:7:"test_id";s:12:"MIHC14:20202";s:10:"reciv_date";s:10:"28-09-2014";s:12:"current_date";s:10:"2014-09-30";s:9:"deli_date";s:10:"12-10-2014";s:12:"patient_name";s:14:"Nurjahan Begum";s:3:"age";s:6:"75 Yrs";s:6:"ref_by";s:59:"Tapesh Kumar Paul, FCPS, (Surgery), MS (Surgical Oncology).";s:3:"sex";s:6:"Female";s:13:"hospital_name";s:41:"Delta Medical College & Hospital. Dhaka. ";s:13:"specimen_name";s:53:"Tissue from intra-abdominal cyst.Case No: MH14-19565.";s:4:"note";s:100:"Result of Immunostaining for CD117 of Case No: MH14-19565 Block No: (02) from DHL Path. Lab. Dhaka. ";s:15:"reporting_board";s:115:"<b><br>CD117 </b>: Neoplastic cells show positive staining for <b>CD117.<br><b><br>Conclusion: CD117-Positive. </b>";s:10:"add_doctor";s:1:"0";}i:154;a:15:{s:7:"immu_id";s:3:"456";s:5:"sl_no";s:3:"515";s:7:"test_id";s:16:"MIHC14:20310-312";s:10:"reciv_date";s:10:"29-09-2014";s:12:"current_date";s:10:"2014-09-30";s:9:"deli_date";s:10:"12-10-2014";s:12:"patient_name";s:14:"Tamanna Khatun";s:3:"age";s:6:"78 Yrs";s:6:"ref_by";s:27:"Mohammad Masud Karim, FCPS ";s:3:"sex";s:6:"Female";s:13:"hospital_name";s:0:"";s:13:"specimen_name";s:52:"Tissue from axillary lymph node. Case No: MH14-20018";s:4:"note";s:113:"Result of Immunostaining for LCA, CD3 & CD20  of Case No: MH14-20018, Block No: (02) from DHL, Path. Lab. Dhaka. ";s:15:"reporting_board";s:344:"<b><br>LCA : </b>Lymphoid cells show positive staining for <b><b>LCA </b>.<br><br>CD3 :&nbsp; </b>CD3 positive lymphoid cells are seen.<b><br><br>CD20 : </b>CD20 positive lymphoid cells are seen.<b> <br><br><br><b>Conclusion:&nbsp; Immunostaining result is inconclusive CD15 and CD30 immunostaining is suggested for accurate diagnosis. </b></b>";s:10:"add_doctor";s:1:"0";}i:155;a:15:{s:7:"immu_id";s:3:"457";s:5:"sl_no";s:3:"517";s:7:"test_id";s:12:"MIHC14:19822";s:10:"reciv_date";s:10:"23-09-2014";s:12:"current_date";s:10:"2014-09-30";s:9:"deli_date";s:10:"05-10-2014";s:12:"patient_name";s:17:"Mrs. Johura Begum";s:3:"age";s:6:"48 Yrs";s:6:"ref_by";s:0:"";s:3:"sex";s:6:"Female";s:13:"hospital_name";s:0:"";s:13:"specimen_name";s:71:"One H & EStained slide and 1 (One) paraffin block received for review. ";s:4:"note";s:123:"Result of Immunostaining for EMA , Vimentin , GFAP & CD31 of Case No:MH14-19822, Block No: (__) from DHL Path. Lab. Dhaka. ";s:15:"reporting_board";s:73:"<b>EMA :<br><br><br>Vimentin: <br><br><br>GFAP :<br><br><br><br>CD31:</b>";s:10:"add_doctor";s:1:"0";}i:156;a:15:{s:7:"immu_id";s:3:"458";s:5:"sl_no";s:3:"518";s:7:"test_id";s:12:"MIHC14:20012";s:10:"reciv_date";s:10:"26-09-2014";s:12:"current_date";s:10:"2014-09-30";s:9:"deli_date";s:10:"05-10-2014";s:12:"patient_name";s:14:"Mrs. Shahanaz ";s:3:"age";s:6:"19 Yrs";s:6:"ref_by";s:16:"Mahfuz Ara Begum";s:3:"sex";s:6:"Female";s:13:"hospital_name";s:27:"Azmal Hospital Ltd. Dhaka. ";s:13:"specimen_name";s:38:"Tubo Ovarian Mass. Case No: MH14-20012";s:4:"note";s:106:"Result of Immunostaining for CK & CD68 of Case No: MH14-20012, Block No: ( __) from DHL Path. Lab. Dhaka. ";s:15:"reporting_board";s:33:"<b>CK :<br><br><br>CD68 :</b><br>";s:10:"add_doctor";s:1:"0";}i:157;a:15:{s:7:"immu_id";s:3:"460";s:5:"sl_no";s:3:"522";s:7:"test_id";s:12:"MIHC14:20548";s:10:"reciv_date";s:10:"02-10-2014";s:12:"current_date";s:10:"2014-10-15";s:9:"deli_date";s:10:"19-10-2014";s:12:"patient_name";s:18:"Mrs. Hasina Akhter";s:3:"age";s:6:"45 Yrs";s:6:"ref_by";s:55:"Md. Mokhles Uddin, MBBS, FCPS (Radiotherapy) CMC, Ctg. ";s:3:"sex";s:6:"Female";s:13:"hospital_name";s:31:"Medi Aid Complex, Chittagong.  ";s:13:"specimen_name";s:50:"Tissue from part of small gut, Case No: MH14-17777";s:4:"note";s:101:"Result of Immunostaining for CD117 of Case No: MH14-17777, Block No: (01) from DHL, Path Lab. Dhaka. ";s:15:"reporting_board";s:137:"<b><br>CD117 :</b> Neoplastic cells show positive staining for <b>CD117</b>.<br><br><br><b><i>Conclusion:  CD117 - Positive.</i></b><br>";s:10:"add_doctor";s:1:"0";}i:158;a:15:{s:7:"immu_id";s:3:"461";s:5:"sl_no";s:3:"527";s:7:"test_id";s:12:"MIHC14:20704";s:10:"reciv_date";s:10:"09-10-2014";s:12:"current_date";s:10:"2014-10-15";s:9:"deli_date";s:10:"19-10-2014";s:12:"patient_name";s:19:"Mrs. Sabekun Nahar.";s:3:"age";s:6:"39 Yrs";s:6:"ref_by";s:24:"A.B.M. Zamal, FCPS, FRCS";s:3:"sex";s:6:"Female";s:13:"hospital_name";s:32:"Health and Hope Hospital, Dhaka ";s:13:"specimen_name";s:67:"Tissue from root of mesentery near D3 Junction. Case No: MH14-20370";s:4:"note";s:100:"Result of Immunostaining for CD117 of Case No: MH14-20370, Block No: ( 01) from DHL Path. Lab. Dhaka";s:15:"reporting_board";s:130:"<br><b><br>CD117 :</b> Neoplastic cells show positive staining for CD117.<br><br><br><b>Conclusion: CD117 - Positive. </b><br><br>";s:10:"add_doctor";s:1:"0";}i:159;a:15:{s:7:"immu_id";s:3:"469";s:5:"sl_no";s:3:"541";s:7:"test_id";s:12:"MIHC14:20826";s:10:"reciv_date";s:10:"12-10-2014";s:12:"current_date";s:10:"2014-10-15";s:9:"deli_date";s:10:"19-10-2014";s:12:"patient_name";s:11:"Indira Rani";s:3:"age";s:6:"43 Yrs";s:6:"ref_by";s:18:"Partha Senethi Roy";s:3:"sex";s:6:"Female";s:13:"hospital_name";s:44:"Hasan X- Ray Clnic & Pathology, Thakurgoan. ";s:13:"specimen_name";s:43:"Tissue from Rt. Kidney. Case No: MH14-20826";s:4:"note";s:108:"Result of Immunostaining for Vimentin & CK of Case No: MH14-20826, Block No: (01)from DHL Path. Lab. Dhaka. ";s:15:"reporting_board";s:37:"<b>Vimentin :<br><br><br>CK </b>:<br>";s:10:"add_doctor";s:1:"0";}}s:13:"result_object";a:160:{i:0;O:8:"stdClass":15:{s:7:"immu_id";s:2:"26";s:5:"sl_no";s:3:"180";s:7:"test_id";s:16:"MIHC13-09598-599";s:10:"reciv_date";s:10:"28-05-2013";s:12:"current_date";s:10:"2013-05-28";s:9:"deli_date";s:10:"23-06-2013";s:12:"patient_name";s:18:"Mrs. Zarin Sultana";s:3:"age";s:6:"23 Yrs";s:6:"ref_by";s:48:"Mahtab Uddin Ahmed. MBBS, MD (Path. Thisis Part)";s:3:"sex";s:6:"Female";s:13:"hospital_name";s:13:"BIHS Hospital";s:13:"specimen_name";s:35:"Tissue from Lt. cervical lymph node";s:4:"note";s:109:"Result of Immunostaining  for LCA &amp; CD30  of case No:MH13-01747Block No: (02) from DHL , Path Lab. Dhaka.";s:15:"reporting_board";s:262:"&nbsp;

 &nbsp;
<br><span>
 LCA : Lymphoid cells show diffuse staining for LCA. <br>
 <br>
 CD30: Large atypical cells resembling RS cells show positive staining for CD30. </span>

 &nbsp;

 &nbsp;

 &nbsp;

 &nbsp;

 &nbsp;

 &nbsp;

 &nbsp;";s:10:"add_doctor";s:1:"0";}i:1;O:8:"stdClass":15:{s:7:"immu_id";s:2:"51";s:5:"sl_no";s:3:"264";s:7:"test_id";s:13:"MIHC13:-13028";s:10:"reciv_date";s:10:"12/07/2013";s:12:"current_date";s:10:"2013-07-12";s:9:"deli_date";s:10:"21/07/2013";s:12:"patient_name";s:12:"Parul Sikder";s:3:"age";s:6:"67 Yrs";s:6:"ref_by";s:68:"Md. Mokhles Uddin , FCPS , Prof. of. Radiotherapy, CMC, Chittagong. ";s:3:"sex";s:6:"Female";s:13:"hospital_name";s:51:"Chevron Clinical Laboratory (Pvt.) Ltd. Chittagong.";s:13:"specimen_name";s:46:"Tissue from upper 1/3 perforated jejunum wall.";s:4:"note";s:86:"Result of Immunostaining  for CD117 of Case No:MH13-12064 from DHL, Path. Lab. Dhaka. ";s:15:"reporting_board";s:242:"<p><em><strong>CD117 :-</strong></em> Tumour cells show positive staining for <strong>CD117.</strong></p>

<p><em><strong>Summary : CD117-Positive&nbsp;</strong></em></p>

<p>&nbsp;</p>

<p>&nbsp;</p>

<p>&nbsp;</p>

<p>&nbsp;</p>
";s:10:"add_doctor";s:1:"0";}i:2;O:8:"stdClass":15:{s:7:"immu_id";s:2:"52";s:5:"sl_no";s:3:"270";s:7:"test_id";s:17:"MIHC13:-13375-380";s:10:"reciv_date";s:10:"17/07/2013";s:12:"current_date";s:10:"2013-07-17";s:9:"deli_date";s:10:"21/07/2013";s:12:"patient_name";s:19:"Mrs. Rudbar Mahmud ";s:3:"age";s:6:"22 Yrs";s:6:"ref_by";s:61:"Parvin Akhter Banu, Chief Consultant (Oncology)DMC&H, Dhaka. ";s:3:"sex";s:6:"Female";s:13:"hospital_name";s:43:"IBN SINA DIAGNOSTIC & IMAGING CENTRE, DHAKA";s:13:"specimen_name";s:38:"One paraffin block case no: HB13-4745F";s:4:"note";s:168:"Result of Immunostaining  for LCA , CD3 , CD20 , CD15 , CD30 & EMA  of case No:HB13-4745 F Block No: (06) from Bankok Hospital Group Pathology Center, Bankok, Thailand ";s:15:"reporting_board";s:842:"<p><strong>LCA :- </strong>Lymphoid cells show positive staining for <strong>LCA</strong>.</p>

<p><strong>CD3:- </strong>Some of the lymphoid cells show positive staining&nbsp; for <strong>CD3</strong>.<br />
<br />
<strong>CD20:-</strong> Some of the lymphoid cells show positive staining for <strong>CD20</strong>.<br />
<br />
<strong>CD15:-</strong> Scattered large atyical cells show positive staining for <strong>CD15</strong>.</p>

<p><strong>CD30:-</strong> Scattered large atypical cells show positive staining for <strong>CD30</strong>.</p>

<p><strong>EMA:-</strong> Scattered large atypical cells show positive staining for <strong>EMA</strong>.</p>

<h3><em><strong>Conclusion:&nbsp; Immunostaining results favor the diagnosis of Nodular lymphocyte-predominent lymphoma (N-LPHL)</strong></em></h3>

<p>&nbsp;</p>
";s:10:"add_doctor";s:1:"0";}i:3;O:8:"stdClass":15:{s:7:"immu_id";s:2:"53";s:5:"sl_no";s:3:"272";s:7:"test_id";s:13:"MIHC13:-13429";s:10:"reciv_date";s:10:"17/07/2013";s:12:"current_date";s:10:"2013-07-17";s:9:"deli_date";s:10:"21/07/2013";s:12:"patient_name";s:4:"Asha";s:3:"age";s:6:"18 Yrs";s:6:"ref_by";s:26:"Md. Setabur Rahman, MS (S)";s:3:"sex";s:6:"Female";s:13:"hospital_name";s:23:"NICRH, Mohakhali, Dhaka";s:13:"specimen_name";s:35:"Tissue from ? intestinal lymphnode.";s:4:"note";s:102:"Result of Immunostaining  for CD117 of Case No: MH13-11919 Block No: (02) from DHL, Path. Lab. Dhaka. ";s:15:"reporting_board";s:225:"<p><strong>CD117 :-</strong> Tumour cells show no staining for <strong>CD117.</strong></p>

<p>&nbsp;</p>

<h3><em><strong>Summary : CD117-Negative. </strong></em></h3>

<p>&nbsp;</p>

<p>&nbsp;</p>

<p>&nbsp;</p>
";s:10:"add_doctor";s:1:"0";}i:4;O:8:"stdClass":15:{s:7:"immu_id";s:2:"57";s:5:"sl_no";s:3:"279";s:7:"test_id";s:17:"MIHC13:-13543-545";s:10:"reciv_date";s:10:"19/07/2013";s:12:"current_date";s:10:"2013-07-19";s:9:"deli_date";s:10:"28/07/2013";s:12:"patient_name";s:15:"Mrs. Lipi Begum";s:3:"age";s:6:"25 Yrs";s:6:"ref_by";s:62:"Jahan Afroza Lucky, MBBS, M.Phil ( Radio Therapy ), Oncologist";s:3:"sex";s:6:"Female";s:13:"hospital_name";s:13:"RMCH, Rangpur";s:13:"specimen_name";s:32:"Tissue from broad Ligament tumor";s:4:"note";s:91:"Result of Immunostaining  for S100 , CK & Vimentin of Case No: MH13-11220  Block No: ( 02 )";s:15:"reporting_board";s:447:"<p><strong>S100 :</strong> Atypical cells show positive staining for <strong>S100.</strong></p>

<p>&nbsp;</p>

<p><strong>CK :</strong> Atypical cells are negative for <strong>CK. </strong></p>

<p>&nbsp;</p>

<p><strong>Vimentin : </strong>Atypical cells show positive staining for <strong>Vimentin.</strong></p>

<p>&nbsp;</p>

<h3><em><strong>Conclusion: Immunostaining results favor the diagnosis of sarcoma. </strong></em></h3>
";s:10:"add_doctor";s:1:"0";}i:5;O:8:"stdClass":15:{s:7:"immu_id";s:2:"58";s:5:"sl_no";s:3:"283";s:7:"test_id";s:13:"MIHC13:-13631";s:10:"reciv_date";s:10:"21/07/2013";s:12:"current_date";s:10:"2013-07-21";s:9:"deli_date";s:10:"28/07/2013";s:12:"patient_name";s:4:"Sumi";s:3:"age";s:6:"20 Yrs";s:6:"ref_by";s:0:"";s:3:"sex";s:6:"Female";s:13:"hospital_name";s:42:"Comilla Popular Hospital Pvt. Ltd. Comilla";s:13:"specimen_name";s:38:"One paraffin block Case no: ALH1335/13";s:4:"note";s:106:"Result of Immunostaining  for CD99 of Case No:ALH1335/13. Block No (02) from The Alfa Laboratory, Comilla.";s:15:"reporting_board";s:335:"<p><strong>CD99 </strong>: Clusters of atypical round cells show positive staining for <strong>CD99.</strong></p>

<h3><em><strong>Conclusion: Immunostaining results favor the diagnosis of Ewing&#39;s sarcoma. </strong></em></h3>

<p>&nbsp;</p>

<p>&nbsp;</p>

<p>&nbsp;</p>

<p>&nbsp;</p>

<p>&nbsp;</p>

<p>&nbsp;</p>
";s:10:"add_doctor";s:1:"0";}i:6;O:8:"stdClass":15:{s:7:"immu_id";s:2:"63";s:5:"sl_no";s:3:"311";s:7:"test_id";s:17:"MIHC13:-14769-770";s:10:"reciv_date";s:10:"05/08/2013";s:12:"current_date";s:10:"2013-08-05";s:9:"deli_date";s:10:"18/08/2013";s:12:"patient_name";s:12:"Fatema Begum";s:3:"age";s:6:"65 Yrs";s:6:"ref_by";s:41:"Md.Yeaqub Ali, MBBS, FCPS (Radiotherapy).";s:3:"sex";s:6:"Female";s:13:"hospital_name";s:66:"AL-RAJI HOSPITAL (Diagnostic & Consultation Centre). Farmgat.Dhaka";s:13:"specimen_name";s:39:"Tissue from Rt. sided lymph node (neck)";s:4:"note";s:87:"Result of Immunostaining  for LCA, CK of Case No: MH13-14561 from DHL Path. Lab. Dhaka.";s:15:"reporting_board";s:377:"<br><br><br><b>LCA:-</b>Tumor cells show diffuse staining for <b>LCA. </b><br><br><b>CK :-</b> Tumor cells show no staining for <b>CK. </b><br><br><br><b><i>Conclusion: Immunostaining results favor the diagnosis of non-Hodgkin's lymphoma. </i></b><br><br><br><h4><b>Advice: CD3&nbsp; &amp; CD20 Staining may be done to differentiate&nbsp; T/B cell origin. </b></h4><br><br><br>";s:10:"add_doctor";s:1:"0";}i:7;O:8:"stdClass":15:{s:7:"immu_id";s:2:"68";s:5:"sl_no";s:3:"322";s:7:"test_id";s:10:"MH13-15322";s:10:"reciv_date";s:10:"19/08/2013";s:12:"current_date";s:10:"2013-08-19";s:9:"deli_date";s:10:"25/08/2013";s:12:"patient_name";s:13:"Most. Tahmina";s:3:"age";s:6:"26 Yrs";s:6:"ref_by";s:20:"Mizanur Rahman , PGT";s:3:"sex";s:6:"Female";s:13:"hospital_name";s:26:"Rabeya Nursing Home, Bogra";s:13:"specimen_name";s:23:"Tissue from Rt. Breast.";s:4:"note";s:92:"&nbsp;Result of Immunostaining  for CD31of Case No: MH13-15322 , DHL, Path. Lab. Dhaka. <br>";s:15:"reporting_board";s:92:"<b>CD31</b>:<br><br><br><br><br><br><br><br><br><br><br><br><br><br><br><br><br><br><br><br>";s:10:"add_doctor";s:1:"0";}i:8;O:8:"stdClass":15:{s:7:"immu_id";s:2:"70";s:5:"sl_no";s:3:"339";s:7:"test_id";s:17:"MIHC13:-16684-685";s:10:"reciv_date";s:10:"03/09/2013";s:12:"current_date";s:10:"2013-09-03";s:9:"deli_date";s:10:"08/09/2013";s:12:"patient_name";s:13:"Fatema Begum ";s:3:"age";s:8:"65 Yrs, ";s:6:"ref_by";s:41:"Md. Yeaqub Ali. MBBS, FCPS (Radiotherapy)";s:3:"sex";s:6:"Female";s:13:"hospital_name";s:33:"Al Raji Hospital, Farmget, Dhaka ";s:13:"specimen_name";s:26:"Tissue from Rt. lymph node";s:4:"note";s:130:"Result of Immunostaining  for CD3 &amp; CD20 of Case No: MH13-14561,&nbsp; Block No: (01)<br>from&nbsp; DHL, Path. Lab, Dhaka.<br>";s:15:"reporting_board";s:380:"<br><br><b>CD3&nbsp; :&nbsp; </b>Scattered lymphoid cells show positive staining for <b> </b>CD3<b>.<br><br><br>CD20 :&nbsp; </b>Most of the atypical lymphoid cells show positive staining for <b>CD20</b><br><br><br><br><b><i>Conclusion:&nbsp; Immunostaining results favor the diagnosis of non-Hodgkin's lymphoma of "B" cell origin</i>. </b><br><br><br><br><br><br><br><br><br><br>";s:10:"add_doctor";s:1:"0";}i:9;O:8:"stdClass":15:{s:7:"immu_id";s:2:"72";s:5:"sl_no";s:3:"353";s:7:"test_id";s:23:"MIHC13:-17147-149,17334";s:10:"reciv_date";s:10:"08/09/2013";s:12:"current_date";s:10:"2013-09-08";s:9:"deli_date";s:10:"15/09/2013";s:12:"patient_name";s:17:"Mrs. Farhat Begum";s:3:"age";s:6:"63 Yrs";s:6:"ref_by";s:45:"Amin Lutful Kabir M.Phil , FCPS (Haematology)";s:3:"sex";s:6:"Female";s:13:"hospital_name";s:12:"DLMCH, Dhaka";s:13:"specimen_name";s:43:"Tissue from lymph node. Case No: MH13-16900";s:4:"note";s:117:"Result of Immunostaining  for CD3 , CD20, CD15 &amp; CD30 of Case No: MH13-16900, <br>from, DHL. Path. Lab. Dhaka<br>";s:15:"reporting_board";s:463:"<b>CD3 </b>: Scattered lymphoid cells show positive staining for <b>CD3</b>.<br><br><br><b>CD20 :</b> Scattered lymphoid cells show positive staining for <b>CD20.</b><br><br><br><b>CD15 :</b> Large atypical cells show positive staining for <b>CD15. </b><br><br><br><b>CD30:</b>&nbsp; Large atypical cells show&nbsp; positive staining for<b> CD30.</b><br><br><br><h3><b><i>Conclusion: Immunostaining results favor the diagnosis of Hodgkin's lymphoma. </i></b></h3>";s:10:"add_doctor";s:1:"0";}i:10;O:8:"stdClass":15:{s:7:"immu_id";s:2:"73";s:5:"sl_no";s:3:"347";s:7:"test_id";s:13:"MIHC13:-17026";s:10:"reciv_date";s:10:"07/09/2013";s:12:"current_date";s:10:"2013-09-07";s:9:"deli_date";s:10:"15/09/2013";s:12:"patient_name";s:16:"Miss. Irin Nahar";s:3:"age";s:6:"18 Yrs";s:6:"ref_by";s:14:"S.M. Abu Taleb";s:3:"sex";s:6:"Female";s:13:"hospital_name";s:53:"Rangpur Community Medical College & Hospital Rangpur.";s:13:"specimen_name";s:74:"Tissue from pelvic region (Lt.) and inguinal lymphnode.Case No: MH13-13976";s:4:"note";s:109:"Result of Immunostaining  for HMB 45 of Case No: MH13-13976 , Block No: ( 02) from, DHL. Path. Lab. Dhaka<br>";s:15:"reporting_board";s:209:"<b><br><br>HMB-45:</b> Tumour cells show positive staining for <b>HMB-45<br><br><br><br><br><br></b><h3><b><i>Conclusion: Immunostaining results favor the diagnosis of metastatic melanoma.</i></b><br></h3><br>";s:10:"add_doctor";s:1:"0";}i:11;O:8:"stdClass":15:{s:7:"immu_id";s:2:"79";s:5:"sl_no";s:3:"370";s:7:"test_id";s:17:"MIHC13:-17851-854";s:10:"reciv_date";s:10:"17/09/2013";s:12:"current_date";s:10:"2013-09-17";s:9:"deli_date";s:10:"22/09/2013";s:12:"patient_name";s:18:"Mrs. Anowara Begum";s:3:"age";s:6:"40 Yrs";s:6:"ref_by";s:57:"S.M Noman Khaled Chowdhury MBBS, MS (Neurosurgery) IPGMR.";s:3:"sex";s:6:"Female";s:13:"hospital_name";s:45:"Chevron Clinical Lab (Pvt.) Ltd. Chittagong. ";s:13:"specimen_name";s:53:"Tissue from vertebral body (DIO), Case No: MH13-15851";s:4:"note";s:119:"Result of Immunostaining  for LCA , CD3 , CD20 &amp;&nbsp;CD138 of case No: MH13-15851 from DHL, Path. Lab, Dhaka. <br>";s:15:"reporting_board";s:529:"<b>LCA :</b> Scattered lymphoid cells show positive staining for<b> LCA. </b><br><br><b>CD3 :</b> Scattered lymphoid cells show positive staining for <b>CD3.</b><br><br><b>CD20:</b> No staining was observed for <b>CD20.</b><br><br><b>CD138:</b> Atypical cells show strong positivity for <b>CD138. </b><br><br><b><i>Conclusion: Immunostaining results favor the diagnosis of multiple myeloma. </i></b><br><br><b>Serum Protein Electrophoresis , Bone Marrow&nbsp; examination and bone scanning is suggested for confirmation. </b><br>";s:10:"add_doctor";s:1:"0";}i:12;O:8:"stdClass":15:{s:7:"immu_id";s:2:"83";s:5:"sl_no";s:3:"364";s:7:"test_id";s:13:"MIHC13:-15699";s:10:"reciv_date";s:10:"24/09/2013";s:12:"current_date";s:10:"2013-09-24";s:9:"deli_date";s:10:"22/09/2013";s:12:"patient_name";s:19:"Mrs. Sanjida Parvin";s:3:"age";s:6:"26 Yrs";s:6:"ref_by";s:0:"";s:3:"sex";s:6:"Female";s:13:"hospital_name";s:31:"Mukti Clinic Pvt. Ltd. Rajshahi";s:13:"specimen_name";s:19:"Tissue from breast.";s:4:"note";s:64:"Result of Immunostaining  for CK of Case No:___ Block No: ( )___";s:15:"reporting_board";s:62:"<b>CK </b><br><br><br><br><br><br><br><br><br><br><br><br><br>";s:10:"add_doctor";s:0:"";}i:13;O:8:"stdClass":15:{s:7:"immu_id";s:2:"86";s:5:"sl_no";s:3:"383";s:7:"test_id";s:17:"MIHC13:-18607-609";s:10:"reciv_date";s:10:"25/09/2013";s:12:"current_date";s:10:"2013-09-25";s:9:"deli_date";s:10:"06/10/2013";s:12:"patient_name";s:20:"Mrs. Shahanaz Parvin";s:3:"age";s:6:"30 Yrs";s:6:"ref_by";s:45:"Tapesh Kumar Paul,FCPS,MS (Oncology Surgery).";s:3:"sex";s:6:"Female";s:13:"hospital_name";s:3:"DHL";s:13:"specimen_name";s:59:"Tissue from back (Lt. scapular region). Case No: MH13-18317";s:4:"note";s:134:"Result of Immunostaining  for CD99 , CK &amp; Desmin of Case No: MH13-18317 , <br>Block No: (02)&nbsp; from DHL. Path. Lab. Dhaka.<br>";s:15:"reporting_board";s:339:"<b> CD99 :</b> Tumour cells show positive staining for <b>CD99</b>.<br><br><br><b>CK :</b>&nbsp; Scattered cells show positive staining for <b>CK.</b><br><br><br><b>Desmin :</b> Tumour cells show no staining for <b>Desmin</b>. <br><br>Comments: Immunostaining  results favor the diagnosis of primitive neuroectodermal tumour (PNET)<br><br>";s:10:"add_doctor";s:1:"0";}i:14;O:8:"stdClass":15:{s:7:"immu_id";s:2:"88";s:5:"sl_no";s:3:"398";s:7:"test_id";s:17:"MIHC13:-19143-144";s:10:"reciv_date";s:10:"03/10/2013";s:12:"current_date";s:10:"2013-10-03";s:9:"deli_date";s:10:"06/10/2013";s:12:"patient_name";s:18:"Mr. Jainal Abedin ";s:3:"age";s:6:"60 Yrs";s:6:"ref_by";s:31:"Lt. Col. M S Sarwar Alam (Rtd.)";s:3:"sex";s:6:"Female";s:13:"hospital_name";s:3:"DHL";s:13:"specimen_name";s:38:"One paraffin block, Case No: SH-133/13";s:4:"note";s:139:"Result of Immunostaining  for&nbsp; LCA &amp; CK of Case No: SH-133/13 Block No: (01 ), from Salauddin Specialized Hospital Ltd. Dhaka <br>";s:15:"reporting_board";s:335:"<b> </b><br><br><br><b>LCA:</b>&nbsp;  Tumour cell show diffuse staining for <b>LCA.</b><br><br><br><b>CK:</b>&nbsp; Epithelial cells show positive staining for <b>CK.</b><br><br><br><b><i>Conclusion:&nbsp; Immunostaining results confirm the diagnosis of Non-Hodgkin's lymphoma. </i></b><br><br><br><br><br><br><br><br><br><br><br><br>";s:10:"add_doctor";s:1:"0";}i:15;O:8:"stdClass":15:{s:7:"immu_id";s:2:"96";s:5:"sl_no";s:3:"415";s:7:"test_id";s:13:"MIHC13:-20185";s:10:"reciv_date";s:10:"22/10/2013";s:12:"current_date";s:10:"2013-10-22";s:9:"deli_date";s:10:"27/10/2013";s:12:"patient_name";s:20:"Ms. Sumani Khaleque ";s:3:"age";s:6:"30 Yrs";s:6:"ref_by";s:45:"Tapesh Kumar Paul,FCPS,MS (Oncology Surgery).";s:3:"sex";s:6:"Female";s:13:"hospital_name";s:11:"DHL, C -514";s:13:"specimen_name";s:19:"Tissue from thyroid";s:4:"note";s:98:"Result of Immunostaining  for Chromogranin of Case No: MH13-19872 , Block No: (03) Additional <br>";s:15:"reporting_board";s:276:"<br><br><b><br><br>Chromogranin :</b> Granular cytoplasmic staining is observed in the tumor cells. <br><br><br><h4><b>Conclusion: Immunostaining result favors the diagnosis of medullary carcinoma of thyroid with papillary structures. </b></h4><br><br><br><br><br><br><br><br>";s:10:"add_doctor";s:1:"0";}i:16;O:8:"stdClass":15:{s:7:"immu_id";s:2:"97";s:5:"sl_no";s:3:"419";s:7:"test_id";s:17:"MIHC13:-20280-282";s:10:"reciv_date";s:10:"24/10/2013";s:12:"current_date";s:10:"2013-10-24";s:9:"deli_date";s:10:"27/10/2013";s:12:"patient_name";s:7:"Mithila";s:3:"age";s:5:"11Yrs";s:6:"ref_by";s:9:"Abu Taleb";s:3:"sex";s:6:"Female";s:13:"hospital_name";s:24:"R.G. Hospital. Rangpur. ";s:13:"specimen_name";s:54:"Tissue from cervical lymph node. Case no: MH13-19818. ";s:4:"note";s:106:"Result of Immunostaining  for LCA , CD3 &amp; CD20 of Case No:MH13-19818, from DHL. Path. Lab. Dhaka. <br>";s:15:"reporting_board";s:403:"<br><br><b>LCA :</b> Lymphoid cells show positive staining for <b>LCA.</b><br><br><b>CD3 :</b> Majority of the atypical lymphoid cells show positive staining for <b>CD3.</b><br><br><b>CD20 :</b> Scattered clusters of lymphoid cells show positive staining for <b>CD20.</b><br><br><h4><b><i>Conclusion: Immunostaining results favor the diagnosis of non-Hodgkin's lymphoma of "T" cell origin. </i></b></h4>";s:10:"add_doctor";s:1:"0";}i:17;O:8:"stdClass":15:{s:7:"immu_id";s:3:"102";s:5:"sl_no";s:3:"436";s:7:"test_id";s:13:"MIHC13:-21145";s:10:"reciv_date";s:10:"04/11/2013";s:12:"current_date";s:10:"2013-11-04";s:9:"deli_date";s:10:"10/11/2013";s:12:"patient_name";s:16:"Mrs. Dawsanq Pru";s:3:"age";s:6:"46 Yrs";s:6:"ref_by";s:0:"";s:3:"sex";s:6:"Female";s:13:"hospital_name";s:16:"CSCR, Chittagong";s:13:"specimen_name";s:62:"Tissue from colonic polyp. Case No: MH13-20622, Block No: (01)";s:4:"note";s:116:"Result of Immunostaining  for CD117 of Case No:MH13-20622, Block No: (01) from DHL. Path. Lab. Dhaka.&nbsp; <br><br>";s:15:"reporting_board";s:146:"<b><br>CD117 </b>: Occasional spindle cells show positive staining for <b>CD117. </b><br><br><br><h3><b><i>Result : Inconclusive.</i></b></h3><br>";s:10:"add_doctor";s:1:"0";}i:18;O:8:"stdClass":15:{s:7:"immu_id";s:3:"103";s:5:"sl_no";s:3:"437";s:7:"test_id";s:17:"MIHC13:-21146-148";s:10:"reciv_date";s:10:"04/11/2013";s:12:"current_date";s:10:"2013-11-04";s:9:"deli_date";s:10:"10/11/2013";s:12:"patient_name";s:18:"Mrs. Monjura Begum";s:3:"age";s:6:"60 Yrs";s:6:"ref_by";s:0:"";s:3:"sex";s:6:"Female";s:13:"hospital_name";s:40:"Lancet Diagnostic & Research, Chittagong";s:13:"specimen_name";s:72:"Tissue from Rt. cervical lymph node. Case No: MH13-20138, Block No: (01)";s:4:"note";s:125:"Result of Immunostaining  for LCA , CD3 &amp; CD20 of Case No:MH13-20138. Block No: (01) from DHL. Path. Lab. Dhaka. <br><br>";s:15:"reporting_board";s:394:"<b> LCA :</b> Lymphoid cells show diffuse staining for <b>LCA.</b><br><br><b>CD3:</b> Scattered lymphoid cells show positive staining for <b>CD3.</b><br><br><b>CD20:</b> Majority of large atypical cells show positive staining for <b>CD20. </b><br><br><br><b><i>Conclusion: Immunostaining results&nbsp; favor the diagnosis of non-Hodgkin's lymphoma of&nbsp; "B" cell origin. </i></b><br><br><br>";s:10:"add_doctor";s:1:"0";}i:19;O:8:"stdClass":15:{s:7:"immu_id";s:3:"105";s:5:"sl_no";s:3:"443";s:7:"test_id";s:13:"MIHC13:-21285";s:10:"reciv_date";s:10:"06/11/2013";s:12:"current_date";s:10:"2013-11-06";s:9:"deli_date";s:10:"10/11/2013";s:12:"patient_name";s:17:"Mrs. Anwara Begum";s:3:"age";s:6:"47 Yrs";s:6:"ref_by";s:45:"Tapesh Kumar Paul,FCPS,MS (Oncology Surgery).";s:3:"sex";s:6:"Female";s:13:"hospital_name";s:10:"DHL C -510";s:13:"specimen_name";s:44:"Tissue from mesentery. Case No: MH13-21055. ";s:4:"note";s:109:"Result of Immunostaining  for CD117 of Case No: MH13-21055 , Block No: (02 ) from DHL, Path, Lab. Dhaka. <br>";s:15:"reporting_board";s:86:"<b><br><br>CD117:&nbsp; </b>Tumor cells show no staining for <b>CD117.</b><br><br><br>";s:10:"add_doctor";s:1:"0";}i:20;O:8:"stdClass":15:{s:7:"immu_id";s:3:"107";s:5:"sl_no";s:3:"449";s:7:"test_id";s:17:"MIHC13:-21544-545";s:10:"reciv_date";s:10:"10/11/2013";s:12:"current_date";s:10:"2013-11-10";s:9:"deli_date";s:10:"17/11/2013";s:12:"patient_name";s:11:"Mrs. Jesmin";s:3:"age";s:6:"19 Yrs";s:6:"ref_by";s:45:"Amin Lutful Kabir M.Phil , FCPS (Haematology)";s:3:"sex";s:6:"Female";s:13:"hospital_name";s:3:"DHL";s:13:"specimen_name";s:51:"Tissue from cervical lymph node.Case No: MH12-23133";s:4:"note";s:117:"Result of Immunostaining  for CD15 &amp; CD30 of Case No: MH12-23133, Block No: (02) from DHL. Path. Lab. Dhaka. <br>";s:15:"reporting_board";s:298:"<b><br>CD15:</b> Occasional large cells show positive staining for <b>CD15. </b><br><br><br><b>CD30:</b>&nbsp; Many large atypical cells show positive staining for <b>CD30. </b><br><br><h3><b><i>Conclusion: Immunostaining results favor the diagnosis of Hodgkin's lymphoma. </i></b></h3><br><br><br>";s:10:"add_doctor";s:1:"0";}i:21;O:8:"stdClass":15:{s:7:"immu_id";s:3:"109";s:5:"sl_no";s:3:"457";s:7:"test_id";s:15:"DIHC13:-2588-89";s:10:"reciv_date";s:10:"14/11/2013";s:12:"current_date";s:10:"2013-11-14";s:9:"deli_date";s:10:"17/11/2013";s:12:"patient_name";s:18:"Mrs. Shahida Begum";s:3:"age";s:6:"53 Yrs";s:6:"ref_by";s:21:"S.C. Dhar. FCPS. MD. ";s:3:"sex";s:6:"Female";s:13:"hospital_name";s:31:"Lab Aid Ltd. Dhanmondi, Dhaka. ";s:13:"specimen_name";s:41:"Tissue from stomach. Case No: DH13-2570, ";s:4:"note";s:95:"Result of Immunostaining  for  LCA & CK of Case No: DH13-2570, from DHL Path. Lab. Dhaka. <br>";s:15:"reporting_board";s:255:"<br><b>LCA :</b> Atypical cells show positive staining for <b>LCA.</b><br><br><br><b>CK : </b>Atypical cells show no staining for<b> CK.<br><br></b><h3><b><i>Conclusion: Immunostaining results confirm the diagnosis of non-Hodgkin's lymphoma. </i></b></h3>";s:10:"add_doctor";s:1:"0";}i:22;O:8:"stdClass":15:{s:7:"immu_id";s:3:"110";s:5:"sl_no";s:3:"458";s:7:"test_id";s:13:"MIHC13:-21751";s:10:"reciv_date";s:10:"14/11/2013";s:12:"current_date";s:10:"2013-11-14";s:9:"deli_date";s:10:"17/11/2013";s:12:"patient_name";s:4:"Runa";s:3:"age";s:6:"30 Yrs";s:6:"ref_by";s:18:"Md. Habibur Rahman";s:3:"sex";s:6:"Female";s:13:"hospital_name";s:30:"Himi Poly Clinic, Patuakhali. ";s:13:"specimen_name";s:47:"Soft tissue mass in caecum. Case No: MH13-21015";s:4:"note";s:112:"Result of Immunostaining  for CD117 of Case No: MH13-21015&nbsp; Block No: (02) from DHL. Path. Lab. Dhaka. <br>";s:15:"reporting_board";s:149:"<br><br><b>CD117:</b> Neoplastic spindle cells show no staining for <b>CD117.</b><br><br><h3><b><i>Conclusion: CD117 - Negative </i></b></h3><br><br>";s:10:"add_doctor";s:1:"0";}i:23;O:8:"stdClass":15:{s:7:"immu_id";s:3:"116";s:5:"sl_no";s:3:"466";s:7:"test_id";s:21:"MIHC13:-22284 & 22467";s:10:"reciv_date";s:10:"20/11/2013";s:12:"current_date";s:10:"2013-11-20";s:9:"deli_date";s:10:"01/12/2013";s:12:"patient_name";s:11:"Mrs. Champa";s:3:"age";s:6:"30 Yrs";s:6:"ref_by";s:45:"Tapesh Kumar Paul,FCPS,MS (Oncology Surgery).";s:3:"sex";s:6:"Female";s:13:"hospital_name";s:3:"DHL";s:13:"specimen_name";s:59:"Tissue from left breast. (Core biopsy) Case No: MH13-21902.";s:4:"note";s:102:"Result of Immunostaining  for LCA, CK and CD20 of Case No: MH13-21902 from DHL. Path. Lab. Dhaka. <br>";s:15:"reporting_board";s:442:"<b><br></b><b>LCA:&nbsp; </b>All the atypical lymphoid cell show positive staining for<b> LCA.&nbsp; </b><br><br><br><b>CK :</b> Epithelial cells lining normal ducts show positive staining for <b>CK.</b><br><br><br><b>CD20</b><b>:&nbsp; </b>Atypical lymphoid cells show positive staining for <b>CD20. </b><br><br><br><b><i>Conclusion: Immunostaining results confirm the diagnosis of Non-Hodgkin's lymphoma of "B" cell origin. </i></b><br><br>";s:10:"add_doctor";s:1:"0";}i:24;O:8:"stdClass":15:{s:7:"immu_id";s:3:"118";s:5:"sl_no";s:3:"476";s:7:"test_id";s:17:"MIHC13:-22574-576";s:10:"reciv_date";s:10:"24/11/2013";s:12:"current_date";s:10:"2013-11-24";s:9:"deli_date";s:10:"01/11/2013";s:12:"patient_name";s:20:"Mrs. Murshida Khanom";s:3:"age";s:6:"58 Yrs";s:6:"ref_by";s:45:"Amin Lutful Kabir M.Phil , FCPS (Haematology)";s:3:"sex";s:6:"Female";s:13:"hospital_name";s:3:"DHL";s:13:"specimen_name";s:60:"Tissue from axillary mass Case No: 130907603, Block No: (A6)";s:4:"note";s:128:"Result of Immunostaining  for BCL-2 , CD20 &amp; CD3 of Case No: 130907603 Block No: (A6) from a i khan Lab Ltd. Dhaka. <br><br>";s:15:"reporting_board";s:438:"<br><b>CD3 </b>: Scattered lymphoid cells show positive staining for <b>CD3. <br><br></b><b>CD20 </b>: Most of the follicular centre cells show positive staining for <b>CD20.</b><br><br><b>BCL-2 :</b> Most of the follicular center cells show positive staining for <b>BCL-2</b><br><br><br><br><br><h3><b><i>Conclusion: Immunostaining results favor the diagnosis of non-Hodgkin's lymphoma of low grade follicular type. </i></b></h3><br><br>";s:10:"add_doctor";s:1:"0";}i:25;O:8:"stdClass":15:{s:7:"immu_id";s:3:"120";s:5:"sl_no";s:3:"491";s:7:"test_id";s:17:"MIHC13:-23010-012";s:10:"reciv_date";s:10:"03/12/2013";s:12:"current_date";s:10:"2013-12-03";s:9:"deli_date";s:10:"08/12/2013";s:12:"patient_name";s:15:"Mr. Abdul Hakim";s:3:"age";s:6:"56 Yrs";s:6:"ref_by";s:47:"Parvin Akhter Banu, Chief Consultant (Oncology)";s:3:"sex";s:6:"Female";s:13:"hospital_name";s:3:"DHL";s:13:"specimen_name";s:62:"(Nasopharyngeal tissue) One paraffin block. Case No: 131109572";s:4:"note";s:133:"Result of Immunostaining  for LCA , CD3 &amp; CD20&nbsp; of Case No: 131109572 Block No (A1) from a i Khan. Lab. Ltd. Dhaka. <br><br>";s:15:"reporting_board";s:420:"<b><br></b><b>LCA :</b> Lymphoid cells show positive staining for<b> LCA.<br><br><br></b><b>CD3:</b>&nbsp;Scattered lymphoid cells show positive staining for <b>CD3</b>.<br><br><br><b>CD20 :</b> Majority of the atypical lymphoid cells show positive staining for <b>CD20. </b><br><br><br><b>Conclusion:</b> Immunostaining results confirm the diagnosis of <b>Non-Hodgkin's</b> lymphoma of&nbsp; <b>"B" cell origin.</b><br>";s:10:"add_doctor";s:1:"0";}i:26;O:8:"stdClass":15:{s:7:"immu_id";s:3:"124";s:5:"sl_no";s:3:"499";s:7:"test_id";s:17:"MIHC13:-23283-285";s:10:"reciv_date";s:10:"08/12/2013";s:12:"current_date";s:10:"2013-12-08";s:9:"deli_date";s:10:"15/12/2013";s:12:"patient_name";s:15:"Mrs. Bulbul Ara";s:3:"age";s:6:"70 Yrs";s:6:"ref_by";s:0:"";s:3:"sex";s:6:"Female";s:13:"hospital_name";s:34:"Chevron Clinical Lab , Chittagong.";s:13:"specimen_name";s:57:"Tissue from left inguinal lymph node.Case No: MH13-22855.";s:4:"note";s:131:"Result of Immunostaining  for CD3 , CD20&nbsp; &amp; CD30 of Case No: MH13-22855 , Block No: (02), from DHL. Path. Lab. Dhaka. <br>";s:15:"reporting_board";s:104:"<b>CD3 :</b><br><br><br><br><b>CD20:</b><br><br><br><br><b>CD30:</b><br><br><br><br><b>&nbsp;CK:</b><br>";s:10:"add_doctor";s:1:"0";}i:27;O:8:"stdClass":15:{s:7:"immu_id";s:3:"130";s:5:"sl_no";s:3:"520";s:7:"test_id";s:17:"MIHC13:-23671-672";s:10:"reciv_date";s:10:"16/12/2013";s:12:"current_date";s:10:"2013-12-16";s:9:"deli_date";s:10:"22/12/2013";s:12:"patient_name";s:17:"Mst. Arjina Begum";s:3:"age";s:6:"40 Yrs";s:6:"ref_by";s:4:"Self";s:3:"sex";s:6:"Female";s:13:"hospital_name";s:32:"Islami Bank Hospital , Rangpur. ";s:13:"specimen_name";s:47:"Tissue from neck swelling. Case No: MH13-22367.";s:4:"note";s:98:"Result of Immunostaining  for LCA &amp; CK of Case No: MH13-22367, from DHL, Path. Lab. Dhaka <br>";s:15:"reporting_board";s:251:"<b><br>LCA :</b> Atypical cells show positive staining for <b>LCA.</b><br><br><br><b>CK :</b> Atypical cells show no staining for <b>CK.</b><br><br><br><b><i>Conclusion: Immunostaining results favor the diagnosis of Non-Hodgkin's lymphoma.</i></b><br>";s:10:"add_doctor";s:1:"0";}i:28;O:8:"stdClass":15:{s:7:"immu_id";s:3:"131";s:5:"sl_no";s:1:" ";s:7:"test_id";s:11:"MIHC12:1369";s:10:"reciv_date";s:10:"24/01/2012";s:12:"current_date";s:10:"2013-01-24";s:9:"deli_date";s:10:"29/01/2012";s:12:"patient_name";s:17:"Mrs. Majeda Begum";s:3:"age";s:6:"65 Yrs";s:6:"ref_by";s:15:"Khademul Islam ";s:3:"sex";s:6:"Female";s:13:"hospital_name";s:29:"Lab Aid Specialized Hospital ";s:13:"specimen_name";s:34:" One paraffin block No H-145A/2012";s:4:"note";s:131:"<b><u>Result of immunostaining case no H-145A/2012, from Lab
Aid Diagnostic,</u></b>

<b><u>Dhanmondi for CD 117</u></b>

<br>";s:15:"reporting_board";s:333:"<span><b>CD 117&nbsp;&nbsp;&nbsp; </b>:&nbsp;
Tumour cells show positive staining for CD117. </span>

&nbsp;

<br><br><b>Summary
of results :

&nbsp;

</b><span><b>&nbsp;&nbsp;&nbsp;&nbsp;&nbsp;&nbsp;&nbsp;&nbsp;&nbsp;&nbsp;&nbsp;&nbsp; </b><br><br><b>CD 117 -&nbsp; Positive. </b></span><b>

&nbsp;

&nbsp;

</b><br>";s:10:"add_doctor";s:1:"0";}i:29;O:8:"stdClass":15:{s:7:"immu_id";s:3:"133";s:5:"sl_no";s:3:"533";s:7:"test_id";s:17:"MIHC13:-24206-208";s:10:"reciv_date";s:10:"26/12/2013";s:12:"current_date";s:10:"2013-12-26";s:9:"deli_date";s:10:"29/12/2013";s:12:"patient_name";s:15:"Mita Das Gupta ";s:3:"age";s:6:"50 Yrs";s:6:"ref_by";s:13:"Animesh Mitra";s:3:"sex";s:6:"Female";s:13:"hospital_name";s:39:"Metro Diagnostic Centre Ltd. Chittagong";s:13:"specimen_name";s:47:"Tissue from vaginal growth. Case No: MH13-23600";s:4:"note";s:100:"Result of Immunostaining  for S-100 , Vimentin &amp; SMA of Case No: MH13-23600 , Block No: (02)<br>";s:15:"reporting_board";s:404:"<b>S-100:</b>&nbsp; Tumor cells show strong positive staining for <b>S-100.</b><br><br><br><b>Vimentin :</b> Tumor cells show positive staining for <b>Vimentin. </b><br><br><br><b>SMA :</b> Tumor cells show no staining for <b>SMA.</b><br><br><br><h4><b><i>Conclusion: Immunostaining results favor the diagnosis of low grade malignant peripheral&nbsp; nerve sheath tumor (MPNST). </i></b></h4><br><br><br>";s:10:"add_doctor";s:1:"0";}i:30;O:8:"stdClass":15:{s:7:"immu_id";s:3:"134";s:5:"sl_no";s:3:"499";s:7:"test_id";s:17:"MIHC13:-23283-285";s:10:"reciv_date";s:10:"08/12/2013";s:12:"current_date";s:10:"2013-12-08";s:9:"deli_date";s:10:"29/12/2013";s:12:"patient_name";s:16:"Mrs. Bulbul Ara ";s:3:"age";s:6:"70 Yrs";s:6:"ref_by";s:0:"";s:3:"sex";s:6:"Female";s:13:"hospital_name";s:32:"Chevron Clinical Lab, Chittagong";s:13:"specimen_name";s:57:"Tissue from left inguinal lymph node. Case No: MH13-22855";s:4:"note";s:135:"Result of Immunostaining  for LCA, CD3 , CD20 &amp; CD30&nbsp; of Case No: MH13-22855 , Block No: (02) from DHL. Path. Lab. Dhaka. <br>";s:15:"reporting_board";s:548:"<b>LCA :&nbsp;</b> All the atypical cells show positive staining for<b> LCA. <br><br><br>CD3 :</b> Scattered cells show positive staining for <b>CD3.</b><br><br><br><b>CD20:&nbsp; </b>Most of the atypical cells including large atypical cells and multinucleated giant cells show&nbsp; positive staining for <b>CD20.</b><br><br><br><b>CD30 :</b> Occasional large atypical cells show positive staining for <b>CD30.</b><br><br><br><h4><b><i>Conclusion: Immunostaining results favor the diagnosis of NHL, diffuse large B-cell type. </i></b></h4><br><br>";s:10:"add_doctor";s:1:"0";}i:31;O:8:"stdClass":15:{s:7:"immu_id";s:3:"135";s:5:"sl_no";s:3:"527";s:7:"test_id";s:13:"MIHC13:-23987";s:10:"reciv_date";s:10:"22/12/2013";s:12:"current_date";s:10:"2013-12-22";s:9:"deli_date";s:10:"29/12/2013";s:12:"patient_name";s:5:"Ratri";s:3:"age";s:6:"13 Yrs";s:6:"ref_by";s:4:"Diba";s:3:"sex";s:6:"Female";s:13:"hospital_name";s:23:"NICRH, Mohakhali, Dhaka";s:13:"specimen_name";s:102:"Tisue from posterior aspect of right leg (In the plane of gastro-soleus muscle.). Case No: MH13-23516.";s:4:"note";s:107:"Result of Immunostaining  for CD99 of Case No: MH13-23516 , Block No: (02) from DHL. Path. Lab. Dhaka. <br>";s:15:"reporting_board";s:176:"<b>CD99 </b>: Tumor cells show positive staining for <b>CD99. </b><br><br><br><h4><b><i>Conclusion: Immunostaining result favors the diagnosis of Ewing's sarcoma. </i></b></h4>";s:10:"add_doctor";s:1:"0";}i:32;O:8:"stdClass":15:{s:7:"immu_id";s:3:"142";s:5:"sl_no";s:1:" ";s:7:"test_id";s:12:"MIHC12-05598";s:10:"reciv_date";s:10:"27/03/2012";s:12:"current_date";s:10:"2012-03-27";s:9:"deli_date";s:10:"03/05/2012";s:12:"patient_name";s:6:"Shrity";s:3:"age";s:6:"12 Yrs";s:6:"ref_by";s:47:"Mahtab Uddin Ahmed, MD, (Pathology) Thesis Part";s:3:"sex";s:6:"Female";s:13:"hospital_name";s:4:"SSMC";s:13:"specimen_name";s:27:"One paraffin block No- (14)";s:4:"note";s:195:"<span><b>Result of
CD30 Immunostaining, of sections prepared from paraffin block ID Code (14 ) supplied
by Dr. Mahtab Uddin Ahmed, MD. (Pathology) Thesis part. </b><b><u></u></b></span>

<br>";s:15:"reporting_board";s:85:"CD30
- Large atypical cells resembling RS cells show CD30 Positive staining.

<br>";s:10:"add_doctor";s:1:"0";}i:33;O:8:"stdClass":15:{s:7:"immu_id";s:3:"146";s:5:"sl_no";s:1:" ";s:7:"test_id";s:12:"MIHC12-05050";s:10:"reciv_date";s:10:"20/03/2012";s:12:"current_date";s:10:"2012-03-20";s:9:"deli_date";s:10:"03/05/2012";s:12:"patient_name";s:13:"Shamsun Nahar";s:3:"age";s:6:"60 Yrs";s:6:"ref_by";s:48:"Mahtab Uddin Ahmed,  MD. (Pathology) Thesis part";s:3:"sex";s:6:"Female";s:13:"hospital_name";s:8:"S.S.M.C.";s:13:"specimen_name";s:27:"One paraffin block No: (08)";s:4:"note";s:200:"<span><b>Result of CD30
Immunostaining, of sections prepared from paraffin block ID Code (08)supplied
by Dr. Mahtab Uddin Ahmed, MD. (Pathology) Thesis <u>part. </u></b><b><u></u></b></span>

<br>";s:15:"reporting_board";s:89:"CD30
- Large atypical cells resembling RS cells show Positive staining for CD30.

<br>";s:10:"add_doctor";s:1:"0";}i:34;O:8:"stdClass":15:{s:7:"immu_id";s:3:"152";s:5:"sl_no";s:1:" ";s:7:"test_id";s:13:"MH12-10459-61";s:10:"reciv_date";s:10:"04/06/2012";s:12:"current_date";s:10:"2012-06-04";s:9:"deli_date";s:10:"10/06/2013";s:12:"patient_name";s:17:"Mrs. Momtaz Begum";s:3:"age";s:6:"45 Yrs";s:6:"ref_by";s:24:"Amin Lutful Kabir , FCPS";s:3:"sex";s:6:"Female";s:13:"hospital_name";s:3:"DHL";s:13:"specimen_name";s:26:"One Paraffin Block K12-145";s:4:"note";s:244:"<b>Result of immunostaining for &nbsp;LCA, CD3 &amp; CD20 case No. IBCH-12/145 Block
No: K12-145(02) from </b><b>Islami</b><b> </b><b>Bank</b><b> </b><b>Central</b><b> </b><b>Hospital</b><b>, </b><b>Dhaka</b><b><span>&nbsp; <br></span></b><br>";s:15:"reporting_board";s:412:"LCA -&nbsp; show diffuse positive staining of lymphoid
cells.

&nbsp;

<span><br><br>CD3 -&nbsp; Scattered lymphoid cells show positive
staining.</span>

&nbsp;

<br><br><br>CD20- Most of the atypical
lymphoid cells show positive staining 

&nbsp;

&nbsp;

<br><br>Conclusion:- Considering the
immunostaining results, this case can be treated as non-Hodgkins lymphoma of
B cell origin.

<br>";s:10:"add_doctor";s:1:"0";}i:35;O:8:"stdClass":15:{s:7:"immu_id";s:3:"153";s:5:"sl_no";s:1:" ";s:7:"test_id";s:13:"MH12-10459-61";s:10:"reciv_date";s:10:"04/06/2012";s:12:"current_date";s:10:"2012-06-04";s:9:"deli_date";s:10:"10/06/2012";s:12:"patient_name";s:17:"Mrs. Momtaz Begum";s:3:"age";s:6:"45 Yrs";s:6:"ref_by";s:24:"Amin Lutful Kabir , FCPS";s:3:"sex";s:6:"Female";s:13:"hospital_name";s:3:"DHL";s:13:"specimen_name";s:26:"One Paraffin Block K12-145";s:4:"note";s:189:"<b>Result of immunostaining for &nbsp;LCA, CD3 &amp; CD20 case No. IBCH-12/145 Block
No: K12-145(02) from Islami
 Bank Central
 Hospital, Dhaka &nbsp;</b>

<b><u>&nbsp;</u></b>

<br>";s:15:"reporting_board";s:406:"LCA -&nbsp; show diffuse positive staining of lymphoid
cells.

&nbsp;

<span><br><br>CD3 -&nbsp; Scattered lymphoid cells show positive
staining.</span>

&nbsp;
<br><br>CD20- Most of the atypical
lymphoid cells show positive staining 

&nbsp;

&nbsp;

<br><br>Conclusion:- Considering the
immunostaining results, this case can be treated as non-Hodgkins lymphoma of
B cell origin.

<br>";s:10:"add_doctor";s:1:"0";}i:36;O:8:"stdClass":15:{s:7:"immu_id";s:3:"154";s:5:"sl_no";s:1:" ";s:7:"test_id";s:12:"MIHC12-10529";s:10:"reciv_date";s:10:"05/06/2012";s:12:"current_date";s:10:"2012-06-05";s:9:"deli_date";s:10:"10/06/2012";s:12:"patient_name";s:17:"Mrs. Lukna Rahman";s:3:"age";s:6:"33 Yrs";s:6:"ref_by";s:34:"M.M. Mafizur Rahman, MD, MS, Ph.D.";s:3:"sex";s:6:"Female";s:13:"hospital_name";s:25:"City Hospital Ltd, Dhaka ";s:13:"specimen_name";s:49:"Tissue from segment of transverse colon with lump";s:4:"note";s:97:"<b>Result of
immunostaining case no MH12-4416, Block No-(01) for &nbsp;CD&nbsp; 117 </b>

<br>";s:15:"reporting_board";s:302:"<span><b>CD 117&nbsp;&nbsp;&nbsp; </b>:&nbsp;
Tumour cells show no staining for&nbsp;
CD117. </span>

&nbsp;

<br><br>Summary
of results :

&nbsp;

<span>&nbsp;&nbsp;&nbsp;&nbsp;&nbsp;&nbsp;&nbsp;&nbsp;&nbsp;&nbsp;&nbsp;&nbsp;&nbsp; <br><br>CD 117 -&nbsp; Negative. </span>

&nbsp;

<br>";s:10:"add_doctor";s:1:"0";}i:37;O:8:"stdClass":15:{s:7:"immu_id";s:3:"156";s:5:"sl_no";s:2:"04";s:7:"test_id";s:16:"MIHC14:00124-126";s:10:"reciv_date";s:10:"02/01/2014";s:12:"current_date";s:10:"2014-01-02";s:9:"deli_date";s:10:"05/01/2014";s:12:"patient_name";s:11:"Mrs. Shafia";s:3:"age";s:6:"60 Yrs";s:6:"ref_by";s:47:"Tapesh Kumar Paul, FCPS, MS (Oncology Surgery).";s:3:"sex";s:6:"Female";s:13:"hospital_name";s:20:"DHL. Mirpur. Dhaka. ";s:13:"specimen_name";s:52:"Tissue from cervical lymph node. Case No: MH13-24504";s:4:"note";s:105:"Result of Immunostaining  for LCA, CD3 &amp; CD20 of Case No: MH13-24504 from DHL. Path. Lab. Dhaka. <br>";s:15:"reporting_board";s:423:"<b><br>LCA:</b> Lymphoid cells show positive staining for<b> </b><b>LCA</b><b>.</b><br><br><br><b>CD3:</b> Scattered lymphoid cells show positive staining for<b> </b><b>CD3.</b><br><br><br><b>CD20 :</b> Majority of the atypical lymphoid cells show positive staining for <b>CD20.</b><br><br><b><i>Conclusion: Immunostaining results favor the diagnosis of Non-Hodgkin's lymphoma of&nbsp; "B" cell origin. </i></b><br><br><br>";s:10:"add_doctor";s:1:"0";}i:38;O:8:"stdClass":15:{s:7:"immu_id";s:3:"157";s:5:"sl_no";s:3:"003";s:7:"test_id";s:13:"MIHC14:-24468";s:10:"reciv_date";s:10:"31/12/2013";s:12:"current_date";s:10:"2013-12-31";s:9:"deli_date";s:10:"05/01/2014";s:12:"patient_name";s:12:"Mrs. Lovely ";s:3:"age";s:6:"30 Yrs";s:6:"ref_by";s:26:"Nirmalendu Roy, MCPS, CAMS";s:3:"sex";s:6:"Female";s:13:"hospital_name";s:29:"Update Care Hospital , Ranpur";s:13:"specimen_name";s:41:"Tissue from stomach. Case No:____________";s:4:"note";s:65:"Result of Immunostaining  for CK &amp; CD-138 of Case No:____<br>";s:15:"reporting_board";s:46:"<b>CK :</b><br><br><br><br><b>CD-138 :</b><br>";s:10:"add_doctor";s:1:"0";}i:39;O:8:"stdClass":15:{s:7:"immu_id";s:3:"161";s:5:"sl_no";s:1:" ";s:7:"test_id";s:15:"MIHC12:12210-11";s:10:"reciv_date";s:10:"27/06/2012";s:12:"current_date";s:10:"2012-06-27";s:9:"deli_date";s:10:"01/07/2012";s:12:"patient_name";s:11:"Mrs. Rehana";s:3:"age";s:6:"48 Yrs";s:6:"ref_by";s:57:"Mahtab Uddin Ahmed, MD, (Pathology), Student, Thesis Part";s:3:"sex";s:6:"Female";s:13:"hospital_name";s:6:"SSMC&H";s:13:"specimen_name";s:36:"One paraffin block, ID Code (1088). ";s:4:"note";s:267:"<u>Result of LCA &amp; CD30 immunostaining of sections
prepared from paraffin block 

</u><span><u><span>ID code (1088) Supplied by<b> </b></span></u><b><u>Dr. Mahtab Uddin Ahmed, MD.
(Pathology), Student, Thesis Part. </u></b><b><u></u></b></span><u>

</u><br>";s:15:"reporting_board";s:134:"&nbsp;<span><b>LCA&nbsp;&nbsp;&nbsp;
</b>:&nbsp; No Lymphnodal tissue is seen and
no CD 30 positive cells are seen . </span>

<br>";s:10:"add_doctor";s:1:"0";}i:40;O:8:"stdClass":15:{s:7:"immu_id";s:3:"164";s:5:"sl_no";s:1:" ";s:7:"test_id";s:15:"MIHC12:12215-17";s:10:"reciv_date";s:10:"27/06/2012";s:12:"current_date";s:10:"2012-06-27";s:9:"deli_date";s:10:"01/07/2012";s:12:"patient_name";s:20:"Mrs. Khorshida Begum";s:3:"age";s:6:"30 Yrs";s:6:"ref_by";s:18:"Parvin Akhter Banu";s:3:"sex";s:6:"Female";s:13:"hospital_name";s:3:"DHL";s:13:"specimen_name";s:32:"One paraffin block  No. P- 8912 ";s:4:"note";s:153:"<b>Result of
immunostaining for LCA, CD3 &amp; CD20 &nbsp;of case no. P-8912 Block No. (02)&nbsp;</b><b> from
Modern Diagnostic Centre Ltd.</b>

<br>";s:15:"reporting_board";s:552:"<span><b>LCA &nbsp;&nbsp;</b>: &nbsp;Lymphoid cells show diffuse&nbsp; positive staining .</span>&nbsp;

<u><b><br><br></b></u><span><b>CD3</b>&nbsp;&nbsp; &nbsp;:&nbsp;&nbsp;
Scattered lymphoid cells show positive staining. </span>

<span><b><br><br>CD20</b>&nbsp; :&nbsp;&nbsp; Most
of the lymphoid cells show positive staining. </span>

&nbsp;

<span><br><br><b><i>Conclusion: Considering the
immunostaining results, this case can be treated as a case of non-Hodgkins
lymphoma of&nbsp; B cell origin.</i></b></span><b><i>

</i></b><br>";s:10:"add_doctor";s:1:"0";}i:41;O:8:"stdClass":15:{s:7:"immu_id";s:3:"165";s:5:"sl_no";s:1:" ";s:7:"test_id";s:13:"MH12-12215-17";s:10:"reciv_date";s:10:"27/06/2012";s:12:"current_date";s:10:"2012-06-27";s:9:"deli_date";s:10:"30/06/2012";s:12:"patient_name";s:20:"Mrs. Khorshida Begum";s:3:"age";s:6:"30 Yrs";s:6:"ref_by";s:18:"Parvin Akhter Banu";s:3:"sex";s:6:"Female";s:13:"hospital_name";s:0:"";s:13:"specimen_name";s:35:"Two slides and two paraffin blocks ";s:4:"note";s:97:"<b>Result of
immunostaining for CD3, CD2<i></i>0 &amp; LCA of case no. Lab No-P-8912</b>

<br>";s:15:"reporting_board";s:550:"<span><b>LCA&nbsp;&nbsp;
</b>:&nbsp; Lymphoid cells show diffuse&nbsp; positive staining .</span><br><br><span><b>CD3</b>&nbsp;&nbsp;&nbsp; :&nbsp;&nbsp;
Scattered lymphoid cells show positive staining. </span>

<span><b><br><br>CD20</b>&nbsp; :&nbsp;&nbsp;
Mostly of the lymphoid cells show positive staining. </span>

&nbsp;

<span><br><br><b><i>Conclusion: Consisting the
immunostaining results, this case can be treated as a case of non-Hodgkins
lymphoma of&nbsp; B cell origin.</i></b></span><b><i>

&nbsp;

&nbsp;

</i></b><br>";s:10:"add_doctor";s:1:"0";}i:42;O:8:"stdClass":15:{s:7:"immu_id";s:3:"167";s:5:"sl_no";s:1:" ";s:7:"test_id";s:13:"MIHC12: 11603";s:10:"reciv_date";s:10:"19/06/2012";s:12:"current_date";s:10:"2012-06-19";s:9:"deli_date";s:10:"01/07/2012";s:12:"patient_name";s:12:"Mrs. Jamila ";s:3:"age";s:6:"22 Yrs";s:6:"ref_by";s:57:"Mahtab Uddin Ahmed, MD, (Pathology), Student, Thesis Part";s:3:"sex";s:6:"Female";s:13:"hospital_name";s:4:"SSMC";s:13:"specimen_name";s:34:"One paraffin block, ID Code (24). ";s:4:"note";s:227:"Result of CD30 immunostaining of sections prepared
from paraffin block 

<span><span>ID code (24) Supplied by<b> </b></span><b>Dr. Mahtab Uddin Ahmed, MD.
(Pathology), Student, Thesis part. </b><b><u></u></b></span>

<br>";s:15:"reporting_board";s:94:"<span><b>CD30</b>&nbsp; :&nbsp;&nbsp;
Scattered CD30 positive cells are seen. </span>

<br>";s:10:"add_doctor";s:1:"0";}i:43;O:8:"stdClass":15:{s:7:"immu_id";s:3:"168";s:5:"sl_no";s:2:"  ";s:7:"test_id";s:16:"MIHC12: 13970-71";s:10:"reciv_date";s:10:"19/07/2012";s:12:"current_date";s:10:"2012-07-19";s:9:"deli_date";s:10:"29/07/2012";s:12:"patient_name";s:12:"Tazvi Rahman";s:3:"age";s:10:"4 Yrs. 6 m";s:6:"ref_by";s:31:"M. A. Mushfiqur Rahman, FCPS,MS";s:3:"sex";s:6:"Female";s:13:"hospital_name";s:14:"Sigma Lab, Ctg";s:13:"specimen_name";s:34:"Tissue from post auricular region.";s:4:"note";s:148:"<b>Result of Immunostaining for Vimentin, Desmin and S100 of case No. MH12:
13198, </b>

<span><b>Block No. (O1)</b><b><u></u></b></span>

<br>";s:15:"reporting_board";s:412:"Vimentin-
Tumour cells show positive staining for vimentin.&nbsp;

<br><br>Desmin
 Tumour cells show no staining for desmin.

&nbsp;

<span><br><br>S100:&nbsp; Tumour cell show positive staining for S100.</span>

&nbsp;

&nbsp;

<br><br>Conclusion:
Immunostaining result is suggestive of primitive neurocetodermal tumour (PNET).
Immunostaining for CD 99 can further clarify the diagnosis.

<br>";s:10:"add_doctor";s:1:"0";}i:44;O:8:"stdClass":15:{s:7:"immu_id";s:3:"169";s:5:"sl_no";s:1:" ";s:7:"test_id";s:16:"MIHC12:-14580-82";s:10:"reciv_date";s:10:"28/07/2012";s:12:"current_date";s:10:"2012-07-28";s:9:"deli_date";s:10:"05/08/2012";s:12:"patient_name";s:16:"Miss Munmun Erat";s:3:"age";s:6:"19 Yrs";s:6:"ref_by";s:18:"Parvin Akhter Banu";s:3:"sex";s:6:"Female";s:13:"hospital_name";s:24:"BIRDEM General Hospital ";s:13:"specimen_name";s:29:"One paraffin block BH-1967/12";s:4:"note";s:164:"<b>Result of
immunohistochemical study of case no BH-1967/2012 for</b>

<b>&nbsp;LCA, CD3 &amp; CD20 from BIRDEM General
 Hospital.</b>

<b>&nbsp;</b>

<br>";s:15:"reporting_board";s:481:"<span><b>LCA&nbsp;
</b><span>:&nbsp; Tumor cells show positive
staining for LCA.<br><br></span></span><span><b>CD3</b>&nbsp;&nbsp; :&nbsp;
Scattered lymphoid cells show positive staining</span>

<span><b><br><br>CD20</b>&nbsp; : Tumour cells show positive staining for
CD20.</span>

&nbsp;

<span><br><br>Conclusion:
Considering the immunostaining results this case should be treated as a case
of&nbsp;</span> Non-Hodgkins lymphoma of
B cell origin. 

&nbsp;

<br>";s:10:"add_doctor";s:1:"0";}i:45;O:8:"stdClass":15:{s:7:"immu_id";s:3:"171";s:5:"sl_no";s:1:" ";s:7:"test_id";s:16:"MIHC12:-15397-98";s:10:"reciv_date";s:10:"07/08/2012";s:12:"current_date";s:10:"2012-08-07";s:9:"deli_date";s:10:"12/08/2012";s:12:"patient_name";s:15:"Mr. Abdus Salam";s:3:"age";s:6:"55 Yrs";s:6:"ref_by";s:33:"Zahidul Haq, FCPS, FRCS, MS, FICS";s:3:"sex";s:6:"Female";s:13:"hospital_name";s:61:"Popular Medical College Hospital, Consultation Centre ,Dhaka ";s:13:"specimen_name";s:32:"One paraffin block Sp No. QD-419";s:4:"note";s:152:"<b><u>Result of
immunohistochemical study of case no SP NO.QD-419 for</u></b>

<b><u>&nbsp;CK &amp; Chromogranin from The Laboratory.</u></b>

<br>";s:15:"reporting_board";s:422:"<span><b>Chromogranin- </b>Most of the tumour cells show strong
cytoplasmic granular staining.</span>

&nbsp;

<span><b><br><br>CK</b> &nbsp;:&nbsp;
Scattered cells show non specific staining for CK.</span>

&nbsp;<br><br>&nbsp;Conclusion:
Considering the immunostaining results this case can be treated as a carcinoid
tumour.&nbsp; 

&nbsp;&nbsp;&nbsp;&nbsp;&nbsp;&nbsp;&nbsp;&nbsp;&nbsp;&nbsp;&nbsp; 

<br>";s:10:"add_doctor";s:1:"0";}i:46;O:8:"stdClass":15:{s:7:"immu_id";s:3:"173";s:5:"sl_no";s:2:"07";s:7:"test_id";s:17:"MIHC14:-00212-213";s:10:"reciv_date";s:10:"06/01/2014";s:12:"current_date";s:10:"2014-01-06";s:9:"deli_date";s:10:"12/01/2014";s:12:"patient_name";s:4:"Moni";s:3:"age";s:6:"20 Yrs";s:6:"ref_by";s:0:"";s:3:"sex";s:6:"Female";s:13:"hospital_name";s:42:"(Corporate Name: Badal Pharmacy, Rangpur.)";s:13:"specimen_name";s:59:"Tissue from supraclavicular lymph node. Case No: MH13-23939";s:4:"note";s:125:"Result of Immunostaining  for S-100 &amp;&nbsp; Vimentin&nbsp; of Case No: MH13-23939. from&nbsp; DHL, Path. Lab. Dhaka. <br>";s:15:"reporting_board";s:323:"<b>S-100 :</b> Tumor cells show positive staining for <b>S-100. </b><br><br><br><b>Vimentin :</b> Tumor cells show positive staining for <b>Vimentin. </b><br><br><br><h4><b><i>Conclusion: Immunostaining results favor the diagnosis of low grade malignant&nbsp; neoplasm of peripheral nerve&nbsp; sheath origin. </i></b></h4>";s:10:"add_doctor";s:1:"0";}i:47;O:8:"stdClass":15:{s:7:"immu_id";s:3:"176";s:5:"sl_no";s:3:"014";s:7:"test_id";s:18:"MIHC13:-00492-494 ";s:10:"reciv_date";s:10:"12/01/2013";s:12:"current_date";s:10:"2013-01-12";s:9:"deli_date";s:10:"20/01/2013";s:12:"patient_name";s:11:"Mrs. Majeda";s:3:"age";s:6:"47 Yrs";s:6:"ref_by";s:48:"Parvin Akhter Banu, Senior Consultant (Oncology)";s:3:"sex";s:6:"Female";s:13:"hospital_name";s:5:"DLMCH";s:13:"specimen_name";s:27:"One paraffin block (QF-830)";s:4:"note";s:120:"Result of Immunostaining&nbsp; for LCA , CK &amp; Vimentin of case No: QF-830 <br>Block No: (02) from The Laboratory<br>";s:15:"reporting_board";s:161:"<br>LCA:-Scattered inflammatory cells show positive staining. However tumour cells show no staining. <br><br><br><br>CK:-Focal positive staining is seen.<br><br>";s:10:"add_doctor";s:1:"0";}i:48;O:8:"stdClass":15:{s:7:"immu_id";s:3:"177";s:5:"sl_no";s:3:"018";s:7:"test_id";s:17:"MIHC13:-00875-877";s:10:"reciv_date";s:10:"19/01/2013";s:12:"current_date";s:10:"2013-01-19";s:9:"deli_date";s:10:"27/01/2013";s:12:"patient_name";s:11:"Ranu Sushil";s:3:"age";s:6:"45 Yrs";s:6:"ref_by";s:0:"";s:3:"sex";s:6:"Female";s:13:"hospital_name";s:20:"The Lab, Chittagong.";s:13:"specimen_name";s:21:"Tissue from left leg.";s:4:"note";s:99:"Result of Immunostaining&nbsp; for Vimentin &amp; Desmin of case No:MH13-110<br>Block No: ( 02)<br>";s:15:"reporting_board";s:239:"<br><br>Vimentin:- Tumour cell show positive staining for Vimentin.<br><br>Desmin:- Some of the tumour cell show cytoplasmic staining for desmin. <br><br>Conclusion: Immunostaining results favours the diagnosis of Rhabdomyosarcoma.<br><br>";s:10:"add_doctor";s:1:"0";}i:49;O:8:"stdClass":15:{s:7:"immu_id";s:3:"182";s:5:"sl_no";s:3:"044";s:7:"test_id";s:17:"MIHC13:-01888-889";s:10:"reciv_date";s:10:"04/02/2013";s:12:"current_date";s:10:"0000-00-00";s:9:"deli_date";s:10:"10/02/2013";s:12:"patient_name";s:12:"Selina Begum";s:3:"age";s:6:"45 Yrs";s:6:"ref_by";s:34:"Swapan Kumar (Oncologist), Rangpur";s:3:"sex";s:6:"Female";s:13:"hospital_name";s:53:"Rangpur Community Medical College & Hospital Rangpur.";s:13:"specimen_name";s:31:"Tissue from ovarian tumor (Rt.)";s:4:"note";s:95:"Result of Immunostaining&nbsp; for LCA &amp; CD20 of case No: MH13-01019<br>Block No: (03 )<br>";s:15:"reporting_board";s:212:"LCA :- Tumour cells show positive staining for LCA<br><br>CD20:- Tumour cells show positive staining for CD20.<br><br><br>Conclusion : Immunostaining results favor the diagnosis of NHL of "B" cell origin.<br><br>";s:10:"add_doctor";s:1:"0";}i:50;O:8:"stdClass":15:{s:7:"immu_id";s:3:"192";s:5:"sl_no";s:2:"11";s:7:"test_id";s:13:"MIHC14:-01379";s:10:"reciv_date";s:10:"27/01/2013";s:12:"current_date";s:10:"0000-00-00";s:9:"deli_date";s:10:"19/01/2014";s:12:"patient_name";s:19:"Miss. Sweety Akhter";s:3:"age";s:6:"15 Yrs";s:6:"ref_by";s:0:"";s:3:"sex";s:6:"Female";s:13:"hospital_name";s:20:"The Lab, Chittagong.";s:13:"specimen_name";s:54:"Tissue from Swelling of Rt. thigh. Case No: MH13-01379";s:4:"note";s:89:"Result of Immunostaining  for LCA , CD3 , CD20 &amp; CD99 of Case No:MH13-01379. <br><br>";s:15:"reporting_board";s:91:"<b>LCA :</b><br><br><br><b>CD3 :</b><br><br><br><b>CD20 :</b><br><br><br><b>CD99 : </b><br>";s:10:"add_doctor";s:1:"0";}i:51;O:8:"stdClass":15:{s:7:"immu_id";s:3:"194";s:5:"sl_no";s:2:"72";s:7:"test_id";s:13:"MIHC13:-03607";s:10:"reciv_date";s:10:"04/03/2013";s:12:"current_date";s:10:"0000-00-00";s:9:"deli_date";s:10:"10/03/2013";s:12:"patient_name";s:14:"Ms. Rama Dutta";s:3:"age";s:6:"37 Yrs";s:6:"ref_by";s:38:"Ali Asgar Chowdhury , FCPS, Oncologist";s:3:"sex";s:6:"Female";s:13:"hospital_name";s:42:"Surgiscope Hospital Ltd. Unit-2,Chittagong";s:13:"specimen_name";s:38:"One Paraffine Block (R002/N-4752/2012)";s:4:"note";s:143:"Result of Immunostaining&nbsp; for ER of case No:R002/N-4752/2012<br>Block No: (R2/13) from Surgiscope Hospital Ltd. Unit-2, Chittagong<br><br>";s:15:"reporting_board";s:120:"<br>ER:- Tumour cells nuclei show no staining. <br>Quick Score "0"<br><br><br><br>Summary of result: ER-Negative<br><br>";s:10:"add_doctor";s:1:"0";}i:52;O:8:"stdClass":15:{s:7:"immu_id";s:3:"195";s:5:"sl_no";s:2:"76";s:7:"test_id";s:16:"MIHC13:-3639-640";s:10:"reciv_date";s:10:"05/03/2013";s:12:"current_date";s:10:"0000-00-00";s:9:"deli_date";s:10:"10/03/2013";s:12:"patient_name";s:18:"Mrs. Tasrina Jahan";s:3:"age";s:6:"27 Yrs";s:6:"ref_by";s:48:"Parvin Akhter Banu, Senior Consultant (Oncology)";s:3:"sex";s:6:"Female";s:13:"hospital_name";s:3:"DHL";s:13:"specimen_name";s:28:"One Paraffin Block (1311800)";s:4:"note";s:112:"Result of Immunostaining&nbsp; for GFAP &amp; Cytokeratin of case No:1311800 from The Laboratory , Dhaka<br><br>";s:15:"reporting_board";s:234:"GFAP :- Tumour cells show strong positive staining for GFAP. <br><br>Cytokeratin:- Tumour cells show no specific staining for CK. <br><br>Conclusion:&nbsp; Immunostaining results favor the diagnosis of glioblastoma multiforme.<br><br>";s:10:"add_doctor";s:1:"0";}i:53;O:8:"stdClass":15:{s:7:"immu_id";s:3:"196";s:5:"sl_no";s:2:"73";s:7:"test_id";s:14:"MIHC134:-03608";s:10:"reciv_date";s:10:"04/03/2013";s:12:"current_date";s:10:"0000-00-00";s:9:"deli_date";s:10:"10/03/2013";s:12:"patient_name";s:12:"Mrs. Ruksana";s:3:"age";s:6:"35 Yrs";s:6:"ref_by";s:38:"Ali Asgar Chowdhury , FCPS, Oncologist";s:3:"sex";s:6:"Female";s:13:"hospital_name";s:42:"Surgiscope Hospital Ltd. Unit-2,Chittagong";s:13:"specimen_name";s:38:"One Paraffine Block (R003/N-4924/2012)";s:4:"note";s:146:"Result of Immunostaining&nbsp; for ER of case No:R003/N-4924/2012<br>Block No: (R-3-1/13) from Surgiscope Hospital Ltd. Unit-2, Chittagong<br><br>";s:15:"reporting_board";s:124:"ER:- Tumour cells nuclei show no staining. <br>Quick Score "0"<br><br>Summary of Result :&nbsp;&nbsp; ER - Negative.<br><br>";s:10:"add_doctor";s:1:"0";}i:54;O:8:"stdClass":15:{s:7:"immu_id";s:3:"199";s:5:"sl_no";s:3:"105";s:7:"test_id";s:17:"MIHC13:-00751-753";s:10:"reciv_date";s:10:"31/03/2013";s:12:"current_date";s:10:"0000-00-00";s:9:"deli_date";s:10:"07/04/2013";s:12:"patient_name";s:12:"Mrs. Shahida";s:3:"age";s:6:"60 Yrs";s:6:"ref_by";s:9:"A.K. Azad";s:3:"sex";s:6:"Female";s:13:"hospital_name";s:29:"C S C R Hospital, Chittagong.";s:13:"specimen_name";s:10:"Lymph node";s:4:"note";s:111:"Result of Immunostaining&nbsp; for LCA(CD45), CD3 &amp; CD20 of case No:&nbsp; DH13-00666<br>Block No: (01)<br>";s:15:"reporting_board";s:363:"LCA(CD45): Neoplastic cells show diffuse staining for LCA. <br><br><br>CD3: Most of the neoplastic cells show positive staining for CD3.<br><br><br>CD20: Scattered lymphoid cells show positive staining for CD20.<br><br><br>Conclusion: Considering the immunostaining results, this case can be treated as malignant non-Hodgkin's lymphoma of "T" cell origin.<br><br>";s:10:"add_doctor";s:1:"0";}i:55;O:8:"stdClass":15:{s:7:"immu_id";s:3:"200";s:5:"sl_no";s:2:"76";s:7:"test_id";s:16:"MIHC13:-3639-640";s:10:"reciv_date";s:10:"05/03/2013";s:12:"current_date";s:10:"0000-00-00";s:9:"deli_date";s:10:"10/03/2013";s:12:"patient_name";s:18:"Mrs. Tasrina Jahan";s:3:"age";s:6:"27 Yrs";s:6:"ref_by";s:48:"Parvin Akhter Banu, Senior Consultant (Oncology)";s:3:"sex";s:6:"Female";s:13:"hospital_name";s:3:"DHL";s:13:"specimen_name";s:28:"One Paraffin Block (1311800)";s:4:"note";s:108:"Result of Immunostaining&nbsp; for GFAP &amp; Cytokeratin of case No:1311800 from The Laboratory , Dhaka<br>";s:15:"reporting_board";s:150:"GFAP :- Tumour cells show strong positive staining for GFAP. <br><br><br><br>Cytokeratin:- Tumour cells show no specific staining for CK. <br><br><br>";s:10:"add_doctor";s:1:"0";}i:56;O:8:"stdClass":15:{s:7:"immu_id";s:3:"203";s:5:"sl_no";s:3:"118";s:7:"test_id";s:13:"MIHC13:-06169";s:10:"reciv_date";s:10:"11/04/2013";s:12:"current_date";s:10:"2013-04-11";s:9:"deli_date";s:10:"11/04/2013";s:12:"patient_name";s:19:"Mrs. Josna Ferdousi";s:3:"age";s:6:"29 Yrs";s:6:"ref_by";s:0:"";s:3:"sex";s:6:"Female";s:13:"hospital_name";s:41:"Surgiscope Hospital (Unit-2), Chittagong.";s:13:"specimen_name";s:34:"One paraffin block case No: R-5/13";s:4:"note";s:111:"Result of Immunostaining&nbsp; for ER of case No: R-5/13 from Surgiscope Hospital <br>(Unit-2), Chittagong.<br>";s:15:"reporting_board";s:87:"ER:- About 40 % of the ductal epithelial cells show moderate positive staining.<br><br>";s:10:"add_doctor";s:1:"0";}i:57;O:8:"stdClass":15:{s:7:"immu_id";s:3:"204";s:5:"sl_no";s:3:"118";s:7:"test_id";s:12:"MIHC13-06169";s:10:"reciv_date";s:10:"11/04/2013";s:12:"current_date";s:10:"2013-04-11";s:9:"deli_date";s:10:"21/04/2013";s:12:"patient_name";s:19:"Mrs. Josna Ferdousi";s:3:"age";s:6:"29 Yrs";s:6:"ref_by";s:0:"";s:3:"sex";s:6:"Female";s:13:"hospital_name";s:0:"";s:13:"specimen_name";s:0:"";s:4:"note";s:246:"Result of Immunostaining&nbsp; for ER, PR &amp; HER-2 of case No:&nbsp;&nbsp;&nbsp;&nbsp;&nbsp;&nbsp;&nbsp;&nbsp;&nbsp;&nbsp;&nbsp;&nbsp;&nbsp;&nbsp;&nbsp;&nbsp;&nbsp;&nbsp;&nbsp;&nbsp;&nbsp; Block No: (&nbsp;&nbsp;&nbsp;&nbsp;&nbsp;&nbsp; ) <br>";s:15:"reporting_board";s:180:"ER:-Tumor cell nuclei show no staining. <br><br>Quick Score : "O"<br><br><br><br>Summary of result :- <br><br>&nbsp;&nbsp;&nbsp;&nbsp;&nbsp;&nbsp; ER&nbsp;&nbsp; : Negative<br><br>";s:10:"add_doctor";s:1:"0";}i:58;O:8:"stdClass":15:{s:7:"immu_id";s:3:"206";s:5:"sl_no";s:3:"130";s:7:"test_id";s:17:"MIHC13:-06922-923";s:10:"reciv_date";s:10:"21/04/2013";s:12:"current_date";s:10:"2013-04-21";s:9:"deli_date";s:10:"28/04/2013";s:12:"patient_name";s:17:"Mrs. Priyanka Das";s:3:"age";s:6:"20 Yrs";s:6:"ref_by";s:18:"Parvin Akhter Banu";s:3:"sex";s:6:"Female";s:13:"hospital_name";s:3:"DHL";s:13:"specimen_name";s:31:"Tissue from inguinal lymph node";s:4:"note";s:102:"Result of Immunostaining&nbsp; for LCA (CD45) &amp; Cytokeratin (CK) of case No:<br>Block No: (03)<br>";s:15:"reporting_board";s:246:"LCA (CD45): Tumor cells show positive staining for LCA. <br><br><br>Cytokeratin (CK) : Tumour cells show no staining for CK. <br><br>Conclusion: Considering the immunostaining results this case should be treated as Non-Hodgkin's lymphoma.<br><br>";s:10:"add_doctor";s:1:"0";}i:59;O:8:"stdClass":15:{s:7:"immu_id";s:3:"207";s:5:"sl_no";s:3:"131";s:7:"test_id";s:17:"MIHC13:-06934-935";s:10:"reciv_date";s:10:"21/04/2013";s:12:"current_date";s:10:"2013-04-21";s:9:"deli_date";s:10:"28/04/2013";s:12:"patient_name";s:25:"Umme Hasan Nurjahan Begum";s:3:"age";s:6:"68 Yrs";s:6:"ref_by";s:41:"Azizul Islam, Col, CLMED SPL & ONCOLOGIST";s:3:"sex";s:6:"Female";s:13:"hospital_name";s:10:"CMH, DHAKA";s:13:"specimen_name";s:34:"One Paraffin Block case no: 2468/B";s:4:"note";s:96:"Result of Immunostaining&nbsp; for CD15 &amp; CD30&nbsp; of case No: 2468<br>Block No: ( A3)<br>";s:15:"reporting_board";s:241:"CD15: Scattered large atypical cell show positive staining for CD15.<br><br>CD30: Scattered large atypial cells show positive staining for CD30.<br><br><br>Conclusion: Immunostaining result favors the diagnosis of Hodgkin's lymphoma.<br><br>";s:10:"add_doctor";s:1:"0";}i:60;O:8:"stdClass":15:{s:7:"immu_id";s:3:"208";s:5:"sl_no";s:3:"137";s:7:"test_id";s:17:"MIHC13:-07178-180";s:10:"reciv_date";s:10:"25/04/2013";s:12:"current_date";s:10:"2013-04-25";s:9:"deli_date";s:10:"28/04/2013";s:12:"patient_name";s:16:"Mrs. Laily Begum";s:3:"age";s:6:"45 Yrs";s:6:"ref_by";s:0:"";s:3:"sex";s:6:"Female";s:13:"hospital_name";s:21:"Prime Medical College";s:13:"specimen_name";s:10:"Lymph node";s:4:"note";s:100:"Result of Immunostaining&nbsp; for&nbsp; LCA (CD45) , CD3 &amp; CD20&nbsp; of case No: MH13-3920<br>";s:15:"reporting_board";s:344:"LCA (CD45) : Lymphoid cells show diffuse staining for LCA. <br><br>CD3 : Scattered lymphoid cells show positive staining for CD3.<br><br><br>CD20: Lymphoid cells show diffuse staining for CD20.<br><br>Conclusion: Considering the immunostaining resutls , this case can be&nbsp; treated as non-Hodgkin's lymphoma of&nbsp; "B" cell origin.<br><br>";s:10:"add_doctor";s:1:"0";}i:61;O:8:"stdClass":15:{s:7:"immu_id";s:3:"209";s:5:"sl_no";s:3:"138";s:7:"test_id";s:17:"MIHC13:-07268-269";s:10:"reciv_date";s:10:"25/04/2013";s:12:"current_date";s:10:"2013-04-25";s:9:"deli_date";s:10:"28/04/2013";s:12:"patient_name";s:12:"Jashim Uddin";s:3:"age";s:6:"24 Yrs";s:6:"ref_by";s:4:"Self";s:3:"sex";s:6:"Female";s:13:"hospital_name";s:31:"Tissue from cervical lymph node";s:13:"specimen_name";s:0:"";s:4:"note";s:78:"Result of Immunostaining&nbsp; for LCA (CD45) &amp; CD20 of case No: 06364<br>";s:15:"reporting_board";s:328:"LCA (CD45):Lymphoid cells show diffuse staining for LCA. <br><br><br>CD20: Scattered lymphoid cells show positive staining for CD20.<br><br>CD3: Lymphoid cells show diffuse staining for CD3. <br><br>Conclusion: Considering the immunostaining results this case can be treated as non-Hodgkin's lymphoma of "T" cell origin.<br><br>";s:10:"add_doctor";s:1:"0";}i:62;O:8:"stdClass":15:{s:7:"immu_id";s:3:"212";s:5:"sl_no";s:3:"143";s:7:"test_id";s:17:"MIHC13:-07596-597";s:10:"reciv_date";s:10:"30/04/2013";s:12:"current_date";s:10:"2013-04-30";s:9:"deli_date";s:10:"12/05/2013";s:12:"patient_name";s:4:"Mina";s:3:"age";s:6:"09 Yrs";s:6:"ref_by";s:19:"Al-Amin , A/R , POU";s:3:"sex";s:6:"Female";s:13:"hospital_name";s:23:"NICRH, Mohakhali, Dhaka";s:13:"specimen_name";s:26:"Tissue from axillary mass.";s:4:"note";s:157:"Result of Immunostaining&nbsp; for S-100 ,CD68 , Vimentin, LCA , CD3 , CD20, Desmin, Myogenin&nbsp; &amp; CK&nbsp; of case No: MH13-6972 , Block No: (02)<br>";s:15:"reporting_board";s:701:"S-100: Most of the atypical cells show cytoplasmic staining for S100.<br><br>CD68: Scatterted atypical cells show positive staining for CD68. <br><br>Vimentin: Atypical cells show weak cytoplasmic staining for Vimentin. <br><br>LCA:&nbsp; Atypical cells show membrane staining for LCA. <br><br>CD3: Scatterted lymphoid cells show positive staining for CD3.<br><br>CD20: Atypical lymphoid cells show no staining for CD20. <br><br>Desmin: Atypical cells show no staining for Desmin.<br><br>Myogenin: Atypical cells show no staining for Myogenin. <br><br>CK : Atypical cells show no staining for CK.<br><br>Conclusion: Immunostaining results favor the diagnosis of Langerhans cell histiocytosis .<br><br>";s:10:"add_doctor";s:1:"0";}i:63;O:8:"stdClass":15:{s:7:"immu_id";s:3:"213";s:5:"sl_no";s:3:"148";s:7:"test_id";s:13:"MIHC13:-07649";s:10:"reciv_date";s:10:"01/05/2013";s:12:"current_date";s:10:"2013-05-01";s:9:"deli_date";s:10:"05/05/2013";s:12:"patient_name";s:17:"Mrs. Zaheda Shams";s:3:"age";s:6:"58 Yrs";s:6:"ref_by";s:12:"Nurur Rahman";s:3:"sex";s:6:"Female";s:13:"hospital_name";s:0:"";s:13:"specimen_name";s:38:"One Paraffin block Lab no: 13-001-2403";s:4:"note";s:133:"Result of Immunostaining&nbsp; for HER-2 of case No:&nbsp; MH13-001-2403<br>Block No: (03 ) from Anowara Medical Services , Dhaka<br>";s:15:"reporting_board";s:229:"HER-2:-<br><br>Weak to moderate complete membrane staining is observed in more than 10 % of the tumor cells <br>Score : 2+<br><br>Summary of result :- <br><br>&nbsp;&nbsp;&nbsp;&nbsp;&nbsp;&nbsp; HER-2&nbsp; : Borderline.<br><br>";s:10:"add_doctor";s:1:"0";}i:64;O:8:"stdClass":15:{s:7:"immu_id";s:3:"214";s:5:"sl_no";s:3:"151";s:7:"test_id";s:13:"MIHC13:-07961";s:10:"reciv_date";s:10:"04/05/2013";s:12:"current_date";s:10:"2013-05-04";s:9:"deli_date";s:10:"12/05/2013";s:12:"patient_name";s:6:"Bristi";s:3:"age";s:6:"18 Yrs";s:6:"ref_by";s:36:"A B M Khorshid Alam, FCPS , FRCS, MS";s:3:"sex";s:6:"Female";s:13:"hospital_name";s:22:"Doctor's Lab, Comilla.";s:13:"specimen_name";s:30:"One paraffin block. (H-677/13)";s:4:"note";s:110:"Result of Immunostaining&nbsp; for CD-99 of case No:H-677/13<br>Block No: (02) from Doctor's Lab, Comilla.<br>";s:15:"reporting_board";s:141:"CD-99: Tumor cells show positive staining for CD99.<br><br>Conclusion: Immunostaining result favors the diagnosis of Ewing's sarcoma.<br><br>";s:10:"add_doctor";s:1:"0";}i:65;O:8:"stdClass":15:{s:7:"immu_id";s:3:"218";s:5:"sl_no";s:3:"161";s:7:"test_id";s:17:"MIHC13:-08705-709";s:10:"reciv_date";s:10:"15/05/2013";s:12:"current_date";s:10:"2013-05-15";s:9:"deli_date";s:10:"19/05/2013";s:12:"patient_name";s:19:"Mrs. Mahluda Khatun";s:3:"age";s:6:"45 Yrs";s:6:"ref_by";s:28:"Md. Zillur Rahman , FCPS, MS";s:3:"sex";s:6:"Female";s:13:"hospital_name";s:3:"DHL";s:13:"specimen_name";s:23:"Tissue from Rt. Tonsil.";s:4:"note";s:118:"Result of Immunostaining&nbsp; for&nbsp; LCA , CD3 , CD20 , CD15 &amp; CD30<br>case No: MH13-08482. Block No (01).<br>";s:15:"reporting_board";s:450:"LCA : Lymphoid cells show diffuse staining for LCA. <br><br>CD3 : Scattered lymphoid cells show positive staining for CD3. <br><br>CD20 : Neoplastic lymphoid cells show diffuse staining for CD20.<br><br>CD15 : Occasional cells show positive staining for CD15. <br><br>CD30: No CD 30 staining is observed. <br><br><br>Conclusion: Considering the Immunostining results. This case should be treated as non-Hodgking's lymphoma of "B" cell origin.<br><br>";s:10:"add_doctor";s:1:"0";}i:66;O:8:"stdClass":15:{s:7:"immu_id";s:3:"220";s:5:"sl_no";s:3:"172";s:7:"test_id";s:13:"MIHC13:-09197";s:10:"reciv_date";s:10:"22/05/2013";s:12:"current_date";s:10:"2013-05-22";s:9:"deli_date";s:10:"26/05/2013";s:12:"patient_name";s:16:"Mrs. Baby Akhter";s:3:"age";s:6:"40 Yrs";s:6:"ref_by";s:18:"P.B. Roy. FRCS (S)";s:3:"sex";s:6:"Female";s:13:"hospital_name";s:41:"Surgiscope Hospital (Unit-2), Chittagong.";s:13:"specimen_name";s:41:"One slide and one parffain block (R-6/13)";s:4:"note";s:146:"Result of Immunostaining&nbsp; for ER of case No: H-334/N-12037/13 <br>Block No (R-06/13) from Surgiscope Hospital Ltd. (Unit -2), Chittagong.<br>";s:15:"reporting_board";s:172:"ER:-Tumor cell nuclei show no staining. <br><br>Quick Score : "O"<br><br>Summary of result :- <br><br>&nbsp;&nbsp;&nbsp;&nbsp;&nbsp;&nbsp; ER&nbsp;&nbsp; : Negative<br><br>";s:10:"add_doctor";s:1:"0";}i:67;O:8:"stdClass":15:{s:7:"immu_id";s:3:"221";s:5:"sl_no";s:3:"177";s:7:"test_id";s:13:"MIHC13:-09449";s:10:"reciv_date";s:10:"26/05/2013";s:12:"current_date";s:10:"2013-05-26";s:9:"deli_date";s:10:"02/06/2013";s:12:"patient_name";s:23:"Sreemoti Duli Rani Gosh";s:3:"age";s:6:"40 Yrs";s:6:"ref_by";s:52:"Biswajit Bhattacharjee. MBBS, M.Phil, (Radiotherapy)";s:3:"sex";s:6:"Female";s:13:"hospital_name";s:17:"KYAMCH, Sirajgonj";s:13:"specimen_name";s:36:"One paraffin block case no-H-466/13 ";s:4:"note";s:114:"Result of Immunostaining&nbsp; for CD117&nbsp; of case No: H-466/13<br>Block No: (01 ) from KYAMCH, Sirajgonj.<br>";s:15:"reporting_board";s:202:"CD117 :- Neopalstic cells show positive staining for CD 117.<br><br><br>Summary of result:<br>&nbsp;&nbsp;&nbsp;&nbsp;&nbsp; <br>&nbsp;&nbsp;&nbsp;&nbsp;&nbsp;&nbsp;&nbsp;&nbsp; CD117- Positive.<br><br>";s:10:"add_doctor";s:1:"0";}i:68;O:8:"stdClass":15:{s:7:"immu_id";s:3:"226";s:5:"sl_no";s:3:"173";s:7:"test_id";s:13:"MIHC13:-09198";s:10:"reciv_date";s:10:"22/05/2013";s:12:"current_date";s:10:"2013-05-22";s:9:"deli_date";s:10:"26/05/2013";s:12:"patient_name";s:18:"Mrs. Anowara Begum";s:3:"age";s:6:"60 Yrs";s:6:"ref_by";s:0:"";s:3:"sex";s:6:"Female";s:13:"hospital_name";s:43:"Surgiscope Hospital Ltd.(Unit2), Chittagong";s:13:"specimen_name";s:52:"One Paraffin block case no: 870, Block No: (R-7/13).";s:4:"note";s:132:"Result of Immunostaining&nbsp; for ER of case No: 870-Block No:&nbsp; (R-7/13) from Surgiscope Hospital Ltd.(Unit2), Chittagong.<br>";s:15:"reporting_board";s:108:"Tumor cells show no staining.<br>Score : O<br><br><br>Summary of result: -<br><br><br>ER : Negative <br><br>";s:10:"add_doctor";s:1:"0";}i:69;O:8:"stdClass":15:{s:7:"immu_id";s:3:"229";s:5:"sl_no";s:3:"198";s:7:"test_id";s:13:"MIHC13:-10169";s:10:"reciv_date";s:10:"05/06/2013";s:12:"current_date";s:10:"2013-06-05";s:9:"deli_date";s:10:"09/06/2013";s:12:"patient_name";s:20:"Mrs. Jahanara Begum.";s:3:"age";s:6:"50 Yrs";s:6:"ref_by";s:14:"Zillur Rahman.";s:3:"sex";s:6:"Female";s:13:"hospital_name";s:40:"Surgiscope Hospital (Unit-2), Chittagong";s:13:"specimen_name";s:29:"One paraffin block (R-008/13)";s:4:"note";s:131:"Result of Immunostaining&nbsp; for ER of case No:&nbsp; R-008/13 Block (02) from Surgiscope Hospital Ltd. (Unit-2), Chittagong.<br>";s:15:"reporting_board";s:165:"ER:- About 30 % of the tumor cell nuclei show weak staining.<br><br>Quick Score :3+1= 4/8<br><br>Summary of result :- <br><br>ER&nbsp;&nbsp; :&nbsp; Positive<br><br>";s:10:"add_doctor";s:1:"0";}i:70;O:8:"stdClass":15:{s:7:"immu_id";s:3:"233";s:5:"sl_no";s:3:"214";s:7:"test_id";s:17:"MIHC13:-10643-647";s:10:"reciv_date";s:10:"12/06/2013";s:12:"current_date";s:10:"2013-06-12";s:9:"deli_date";s:10:"16/06/2013";s:12:"patient_name";s:13:"Bilkis Khatun";s:3:"age";s:6:"14 Yrs";s:6:"ref_by";s:46:"Saumen Basu MBBS, MD, DNB (Radiation Oncology)";s:3:"sex";s:6:"Female";s:13:"hospital_name";s:18:"KYAMC&H, Sirajgonj";s:13:"specimen_name";s:32:"Tissue from cervical lymph node.";s:4:"note";s:114:"Result of Immunostaining&nbsp; for LCA , CD3 , CD20 , CD15, &amp; CD30 of <br>case No:MH13-9864 Block no: (01)<br>";s:15:"reporting_board";s:477:"LCA :-Lymphoid cells show diffuse staining for LCA. <br><br>CD3 :- Most of the atypical lymphoid cells show positive staining for CD3. <br><br>CD20:- Scattered nests of lymphoid cells show positive staining for CD20. <br><br>CD15:- Lymphoid cells show no staining for CD15. <br><br>CD30 :- Scattered cells show positive staining for CD30. <br><br>Conclusion: Immunostaining results favor the diagnosis of non-Hodgkin's lymphoma of "T"&nbsp;&nbsp;&nbsp; <br>cell origin.<br><br>";s:10:"add_doctor";s:1:"0";}i:71;O:8:"stdClass":15:{s:7:"immu_id";s:3:"234";s:5:"sl_no";s:3:"032";s:7:"test_id";s:17:"MIHC14:-01297-300";s:10:"reciv_date";s:10:"25/01/2014";s:12:"current_date";s:10:"2014-01-25";s:9:"deli_date";s:10:"02/02/2014";s:12:"patient_name";s:15:"Mrs. Renu Begum";s:3:"age";s:6:"50 Yrs";s:6:"ref_by";s:31:"Lt. Col. M S Sarwar Alam (Rtd.)";s:3:"sex";s:6:"Female";s:13:"hospital_name";s:40:"Delta Medical College & Hospital. Dhaka.";s:13:"specimen_name";s:58:"(Tissue from Rt.neck) One paraffin block. Case No: 1400246";s:4:"note";s:116:"Result of Immunostaining  for LCA , CD3 , CD20&nbsp; &amp; BCL2 of Case No:140-0246 from The Laboratory, Dhaka. <br>";s:15:"reporting_board";s:588:"<b>LCA :</b> Lymphoid cells show positive staining for <b>LCA. </b><br><br><br><b>CD3 :</b> Perifollicular&nbsp; lymphoid cells show positive staining for <b>CD3.</b><br><br><br><b>CD20 :</b> Lymphoid cells of the follicles as well as scattered lymphoid cells of other areas show positive staining for <b>CD20.</b><br><br><br><b>BCL2 </b>: Follicular cells as well as scattered other lymphoid cells show positive staining for<b> BCL2.</b><br><br><br><h3><b><i>Conclusion: Immunostaining results favor the diagnosis of Non-Hodgkin's lymphoma of low grade follicular type. </i></b></h3><br>";s:10:"add_doctor";s:1:"0";}i:72;O:8:"stdClass":15:{s:7:"immu_id";s:3:"235";s:5:"sl_no";s:3:"033";s:7:"test_id";s:17:"MIHC14:-01321-323";s:10:"reciv_date";s:10:"26/01/2014";s:12:"current_date";s:10:"2014-01-26";s:9:"deli_date";s:10:"02/02/2014";s:12:"patient_name";s:17:"Mrs. Nibedita Das";s:3:"age";s:6:"59 Yrs";s:6:"ref_by";s:50:"Ali Asgar Chowdhury,MBBS,FCPS,Clinical Onchologist";s:3:"sex";s:6:"Female";s:13:"hospital_name";s:16:"CMCH, Chittagong";s:13:"specimen_name";s:50:"Tissue from Rt. Cervical mass. Case No: MH14-00632";s:4:"note";s:139:"Result of Immunostaining  for LCA , CK , CD3 &amp; CD20&nbsp; of Case No:MH14-00632 ,&nbsp; Block No: (01) from DHL, Path. Lab. Dhaka. <br>";s:15:"reporting_board";s:459:"<b>LCA:</b> Lymphoid cells show positive staining for <b>LCA.</b><br><br><b>CK :</b> Tumor cells show no staining for<b> CK. </b><br><br><b>CD3 :</b> Majority of the atypical lymphoid cells show positive staining for <b>CD3.</b><br><br><b>CD20:&nbsp; </b>Scattered lymphoid cells show positive staining for <b>CD20.</b><br><br><br><h3><b><i>Conclusion: Immunostaining results favor the diagnosis of Non-Hodgkin's lymphoma of "T" cell origin. </i></b></h3><br>";s:10:"add_doctor";s:1:"0";}i:73;O:8:"stdClass":15:{s:7:"immu_id";s:3:"237";s:5:"sl_no";s:3:"040";s:7:"test_id";s:13:"MIHC14:-01195";s:10:"reciv_date";s:10:"23/01/2014";s:12:"current_date";s:10:"2014-01-23";s:9:"deli_date";s:10:"03/02/2014";s:12:"patient_name";s:20:"Sreemoti Sandha Rani";s:3:"age";s:6:"15 Yrs";s:6:"ref_by";s:11:"Rezaul Alam";s:3:"sex";s:6:"Female";s:13:"hospital_name";s:27:"Max Care Hospital, Rangpur.";s:13:"specimen_name";s:53:"Tissue from Lt. parieto-temporal SOL . Case No: _____";s:4:"note";s:84:"Result of Immunostaining  for S-100 , Desmin &amp; Myogenin of Case No: ______. <br>";s:15:"reporting_board";s:91:"<b>S-100 :</b><br><br><br><br><br><b>Desmin :</b><br><br><br><br><br><b>Myogenin : </b><br>";s:10:"add_doctor";s:1:"0";}i:74;O:8:"stdClass":15:{s:7:"immu_id";s:3:"238";s:5:"sl_no";s:3:"041";s:7:"test_id";s:13:"MIHC14:-01283";s:10:"reciv_date";s:10:"25/01/2014";s:12:"current_date";s:10:"2014-01-25";s:9:"deli_date";s:10:"03/02/2014";s:12:"patient_name";s:19:"Mrs. Jahanara Begum";s:3:"age";s:6:"65 Yrs";s:6:"ref_by";s:5:"Self ";s:3:"sex";s:6:"Female";s:13:"hospital_name";s:0:"";s:13:"specimen_name";s:81:"Two H & E stained slides and two paraffin block received for review. Case NO: ___";s:4:"note";s:90:"Result of Immunostaining  for CK &amp; CD117 &amp; Desmin of Case No:_____ Block No: ( __)";s:15:"reporting_board";s:72:"<b>CK :</b><br><br><br><br><b>CD117 :</b><br><br><br><b>Desmin :</b><br>";s:10:"add_doctor";s:1:"0";}i:75;O:8:"stdClass":15:{s:7:"immu_id";s:3:"246";s:5:"sl_no";s:1:" ";s:7:"test_id";s:16:"MIHC12:  3113-15";s:10:"reciv_date";s:10:"22/02/2012";s:12:"current_date";s:10:"2012-02-22";s:9:"deli_date";s:10:"04/03/2012";s:12:"patient_name";s:13:"Mrs.  Khaleda";s:3:"age";s:6:"25 Yrs";s:6:"ref_by";s:0:"";s:3:"sex";s:6:"Female";s:13:"hospital_name";s:10:"CSCR, Ctg.";s:13:"specimen_name";s:19:"Tissue from omentum";s:4:"note";s:134:"<b>Result of immunostaining for LCA, CK, CD3 &amp; CD20
of case no. MH12-02263, Block (1) &amp; R/G  2263, Block No. (2).</b>

<br>";s:15:"reporting_board";s:653:"<span><b>LCA&nbsp;&nbsp;
</b>: Tumor cells are&nbsp; positive for
LCA. </span>

<span><b><br><br>CK</b>&nbsp;&nbsp;&nbsp;&nbsp;&nbsp; :&nbsp;
Lining epithelial cells show positive staining. </span>

<span><b><br><br>CD3</b>&nbsp;&nbsp;&nbsp; :&nbsp;
Scattered lymphoid cells&nbsp; show
positive staining. </span>

<span><b><br><br>CD20</b>&nbsp; :&nbsp; Most
of the lymphoid cells&nbsp; show positive
staining. </span>

&nbsp;

&nbsp;

&nbsp;

<span><br><br>Conclusion:- &nbsp;Considering the immunostaining results, this
case should be &nbsp;treated as &nbsp;non-Hodgkins</span>&nbsp; lymphoma of&nbsp; Bcell &nbsp;origin.

<br>";s:10:"add_doctor";s:1:"0";}i:76;O:8:"stdClass":15:{s:7:"immu_id";s:3:"248";s:5:"sl_no";s:1:" ";s:7:"test_id";s:10:"DH-0037/11";s:10:"reciv_date";s:10:"04/01/2011";s:12:"current_date";s:10:"2011-01-04";s:9:"deli_date";s:10:"09/01/2011";s:12:"patient_name";s:11:"Mrs. Joshna";s:3:"age";s:6:"65 Yrs";s:6:"ref_by";s:24:"Sk. Md. Abu Zafar, FCPS ";s:3:"sex";s:6:"Female";s:13:"hospital_name";s:22:"Gastro Liver Hospital ";s:13:"specimen_name";s:20:"Tissue from stomach ";s:4:"note";s:43:"<b>Result of immunostaining for LCA</b><br>";s:15:"reporting_board";s:208:"Tumor cell show strong immunoreactivity for LCA

 

 

<br><br>Conclusion: Considering the immunostaining result.

This case should be treated as a case of malignant
non-Hodgkins lymphoma. 

<br>";s:10:"add_doctor";s:1:"0";}i:77;O:8:"stdClass":15:{s:7:"immu_id";s:3:"250";s:5:"sl_no";s:1:".";s:7:"test_id";s:11:"MH - 844/11";s:10:"reciv_date";s:10:"19/01/2011";s:12:"current_date";s:10:"2011-01-19";s:9:"deli_date";s:10:"12/02/2011";s:12:"patient_name";s:13:"Shanti Sahani";s:3:"age";s:6:"58 Yrs";s:6:"ref_by";s:0:"";s:3:"sex";s:6:"Female";s:13:"hospital_name";s:0:"";s:13:"specimen_name";s:20:"Tissue from  Breast ";s:4:"note";s:61:"<b>Her -2 Immunostaining Report
for Block No. 03</b>

<br>";s:15:"reporting_board";s:306:"More than 10 %&nbsp; tumor cells show moderate complete membrane
staining for Her-2.

<span>&nbsp;&nbsp;&nbsp;&nbsp;&nbsp;&nbsp; <br><br>Score &nbsp;- 2+ </span>

&nbsp;

<span>&nbsp;&nbsp;&nbsp;&nbsp;&nbsp;&nbsp; <br>Summary: &nbsp;&nbsp;Her - 2 - &nbsp;Border line </span>

<b>&nbsp;</b>

<br>";s:10:"add_doctor";s:1:"0";}i:78;O:8:"stdClass":15:{s:7:"immu_id";s:3:"251";s:5:"sl_no";s:1:" ";s:7:"test_id";s:11:"MH - 845/11";s:10:"reciv_date";s:10:"19/01/2011";s:12:"current_date";s:10:"2011-01-19";s:9:"deli_date";s:10:"12/02/2011";s:12:"patient_name";s:9:"Moni Moti";s:3:"age";s:6:"50 Yrs";s:6:"ref_by";s:0:"";s:3:"sex";s:6:"Female";s:13:"hospital_name";s:0:"";s:13:"specimen_name";s:20:"Tissue from  Breast ";s:4:"note";s:60:"<b>Her -2 Immunostaining Report
of Block No. 16</b>

<br>";s:15:"reporting_board";s:260:"More than 10 %&nbsp;
tumor cells show faint membrane staining for Her-2.

<span>&nbsp;&nbsp;&nbsp;&nbsp; <br><br>&nbsp;Score &nbsp;-1+ </span>

&nbsp;

<span>&nbsp;&nbsp;&nbsp; <br>Summary: &nbsp;&nbsp;Her - 2 - Negative </span>

<b>&nbsp;</b>

<br>";s:10:"add_doctor";s:1:"0";}i:79;O:8:"stdClass":15:{s:7:"immu_id";s:3:"252";s:5:"sl_no";s:1:" ";s:7:"test_id";s:10:"MH  846/11";s:10:"reciv_date";s:10:"19/01/2011";s:12:"current_date";s:10:"2011-01-19";s:9:"deli_date";s:10:"12/02/2011";s:12:"patient_name";s:4:"Afia";s:3:"age";s:6:"45 Yrs";s:6:"ref_by";s:0:"";s:3:"sex";s:6:"Female";s:13:"hospital_name";s:0:"";s:13:"specimen_name";s:20:"Tissue from  Breast ";s:4:"note";s:63:"<b>Her -2 Immunostaining Report
for Block No. 1645</b>

<br>";s:15:"reporting_board";s:292:"<span>More than 10 %&nbsp; tumor cells show
moderate complete membrane staining for <br><br>Her-2.</span>

<span>&nbsp;&nbsp;&nbsp;&nbsp;&nbsp;&nbsp;&nbsp;&nbsp;&nbsp;&nbsp;&nbsp; <br>Score &nbsp;- 2+ </span>

&nbsp;

<span>Summary: &nbsp; <br>Her - 2 &nbsp;Border line </span>

<br>";s:10:"add_doctor";s:1:"0";}i:80;O:8:"stdClass":15:{s:7:"immu_id";s:3:"253";s:5:"sl_no";s:2:"90";s:7:"test_id";s:10:"MH  847/11";s:10:"reciv_date";s:10:"19/01/2011";s:12:"current_date";s:10:"2011-01-19";s:9:"deli_date";s:10:"12/02/2011";s:12:"patient_name";s:6:"Champa";s:3:"age";s:6:"38 Yrs";s:6:"ref_by";s:0:"";s:3:"sex";s:6:"Female";s:13:"hospital_name";s:0:"";s:13:"specimen_name";s:20:"Tissue from  Breast ";s:4:"note";s:62:"<b>Her -2 Immunostaining Report
of Block No. 1651</b>

<br>";s:15:"reporting_board";s:297:"<span>Less than 10 %&nbsp; tumor cells show faint
&nbsp;membrane staining for <br><br>Her-2.</span>

<span>&nbsp;&nbsp;&nbsp;&nbsp;&nbsp;&nbsp;&nbsp;&nbsp;&nbsp;&nbsp;&nbsp; <br><br>Score &nbsp;&nbsp;-&nbsp; 0 </span>

&nbsp;

Summary: &nbsp;&nbsp;HER-2 - Negative 

<b>&nbsp;</b>

<br>";s:10:"add_doctor";s:1:"0";}i:81;O:8:"stdClass":15:{s:7:"immu_id";s:3:"254";s:5:"sl_no";s:2:"43";s:7:"test_id";s:17:"MIHC14:-01701-704";s:10:"reciv_date";s:10:"31/01/2014";s:12:"current_date";s:10:"2014-01-31";s:9:"deli_date";s:10:"16/02/2014";s:12:"patient_name";s:12:"Marium Begum";s:3:"age";s:6:"60 Yrs";s:6:"ref_by";s:49:"Sajjad Mohammad Yusuff, MCPS, FCPS (Radiotherapy)";s:3:"sex";s:6:"Female";s:13:"hospital_name";s:26:"Chittagon Lab, Chittagong.";s:13:"specimen_name";s:52:"Tissue from cervical lymph node. Case No: MH14-01135";s:4:"note";s:120:"Result of Immunostaining  for CD3 , CD20 , CD15 &amp; CD30&nbsp; of Case No:MH14-01135, from DHL, Path. Lab. Dhaka. <br>";s:15:"reporting_board";s:427:"<b>CD3 :</b> Scattered lymphoid cells show positive staining for<b> CD3.</b><br><br><b>CD20 :</b> Atypical lymphoid cells show positive staining for <b>CD20.</b><br><br><b>CD15 :</b> Scattered CD15 positive cells are seen. <br><br><b>CD30 :</b> Scattered CD30 positive cells are seen. <br><br><h4><b><i>Conclusion: Immunostaining results favor the diagnosis of Non-Hodkin's lymphoma of&nbsp; "B"&nbsp; cell origin.</i></b></h4>";s:10:"add_doctor";s:1:"0";}i:82;O:8:"stdClass":15:{s:7:"immu_id";s:3:"257";s:5:"sl_no";s:1:".";s:7:"test_id";s:13:"MH-2334-38/11";s:10:"reciv_date";s:10:"19/02/2011";s:12:"current_date";s:10:"2011-02-19";s:9:"deli_date";s:10:"25/02/2011";s:12:"patient_name";s:18:"Mrs. Farhana Dina ";s:3:"age";s:6:"35 Yrs";s:6:"ref_by";s:10:"P.A. Banu ";s:3:"sex";s:6:"Female";s:13:"hospital_name";s:0:"";s:13:"specimen_name";s:37:"Lymph node from Rt. inguinal region. ";s:4:"note";s:104:"<b>Result of immunostaining for CD3, CD20, CD15, CD30,
LCA &amp; CK of case no. MH-1960/11.</b>

<br>";s:15:"reporting_board";s:999:"<span><b>CD3</b>&nbsp;&nbsp; &nbsp;:&nbsp; &nbsp;Good number of lymphoid cells show positive
staining. </span>

<span><b><br><br>CD20</b>&nbsp; :&nbsp;&nbsp;
Many lymphoid cells show positive staining. </span>

<span><b><br><br>CD15</b>&nbsp; :&nbsp;&nbsp;
Scattered large atypical cell show positive staining. </span>

<span><b><br><br>CD30</b>&nbsp; :&nbsp;&nbsp;
Scattered large atypical cells show positive staining. </span>

<span><b><br><br>LCA (CD</b><b>45</b><b>) </b>: All the lymphoid cells
show  positive staining except those scattered&nbsp; </span>

large
atypical&nbsp; cells showing positive staining
for CD15 &amp; CD30. 

<span>&nbsp;<b><br><br>CK</b>&nbsp;&nbsp;&nbsp;&nbsp;&nbsp; :&nbsp;&nbsp;
Sections show no staining for CK. </span>

&nbsp;

<br><br><h4><b><i>Conclusion: Considering the
immunostaining results, this case should be treated as&nbsp; 

</i></b><b><i>Hodgkins disease. </i></b><b><i>

&nbsp;

&nbsp;

</i></b></h4><br>

<br><br>";s:10:"add_doctor";s:1:"0";}i:83;O:8:"stdClass":15:{s:7:"immu_id";s:3:"261";s:5:"sl_no";s:1:" ";s:7:"test_id";s:10:"MH-5220/11";s:10:"reciv_date";s:10:"07/04/2011";s:12:"current_date";s:10:"2011-04-07";s:9:"deli_date";s:10:"10/04/2011";s:12:"patient_name";s:21:"Mrs. Jahan Ara Begum ";s:3:"age";s:6:"47 Yrs";s:6:"ref_by";s:27:"Lt. Col. M. S. Sarwar Alam ";s:3:"sex";s:6:"Female";s:13:"hospital_name";s:0:"";s:13:"specimen_name";s:37:"Tissue from Lt. submandibular growth ";s:4:"note";s:93:"Result of immunostaining
for&nbsp; CD20 &amp;&nbsp; CD3 of case No.&nbsp; MH 4035/11

<br>";s:15:"reporting_board";s:360:"CD20  Most of the lymphoid
cells show positive staining for CD20.

&nbsp;

&nbsp;

<br><br>CD3  Scattered lymphoid
cells show positive staining.

&nbsp;

&nbsp;

&nbsp;

<span><br><br>Conclusion:&nbsp; Considering the immunostaining results this
case should be treated as a case of&nbsp;</span>CD20 positive, B cell lymphoma.

&nbsp;

<br>";s:10:"add_doctor";s:1:"0";}i:84;O:8:"stdClass":15:{s:7:"immu_id";s:3:"264";s:5:"sl_no";s:1:" ";s:7:"test_id";s:11:"MH- 7315/11";s:10:"reciv_date";s:10:"08/05/2011";s:12:"current_date";s:10:"2011-05-08";s:9:"deli_date";s:10:"16/05/2011";s:12:"patient_name";s:10:"Mrs. Asia ";s:3:"age";s:6:"40 Yrs";s:6:"ref_by";s:20:"Shamsun Nahar, FCPS ";s:3:"sex";s:6:"Female";s:13:"hospital_name";s:0:"";s:13:"specimen_name";s:32:"Tissue from cervical lymph node ";s:4:"note";s:92:"<b>Result of
immunostaining for CD20 &amp; CD3 of case no. MH11-6898, Block (1)</b>

<br>";s:15:"reporting_board";s:358:"CD20:&nbsp;&nbsp; Tumor cells show strong
reactivity. 

<span><br><br>CD3&nbsp; :&nbsp;&nbsp; Scattered lymphoid cells show positive
staining.</span>

&nbsp;&nbsp;

\<br><br>Summary of results: 

&nbsp;

Considering
the immunostaining pattern, this case should be treated as a case of CD20
positive B-cell lymphoma. 

&nbsp;

&nbsp;

<br>";s:10:"add_doctor";s:1:"0";}i:85;O:8:"stdClass":15:{s:7:"immu_id";s:3:"266";s:5:"sl_no";s:3:"059";s:7:"test_id";s:17:"MIHC14:-02526-528";s:10:"reciv_date";s:10:"12/02/2014";s:12:"current_date";s:10:"2014-02-12";s:9:"deli_date";s:10:"16/02/2014";s:12:"patient_name";s:15:"Mrs. Rubi Akter";s:3:"age";s:6:"16 Yrs";s:6:"ref_by";s:0:"";s:3:"sex";s:6:"Female";s:13:"hospital_name";s:31:"Chittagong Lab Ltd., Chittagong";s:13:"specimen_name";s:55:"Tissue from  left tonsillar growth. Case No: MH14-00396";s:4:"note";s:120:"Result of Immunostaining  for LCA , CK &amp; CD20 of Case No: MH14-00396, Block No: (02) from DHL Path. Lab. Dhaka. <br>";s:15:"reporting_board";s:373:"<b> LCA :</b> Atypical lymphoid cells show positive staining for <b>LCA.</b><br><br><b>CK :</b> Tumor cells show no specific staining for <b>CK.</b><br><br><b>CD20 :</b> Atypical lymphoid cells show positive staining for <b>CD20.</b><br><br><h4><b><i>Conclusion: Immunostaining results confirm the diagnosis of Non-Hodgkin's lymphoma of "B"&nbsp; cell origin. </i></b></h4>";s:10:"add_doctor";s:1:"0";}i:86;O:8:"stdClass":15:{s:7:"immu_id";s:3:"268";s:5:"sl_no";s:3:"066";s:7:"test_id";s:13:"MIHC14:-02319";s:10:"reciv_date";s:10:"10/02/2014";s:12:"current_date";s:10:"2014-02-10";s:9:"deli_date";s:10:"16/02/2014";s:12:"patient_name";s:17:"Mrs. Shilpi Begum";s:3:"age";s:6:"23 Yrs";s:6:"ref_by";s:6:"Urme. ";s:3:"sex";s:6:"Female";s:13:"hospital_name";s:33:"Chevron Clinical Lab , Chittagong";s:13:"specimen_name";s:54:"Tissue from Lt. ovary and omentum. Case No: MH14-2319.";s:4:"note";s:104:"Result of Immunostaining  for CK &amp; EMA ,of Case No: MH14- 2319. from DHL, Path. Lab. Dhaka. <br><br>";s:15:"reporting_board";s:49:"<b>CK :</b><br><br><br><br><b>&nbsp;EMA :</b><br>";s:10:"add_doctor";s:1:"0";}i:87;O:8:"stdClass":15:{s:7:"immu_id";s:3:"271";s:5:"sl_no";s:1:" ";s:7:"test_id";s:13:"MH11-13031-32";s:10:"reciv_date";s:10:"03/08/2011";s:12:"current_date";s:10:"2011-08-03";s:9:"deli_date";s:10:"06/08/2011";s:12:"patient_name";s:7:"Promila";s:3:"age";s:6:"50 Yrs";s:6:"ref_by";s:7:"Rangpur";s:3:"sex";s:6:"Female";s:13:"hospital_name";s:0:"";s:13:"specimen_name";s:7:"Rangpur";s:4:"note";s:109:"<b><u>Immunostaining results of Case No- HN:R 0/1107059/22
from&nbsp; Kyamch Cancer
 Center</u></b>

<br>";s:15:"reporting_board";s:1487:"<span><b>LCA&nbsp;&nbsp;
</b><span>: Tumor cells show no staining for&nbsp;
LCA. <br></span></span>

<span><b>CK</b>&nbsp;&nbsp;&nbsp;&nbsp;&nbsp; :&nbsp; Tumor
cells show no staining for CK. </span>

&nbsp;

<br>Chromogranin A- Tumor cells show positive granular cytoplasmic staining.

<br>HMB45  Tumor cells show no staining.

&nbsp;

<br><br>Summary of results :-&nbsp; 

<span><br>LCA&nbsp;&nbsp;&nbsp;&nbsp;&nbsp;&nbsp;&nbsp;&nbsp; &nbsp;&nbsp;&nbsp;&nbsp;&nbsp;&nbsp;&nbsp;&nbsp;&nbsp;&nbsp;&nbsp; : Negative.</span>

<span>&nbsp;&nbsp;&nbsp;&nbsp;&nbsp;&nbsp;&nbsp;&nbsp;&nbsp;&nbsp;&nbsp;&nbsp;&nbsp;&nbsp;&nbsp;&nbsp;&nbsp;&nbsp; <br>CK&nbsp;&nbsp;&nbsp;&nbsp;&nbsp;&nbsp;&nbsp;&nbsp;&nbsp;&nbsp; &nbsp;&nbsp;&nbsp;&nbsp;&nbsp;&nbsp;&nbsp;&nbsp;&nbsp;&nbsp;&nbsp; :
Negative</span>

<span>&nbsp;&nbsp;&nbsp;&nbsp;&nbsp;&nbsp;&nbsp;&nbsp;&nbsp;&nbsp;&nbsp;&nbsp;&nbsp;&nbsp;&nbsp;&nbsp;&nbsp;&nbsp; <br>Chromogranin A-&nbsp;&nbsp; : Positive</span>

<span>&nbsp;&nbsp;&nbsp;&nbsp;&nbsp;&nbsp;&nbsp;&nbsp;&nbsp;&nbsp;&nbsp;&nbsp;&nbsp;&nbsp;&nbsp;&nbsp;&nbsp;&nbsp;&nbsp; <br>HMB45 &nbsp; &nbsp;&nbsp;&nbsp;&nbsp;&nbsp;&nbsp;&nbsp;&nbsp;&nbsp;&nbsp;&nbsp; &nbsp;: Negative</span>

&nbsp;

<br>Conclusion:
Considering the immunostaining results this tumor is considered neuroendocrine
origin, 

possibly&nbsp; malignant carcinoid.Please correlated with
clinical and other investigation findings for the management of&nbsp;patient.

&nbsp;

<br>";s:10:"add_doctor";s:1:"0";}i:88;O:8:"stdClass":15:{s:7:"immu_id";s:3:"277";s:5:"sl_no";s:1:" ";s:7:"test_id";s:15:"MICH11-17524-27";s:10:"reciv_date";s:10:"19/10/2011";s:12:"current_date";s:10:"2011-10-19";s:9:"deli_date";s:10:"23/10/2011";s:12:"patient_name";s:12:"Mrs.  Nasima";s:3:"age";s:6:"35 Yrs";s:6:"ref_by";s:10:"P.A. Banu ";s:3:"sex";s:6:"Female";s:13:"hospital_name";s:3:"DHL";s:13:"specimen_name";s:0:"";s:4:"note";s:86:"<b>Result of immunostaining for CD3, CD20, CD15, CD30, of
case no. LI-169</b>

<br>";s:15:"reporting_board";s:635:"C<span><b>D3</b><span>&nbsp;&nbsp;&nbsp; :&nbsp;&nbsp;
About 50% of the cells are CD3 positive cells. <br><br></span></span><span><b>CD20</b>&nbsp; :&nbsp;&nbsp;
Rest of the cells show CD20 staining with scattered well found
follicles.</span>

<span><b><br><br>CD15</b>&nbsp; :&nbsp;&nbsp;
Scattered atypical cells show positive staining for CD15.</span>

<span><b><br><br>CD30</b>&nbsp; :&nbsp;&nbsp;
Most of cells resembling RS cells are positive for CD30. </span>

&nbsp;
<br><br>Summary: Considering the immunostaining
results, this case can be treated as a case of&nbsp; Hodgkins disease. 

&nbsp;

&nbsp;

<br>";s:10:"add_doctor";s:1:"0";}i:89;O:8:"stdClass":15:{s:7:"immu_id";s:3:"278";s:5:"sl_no";s:1:" ";s:7:"test_id";s:15:"MICH11-17333-34";s:10:"reciv_date";s:10:"16/10/2011";s:12:"current_date";s:10:"2011-10-16";s:9:"deli_date";s:10:"24/10/2011";s:12:"patient_name";s:21:"Mrs.  Hosne Ara Begum";s:3:"age";s:6:"50 Yrs";s:6:"ref_by";s:27:"Sajjad Mohammad Yusuf, FCPS";s:3:"sex";s:6:"Female";s:13:"hospital_name";s:9:"CSCR, Ctg";s:13:"specimen_name";s:19:"Inguinal lymph node";s:4:"note";s:92:"<b>Result of immunostaining for CD3, CD20, of case no. MH11-16721,Block
No-(02)</b>

<br>";s:15:"reporting_board";s:482:"<span><b>CD3</b> :&nbsp; Parafollicular lymphocytes and scattered
lymphocytes in the follicles are CD3 positive. </span>

<b>&nbsp;</b>

<span><b><br><br>CD20</b> :&nbsp;&nbsp; Most of the lymphocytes in the follicles are
positive of &nbsp;CD20.</span>

&nbsp;

<span><span><br><br>Conclusion: Considering the
immunostaining results, this case should be considered as a case of &nbsp;follicular hyperplasia, rather than follicular
lymphoma. </span><b></b></span>

<br>";s:10:"add_doctor";s:1:"0";}i:90;O:8:"stdClass":15:{s:7:"immu_id";s:3:"279";s:5:"sl_no";s:3:"069";s:7:"test_id";s:16:"MIHC14:02663-664";s:10:"reciv_date";s:10:"15/02/2014";s:12:"current_date";s:10:"2014-02-15";s:9:"deli_date";s:10:"23/02/2014";s:12:"patient_name";s:18:"Mrs. Shahida Begum";s:3:"age";s:6:"53 Yrs";s:6:"ref_by";s:12:"Yousuf Ali. ";s:3:"sex";s:6:"Female";s:13:"hospital_name";s:49:"Ahsania Mission Cancer & General Hospital , Dhaka";s:13:"specimen_name";s:41:"Tissue from stomach. Case No: DH13-2570. ";s:4:"note";s:98:"Result of Immunostaining  for CD3 &amp; CD20 of Case No: DH13-2570 from DHL Path. Lab. Dhaka. <br>";s:15:"reporting_board";s:321:"<b>CD3:</b>&nbsp; Scattered lymphoid cells show positive staining for<b> CD3.</b><br><br><b>CD20:</b> Majority of the atypical lymphoid cells show positive staining for<b> CD20.</b><br><br><h4><b><i>Conclusion:&nbsp; Immunostaining results confirm the diagnosis of non-Hodgkin's lymphoma of "B" cell origin. </i></b></h4>";s:10:"add_doctor";s:1:"0";}i:91;O:8:"stdClass":15:{s:7:"immu_id";s:3:"283";s:5:"sl_no";s:1:" ";s:7:"test_id";s:14:"MH-20307-10/11";s:10:"reciv_date";s:10:"06/12/2011";s:12:"current_date";s:10:"2011-12-06";s:9:"deli_date";s:10:"10/12/2011";s:12:"patient_name";s:24:"Mr. Sharat Kumar Singha ";s:3:"age";s:6:"54 Yrs";s:6:"ref_by";s:26:"Md. Jannatul Islam Jinnah ";s:3:"sex";s:6:"Female";s:13:"hospital_name";s:11:"DHL, C- 513";s:13:"specimen_name";s:18:"Rt. hemicolectomy ";s:4:"note";s:100:"<b><u>Result of immunostaining for LCA, CK, CD3 &amp; DC20
of case no. MH-19765/11.</u></b>

<br>";s:15:"reporting_board";s:724:"<span><b>LCA (CD</b><b>45</b><b>) </b>: Majority of the tumor
cells show positive staining.<br><br></span><span><b>CK</b>&nbsp;&nbsp;&nbsp;&nbsp;&nbsp; :&nbsp;&nbsp;
Tumor cells show no staining.</span>

<br><br><span><b>CD3</b>&nbsp;&nbsp;&nbsp; :&nbsp;&nbsp; Scattered
lymphoid cells show positive staining.</span>

<br><br><span><b>CD20</b>&nbsp; :&nbsp;&nbsp; Majority
of the tumor cells show positive staining. </span>

&nbsp;

<br><br>Conclusion: Considering the
immunostaining results, this case can be treated as well as a case of non-Hodgkins lymphoma of
B cell origin, rather than carcinoma. 

&nbsp;

&nbsp;

&nbsp;

&nbsp;

&nbsp;

&nbsp;

&nbsp;

&nbsp;

&nbsp;

&nbsp;

<br>";s:10:"add_doctor";s:1:"0";}i:92;O:8:"stdClass":15:{s:7:"immu_id";s:3:"284";s:5:"sl_no";s:2:"  ";s:7:"test_id";s:14:"MH-20307-10/11";s:10:"reciv_date";s:10:"06/12/2011";s:12:"current_date";s:10:"2011-12-06";s:9:"deli_date";s:10:"10/12/2011";s:12:"patient_name";s:24:"Mr. Sharat Kumar Singha ";s:3:"age";s:6:"54 Yrs";s:6:"ref_by";s:26:"Md. Jannatul Islam Jinnah ";s:3:"sex";s:6:"Female";s:13:"hospital_name";s:11:"DHL, C- 513";s:13:"specimen_name";s:18:"Rt. hemicolectomy ";s:4:"note";s:100:"<b><u>Result of immunostaining for LCA, CK, CD3 &amp; DC20
of case no. MH-19765/11.</u></b>

<br>";s:15:"reporting_board";s:658:"<span><b>LCA&nbsp;
&nbsp;</b>: Majority
of the tumor cells show positive staining. </span>

<span><b><br><br>CK</b>&nbsp;&nbsp;&nbsp;&nbsp;&nbsp; :&nbsp;&nbsp;
Tumor cells show no staining.</span>

<span><b><br><br>CD3</b>&nbsp;&nbsp;&nbsp; :&nbsp;&nbsp;
Scattered lymphoid cells show positive staining.</span>

<span><b><br><br>CD20</b>&nbsp; :&nbsp;&nbsp;
Majority of the tumor cells show positive staining. </span>

&nbsp;

<br><br>Conclusion: Considering the
immunostaining results this case can be treated as a case of&nbsp; non-Hodgkins lymphoma of
B cell origin, rather than carcinoma. 

&nbsp;

&nbsp;

&nbsp;

&nbsp;

<br>";s:10:"add_doctor";s:1:"0";}i:93;O:8:"stdClass":15:{s:7:"immu_id";s:3:"286";s:5:"sl_no";s:3:"086";s:7:"test_id";s:17:"MIHC14:-03578-580";s:10:"reciv_date";s:10:"26/02/2014";s:12:"current_date";s:10:"2014-02-26";s:9:"deli_date";s:10:"02/03/2014";s:12:"patient_name";s:18:"Mrs. Sabekun Nahar";s:3:"age";s:6:"34 Yrs";s:6:"ref_by";s:0:"";s:3:"sex";s:6:"Female";s:13:"hospital_name";s:41:"Chittagong Belle Vue Unit-1, Chittagong. ";s:13:"specimen_name";s:51:"Tissue from mesenteric growth. Case No: MH14-02901.";s:4:"note";s:153:"Result of Immunostaining  for&nbsp; LCA , CD3,&nbsp; CD20&nbsp; &amp; BCL-2&nbsp; of Case No: MH14-02901. Block No: (03). from DHL, Path. Lab. Dhaka.<br>";s:15:"reporting_board";s:550:"<b>LCA :</b> Lymphoid cells show positive staining for <b>LCA. </b><br><br><b>CD3 :</b> Perifollicular cells show positive&nbsp; staining for <b>CD3. </b><br><br><b>CD20 :</b> Mostly follicular cells show positive staining for <b>CD20. </b><br><br><b>BCL-2&nbsp; :</b> Follicular cells and scattered perifollicular cells show positive staining for&nbsp; <b>BCL-2 .<br><br></b><h3><b><i>Conclusion: Immunostaining results favor the diagnosis of non-Hodgkin's lymphoma of low grade follicular type (B cell origin).</i> </b></h3><br><br><br><br><br><br>";s:10:"add_doctor";s:1:"0";}i:94;O:8:"stdClass":15:{s:7:"immu_id";s:3:"287";s:5:"sl_no";s:2:"88";s:7:"test_id";s:13:"MIHC14:-03317";s:10:"reciv_date";s:10:"23/02/2014";s:12:"current_date";s:10:"2014-02-23";s:9:"deli_date";s:10:"02/03/2014";s:12:"patient_name";s:18:"Mst. Latifa Begum.";s:3:"age";s:6:"55 Yrs";s:6:"ref_by";s:25:" Hera Mbo Kumar Roy,MBBS.";s:3:"sex";s:6:"Female";s:13:"hospital_name";s:40:"New Life Clinic & Nursing Home, Rangpur.";s:13:"specimen_name";s:33:"Tissue from omental. Case No:____";s:4:"note";s:68:"Result of Immunostaining  for CD68 &amp; CD138 of Case No: ____.<br>";s:15:"reporting_board";s:47:"<b>CD68 :</b><br><br><br><br><b>CD138 :</b><br>";s:10:"add_doctor";s:1:"0";}i:95;O:8:"stdClass":15:{s:7:"immu_id";s:3:"288";s:5:"sl_no";s:3:"087";s:7:"test_id";s:13:"MIHC14:-03232";s:10:"reciv_date";s:10:"26/02/2014";s:12:"current_date";s:10:"2014-02-26";s:9:"deli_date";s:10:"02/03/2014";s:12:"patient_name";s:12:"Rokeya Begum";s:3:"age";s:7:"50 Yrs.";s:6:"ref_by";s:0:"";s:3:"sex";s:6:"Female";s:13:"hospital_name";s:39:"Mother Clinic & Nursing Home, Kurigram.";s:13:"specimen_name";s:36:"Tissue from left leg. Case No: ____-";s:4:"note";s:63:"Result of Immunostaining  for CD68 &amp; HMB45 of Case No: ____";s:15:"reporting_board";s:53:"<b>CD68 :</b><br><br><br><br><b>&nbsp;HMB45 :</b><br>";s:10:"add_doctor";s:1:"0";}i:96;O:8:"stdClass":15:{s:7:"immu_id";s:3:"291";s:5:"sl_no";s:1:" ";s:7:"test_id";s:16:"MIHC:4497-500/12";s:10:"reciv_date";s:10:"14/03/2012";s:12:"current_date";s:10:"2012-03-14";s:9:"deli_date";s:10:"18/03/2012";s:12:"patient_name";s:19:"Mrs. Rabeya Khatun ";s:3:"age";s:6:"60 Yrs";s:6:"ref_by";s:15:"Anowar Hossain ";s:3:"sex";s:6:"Female";s:13:"hospital_name";s:24:"Kurigram Sadar Hospital ";s:13:"specimen_name";s:23:"Tissue from thigh (Rt.)";s:4:"note";s:86:"<b><u>Result of immunostaining for LCA, CK, CD3, CD20
of case no H12-4124</u></b><br>";s:15:"reporting_board";s:657:"<span><b>LCA</b>&nbsp;&nbsp;&nbsp; :&nbsp;&nbsp; Tumor
cell show positive staining.</span>

<span><b><span><br><br>CK&nbsp;&nbsp;&nbsp;&nbsp;&nbsp;&nbsp; </span></b>:<b>&nbsp;&nbsp; </b>Tumor cell show no staining. </span>

<span><b><br><br>CD3</b><span>&nbsp;&nbsp;&nbsp; :&nbsp;&nbsp;
Scattered lymphoid cells show positive staining. <br><br></span></span><span><b>CD20</b>&nbsp; :&nbsp;&nbsp;&nbsp;
Most of the tumor cells show positive staining. </span><u><b><br></b></u> <span><br>Conclusion:-&nbsp; Considering the immunostaining results, this
case can be treated as non-Hodgkins&nbsp;</span>lymphoma of&nbsp; B cell origin. 

&nbsp;

<br>";s:10:"add_doctor";s:1:"0";}i:97;O:8:"stdClass":15:{s:7:"immu_id";s:3:"292";s:5:"sl_no";s:1:" ";s:7:"test_id";s:13:"MH-6505-06/12";s:10:"reciv_date";s:9:"07/042012";s:12:"current_date";s:10:"2012-04-07";s:9:"deli_date";s:10:"22/04/2012";s:12:"patient_name";s:20:"Mrs. Mahmuda Khatun ";s:3:"age";s:6:"80 Yrs";s:6:"ref_by";s:17:"Md. Mukitul Huda ";s:3:"sex";s:6:"Female";s:13:"hospital_name";s:3:"DHL";s:13:"specimen_name";s:42:"Tissue from Rt. submandibular lymph node. ";s:4:"note";s:91:"<b>Result of
immunostaining for CD3, CD20, CD15, CD30 of case no. MH 12-06160.</b>

<br>";s:15:"reporting_board";s:565:"<span><b>CD3</b>&nbsp;&nbsp;&nbsp; :&nbsp;&nbsp;
Scattered cell show positive staining. </span>

<span><b><br><br>CD20</b><span>&nbsp; :&nbsp;&nbsp;
Scattered cells show positive staining. <br><br></span></span><span><b>CD15</b><span>&nbsp; :&nbsp;&nbsp;
Good number of CD15 positive cells are detected.<br><br></span></span><span><b>CD30</b>&nbsp; :&nbsp;&nbsp; Small
number of cells show CD30 staining. </span>

&nbsp;

&nbsp;
<br><br>Conclusion: Considering the
immunostaining results, we suggest to treat the case as&nbsp; Hodgkins disease. 

<br>";s:10:"add_doctor";s:1:"0";}i:98;O:8:"stdClass":15:{s:7:"immu_id";s:3:"294";s:5:"sl_no";s:1:" ";s:7:"test_id";s:14:"MMIHC12  06156";s:10:"reciv_date";s:10:"03/04/2012";s:12:"current_date";s:10:"2012-04-03";s:9:"deli_date";s:10:"03/05/2012";s:12:"patient_name";s:16:"Mrs. Rejia Begum";s:3:"age";s:6:"16 Yrs";s:6:"ref_by";s:46:"Mahtab Uddin Ahmed, MD (Pathology) Thesis part";s:3:"sex";s:6:"Female";s:13:"hospital_name";s:8:"S.S.M.C.";s:13:"specimen_name";s:27:"One paraffin block No. (20)";s:4:"note";s:176:"Result of CD30 immunostaining of sections prepared
from paraffin block ID Code-(20), supplied&nbsp;
by&nbsp; Dr. Mahtab Uddin Ahmed,
MD(Pathology)&nbsp; Thesis part.

<br>";s:15:"reporting_board";s:135:"<span><b>CD30</b>&nbsp; -&nbsp;
CD30&nbsp; stained cells are seen.</span>&nbsp;

<br><br>&nbsp;Note: Tissue is poorly fixed.

<br>";s:10:"add_doctor";s:1:"0";}i:99;O:8:"stdClass":15:{s:7:"immu_id";s:3:"301";s:5:"sl_no";s:3:"100";s:7:"test_id";s:13:"MIHC14:-04112";s:10:"reciv_date";s:10:"06/03/2014";s:12:"current_date";s:10:"2014-03-06";s:9:"deli_date";s:10:"09/03/2014";s:12:"patient_name";s:14:"Jannatul Busra";s:3:"age";s:8:"9 M 25 D";s:6:"ref_by";s:32:"Al-Amin, (Assistant Registrarar)";s:3:"sex";s:6:"Female";s:13:"hospital_name";s:25:"NICRH, Mohakhali, Dhaka. ";s:13:"specimen_name";s:56:"Soft tissue swelling over Lt. flank. Case No: MH14-03407";s:4:"note";s:107:"Result of Immunostaining  for CD99 of Case No: MH14-03407, Block No: (01) from DHL , Path. Lab. Dhaka. <br>";s:15:"reporting_board";s:224:"<b>CD99 :</b> Neoplastic cells show weak membrane staining for<b> CD99.</b><br><br><br><h3><b><i>Conclusion: Immunostaining results favor the diagnosis of Ewing's sarcoma / PNET.</i></b></h3><br><br><br><b>&nbsp;</b><br><br>";s:10:"add_doctor";s:1:"0";}i:100;O:8:"stdClass":15:{s:7:"immu_id";s:3:"302";s:5:"sl_no";s:3:"095";s:7:"test_id";s:17:"MIHC14:-03902-903";s:10:"reciv_date";s:10:"03/03/2014";s:12:"current_date";s:10:"2014-03-03";s:9:"deli_date";s:10:"16/03/2014";s:12:"patient_name";s:9:"Miss. Mim";s:3:"age";s:6:"11 Yrs";s:6:"ref_by";s:47:"Parvin Akhter Banu, Chief Consultant (Oncology)";s:3:"sex";s:6:"Female";s:13:"hospital_name";s:49:"W-521/4, Delta Medical College & Hospital, Dhaka.";s:13:"specimen_name";s:67:"Tissue from infratemporal lesion. Case No: MH14-03386 &  (140-1389)";s:4:"note";s:151:"Result of Immunostaining  for&nbsp; LCA &amp; CD99 of Case No: MH14-03386 &amp; (140-1389) from DHL, Path. Lab. Dhaka. &amp; The Laboratory Dhaka. <br>";s:15:"reporting_board";s:285:"<b>LCA:</b> Tumor cells show no staining for <b>LCA.</b><br><br><b>CD99 :</b>&nbsp; Atypical round cells show positive staining for <b>CD99.</b><br><br><br><h3><b><i>Conclusion: Immunostaining results favor the diagnosis of Ewing's sarcoma /&nbsp;PNET.</i></b></h3><br><br><br><br><br>";s:10:"add_doctor";s:1:"0";}i:101;O:8:"stdClass":15:{s:7:"immu_id";s:3:"305";s:5:"sl_no";s:0:"";s:7:"test_id";s:12:"MIHC12  6155";s:10:"reciv_date";s:10:"03/04/2012";s:12:"current_date";s:10:"2012-04-03";s:9:"deli_date";s:10:"05/05/2012";s:12:"patient_name";s:17:"Mrs. Amena Tazrin";s:3:"age";s:6:"16 Yrs";s:6:"ref_by";s:48:"Mahtab Uddin Ahmed,  MD. (Pathology) Thesis part";s:3:"sex";s:6:"Female";s:13:"hospital_name";s:8:"S.S.M.C.";s:13:"specimen_name";s:28:"One paraffin block No:  (19)";s:4:"note";s:188:"<b>&nbsp;</b>

Result of CD30 immunostaining of sections prepared
from paraffin block ID Code-(19), supplied&nbsp;
by&nbsp; Dr. Mahtab Uddin Ahmed, MD (Pathology)
Thesis part.

<br>";s:15:"reporting_board";s:226:"<span><b>CD30</b>&nbsp; -&nbsp;&nbsp; Large
atypical cells resembling RS cells show&nbsp;
positive staining for CD30&nbsp;</span><b><br><br>&nbsp;</b>

<span><b>Note:&nbsp;&nbsp; </b>Tissue is poorly fixed. </span>

<br>";s:10:"add_doctor";s:1:"0";}i:102;O:8:"stdClass":15:{s:7:"immu_id";s:3:"306";s:5:"sl_no";s:1:" ";s:7:"test_id";s:12:"MIHC12  6158";s:10:"reciv_date";s:10:"03/04/2012";s:12:"current_date";s:10:"2012-04-03";s:9:"deli_date";s:10:"05/05/2012";s:12:"patient_name";s:14:"Mrs. Jahanara ";s:3:"age";s:6:"61 Yrs";s:6:"ref_by";s:48:"Mahtab Uddin Ahmed,  MD. (Pathology) Thesis part";s:3:"sex";s:6:"Female";s:13:"hospital_name";s:8:"S.S.M.C.";s:13:"specimen_name";s:28:"One paraffin block No:  (26)";s:4:"note";s:175:"Result of CD30 immunostaining of sections prepared
from paraffin block ID Code-(26), supplied&nbsp;
by&nbsp; Dr. Mahtab Uddin Ahmed, MD(Pathology)&nbsp; Thesis part.

<br>";s:15:"reporting_board";s:207:"<span><b>CD30</b>&nbsp; - &nbsp;Sections reveal no CD30 positive cells. </span>

&nbsp;

<span><br><br>Note:&nbsp; Tissue is poorly fixed. Poor
fixation may influence the immunostaining. </span>

<br>";s:10:"add_doctor";s:1:"0";}i:103;O:8:"stdClass":15:{s:7:"immu_id";s:3:"307";s:5:"sl_no";s:1:" ";s:7:"test_id";s:12:"MIHC12  7179";s:10:"reciv_date";s:10:"17/04/2012";s:12:"current_date";s:10:"2012-04-17";s:9:"deli_date";s:10:"05/05/2012";s:12:"patient_name";s:18:"Mrs. Nazmun Nahar ";s:3:"age";s:6:"15 Yrs";s:6:"ref_by";s:48:"Mahtab Uddin Ahmed,  MD. (Pathology) Thesis part";s:3:"sex";s:6:"Female";s:13:"hospital_name";s:8:"S.S.M.C.";s:13:"specimen_name";s:28:"One paraffin block No:  (30)";s:4:"note";s:176:"Result of CD30 immunostaining of sections prepared
from paraffin block ID Code-(30), supplied&nbsp;
by&nbsp; Dr. Mahtab Uddin Ahmed,
MD(Pathology)&nbsp; Thesis part.

<br>";s:15:"reporting_board";s:133:"<span><b>CD30</b>&nbsp; - &nbsp;&nbsp;Large atypical cells resembling RS cells
show&nbsp; positive staining for CD30 </span>

<br>";s:10:"add_doctor";s:1:"0";}i:104;O:8:"stdClass":15:{s:7:"immu_id";s:3:"308";s:5:"sl_no";s:1:" ";s:7:"test_id";s:12:"MIHC12  7180";s:10:"reciv_date";s:10:"17/04/2012";s:12:"current_date";s:10:"2012-04-17";s:9:"deli_date";s:10:"09/03/2012";s:12:"patient_name";s:18:"Mrs. Rahima Begum ";s:3:"age";s:6:"20 Yrs";s:6:"ref_by";s:48:"Mahtab Uddin Ahmed,  MD. (Pathology) Thesis part";s:3:"sex";s:6:"Female";s:13:"hospital_name";s:8:"S.S.M.C.";s:13:"specimen_name";s:28:"One paraffin block No:  (31)";s:4:"note";s:183:"<u>Result of CD30 immunostaining of sections prepared
from paraffin block ID Code-(31), supplied&nbsp;
by&nbsp; Dr. Mahtab Uddin Ahmed,
MD(Pathology)&nbsp; Thesis part.

</u><br>";s:15:"reporting_board";s:128:"<span><b>CD30</b>&nbsp; - &nbsp;Large atypical cells resembling RS cells
show&nbsp; positive staining for CD30. </span>

<br>";s:10:"add_doctor";s:1:"0";}i:105;O:8:"stdClass":15:{s:7:"immu_id";s:3:"309";s:5:"sl_no";s:1:" ";s:7:"test_id";s:12:"MIHC12  6777";s:10:"reciv_date";s:10:"10/04/2012";s:12:"current_date";s:10:"2012-04-10";s:9:"deli_date";s:10:"05/05/2012";s:12:"patient_name";s:18:"Mrs. Lutfun Nahar ";s:3:"age";s:6:"66 Yrs";s:6:"ref_by";s:48:"Mahtab Uddin Ahmed,  MD. (Pathology) Thesis part";s:3:"sex";s:6:"Female";s:13:"hospital_name";s:8:"S.S.M.C.";s:13:"specimen_name";s:28:"One paraffin block No:  (29)";s:4:"note";s:172:"Result of CD30 immunostaining of sections prepared
from paraffin block ID Code-(29), supplied&nbsp;
by&nbsp; Dr. Mahtab Uddin Ahmed,
MD(Pathology)&nbsp; Thesis part.

";s:15:"reporting_board";s:128:"<span><b>CD30</b>&nbsp; - &nbsp;Large atypical cells resembling RS cells
show&nbsp; positive staining for CD30. </span>

<br>";s:10:"add_doctor";s:1:"0";}i:106;O:8:"stdClass":15:{s:7:"immu_id";s:3:"311";s:5:"sl_no";s:1:" ";s:7:"test_id";s:12:"MIHC12  6776";s:10:"reciv_date";s:10:"10/04/2012";s:12:"current_date";s:10:"2012-04-10";s:9:"deli_date";s:10:"05/05/2012";s:12:"patient_name";s:19:"Mrs. Anowara Begum ";s:3:"age";s:6:"28 Yrs";s:6:"ref_by";s:48:"Mahtab Uddin Ahmed,  MD. (Pathology) Thesis part";s:3:"sex";s:6:"Female";s:13:"hospital_name";s:8:"S.S.M.C.";s:13:"specimen_name";s:28:"One paraffin block No:  (28)";s:4:"note";s:176:"Result of CD30 immunostaining of sections prepared
from paraffin block ID Code-(28), supplied&nbsp;
by&nbsp; Dr. Mahtab Uddin Ahmed,
MD(Pathology)&nbsp; Thesis part.

<br>";s:15:"reporting_board";s:128:"<span><b>CD30</b>&nbsp; - &nbsp;Large atypical cells resembling RS cells
show&nbsp; positive staining for CD30. </span>

<br>";s:10:"add_doctor";s:1:"0";}i:107;O:8:"stdClass":15:{s:7:"immu_id";s:3:"312";s:5:"sl_no";s:1:" ";s:7:"test_id";s:12:"MIHC12  7119";s:10:"reciv_date";s:10:"16/04/2012";s:12:"current_date";s:10:"2012-04-16";s:9:"deli_date";s:10:"07/05/2012";s:12:"patient_name";s:7:"Jamila ";s:3:"age";s:6:"22 Yrs";s:6:"ref_by";s:48:"Mahtab Uddin Ahmed,  MD. (Pathology) Thesis part";s:3:"sex";s:6:"Female";s:13:"hospital_name";s:8:"S.S.M.C.";s:13:"specimen_name";s:28:"One paraffin block No:  (24)";s:4:"note";s:175:"Result of LCA immunostaining of sections prepared
from paraffin block ID Code-(24), supplied&nbsp;
by&nbsp; Dr. Mahtab Uddin Ahmed,
MD(Pathology)&nbsp; Thesis part.

<br>";s:15:"reporting_board";s:113:"<span>LCA&nbsp; - &nbsp;Large atypical cells resembling RS cells show Positive
staining for LCA. </span>

<br>";s:10:"add_doctor";s:1:"0";}i:108;O:8:"stdClass":15:{s:7:"immu_id";s:3:"315";s:5:"sl_no";s:1:" ";s:7:"test_id";s:12:"MIHC12  7115";s:10:"reciv_date";s:10:"16/04/2012";s:12:"current_date";s:10:"2012-04-16";s:9:"deli_date";s:10:"07/05/2012";s:12:"patient_name";s:12:"Mrs. Afsana ";s:3:"age";s:6:"22 Yrs";s:6:"ref_by";s:48:"Mahtab Uddin Ahmed,  MD. (Pathology) Thesis part";s:3:"sex";s:6:"Female";s:13:"hospital_name";s:8:"S.S.M.C.";s:13:"specimen_name";s:28:"One paraffin block No:  (21)";s:4:"note";s:170:"Result of LCA immunostaining of sections prepared
from paraffin block ID Code-(21), supplied&nbsp;
by&nbsp; Dr. Mahtab Uddin Ahmed, MD (Pathology)
Thesis part.

<br>";s:15:"reporting_board";s:113:"<span>LCA&nbsp; - &nbsp;Large atypical cells resembling RS cells show Positive
staining for LCA. </span>

<br>";s:10:"add_doctor";s:1:"0";}i:109;O:8:"stdClass":15:{s:7:"immu_id";s:3:"319";s:5:"sl_no";s:1:" ";s:7:"test_id";s:17:"MIHC12: 11408-411";s:10:"reciv_date";s:10:"18/06/2012";s:12:"current_date";s:10:"2012-06-18";s:9:"deli_date";s:10:"24/06/2012";s:12:"patient_name";s:17:"Mrs. Zohura Begum";s:3:"age";s:6:"70 Yrs";s:6:"ref_by";s:43:"Saumen Basu, MBBS, MD, DNB (Radiation Onco)";s:3:"sex";s:6:"Female";s:13:"hospital_name";s:43:"Khwaja Yunus Ali Medical College & Hospital";s:13:"specimen_name";s:45:"One paraffin Block No (02), Case No:-H12-1912";s:4:"note";s:182:"<b><u>Result of immunostaining for &nbsp;CK, EMA, S100 &amp; CD 117 of case no. H12-1912,
from Apollo Hospital , Dhaka,
&nbsp;Block No. (2).</u></b>

<b><u>&nbsp;</u></b>

<br>";s:15:"reporting_board";s:548:"<span><b>CK</b>&nbsp;&nbsp;&nbsp;&nbsp;&nbsp; :&nbsp; Tumor
cells show no staining for CK.</span>

<span><br><br>EMA&nbsp;&nbsp;&nbsp; : &nbsp;Tumor cells show no staining for EMA</span>

<span><br><br>S100&nbsp; :&nbsp; Tumor cells&nbsp;
show positive staining for S100</span>

<span><br><br>CD117:&nbsp; Tumor cells show no staining for CD117. </span>

&nbsp;

&nbsp;

<br><br>Considering the
immunostaining results this case can be treated as a case of sarcoma (possibly
of neural origin) rather than carcinoma.

&nbsp;

<br>";s:10:"add_doctor";s:1:"0";}i:110;O:8:"stdClass":15:{s:7:"immu_id";s:3:"320";s:5:"sl_no";s:3:"114";s:7:"test_id";s:13:"MIHC14:-04193";s:10:"reciv_date";s:10:"08/03/2014";s:12:"current_date";s:10:"2014-03-08";s:9:"deli_date";s:10:"16/03/2014";s:12:"patient_name";s:16:"Mrs. Jabun Nahar";s:3:"age";s:6:"45 Yrs";s:6:"ref_by";s:25:"Ferdous Ara Shuchi , FCPS";s:3:"sex";s:6:"Female";s:13:"hospital_name";s:11:"DHL, C- 513";s:13:"specimen_name";s:45:"Uterus with both adnexae. Case No: MH14-04193";s:4:"note";s:102:"Result of Immunostaining  for S-100 of Case No: MH14-04193, Block No: (01) DHL, Path. Lab. Dhaka. <br>";s:15:"reporting_board";s:18:"<b>S-100 :</b><br>";s:10:"add_doctor";s:1:"0";}i:111;O:8:"stdClass":15:{s:7:"immu_id";s:3:"329";s:5:"sl_no";s:3:"115";s:7:"test_id";s:13:"MIHC14:-04475";s:10:"reciv_date";s:10:"11/03/2014";s:12:"current_date";s:10:"2014-03-11";s:9:"deli_date";s:10:"16/03/2014";s:12:"patient_name";s:16:"Mrs. Amena Begum";s:3:"age";s:6:"30 Yrs";s:6:"ref_by";s:0:"";s:3:"sex";s:6:"Female";s:13:"hospital_name";s:4:"CSCR";s:13:"specimen_name";s:38:"One paraffin block case no: MH14-04475";s:4:"note";s:98:"Result of Immunostaining  for CK &amp; CD31of Case No: MH14-04475 from DHL. Path. Lab. Dhaka. <br>";s:15:"reporting_board";s:43:"<b>CK :</b><br><br><br><br><b>CD31:</b><br>";s:10:"add_doctor";s:1:"0";}i:112;O:8:"stdClass":15:{s:7:"immu_id";s:3:"331";s:5:"sl_no";s:1:" ";s:7:"test_id";s:11:"MH-16254/12";s:10:"reciv_date";s:10:"28/08/2012";s:12:"current_date";s:10:"2012-08-28";s:9:"deli_date";s:10:"02/09/2012";s:12:"patient_name";s:20:"Miss Afreen Sultana ";s:3:"age";s:6:"12 Yrs";s:6:"ref_by";s:49:"Parvin Akhter Banu , Senior Consultant (Oncology)";s:3:"sex";s:6:"Female";s:13:"hospital_name";s:4:"DHL ";s:13:"specimen_name";s:54:"(Inguinal lymph node) One kparaffin block ( 5573/12). ";s:4:"note";s:125:"<b>&nbsp;Result of immunostaining of Case no. 5573/12,
for CD20 from ARMED FORCES INSTITUTE Of PATHOLOGY, Dhaka.</b>

<br>";s:15:"reporting_board";s:203:"CD20:&nbsp;&nbsp; Tumor cells show no
staining for CD20

<br><br><br><br>

<b><u>Summary :</u></b>

&nbsp;

<span><b>CD20  Negative . </b><b></b></span>

&nbsp;

&nbsp;

&nbsp;

<br><br>";s:10:"add_doctor";s:1:"0";}i:113;O:8:"stdClass":15:{s:7:"immu_id";s:3:"332";s:5:"sl_no";s:3:"353";s:7:"test_id";s:15:"MIHC12-23026-27";s:10:"reciv_date";s:10:"22/11/2012";s:12:"current_date";s:10:"2012-11-22";s:9:"deli_date";s:10:"25/11/2012";s:12:"patient_name";s:21:"Mrs. Khurshida Begum ";s:3:"age";s:6:"65 Yrs";s:6:"ref_by";s:40:"M.N Huda, Chief Consultant (Oncologist) ";s:3:"sex";s:6:"Female";s:13:"hospital_name";s:3:"DHL";s:13:"specimen_name";s:32:"Tissue from Cervical lymph node ";s:4:"note";s:114:"<b>Result of immunostaining
for&nbsp; CD20 &amp; CD3 case No MH12-22731.&nbsp;</b><b> Block No:
(02)</b>

<br>";s:15:"reporting_board";s:496:"CD20- Most of the tumor
cells show positive staining.

&nbsp;

&nbsp;

&nbsp;
<br><br>CD3 -&nbsp; Scattered lymphoid cells show positive
staining. 

&nbsp;

&nbsp;&nbsp;

<br><br>&nbsp;Summary of results :- 

&nbsp;

<span>&nbsp;&nbsp;&nbsp;&nbsp;&nbsp;&nbsp;&nbsp;&nbsp;&nbsp;&nbsp;&nbsp;&nbsp; <br><br>Considering the immunostaining
results, this case should be&nbsp;</span>treated as a case of malignant
non-Hodgkins lymphoma of B cell origin. 

&nbsp;

&nbsp;

<br>";s:10:"add_doctor";s:1:"0";}i:114;O:8:"stdClass":15:{s:7:"immu_id";s:3:"335";s:5:"sl_no";s:1:" ";s:7:"test_id";s:16:"MIHC:12-17144-46";s:10:"reciv_date";s:10:"08/09/2012";s:12:"current_date";s:10:"2012-09-08";s:9:"deli_date";s:10:"16/09/2012";s:12:"patient_name";s:11:"Kusum Bala ";s:3:"age";s:6:"60 Yrs";s:6:"ref_by";s:33:"Metro Diagnostic Centre Ltd, Ctg.";s:3:"sex";s:6:"Female";s:13:"hospital_name";s:29:"Desh Medical Services, Ctg.  ";s:13:"specimen_name";s:20:"Cervical lymph node ";s:4:"note";s:100:"<b><u>Result of immunostaining for CD3, CD20, CD30 of  case no. MH-16676/12, Block (02)</u></b><br>";s:15:"reporting_board";s:462:"<span><b>CD3</b>    :  
Majority of the lymphoid cells show positive staining for CD3</span><br><br> <span><b>CD20</b>  :  
Some of the lymphoid cells forming aggregates show positive staining. </span>

<span><b><br><br>CD30</b>  :  
Many large atypical cells show positive staining for CD30.</span>

 

 

<br><br>Conclusion: Considering the
immunostaining results, this case should be treated as Hodgkins disease. 

 

 

<br>";s:10:"add_doctor";s:1:"0";}i:115;O:8:"stdClass":15:{s:7:"immu_id";s:3:"336";s:5:"sl_no";s:3:"119";s:7:"test_id";s:17:"MIHC14:-04673-676";s:10:"reciv_date";s:10:"13/03/2014";s:12:"current_date";s:10:"2014-03-13";s:9:"deli_date";s:10:"23/03/2014";s:12:"patient_name";s:17:"Mrs. Rahima Begum";s:3:"age";s:6:"69 Yrs";s:6:"ref_by";s:37:"Belayet Hossain Siddique.FCPS, FICS. ";s:3:"sex";s:6:"Female";s:13:"hospital_name";s:34:"Medinet. Medical Services. Dhaka. ";s:13:"specimen_name";s:59:"One paraffin block (Rt.Neck mass tissue) Case No: 140301998";s:4:"note";s:134:"Result of Immunostaining  for LCA, CK , CD3 &amp; CD20 of Case No: 140301998, Block No: (A3) from&nbsp; a i Khan Lab. Ltd. Dhaka. <br>";s:15:"reporting_board";s:437:"<b>LCA :</b> Tumor cells show positive staining for <b>LCA .</b><br><br><b>CK :</b> Tumor cells show no staining for <b>CK.</b><br><br><b>CD3:</b> Scattered lymphoid cells show positive staining for <b>CD3.</b><br><br><b>CD20: </b>Atypical lymphoid cells show positive staining for<b> CD20.</b><br><br><h2><b><i>Conclusion: Immunostaining results favor the diagnosis of Non-Hodgkin's lymphoma of "B" cell origin.</i></b></h2><br><br><br>";s:10:"add_doctor";s:1:"0";}i:116;O:8:"stdClass":15:{s:7:"immu_id";s:3:"337";s:5:"sl_no";s:3:"123";s:7:"test_id";s:17:"MIHC14:-04749-751";s:10:"reciv_date";s:10:"15/03/2014";s:12:"current_date";s:10:"2014-03-15";s:9:"deli_date";s:10:"25/03/2014";s:12:"patient_name";s:7:"Jannat ";s:3:"age";s:6:"11 Yrs";s:6:"ref_by";s:36:"Assot. Prof. Dr. Md. Arifur Rahman. ";s:3:"sex";s:6:"Female";s:13:"hospital_name";s:71:"Institute of Child Health & Shishu Sasthya Foundation Hospital. Dhaka. ";s:13:"specimen_name";s:69:"Tissue from left sided cervical lymph node. Case No: MH14-04178 (R/G)";s:4:"note";s:135:"Result of Immunostaining  for CD3 , CD20&nbsp; &amp; BCL2 of Case No: MH14-04178 (R/G), Block No: (01) from DHL, Path. Lab. Dhaka. <br>";s:15:"reporting_board";s:413:"<b>CD3 :</b> Majority of the lymphoid cells show positive staining for<b> CD3.</b><br><br><b>CD20 :</b> Majority of the lymphoid cells show positive staining for <b>CD20.</b><br><br><b>BCL2 :</b> Follicular centre cells show no staining for <b>BCL2.<br><br></b><h4><b><i>Conclusion: Immunostaining results favor the diagnosis of reactive hyperplasia&nbsp; rather then Non-Hodgkin's lymphoma. </i></b></h4><br><br>";s:10:"add_doctor";s:1:"0";}i:117;O:8:"stdClass":15:{s:7:"immu_id";s:3:"341";s:5:"sl_no";s:3:"129";s:7:"test_id";s:13:"MIHC14:-05158";s:10:"reciv_date";s:10:"22/03/2014";s:12:"current_date";s:10:"2014-03-22";s:9:"deli_date";s:10:"30/03/2014";s:12:"patient_name";s:12:"Momtaz Begum";s:3:"age";s:6:"15 Yrs";s:6:"ref_by";s:0:"";s:3:"sex";s:6:"Female";s:13:"hospital_name";s:25:"NICRH, Mohakhali, Dhaka. ";s:13:"specimen_name";s:45:"Tissue from cervical mass. Case No: MH14-3165";s:4:"note";s:112:"Result of Immunostaining  for&nbsp; Desmin of Case No: MH14-3165, Block No: (02) from DHL Path. Lab. Dhaka. <br>";s:15:"reporting_board";s:219:"<b><br>Desmin :</b> Scattered neoplastic cells show strong positive reaction for&nbsp; <b>Desmin.</b><br><br><br><h4><b><i>Conclusion: Immunostaining result favors the diagnosis of rhabdomyosarcoma.</i></b></h4><br><br>";s:10:"add_doctor";s:1:"0";}i:118;O:8:"stdClass":15:{s:7:"immu_id";s:3:"342";s:5:"sl_no";s:3:"138";s:7:"test_id";s:13:"MIHC14:-05495";s:10:"reciv_date";s:10:"26/03/2014";s:12:"current_date";s:10:"2014-03-26";s:9:"deli_date";s:10:"30/03/2014";s:12:"patient_name";s:10:"Hena Begum";s:3:"age";s:6:"40 Yrs";s:6:"ref_by";s:11:"A B M Jamal";s:3:"sex";s:6:"Female";s:13:"hospital_name";s:42:"Dhaka Medical College  & Hospital. Dhaka. ";s:13:"specimen_name";s:45:"Tissue from gastric polyp. Case No: MH14-5185";s:4:"note";s:108:"Result of Immunostaining  for CD117 of Case No: MH14-5185 , Block No: (02) from DHL , Path. Lab. Dhaka. <br>";s:15:"reporting_board";s:130:"<b><br>CD117 :</b> Tumor cells show positive staining for<b> CD117.</b><br><br><h4><b><i>Conclusion: CD117 Positive. </i></b></h4>";s:10:"add_doctor";s:1:"0";}i:119;O:8:"stdClass":15:{s:7:"immu_id";s:3:"343";s:5:"sl_no";s:3:"131";s:7:"test_id";s:17:"	MIHC14:05283-285";s:10:"reciv_date";s:10:"23/03/2014";s:12:"current_date";s:10:"2014-03-23";s:9:"deli_date";s:10:"30/03/2014";s:12:"patient_name";s:17:"Mrs. Mazeda Begum";s:3:"age";s:6:"48 Yrs";s:6:"ref_by";s:47:"Parvin Akhter Banu, Chief Consultant (Oncology)";s:3:"sex";s:6:"Female";s:13:"hospital_name";s:13:"DLMCH, Dhaka.";s:13:"specimen_name";s:50:"Rt. sided mastectomy specimen. Case No: MH14-04057";s:4:"note";s:125:"Result of Immunostaining  for ER, PR &amp; HER-2 of Case No:      MH14-04057, Block No: (02) from DHL, Path. Lab. Dhaka. <br>";s:15:"reporting_board";s:198:"Immunostaining for ER, PR &amp; HER2 is done. But 
due to extensive necrosis , no viable malignant cell persists and we can&nbsp; not give any conclusive opinion from the section examined. <br><br>";s:10:"add_doctor";s:1:"0";}i:120;O:8:"stdClass":15:{s:7:"immu_id";s:3:"352";s:5:"sl_no";s:3:"173";s:7:"test_id";s:17:"MIHC14:-06649-650";s:10:"reciv_date";s:10:"17/04/2014";s:12:"current_date";s:10:"2014-04-17";s:9:"deli_date";s:10:"20/04/2014";s:12:"patient_name";s:7:"Parvin ";s:3:"age";s:6:"25 Yrs";s:6:"ref_by";s:36:"Rita Paul, MD. (Student Thesis Part)";s:3:"sex";s:6:"Female";s:13:"hospital_name";s:14:"SSMCH. Dhaka. ";s:13:"specimen_name";s:31:"One paraffin block.Case No: R75";s:4:"note";s:85:"Result of Immunostaining  for LCA &amp; CD99 of Case No: R75. from SSMCH. Dhaka. <br>";s:15:"reporting_board";s:276:"<b>LCA: </b>Neoplastic cells show positive staining for <b>LCA.</b><br><br><b>CD99 :</b> Neoplastic cells show no staining for <b>CD99 .<br><br></b><h4><b><i>Conclusion: Immunostaining results favor the diagnosis of Non-Hodgkin's lymphoma. </i></b></h4><b><br></b><br><br><br>";s:10:"add_doctor";s:1:"0";}i:121;O:8:"stdClass":15:{s:7:"immu_id";s:3:"355";s:5:"sl_no";s:3:"183";s:7:"test_id";s:17:"MIHC14:-07161-164";s:10:"reciv_date";s:10:"16/04/2014";s:12:"current_date";s:10:"2014-04-16";s:9:"deli_date";s:10:"20/04/2014";s:12:"patient_name";s:17:"Mrs. Safia Khatun";s:3:"age";s:6:"40 Yrs";s:6:"ref_by";s:46:"Lt. Col. Lutfunnahar Khan. FCPS (Haematology).";s:3:"sex";s:6:"Female";s:13:"hospital_name";s:33:"Modern Diagnostic Centre. Jesore.";s:13:"specimen_name";s:37:"One paraffin block.Case No: VH-317/14";s:4:"note";s:131:"Result of Immunostaining  for LCA , CD3 ,CD20 , BCL2 of Case No: VH-317/14, Block No: (01) from Modern Diagnostic Center. Dhaka<br>";s:15:"reporting_board";s:480:"<b>LCA :</b> Lymphoid cells show positive staining for <b>LCA.<br></b><br><b>CD3 :</b> Scattered lymphoid cells show positive staining for <b>CD3.</b><br><br><b>CD20:</b> Majority of the atypical lymphoid cells show positive staining for <b>CD20.<br></b><br><b>BCL2 :</b> No specific stain is observed for <b>BCL2.<br><br></b><h4><b><i>Conclusion: Immunostaining results favor the diagnosis of Non-Hodgkin's lymphoma of "B"&nbsp; cell origin. </i></b></h4><br><br><br><br><br><br>";s:10:"add_doctor";s:1:"0";}i:122;O:8:"stdClass":15:{s:7:"immu_id";s:3:"359";s:5:"sl_no";s:3:"191";s:7:"test_id";s:17:"MIHC14:-07391-393";s:10:"reciv_date";s:10:"20/04/2014";s:12:"current_date";s:10:"2014-04-20";s:9:"deli_date";s:10:"27/04/2014";s:12:"patient_name";s:19:"Mrs. Dawlatun Nessa";s:3:"age";s:6:"62 Yrs";s:6:"ref_by";s:50:"Parvin Akhter Banu, Chief Consultant (Oncologist).";s:3:"sex";s:6:"Female";s:13:"hospital_name";s:12:"DLMCH, Dhaka";s:13:"specimen_name";s:47:"Tissue from sacral region. Case No:  MH14-06420";s:4:"note";s:110:"Result of Immunostaining  for LCA, CD3 &amp; CD20&nbsp; of Case No: MH14-06420 from DHL, Path. Lab Dhaka. <br>";s:15:"reporting_board";s:396:"<b>LCA:</b> Lymphoid cells show positive staining for <b>LCA.</b><br><br><b>CD3 :</b> Scattered lymphoid cells show positive staining for <b>CD3.<br></b><br><b>CD20 :</b> Atypical lymphoid cells show positive staining for <b>CD20.<br><br></b><h4><b><i>Conclusion: Immunostaining results favor the diagnosis of Non-Hodgkin's lymphoma of "B"&nbsp; cell origin. </i></b></h4><br><br><br><br><br><br>";s:10:"add_doctor";s:1:"0";}i:123;O:8:"stdClass":15:{s:7:"immu_id";s:3:"361";s:5:"sl_no";s:3:"194";s:7:"test_id";s:17:"MIHC14:-07477-478";s:10:"reciv_date";s:10:"20/04/2014";s:12:"current_date";s:10:"2014-04-20";s:9:"deli_date";s:10:"27/04/2014";s:12:"patient_name";s:14:"Mrs. Del Afroz";s:3:"age";s:6:"42 Yrs";s:6:"ref_by";s:38:"Md. Mohoshin Sarker, D.ortho (DU) R.S.";s:3:"sex";s:6:"Female";s:13:"hospital_name";s:43:"Delta Medical College & Hospital Ltd. Dhaka";s:13:"specimen_name";s:63:"Soft tissue from dorsal aspect of Rt. foot. Case No:  MH14-6985";s:4:"note";s:116:"Result of Immunostaining  for CD99 &amp; Desmin of Case No: MH14-6985, Block No: (02) from DHL, Path. Lab. Dhaka<br>";s:15:"reporting_board";s:291:"<b>CD99 :</b> Tumor cells show positive staining for <b>CD99.</b><br><br><b>Desmin :</b> Tumor cells show no staining for&nbsp; <b>Desmin .<br><br></b><h4><b><i>Conclusion:&nbsp; Immunostaining results favor the </i></b><b><i>diagnosis</i></b><b><i> of Ewing's sarcoma. </i></b></h4><br><br>";s:10:"add_doctor";s:1:"0";}i:124;O:8:"stdClass":15:{s:7:"immu_id";s:3:"365";s:5:"sl_no";s:3:"216";s:7:"test_id";s:13:"MIHC14:-08327";s:10:"reciv_date";s:10:"30/04/2014";s:12:"current_date";s:10:"2014-04-30";s:9:"deli_date";s:10:"04/05/2014";s:12:"patient_name";s:12:"Fatema Begum";s:3:"age";s:6:"50 Yrs";s:6:"ref_by";s:0:"";s:3:"sex";s:6:"Female";s:13:"hospital_name";s:20:"The Lab, Chittagong.";s:13:"specimen_name";s:31:"Lymph node. Case No: MH14-07452";s:4:"note";s:93:"Result of Immunostaining  for CD20 of Case No: MH14-07452, from DHL, Path. Lab. Dhaka<br><br>";s:15:"reporting_board";s:214:"<b>CD20:</b> Most of the neoplastic cells show positive staining for <b>CD20.<br><br></b><h4><b><i>Conclusion : Immunostaining results favor the diagnosis of Non-Hodgkin's lymphoma of "B" cell origin. </i></b></h4>";s:10:"add_doctor";s:1:"0";}i:125;O:8:"stdClass":15:{s:7:"immu_id";s:3:"367";s:5:"sl_no";s:3:"233";s:7:"test_id";s:13:"MIHC14:-08599";s:10:"reciv_date";s:10:"05/05/2014";s:12:"current_date";s:10:"2014-05-05";s:9:"deli_date";s:10:"11/05/2014";s:12:"patient_name";s:11:"Mrs. Nargis";s:3:"age";s:6:"40 Yrs";s:6:"ref_by";s:0:"";s:3:"sex";s:6:"Female";s:13:"hospital_name";s:34:"Popular Community Hospita, Rangpur";s:13:"specimen_name";s:34:"Tissue from breast. Case No: 08599";s:4:"note";s:107:"Result of Immunostaining  for LCA &amp; CK of Case No:08599 Block No: (03) from DHL, Path. Lab. Dhaka. <br>";s:15:"reporting_board";s:47:"<b>LCA :</b><br><br><br><br><b>CK :</b><br><br>";s:10:"add_doctor";s:1:"0";}i:126;O:8:"stdClass":15:{s:7:"immu_id";s:3:"369";s:5:"sl_no";s:3:"239";s:7:"test_id";s:17:"MIHC14:-09158-163";s:10:"reciv_date";s:10:"12/05/2014";s:12:"current_date";s:10:"2014-05-12";s:9:"deli_date";s:10:"25/05/2014";s:12:"patient_name";s:18:"Mrs. Rekha Akhter.";s:3:"age";s:6:"25 Yrs";s:6:"ref_by";s:63:"Naheed Rukhsana , FCPS, (Radiotherapy). Consultant. oncologist.";s:3:"sex";s:6:"Female";s:13:"hospital_name";s:49:"Delta Medical College & Hospital, W-521/8. Dhaka.";s:13:"specimen_name";s:32:"Spinal Tissue. Case No: DH14-339";s:4:"note";s:147:"Result of Immunostaining  for LCA, CD3, CD20, CD138, Kappa &amp; Lambda&nbsp; of Case No: DH14-339, Block No: (01) from DHL, Path. Lab. Dhaka. <br>";s:15:"reporting_board";s:579:"<b>LCA :</b> Occasional cells show positive staining for <b>LCA.</b><br><br><b>CD3 :</b> Occasional cells show positive staining for <b>CD3,</b><br><br><b>CD20 :</b> Occasional cells show positive staining for <b>CD20.</b><br><br><b>CD138 :</b> Neoplastic cells show positive staining for <b>CD138.</b><br><br><b>Kappa :</b>&nbsp; Neoplastic cells show positive staining for <b>Kappa.</b><br><br><b>Lambda :</b> Neoplastic cells show positive staining for <b>Lambda.<br><br>&nbsp;</b><br><b><i>Conclusion : Immunostaining results favor the diagnosis of plasmacytoma. </i></b><br>";s:10:"add_doctor";s:1:"0";}i:127;O:8:"stdClass":15:{s:7:"immu_id";s:3:"381";s:5:"sl_no";s:3:"275";s:7:"test_id";s:17:"MIHC14:-10387-389";s:10:"reciv_date";s:10:"26/05/2014";s:12:"current_date";s:10:"2014-05-26";s:9:"deli_date";s:10:"01/06/2014";s:12:"patient_name";s:12:"Mrs. Dipali.";s:3:"age";s:6:"55 Yrs";s:6:"ref_by";s:60:"Lt. Col. M.S. Sarwar Alam (Rtd.), FCPS, Clinical oncologist.";s:3:"sex";s:6:"Female";s:13:"hospital_name";s:48:"Delta Medical College & Hospital (Oncology Unit)";s:13:"specimen_name";s:64:"One paraffin block received (Deltoid muscle).Case No: MH-2473/14";s:4:"note";s:138:"Result of Immunostaining  for CD99 , Desmin&nbsp; &amp; Myogenin of Case No: MH-2473/14, Block No: (B) from Medinova Diagnostic Dhaka.<br>";s:15:"reporting_board";s:322:"<b>CD99 : </b>Neoplastic cell show positive staining for <b><b>CD99.<br><br>Desmin : </b></b>Neoplastic cells show no staining for <b><b><b>Desmin</b>.<br><br>Myogenin : </b></b>Neoplastic cell show no staining<b> for <b>Myogenin.<br><br>Conclusion : Immunostaining results favor the diagnosis of Ewing's sarcoma. </b></b>";s:10:"add_doctor";s:1:"0";}i:128;O:8:"stdClass":15:{s:7:"immu_id";s:3:"382";s:5:"sl_no";s:3:"280";s:7:"test_id";s:13:"MIHC14:-10343";s:10:"reciv_date";s:10:"26/05/2014";s:12:"current_date";s:10:"2014-05-26";s:9:"deli_date";s:10:"01/06/2014";s:12:"patient_name";s:19:"Most. Zamela Khatun";s:3:"age";s:6:"45 Yrs";s:6:"ref_by";s:0:"";s:3:"sex";s:6:"Female";s:13:"hospital_name";s:32:"New Sonag Bangla Clinic, Rangpur";s:13:"specimen_name";s:29:"Appendix. Case No: MH14-10343";s:4:"note";s:89:"Result of Immunostaining  for CK &amp; Chromogranin of Case No: Block No: ( ___) from<br>";s:15:"reporting_board";s:53:"<b>CK :</b><br><br><br><br><b>Chromogranin : </b><br>";s:10:"add_doctor";s:1:"0";}i:129;O:8:"stdClass":15:{s:7:"immu_id";s:3:"383";s:5:"sl_no";s:3:"281";s:7:"test_id";s:17:"MIHC14:-10266-267";s:10:"reciv_date";s:10:"25/05/2014";s:12:"current_date";s:10:"2014-05-25";s:9:"deli_date";s:10:"01/06/2014";s:12:"patient_name";s:5:"Sufia";s:3:"age";s:6:"30 Yrs";s:6:"ref_by";s:0:"";s:3:"sex";s:6:"Female";s:13:"hospital_name";s:39:"The Lab Aid Diagnostic, Brahammanbaria.";s:13:"specimen_name";s:56:"Tissue from cervical lymph node. Case No: MH14-10266-267";s:4:"note";s:84:"Result of Immunostaining  for S-100 of Case No: MH14-10266-267 , Block No: ( __)<br>";s:15:"reporting_board";s:17:"<b>S-100:</b><br>";s:10:"add_doctor";s:1:"0";}i:130;O:8:"stdClass":15:{s:7:"immu_id";s:3:"385";s:5:"sl_no";s:3:"284";s:7:"test_id";s:17:"MIHC14:-10838-840";s:10:"reciv_date";s:10:"01/06/2014";s:12:"current_date";s:10:"2014-06-01";s:9:"deli_date";s:10:"08/06/2014";s:12:"patient_name";s:18:"Mrs. Salma Rahman.";s:3:"age";s:6:"60 Yrs";s:6:"ref_by";s:48:"Parvin Akhter Banu, Chief Consultant Oncologist.";s:3:"sex";s:6:"Female";s:13:"hospital_name";s:33:"Delta Medical College & Hospital.";s:13:"specimen_name";s:47:"Tissue from left upper leg. Case No: MH14-10569";s:4:"note";s:118:"Result of Immunostaining  for LCA, CD3 & CD20  of Case No: MH14-10569, Block No: (02) from DHL Path. Lab. Dhaka. <br>";s:15:"reporting_board";s:363:"<b>LCA :</b> Lymphoid cells show positive staining for <b>LCA.</b><br><br><b>CD3 :</b> Scattered lymphoid cells show positive staining for <b>CD3.</b><br><br><b>CD20 :</b> Neoplastic lymphoid cells show positive staining for <b>CD20.<br><br><h4><b>Conclusion : Immunostaining results favor the diagnosis of Non-Hodgkin's lymphoma of "B" cell origin. </b></h4></b>";s:10:"add_doctor";s:1:"0";}i:131;O:8:"stdClass":15:{s:7:"immu_id";s:3:"388";s:5:"sl_no";s:3:"297";s:7:"test_id";s:13:"MIHC14:-09999";s:10:"reciv_date";s:10:"21/06/2014";s:12:"current_date";s:10:"2014-06-21";s:9:"deli_date";s:10:"04/06/2014";s:12:"patient_name";s:13:"Parvin Akhter";s:3:"age";s:6:"12 Yrs";s:6:"ref_by";s:10:"Dr. Sumon ";s:3:"sex";s:6:"Female";s:13:"hospital_name";s:31:"Prime Medical College, Rangpur.";s:13:"specimen_name";s:45:"Tisue from sigmoid colon. Case No: MH14-09999";s:4:"note";s:83:"Result of Immunostaining  for CD117 , CK &amp; Vimentin of Case No: MH14-09999,<br>";s:15:"reporting_board";s:82:"<b>CD117 :</b><br><br><br><b>&nbsp;CK :</b><br><br><br><b>&nbsp;Vimentin :</b><br>";s:10:"add_doctor";s:1:"0";}i:132;O:8:"stdClass":15:{s:7:"immu_id";s:3:"393";s:5:"sl_no";s:3:"310";s:7:"test_id";s:13:"MIHC14:-11590";s:10:"reciv_date";s:10:"10/06/2014";s:12:"current_date";s:10:"2014-06-10";s:9:"deli_date";s:10:"15/06/2014";s:12:"patient_name";s:18:"Mrs. Kasmiri Begum";s:3:"age";s:6:"65 Yrs";s:6:"ref_by";s:43:"Abu Naser Siddidue, Asstt. Prof. (Medicine)";s:3:"sex";s:6:"Female";s:13:"hospital_name";s:41:"Chittagong Medical Collage Hospital. Ctg.";s:13:"specimen_name";s:40:"Tissue from stomach. Case No: MH14-09786";s:4:"note";s:90:"Result of Immunostaining  for HER-2 of Case No: MH14-09786 from DHL, Path. Lab. Dhaka.<br>";s:15:"reporting_board";s:234:"Weak to moderate complete membrane staining is observed in more than 10 % of the tumor cells.<br>Score : 2+<br><br><b>Summary of result: </b><br><b>                           HER-2 : Borderline</b><br><br><br>";s:10:"add_doctor";s:1:"0";}i:133;O:8:"stdClass":15:{s:7:"immu_id";s:3:"398";s:5:"sl_no";s:3:"340";s:7:"test_id";s:12:"MIHC14:11681";s:10:"reciv_date";s:10:"11-06-2014";s:12:"current_date";s:10:"2014-06-25";s:9:"deli_date";s:10:"29-06-2014";s:12:"patient_name";s:22:"Mrs. Nurun Nahar Begum";s:3:"age";s:6:"70 Yrs";s:6:"ref_by";s:0:"";s:3:"sex";s:6:"Female";s:13:"hospital_name";s:40:"Lancet Diagnostic & Research, Chittagong";s:13:"specimen_name";s:55:"Tisue from anterior wall of cervix. Case No: MH14-11681";s:4:"note";s:119:"Result of Immunostaining for LCA , CK , CD3 & CD20 of Case No: MH14-11681, Block No: (___) from DHL, Path. Lab. Dhaka. ";s:15:"reporting_board";s:54:"LCA :<br><br><br>CK :<br><br><br>CD3:<br><br><br>CD20:";s:10:"add_doctor";s:1:"0";}i:134;O:8:"stdClass":15:{s:7:"immu_id";s:3:"399";s:5:"sl_no";s:3:"341";s:7:"test_id";s:12:"MIHC14:11794";s:10:"reciv_date";s:10:"12-06-2014";s:12:"current_date";s:10:"2014-06-25";s:9:"deli_date";s:10:"29-06-2014";s:12:"patient_name";s:12:"Ms. Monsera ";s:3:"age";s:6:"35 Yrs";s:6:"ref_by";s:27:"Md. Lutfor Rahman, FCPS, MS";s:3:"sex";s:6:"Female";s:13:"hospital_name";s:25:"Mahangar Clinic, Rajshani";s:13:"specimen_name";s:88:"Two H & E stained slides and Two paraffin block received for review. Case No: MH14-11794";s:4:"note";s:98:"Result of Immunostaining for LCA, CK & GFAP of Case No: MH14-11794, LCA, CK & GFAP Block No: (___)";s:15:"reporting_board";s:37:"LCA :<br><br><br>CK:<br><br><br>GFAP:";s:10:"add_doctor";s:1:"0";}i:135;O:8:"stdClass":15:{s:7:"immu_id";s:3:"402";s:5:"sl_no";s:3:"350";s:7:"test_id";s:17:"MIHC14: 13353-55 ";s:10:"reciv_date";s:10:"03-07-2014";s:12:"current_date";s:10:"2014-07-02";s:9:"deli_date";s:10:"06-07-2014";s:12:"patient_name";s:7:"Dulali ";s:3:"age";s:6:"30 Yrs";s:6:"ref_by";s:35:"Fatema Ashraf, FCPS, (Gynae & Obs.)";s:3:"sex";s:6:"Female";s:13:"hospital_name";s:10:"Sh.S.M.C.H";s:13:"specimen_name";s:24:"Tissue from pelvic mass ";s:4:"note";s:113:"Result of Immunostaining for Desmin, Myogenin & S-100 of Case No: MH14-12141, Block No: (02) from DHL, Path. Lab.";s:15:"reporting_board";s:405:"<b>Desmin:  </b>Neoplastic cells show no specific staining for <b>desmin.</b><br><br><br><b>Myogenin:</b> Neoplastic cells show no specific staining for <b>myogenin.</b><br><br><br><b>S-100:  </b>Neoplastic cells show positive staining for <b>S-100.</b><br><br><br><i><b>Conclusion: Immunostaining results favor the diagnosis of neoplasm of nerve sheath origin rather than rhabdomyosarcoma. </b></i><br>";s:10:"add_doctor";s:1:"0";}i:136;O:8:"stdClass":15:{s:7:"immu_id";s:3:"404";s:5:"sl_no";s:3:"370";s:7:"test_id";s:17:"MIHC14: 13663-666";s:10:"reciv_date";s:10:"08-07-2014";s:12:"current_date";s:10:"2014-07-09";s:9:"deli_date";s:10:"13-07-2014";s:12:"patient_name";s:17:"Mrs. Josna Begum ";s:3:"age";s:6:"40 Yrs";s:6:"ref_by";s:19:"Al Mamoon Ferdousi ";s:3:"sex";s:6:"Female";s:13:"hospital_name";s:43:"Delta Medical College & Dental Unit, Dhaka.";s:13:"specimen_name";s:50:"Tissue from Lt. buccal area, Case No : MH14-13291.";s:4:"note";s:120:"Result of Immunostaining for LCA (CD45), CD20, CD3 & Cytokeratin (CK) of Case No: MH14-13291,From DHL, Path, Lab, Dhaka.";s:15:"reporting_board";s:479:"<b><br>LCA (CD45):  </b>Lymphoid cells show positive staining for <b>LCA.</b> <br><br><b>CD20 :  </b>Majority of atypical lymphoid cells show positive staining for <b>CD20</b>.<br><br><b>CD3 :</b>  Scattered lymphoid cells show positive staining for <b>CD3.</b><br><br><b>Cytokeratin (CK):  </b>Tumour cells show no staining for <b>CK. </b><br><br><br><i><b>Conclusion:  Immunostaining results confirm the diagnosis of Non-Hodgkin's lymphoma of "B" cell origin. </b></i><br>";s:10:"add_doctor";s:1:"0";}i:137;O:8:"stdClass":15:{s:7:"immu_id";s:3:"408";s:5:"sl_no";s:3:"374";s:7:"test_id";s:12:"MIHC14:13793";s:10:"reciv_date";s:10:"09-07-2014";s:12:"current_date";s:10:"2014-07-09";s:9:"deli_date";s:10:"13-07-2014";s:12:"patient_name";s:17:"Mrs. Bedura Begum";s:3:"age";s:6:"40 Yrs";s:6:"ref_by";s:0:"";s:3:"sex";s:6:"Female";s:13:"hospital_name";s:33:"Chevron Clinical Lab , Chittagong";s:13:"specimen_name";s:49:"Partial gastrectomy specimen. Case No: MH14-13635";s:4:"note";s:102:"Result of Immunostaining for HER-2 of Case No: MH14-13635, Block No: (02) from DHL, Path. Lab. Dhaka. ";s:15:"reporting_board";s:189:"<b><br><br>HER-2</b> : Weak incomplete membrane staining is observed in more than 10 % of the tumor cells.<br>Score&nbsp; : 1+<br><br><b>Conclusion:</b>&nbsp; HER-2:&nbsp; Negative.<br><br>";s:10:"add_doctor";s:1:"0";}i:138;O:8:"stdClass":15:{s:7:"immu_id";s:3:"409";s:5:"sl_no";s:3:"381";s:7:"test_id";s:16:"MIHC14:14087-089";s:10:"reciv_date";s:10:"14-07-2014";s:12:"current_date";s:10:"2014-07-16";s:9:"deli_date";s:10:"20-07-2014";s:12:"patient_name";s:17:"Miss Sadia Karim ";s:3:"age";s:6:"17 Yrs";s:6:"ref_by";s:64:"Dr. Sajjad Mohammad Yusuf, Oncologist, MCPS, FCPS (Radiotherapy)";s:3:"sex";s:6:"Female";s:13:"hospital_name";s:26:"CSCR Hospital , Chittagong";s:13:"specimen_name";s:53:"Tissue from cervical lymph node, Case No: MH14-13461.";s:4:"note";s:113:"Result of Immunostaining for CD3, CD20 & CD30 of Case No: MH14-13461, Block No: (02), From DHL, Path, Lab. Dhaka ";s:15:"reporting_board";s:366:"<b>CD3:</b> Some of the lymphoid cells show positive staining for <b>CD3.</b><br><br><br><b>CD20:  </b>Some of the lymphoid cells show positive staining for <b>CD20</b>.<br><br><br><b>CD30:  </b>Scattered large cells show positive staining for <b>CD30</b>.<br><br><br><b><i>Conclusion: Immunostaining results favor the diagnosis of Hodgkin's lymphoma.</i></b> <br>";s:10:"add_doctor";s:1:"0";}i:139;O:8:"stdClass":15:{s:7:"immu_id";s:3:"411";s:5:"sl_no";s:3:"392";s:7:"test_id";s:11:"MIHC14:1520";s:10:"reciv_date";s:10:"20-07-2014";s:12:"current_date";s:10:"2014-07-24";s:9:"deli_date";s:10:"27-07-2014";s:12:"patient_name";s:13:"Mrs. Shamima ";s:3:"age";s:6:"50 Yrs";s:6:"ref_by";s:24:"Md. Anisur Rahman, FCPS ";s:3:"sex";s:6:"Female";s:13:"hospital_name";s:30:"Popular Diagnostic Centre Ltd.";s:13:"specimen_name";s:18:"Tissue from lesion";s:4:"note";s:73:"Result of Immunostaining for LCA & CK of Case No:DH14-1520, Block No: ( )";s:15:"reporting_board";s:56:"<br><b>LCA:</b><br><br><br><b>CK:&nbsp; </b><br><br><br>";s:10:"add_doctor";s:1:"0";}i:140;O:8:"stdClass":15:{s:7:"immu_id";s:3:"412";s:5:"sl_no";s:3:"389";s:7:"test_id";s:16:"MIHC14:14686-688";s:10:"reciv_date";s:10:"22-07-2014";s:12:"current_date";s:10:"2014-07-26";s:9:"deli_date";s:10:"27-07-2014";s:12:"patient_name";s:11:"Rezia Begum";s:3:"age";s:6:"65 Yrs";s:6:"ref_by";s:24:"Dr. Suraiya Begum, FCPS ";s:3:"sex";s:6:"Female";s:13:"hospital_name";s:40:"IBN SINA  Hospital and Diagnostic center";s:13:"specimen_name";s:62:"Three paraffin blocks (Uterus)  recived, Case No: E 121749/14.";s:4:"note";s:126:"Result of Immunostaining for  ER & PR of Case No: E 121749/14, Block No: (02) , from IBN SINA  Hospital and Diagnostic center.";s:15:"reporting_board";s:322:"<b>ER: </b>Tumor cell nuclei show no staining.<br>       Quick Score: "O"<br><br><b>PR:</b> Tumor cell nuclei show no staining.<br>       Quick Score: "O"<br><br>Summary of result: <br>                    <b> ER : </b>Negative <br>                     <b>PR :</b> Negative <br>";s:10:"add_doctor";s:1:"0";}i:141;O:8:"stdClass":15:{s:7:"immu_id";s:3:"419";s:5:"sl_no";s:3:"406";s:7:"test_id";s:16:"MIHC14:15642-645";s:10:"reciv_date";s:10:"09-08-2014";s:12:"current_date";s:10:"2014-08-13";s:9:"deli_date";s:10:"17-08-2014";s:12:"patient_name";s:19:"Mrs. Shimul Akhter ";s:3:"age";s:6:"34 Yrs";s:6:"ref_by";s:62:"(Lt. Col.) M.S. Sarwar Alam (Rtd.), FCPS, Clinical Oncologist.";s:3:"sex";s:6:"Female";s:13:"hospital_name";s:18:"Delta Hospital Ltd";s:13:"specimen_name";s:70:"One paraffin block (Tissue from mass of rt toe). Case No: 14-052-12339";s:4:"note";s:83:"Result of Immunostaining for S-100, CK , Vimentin & HMB45 of Case No: 14-052-12339.";s:15:"reporting_board";s:539:"<b>CK :</b>Tumor cells show positive staining&nbsp; for<b> CK. <br><br>S-100 : </b>Tumor cells show positive staining for<b><b> S-100</b>.<br><b><b><br>Vimentin :</b></b> T</b>umor cells show no staining for<b><b><b><b><b> Vimentin </b></b>.<b><br><br>HMB45 :&nbsp; </b></b></b></b>Tumor cells show no staining for <b><b><b><b>HMB45.</b><b><br><br><i>Conclusion: Immunostaining&nbsp; results favor the diagnosis of squamous cell carcinoma rather than melanoma. </i></b><i><br><br></i><b>Note: Tissue is poorly fixed.</b><i><br></i></b></b>";s:10:"add_doctor";s:1:"0";}i:142;O:8:"stdClass":15:{s:7:"immu_id";s:3:"426";s:5:"sl_no";s:3:"425";s:7:"test_id";s:17:"MIHC14:-16341-342";s:10:"reciv_date";s:10:"18/08/2014";s:12:"current_date";s:10:"2014-08-18";s:9:"deli_date";s:10:"24/08/2014";s:12:"patient_name";s:11:"Miss Jannat";s:3:"age";s:6:"24 Yrs";s:6:"ref_by";s:59:"Tapesh Kumar Paul, FCPS, (Surgery), MS (Surgical Oncology).";s:3:"sex";s:6:"Female";s:13:"hospital_name";s:39:"Delta Medical College & Hospital, Dhaka";s:13:"specimen_name";s:63:"4 (Four) paraffin blocks. Case No: 14-01-5535,  Block No: (02) ";s:4:"note";s:124:"Result of Immunostaining  for LCA &amp; CK of Case No: 14-01-5535, Block No: (02) from Anowara Medical Services, Dhaka. <br>";s:15:"reporting_board";s:240:"<b>LCA : </b>Tumor cells show no staining for<b> LCA.<br><br>CK :</b> Tumor cells show no staining for <b>CK.<br><br>Inconclusive immunostaining result. <br><br>Further panel of antibodies is necessary to determine the histogenesis.<br></b>";s:10:"add_doctor";s:1:"0";}i:143;O:8:"stdClass":15:{s:7:"immu_id";s:3:"429";s:5:"sl_no";s:3:"431";s:7:"test_id";s:13:"MIHC14:-15773";s:10:"reciv_date";s:10:"10/08/2014";s:12:"current_date";s:10:"2014-08-10";s:9:"deli_date";s:10:"24/08/2014";s:12:"patient_name";s:17:"Mrs. Rabeya Begum";s:3:"age";s:6:"40 Yrs";s:6:"ref_by";s:13:"Faruque Ahmed";s:3:"sex";s:6:"Female";s:13:"hospital_name";s:24:"Khidma Hospital. Dhaka. ";s:13:"specimen_name";s:37:"Tissue from mode. Case No: MH14-15773";s:4:"note";s:79:"Result of Immunostaining  for CK &amp; HMB45 of Case No: MH14-15773 from...<br>";s:15:"reporting_board";s:34:"<b>CK :<br><br><br>HMB45 :</b><br>";s:10:"add_doctor";s:1:"0";}i:144;O:8:"stdClass":15:{s:7:"immu_id";s:3:"430";s:5:"sl_no";s:3:"427";s:7:"test_id";s:17:"MIHC14:-16577-580";s:10:"reciv_date";s:10:"19/08/2014";s:12:"current_date";s:10:"2014-08-19";s:9:"deli_date";s:10:"24/08/2014";s:12:"patient_name";s:15:"Hosne Ara Begum";s:3:"age";s:6:"35 Yrs";s:6:"ref_by";s:0:"";s:3:"sex";s:6:"Female";s:13:"hospital_name";s:26:"Medical Center, Chittagong";s:13:"specimen_name";s:40:"Inguinal lymph node. Case No: MH14-14807";s:4:"note";s:122:"Result of Immunostaining  for LCA, CD3 , CD20 , BCL, CD15 & CD30  of Case No: MH14-14807 from DHL, Path. Lab. Dhaka. <br>";s:15:"reporting_board";s:110:"<b>LCA :<br><br><br>CD3: <br><br><br>CD20 :<br><br><br>BCL :<br><br><br>CD15:  <br><br><br>CD30 :</b><br><br>";s:10:"add_doctor";s:1:"0";}i:145;O:8:"stdClass":15:{s:7:"immu_id";s:3:"431";s:5:"sl_no";s:3:"425";s:7:"test_id";s:28:"MIHC14:-16341-342, 17715-716";s:10:"reciv_date";s:10:"18/08/2014";s:12:"current_date";s:10:"2014-08-18";s:9:"deli_date";s:10:"31/08/2014";s:12:"patient_name";s:11:"Miss Jannat";s:3:"age";s:6:"24 Yrs";s:6:"ref_by";s:59:"Tapesh Kumar Paul, FCPS, (Surgery), MS (Surgical Oncology).";s:3:"sex";s:6:"Female";s:13:"hospital_name";s:39:"Delta Medical College & Hospital. Dhaka";s:13:"specimen_name";s:44:"4 (Four) Paraffin blocks.Case No: 14-01-5535";s:4:"note";s:156:"Result of Immunostaining  for LCA, CK, CD99 &amp; Chromogranin&nbsp; of Case No: 14-01-5535, Block No: (02) from Anowara Medical Services,&nbsp; Dhaka. <br>";s:15:"reporting_board";s:463:"<b> LCA :</b> Tumor cells show no staining for <b>LCA.</b><br><br><b>CK:&nbsp; </b>Tumor cells show no staining for <b>CK. </b><br><br><b>CD99 :</b> Tumor cells show strong positive staining for <b>CD99.</b><br><br><b><b>Chromogranin</b>:</b> Tumor cells show no staining for <b>Chromogranin.</b><br><br><br><b>Conclusion: Immunostaining results favor the diagnosis of Primitive&nbsp; neuroectodermal tumor (PNET) rather than ductal carcinoma.</b><br><br><br><br>";s:10:"add_doctor";s:1:"0";}i:146;O:8:"stdClass":15:{s:7:"immu_id";s:3:"433";s:5:"sl_no";s:3:"440";s:7:"test_id";s:17:"DIHC14:-01743-747";s:10:"reciv_date";s:10:"25/08/2014";s:12:"current_date";s:10:"2014-08-25";s:9:"deli_date";s:10:"31/08/2014";s:12:"patient_name";s:18:"Mrs. Hena Majumdar";s:3:"age";s:6:"65 Yrs";s:6:"ref_by";s:42:"M.A. Khan.  FCPS (Haematology) , FRCP (UK)";s:3:"sex";s:6:"Female";s:13:"hospital_name";s:33:"Lab  aid cardiac Hospital , Dhaka";s:13:"specimen_name";s:39:"Tissue from stomach. Case No: DH14-1665";s:4:"note";s:116:"Result of Immunostaining  for LCA, CD3, CD20, CD15 &amp; CD30&nbsp;of Case No:DH14-1665, from DHL, Path. Lab. Dhaka.";s:15:"reporting_board";s:468:"<b>LCA : </b>Tumour cells show positive staining for <b>LCA</b>.<br><b><br>CD3: </b>Scattered lymphoid cells show positive staining for<b> CD3.<br><br>CD20:</b> Tumour cells show positive staining for <b>CD20.<br><br>CD15 : </b>Tumour cells show no staining for <b>CD15</b>.<br><b><br>CD30 :</b> Tumour cells show no staining for <b>CD30.</b><br><br><b><i>Conclusion: Immunostaining results confirm the diagnosis of Non-Hodgkin's lymphoma of B-cell origin.</i></b><br>";s:10:"add_doctor";s:1:"0";}i:147;O:8:"stdClass":15:{s:7:"immu_id";s:3:"435";s:5:"sl_no";s:3:"449";s:7:"test_id";s:17:"MIHC14:-17398-400";s:10:"reciv_date";s:10:"28/08/2014";s:12:"current_date";s:10:"2014-08-28";s:9:"deli_date";s:10:"07/09/2014";s:12:"patient_name";s:17:"Mrs. Juleka Begum";s:3:"age";s:6:"48 Yrs";s:6:"ref_by";s:44:"Saumen Basu, MBBS, MD (Cal.). DNB, Oncology.";s:3:"sex";s:6:"Female";s:13:"hospital_name";s:20:"KYAMCH. Siragjgonj. ";s:13:"specimen_name";s:40:"Tissue from stomach. Case No: MH14-13550";s:4:"note";s:112:"Result of Immunostaining  for HER-2 , LCA , CD20 &amp; CK of Case No: MH14-13550, from DHL ,Path. Lab. Dhaka<br>";s:15:"reporting_board";s:427:"<b>HER-2 :</b> Score +2 (Borderline)<br><b><br>LCA : </b>Lymphoid cells show positive staining for<b><b> LCA. </b><br><br><b>CD20&nbsp; :&nbsp; </b></b>CD20 Staining is negative. <b><br><br><b><b>CK:&nbsp;</b></b></b> Staining was done on academic interest and tumor cells show positive staining for <b>CK.<b><br><br><b>Conclusion: Immunostaining results favor the diagnosis of adenocarcinoma rather than lymphoma. </b></b></b>";s:10:"add_doctor";s:1:"0";}i:148;O:8:"stdClass":15:{s:7:"immu_id";s:3:"439";s:5:"sl_no";s:3:"477";s:7:"test_id";s:17:"MIHC14:-18728-731";s:10:"reciv_date";s:10:"10/09/2014";s:12:"current_date";s:10:"2014-09-10";s:9:"deli_date";s:10:"21/09/2014";s:12:"patient_name";s:12:"Mrs. Nilufa ";s:3:"age";s:6:"45 Yrs";s:6:"ref_by";s:49:"Parvin Akhter Banu, Chief Consultant (Oncologist)";s:3:"sex";s:6:"Female";s:13:"hospital_name";s:44:"Delta Medical College & Hospital Ltd. Dhaka.";s:13:"specimen_name";s:48:"Tissue from Tonsillar growth. Case No: 140809128";s:4:"note";s:122:"Result of Immunostaining  for LCA, CK, CD3 & CD20 of Case No: 140809128, Block No: (A1) from a i Khan Lab Ltd. Dhaka. <br>";s:15:"reporting_board";s:435:"<b>LCA : </b>Lymphoid cells show positive staining for <b><b>LCA </b>.<br><br>CK : </b>Lining epithelium show positive staining for<b><b> CK. </b><br><br>CD3:</b> Scattered lymphoid cells show positive staining for<b><b> CD3</b><br><br>CD20 :</b> Majority of the atypical lymphoid cells show positive staining for <b>CD20.<br><br>Conclusion: Immunostaining results favor the diagnosis of Non-Hodgkin's lymphoma of "B" cell origin. </b>";s:10:"add_doctor";s:1:"0";}i:149;O:8:"stdClass":15:{s:7:"immu_id";s:3:"441";s:5:"sl_no";s:3:"484";s:7:"test_id";s:13:"MIHC14:-19173";s:10:"reciv_date";s:10:"15/09/2014";s:12:"current_date";s:10:"2014-09-15";s:9:"deli_date";s:10:"21/09/2014";s:12:"patient_name";s:17:"Mrs. Kawser Begum";s:3:"age";s:6:"34 Yrs";s:6:"ref_by";s:18:"A F M  Kamal Uddin";s:3:"sex";s:6:"Female";s:13:"hospital_name";s:0:"";s:13:"specimen_name";s:41:"Tissue from stomach. Case No: MH14-18130 ";s:4:"note";s:93:"Result of Immunostaining  for HER-2 of Case No: MH14-18130 from,  DHL, Path. Lab. Dhaka.<br>";s:15:"reporting_board";s:304:"<b>HER-2</b> :  Weak incomplete membrane staining is observed in more than 10 % of the tumor cells.<br>               Score : 1+<br><br><br><span>Summary
